[[33mWarning [0m] warning: there were three feature warnings; re-run with -feature for details
[[34m  Info  [0m] Output written on leon.out
[[34m  Info  [0m] Output written on leon.out
Warning: Cannot find a non-placeholder in equivalence class Set(P@24) for fundef: 
 def new@tStreamT00[T11, P@24](cc0 : tStreamT0@0[T11], st@23 : Set[MemoFuns@0[P@24]]): tStreamT0@0[T11] = cc0
[[34m  Info  [0m] Output written on leon.out
[[34m  Info  [0m] Output written on leon.out
[[34m  Info  [0m] Output written on leon.out
instfuncs: tailSub,force,cons,forceTwice,rotateDrop,drop,tail,takeLazy,empty,revAppend,createQueue,reverse,eval@tStreamT0@,take,get-mem,rotateRev instFuncTypes: 
[[34m  Info  [0m] Output written on leon.out
[[34m  Info  [0m] Output written on leon.out
[[34m  Info  [0m] Output written on leon.out
instfuncs:  instFuncTypes: 
[[34m  Info  [0m] - considering function takeLazy-time...
[[34m  Info  [0m] Candidate invariants
[[34m  Info  [0m] takeLazy-time-->res125._2 <= 0
[[34m  Info  [0m] checked VC inst... in 0.077s
[[34m  Info  [0m] Function: takeLazy-time--Found candidate invariant is not a real invariant! 
[[34m  Info  [0m] # of atomic predicates: 6 + 1
[[34m  Info  [0m] solving...
[[34m  Info  [0m] solved... in 0.055s
[[34m  Info  [0m] Candidate invariants
[[34m  Info  [0m] takeLazy-time-->res125._2 + -10 <= 0
[[34m  Info  [0m] checked VC inst... in 0.028s
[[34m  Info  [0m] Function: takeLazy-time--Found candidate invariant is not a real invariant! 
[[34m  Info  [0m] # of atomic predicates: 9 + 7
[[34m  Info  [0m] solving...
[[34m  Info  [0m] solved... in 0.014s
[[34m  Info  [0m] Candidate invariants
[[34m  Info  [0m] takeLazy-time-->res125._2 + -15 <= 0
[[34m  Info  [0m] checked VC inst... in 0.025s
[[34m  Info  [0m] Function: takeLazy-time--Found candidate invariant is not a real invariant! 
[[34m  Info  [0m] # of atomic predicates: 8 + 16
[[34m  Info  [0m] solving...
[[34m  Info  [0m] solved... in 0.013s
[[34m  Info  [0m] - More unrollings for invariant inference
[[34m  Info  [0m] Candidate invariants
[[34m  Info  [0m] takeLazy-time-->res125._2 <= 0
[[34m  Info  [0m] checked VC inst... in 0.041s
[[34m  Info  [0m] Function: takeLazy-time--Found candidate invariant is not a real invariant! 
[[34m  Info  [0m] # of atomic predicates: 9 + 1
[[34m  Info  [0m] solving...
[[34m  Info  [0m] solved... in 0.008s
[[34m  Info  [0m] Candidate invariants
[[34m  Info  [0m] takeLazy-time-->res125._2 + -10 <= 0
[[34m  Info  [0m] checked VC inst... in 0.031s
[[34m  Info  [0m] Function: takeLazy-time--Found candidate invariant is not a real invariant! 
[[34m  Info  [0m] # of atomic predicates: 13 + 10
[[34m  Info  [0m] solving...
[[34m  Info  [0m] solved... in 0.014s
[[34m  Info  [0m] Candidate invariants
[[34m  Info  [0m] takeLazy-time-->res125._2 + -15 <= 0
[[34m  Info  [0m] checked VC inst... in 0.016s
[[34m  Info  [0m] Function: takeLazy-time--Found candidate invariant is not a real invariant! 
[[34m  Info  [0m] # of atomic predicates: 13 + 23
[[34m  Info  [0m] solving...
[[34m  Info  [0m] solved... in 0.014s
[[34m  Info  [0m] Candidate invariants
[[34m  Info  [0m] takeLazy-time-->res125._2 + -18 <= 0
[[34m  Info  [0m] checked VC inst... in 0.005s
[[34m  Info  [0m] minimizing...
[[34m  Info  [0m] Candidate invariants
[[34m  Info  [0m] takeLazy-time-->res125._2 + -17 <= 0
[[34m  Info  [0m] checked VC inst... in 0.004s
[[34m  Info  [0m] - Found inductive invariant: takeLazy-time --> time + BigInt(-17) <= BigInt(0)
[[34m  Info  [0m] - Verifying Invariants... 
[[34m  Info  [0m] - Invariant verified
[[34m  Info  [0m] - considering function revAppend-time...
[[34m  Info  [0m] Candidate invariants
[[34m  Info  [0m] revAppend-time-->res126._2 <= 0
[[34m  Info  [0m] checked VC inst... in 0.018s
[[34m  Info  [0m] Function: revAppend-time--Found candidate invariant is not a real invariant! 
[[34m  Info  [0m] # of atomic predicates: 8 + 1
[[34m  Info  [0m] solving...
[[34m  Info  [0m] solved... in 0.01s
[[34m  Info  [0m] Candidate invariants
[[34m  Info  [0m] revAppend-time-->(-1 * l1.size + res126._2) + -4 <= 0
[[34m  Info  [0m] checked VC inst... in 0.013s
[[34m  Info  [0m] Function: revAppend-time--Found candidate invariant is not a real invariant! 
[[34m  Info  [0m] # of atomic predicates: 10 + 9
[[34m  Info  [0m] solving...
[[34m  Info  [0m] solved... in 0.007s
[[34m  Info  [0m] - More unrollings for invariant inference
[[34m  Info  [0m] Candidate invariants
[[34m  Info  [0m] revAppend-time-->res126._2 <= 0
[[34m  Info  [0m] checked VC inst... in 0.148s
[[34m  Info  [0m] Function: revAppend-time--Found candidate invariant is not a real invariant! 
[[34m  Info  [0m] # of atomic predicates: 8 + 1
[[34m  Info  [0m] solving...
[[34m  Info  [0m] solved... in 0.007s
[[34m  Info  [0m] Candidate invariants
[[34m  Info  [0m] revAppend-time-->res126._2 + -4 <= 0
[[34m  Info  [0m] checked VC inst... in 0.141s
[[34m  Info  [0m] Function: revAppend-time--Found candidate invariant is not a real invariant! 
[[34m  Info  [0m] # of atomic predicates: 15 + 9
[[34m  Info  [0m] solving...
[[34m  Info  [0m] solved... in 0.01s
[[34m  Info  [0m] Candidate invariants
[[34m  Info  [0m] revAppend-time-->(-16 * l1.size + res126._2) + -4 <= 0
[[34m  Info  [0m] checked VC inst... in 0.078s
[[34m  Info  [0m] Function: revAppend-time--Found candidate invariant is not a real invariant! 
[[34m  Info  [0m] # of atomic predicates: 19 + 24
[[34m  Info  [0m] solving...
[[34m  Info  [0m] solved... in 0.014s
[[34m  Info  [0m] - More unrollings for invariant inference
[[34m  Info  [0m] Candidate invariants
[[34m  Info  [0m] revAppend-time-->res126._2 <= 0
[[34m  Info  [0m] checked VC inst... in 0.145s
[[34m  Info  [0m] Function: revAppend-time--Found candidate invariant is not a real invariant! 
[[34m  Info  [0m] # of atomic predicates: 8 + 1
[[34m  Info  [0m] solving...
[[34m  Info  [0m] solved... in 0.007s
[[34m  Info  [0m] Candidate invariants
[[34m  Info  [0m] revAppend-time-->res126._2 + -4 <= 0
[[34m  Info  [0m] checked VC inst... in 0.11s
[[34m  Info  [0m] Function: revAppend-time--Found candidate invariant is not a real invariant! 
[[34m  Info  [0m] # of atomic predicates: 15 + 9
[[34m  Info  [0m] solving...
[[34m  Info  [0m] solved... in 0.011s
[[34m  Info  [0m] Candidate invariants
[[34m  Info  [0m] revAppend-time-->(-16 * l1.size + res126._2) + -4 <= 0
[[34m  Info  [0m] checked VC inst... in 0.018s
[[34m  Info  [0m] minimizing...
[[34m  Info  [0m] Candidate invariants
[[34m  Info  [0m] revAppend-time-->(-12 * l1.size + res126._2) + -2 <= 0
[[34m  Info  [0m] checked VC inst... in 0.108s
[[34m  Info  [0m] Function: revAppend-time--Found candidate invariant is not a real invariant! 
[[34m  Info  [0m] # of atomic predicates: 16 + 24
[[34m  Info  [0m] solving...
[[34m  Info  [0m] solved... in 0.011s
[[34m  Info  [0m] Candidate invariants
[[34m  Info  [0m] revAppend-time-->(-16 * l1.size + res126._2) + -4 <= 0
[[34m  Info  [0m] checked VC inst... in 0.019s
[[34m  Info  [0m] minimizing...
[[34m  Info  [0m] Candidate invariants
[[34m  Info  [0m] revAppend-time-->(-15 * l1.size + res126._2) + -2 <= 0
[[34m  Info  [0m] checked VC inst... in 0.015s
[[34m  Info  [0m] - Found inductive invariant: revAppend-time --> (BigInt(-15) * l1.size + time) + BigInt(-2) <= BigInt(0)
[[34m  Info  [0m] - Verifying Invariants... 
[[34m  Info  [0m] - Invariant verified
[[34m  Info  [0m] - considering function drop-time...
[[34m  Info  [0m] Candidate invariants
[[34m  Info  [0m] drop-time-->res123._2 + 0 * n <= 0
[[34m  Info  [0m] checked VC inst... in 0.023s
[[34m  Info  [0m] Function: drop-time--Found candidate invariant is not a real invariant! 
[[34m  Info  [0m] # of atomic predicates: 8 + 1
[[34m  Info  [0m] solving...
[[34m  Info  [0m] solved... in 0.008s
[[34m  Info  [0m] Candidate invariants
[[34m  Info  [0m] drop-time-->(res123._2 + 0 * n) + -4 <= 0
[[34m  Info  [0m] checked VC inst... in 0.015s
[[34m  Info  [0m] Function: drop-time--Found candidate invariant is not a real invariant! 
[[34m  Info  [0m] # of atomic predicates: 11 + 9
[[34m  Info  [0m] solving...
[[34m  Info  [0m] solved... in 0.007s
[[34m  Info  [0m] - More unrollings for invariant inference
[[34m  Info  [0m] Candidate invariants
[[34m  Info  [0m] drop-time-->res123._2 + 0 * n <= 0
[[34m  Info  [0m] checked VC inst... in 0.088s
[[34m  Info  [0m] Function: drop-time--Found candidate invariant is not a real invariant! 
[[34m  Info  [0m] # of atomic predicates: 9 + 1
[[34m  Info  [0m] solving...
[[34m  Info  [0m] solved... in 0.007s
[[34m  Info  [0m] Candidate invariants
[[34m  Info  [0m] drop-time-->(res123._2 + 0 * n) + -4 <= 0
[[34m  Info  [0m] checked VC inst... in 0.075s
[[34m  Info  [0m] Function: drop-time--Found candidate invariant is not a real invariant! 
[[34m  Info  [0m] # of atomic predicates: 15 + 10
[[34m  Info  [0m] solving...
[[34m  Info  [0m] solved... in 0.008s
[[34m  Info  [0m] Candidate invariants
[[34m  Info  [0m] drop-time-->(res123._2 + -16 * n) + -4 <= 0
[[34m  Info  [0m] checked VC inst... in 0.009s
[[34m  Info  [0m] minimizing...
[[34m  Info  [0m] Candidate invariants
[[34m  Info  [0m] drop-time-->(res123._2 + -13 * n) + -2 <= 0
[[34m  Info  [0m] checked VC inst... in 0.035s
[[34m  Info  [0m] Function: drop-time--Found candidate invariant is not a real invariant! 
[[34m  Info  [0m] # of atomic predicates: 15 + 25
[[34m  Info  [0m] solving...
[[34m  Info  [0m] solved... in 0.009s
[[34m  Info  [0m] Candidate invariants
[[34m  Info  [0m] drop-time-->(res123._2 + -17 * n) + -4 <= 0
[[34m  Info  [0m] checked VC inst... in 0.006s
[[34m  Info  [0m] minimizing...
[[34m  Info  [0m] Candidate invariants
[[34m  Info  [0m] drop-time-->(res123._2 + -16 * n) + -2 <= 0
[[34m  Info  [0m] checked VC inst... in 0.004s
[[34m  Info  [0m] - Found inductive invariant: drop-time --> (time + BigInt(-16) * n) + BigInt(-2) <= BigInt(0)
[[34m  Info  [0m] - Verifying Invariants... 
[[34m  Info  [0m] - Invariant verified
[[34m  Info  [0m] - considering function take-time...
[[34m  Info  [0m] Candidate invariants
[[34m  Info  [0m] take-time-->res129._2 + 0 * n <= 0
[[34m  Info  [0m] checked VC inst... in 0.018s
[[34m  Info  [0m] Function: take-time--Found candidate invariant is not a real invariant! 
[[34m  Info  [0m] # of atomic predicates: 8 + 1
[[34m  Info  [0m] solving...
[[34m  Info  [0m] solved... in 0.008s
[[34m  Info  [0m] Candidate invariants
[[34m  Info  [0m] take-time-->(res129._2 + 0 * n) + -5 <= 0
[[34m  Info  [0m] checked VC inst... in 0.015s
[[34m  Info  [0m] Function: take-time--Found candidate invariant is not a real invariant! 
[[34m  Info  [0m] # of atomic predicates: 9 + 9
[[34m  Info  [0m] solving...
[[34m  Info  [0m] solved... in 0.007s
[[34m  Info  [0m] - More unrollings for invariant inference
[[34m  Info  [0m] Candidate invariants
[[34m  Info  [0m] take-time-->res129._2 + 0 * n <= 0
[[34m  Info  [0m] checked VC inst... in 0.083s
[[34m  Info  [0m] Function: take-time--Found candidate invariant is not a real invariant! 
[[34m  Info  [0m] # of atomic predicates: 9 + 1
[[34m  Info  [0m] solving...
[[34m  Info  [0m] solved... in 0.007s
[[34m  Info  [0m] Candidate invariants
[[34m  Info  [0m] take-time-->(res129._2 + 0 * n) + -5 <= 0
[[34m  Info  [0m] checked VC inst... in 0.049s
[[34m  Info  [0m] Function: take-time--Found candidate invariant is not a real invariant! 
[[34m  Info  [0m] # of atomic predicates: 15 + 10
[[34m  Info  [0m] solving...
[[34m  Info  [0m] solved... in 0.007s
[[34m  Info  [0m] Candidate invariants
[[34m  Info  [0m] take-time-->(res129._2 + -18 * n) + -5 <= 0
[[34m  Info  [0m] checked VC inst... in 0.014s
[[34m  Info  [0m] minimizing...
[[34m  Info  [0m] Candidate invariants
[[34m  Info  [0m] take-time-->(res129._2 + -15 * n) + -3 <= 0
[[34m  Info  [0m] checked VC inst... in 0.027s
[[34m  Info  [0m] Function: take-time--Found candidate invariant is not a real invariant! 
[[34m  Info  [0m] # of atomic predicates: 15 + 25
[[34m  Info  [0m] solving...
[[34m  Info  [0m] solved... in 0.009s
[[34m  Info  [0m] Candidate invariants
[[34m  Info  [0m] take-time-->(res129._2 + -19 * n) + -5 <= 0
[[34m  Info  [0m] checked VC inst... in 0.007s
[[34m  Info  [0m] minimizing...
[[34m  Info  [0m] Candidate invariants
[[34m  Info  [0m] take-time-->(res129._2 + -18 * n) + -3 <= 0
[[34m  Info  [0m] checked VC inst... in 0.005s
[[34m  Info  [0m] - Found inductive invariant: take-time --> (time + BigInt(-18) * n) + BigInt(-3) <= BigInt(0)
[[34m  Info  [0m] - Verifying Invariants... 
[[34m  Info  [0m] - Invariant verified
[[34m  Info  [0m] - considering function rotateRev-time...
[[34m  Info  [0m] Candidate invariants
[[34m  Info  [0m] rotateRev-time-->res130._2 <= 0
[[34m  Info  [0m] checked VC inst... in 0.071s
[[34m  Info  [0m] Function: rotateRev-time--Found candidate invariant is not a real invariant! 
[[34m  Info  [0m] # of atomic predicates: 14 + 1
[[34m  Info  [0m] solving...
[[34m  Info  [0m] solved... in 0.007s
[[34m  Info  [0m] - More unrollings for invariant inference
[[34m  Info  [0m] Candidate invariants
[[34m  Info  [0m] rotateRev-time-->res130._2 <= 0
[[34m  Info  [0m] checked VC inst... in 2.904s
[[34m  Info  [0m] Function: rotateRev-time--Found candidate invariant is not a real invariant! 
[[34m  Info  [0m] # of atomic predicates: 23 + 1
[[34m  Info  [0m] solving...
[[34m  Info  [0m] solved... in 0.009s
[[34m  Info  [0m] Candidate invariants
[[34m  Info  [0m] rotateRev-time-->res130._2 + -124 <= 0
[[34m  Info  [0m] checked VC inst... in 0.058s
[[34m  Info  [0m] minimizing...
[[34m  Info  [0m] Candidate invariants
[[34m  Info  [0m] rotateRev-time-->res130._2 + -120 <= 0
[[34m  Info  [0m] checked VC inst... in 0.605s
[[34m  Info  [0m] Function: rotateRev-time--Found candidate invariant is not a real invariant! 
[[34m  Info  [0m] # of atomic predicates: 23 + 24
[[34m  Info  [0m] solving...
[[34m  Info  [0m] solved... in 0.015s
[[34m  Info  [0m] Candidate invariants
[[34m  Info  [0m] rotateRev-time-->res130._2 + -124 <= 0
[[34m  Info  [0m] checked VC inst... in 0.03s
[[34m  Info  [0m] minimizing...
[[34m  Info  [0m] Candidate invariants
[[34m  Info  [0m] rotateRev-time-->res130._2 + -123 <= 0
[[34m  Info  [0m] checked VC inst... in 0.009s
[[34m  Info  [0m] - Found inductive invariant: rotateRev-time --> time + BigInt(-123) <= BigInt(0)
[[34m  Info  [0m] - Verifying Invariants... 
[[34m  Info  [0m] - Invariant verified
[[34m  Info  [0m] - considering function rotateDrop-time...
[[34m  Info  [0m] Candidate invariants
[[34m  Info  [0m] rotateDrop-time-->res122._2 <= 0
[[34m  Info  [0m] checked VC inst... in 0.051s
[[34m  Info  [0m] Function: rotateDrop-time--Found candidate invariant is not a real invariant! 
[[34m  Info  [0m] # of atomic predicates: 18 + 1
[[34m  Info  [0m] solving...
[[34m  Info  [0m] solved... in 0.008s
[[34m  Info  [0m] Candidate invariants
[[34m  Info  [0m] rotateDrop-time-->res122._2 + -55 <= 0
[[34m  Info  [0m] checked VC inst... in 0.037s
[[34m  Info  [0m] Function: rotateDrop-time--Found candidate invariant is not a real invariant! 
[[34m  Info  [0m] # of atomic predicates: 22 + 19
[[34m  Info  [0m] solving...
[[34m  Info  [0m] solved... in 0.009s
[[34m  Info  [0m] Candidate invariants
[[34m  Info  [0m] rotateDrop-time-->res122._2 + -151 <= 0
[[34m  Info  [0m] checked VC inst... in 0.034s
[[34m  Info  [0m] Function: rotateDrop-time--Found candidate invariant is not a real invariant! 
[[34m  Info  [0m] # of atomic predicates: 22 + 41
[[34m  Info  [0m] solving...
[[34m  Info  [0m] solved... in 0.011s
[[34m  Info  [0m] Candidate invariants
[[34m  Info  [0m] rotateDrop-time-->res122._2 + -166 <= 0
[[34m  Info  [0m] checked VC inst... in 0.041s
[[34m  Info  [0m] Function: rotateDrop-time--Found candidate invariant is not a real invariant! 
[[34m  Info  [0m] # of atomic predicates: 19 + 63
[[34m  Info  [0m] solving...
[[34m  Info  [0m] solved... in 0.012s
[[34m  Info  [0m] - More unrollings for invariant inference
[[34m  Info  [0m] Candidate invariants
[[34m  Info  [0m] rotateDrop-time-->res122._2 <= 0
[[34m  Info  [0m] checked VC inst... in 15.049s
[[34m  Info  [0m] VC solving failed!...retrying with a bigger model...
[[34m  Info  [0m] # of atomic predicates: 2 + 1
[[34m  Info  [0m] solving...
[[34m  Info  [0m] solved... in 0.01s
[[34m  Info  [0m] Candidate invariants
[[34m  Info  [0m] rotateDrop-time-->res122._2 + -1 <= 0
[[34m  Info  [0m] checked VC inst... in 15.049s
[[34m  Info  [0m] VC solving failed!...retrying with a bigger model...
[[34m  Info  [0m] # of atomic predicates: 2 + 2
[[34m  Info  [0m] solving...
[[34m  Info  [0m] solved... in 0.008s
[[34m  Info  [0m] Candidate invariants
[[34m  Info  [0m] rotateDrop-time-->res122._2 + -2 <= 0
[[34m  Info  [0m] checked VC inst... in 15.044s
[[34m  Info  [0m] VC solving failed!...retrying with a bigger model...
[[34m  Info  [0m] # of atomic predicates: 2 + 3
[[34m  Info  [0m] solving...
[[34m  Info  [0m] solved... in 0.006s
[[34m  Info  [0m] Candidate invariants
[[34m  Info  [0m] rotateDrop-time-->res122._2 + -4 <= 0
[[34m  Info  [0m] checked VC inst... in 15.043s
[[34m  Info  [0m] VC solving failed!...retrying with a bigger model...
[[34m  Info  [0m] # of atomic predicates: 2 + 4
[[34m  Info  [0m] solving...
[[34m  Info  [0m] solved... in 0.006s
[[34m  Info  [0m] Candidate invariants
[[34m  Info  [0m] rotateDrop-time-->res122._2 + -8 <= 0
[[34m  Info  [0m] checked VC inst... in 15.044s
[[34m  Info  [0m] VC solving failed!...retrying with a bigger model...
[[34m  Info  [0m] # of atomic predicates: 2 + 5
[[34m  Info  [0m] solving...
[[34m  Info  [0m] solved... in 0.006s
[[34m  Info  [0m] Candidate invariants
[[34m  Info  [0m] rotateDrop-time-->res122._2 + -16 <= 0
[[34m  Info  [0m] checked VC inst... in 15.041s
[[34m  Info  [0m] VC solving failed!...retrying with a bigger model...
[[34m  Info  [0m] # of atomic predicates: 2 + 6
[[34m  Info  [0m] solving...
[[34m  Info  [0m] solved... in 0.006s
[[34m  Info  [0m] Candidate invariants
[[34m  Info  [0m] rotateDrop-time-->res122._2 + -32 <= 0
[[34m  Info  [0m] checked VC inst... in 15.051s
[[34m  Info  [0m] VC solving failed!...retrying with a bigger model...
[[34m  Info  [0m] # of atomic predicates: 2 + 7
[[34m  Info  [0m] solving...
[[34m  Info  [0m] solved... in 0.007s
[[34m  Info  [0m] Candidate invariants
[[34m  Info  [0m] rotateDrop-time-->res122._2 + -64 <= 0
[[34m  Info  [0m] checked VC inst... in 5.736s
[[34m  Info  [0m] Function: rotateDrop-time--Found candidate invariant is not a real invariant! 
[[34m  Info  [0m] # of atomic predicates: 26 + 8
[[34m  Info  [0m] solving...
[[34m  Info  [0m] solved... in 0.01s
[[34m  Info  [0m] Candidate invariants
[[34m  Info  [0m] rotateDrop-time-->res122._2 + -131 <= 0
[[34m  Info  [0m] checked VC inst... in 4.25s
[[34m  Info  [0m] Function: rotateDrop-time--Found candidate invariant is not a real invariant! 
[[34m  Info  [0m] # of atomic predicates: 36 + 34
[[34m  Info  [0m] solving...
[[34m  Info  [0m] solved... in 0.017s
[[34m  Info  [0m] Candidate invariants
[[34m  Info  [0m] rotateDrop-time-->res122._2 + -144 <= 0
[[34m  Info  [0m] checked VC inst... in 4.653s
[[34m  Info  [0m] Function: rotateDrop-time--Found candidate invariant is not a real invariant! 
[[34m  Info  [0m] # of atomic predicates: 36 + 70
[[34m  Info  [0m] solving...
[[34m  Info  [0m] solved... in 0.022s
[[34m  Info  [0m] Candidate invariants
[[34m  Info  [0m] rotateDrop-time-->res122._2 + -147 <= 0
[[34m  Info  [0m] checked VC inst... in 2.781s
[[34m  Info  [0m] Function: rotateDrop-time--Found candidate invariant is not a real invariant! 
[[34m  Info  [0m] # of atomic predicates: 36 + 106
[[34m  Info  [0m] solving...
[[34m  Info  [0m] solved... in 0.027s
[[34m  Info  [0m] Candidate invariants
[[34m  Info  [0m] rotateDrop-time-->res122._2 + -150 <= 0
[[34m  Info  [0m] checked VC inst... in 0.105s
[[34m  Info  [0m] minimizing...
[[34m  Info  [0m] Candidate invariants
[[34m  Info  [0m] rotateDrop-time-->res122._2 + -149 <= 0
[[34m  Info  [0m] checked VC inst... in 0.017s
[[34m  Info  [0m] - Found inductive invariant: rotateDrop-time --> time + BigInt(-149) <= BigInt(0)
[[34m  Info  [0m] - Verifying Invariants... 
[[34m  Info  [0m] - Invariant verified
[[34m  Info  [0m] - considering function get-mem-time...
[[34m  Info  [0m] - considering function force-time...
[[34m  Info  [0m] Candidate invariants
[[34m  Info  [0m] force-time-->res120._2 <= 0
[[34m  Info  [0m] checked VC inst... in 0.011s
[[34m  Info  [0m] Function: force-time--Found candidate invariant is not a real invariant! 
[[34m  Info  [0m] # of atomic predicates: 6 + 1
[[34m  Info  [0m] solving...
[[34m  Info  [0m] solved... in 0.008s
[[34m  Info  [0m] Candidate invariants
[[34m  Info  [0m] force-time-->res120._2 + -9 <= 0
[[34m  Info  [0m] checked VC inst... in 0.006s
[[34m  Info  [0m] Function: force-time--Found candidate invariant is not a real invariant! 
[[34m  Info  [0m] # of atomic predicates: 6 + 7
[[34m  Info  [0m] solving...
[[34m  Info  [0m] solved... in 0.007s
[[34m  Info  [0m] Candidate invariants
[[34m  Info  [0m] force-time-->res120._2 + -11 <= 0
[[34m  Info  [0m] checked VC inst... in 0.005s
[[34m  Info  [0m] Function: force-time--Found candidate invariant is not a real invariant! 
[[34m  Info  [0m] # of atomic predicates: 6 + 13
[[34m  Info  [0m] solving...
[[34m  Info  [0m] solved... in 0.006s
[[34m  Info  [0m] - More unrollings for invariant inference
[[34m  Info  [0m] Candidate invariants
[[34m  Info  [0m] force-time-->res120._2 <= 0
[[34m  Info  [0m] checked VC inst... in 0.013s
[[34m  Info  [0m] Function: force-time--Found candidate invariant is not a real invariant! 
[[34m  Info  [0m] # of atomic predicates: 6 + 1
[[34m  Info  [0m] solving...
[[34m  Info  [0m] solved... in 0.007s
[[34m  Info  [0m] Candidate invariants
[[34m  Info  [0m] force-time-->res120._2 + -9 <= 0
[[34m  Info  [0m] checked VC inst... in 0.008s
[[34m  Info  [0m] Function: force-time--Found candidate invariant is not a real invariant! 
[[34m  Info  [0m] # of atomic predicates: 6 + 7
[[34m  Info  [0m] solving...
[[34m  Info  [0m] solved... in 0.007s
[[34m  Info  [0m] Candidate invariants
[[34m  Info  [0m] force-time-->res120._2 + -11 <= 0
[[34m  Info  [0m] checked VC inst... in 0.008s
[[34m  Info  [0m] Function: force-time--Found candidate invariant is not a real invariant! 
[[34m  Info  [0m] # of atomic predicates: 6 + 13
[[34m  Info  [0m] solving...
[[34m  Info  [0m] solved... in 0.007s
[[34m  Info  [0m] - More unrollings for invariant inference
[[34m  Info  [0m] Candidate invariants
[[34m  Info  [0m] force-time-->res120._2 <= 0
[[34m  Info  [0m] checked VC inst... in 0.076s
[[34m  Info  [0m] Function: force-time--Found candidate invariant is not a real invariant! 
[[34m  Info  [0m] # of atomic predicates: 6 + 1
[[34m  Info  [0m] solving...
[[34m  Info  [0m] solved... in 0.013s
[[34m  Info  [0m] Candidate invariants
[[34m  Info  [0m] force-time-->res120._2 + -9 <= 0
[[34m  Info  [0m] checked VC inst... in 0.04s
[[34m  Info  [0m] Function: force-time--Found candidate invariant is not a real invariant! 
[[34m  Info  [0m] # of atomic predicates: 10 + 7
[[34m  Info  [0m] solving...
[[34m  Info  [0m] solved... in 0.012s
[[34m  Info  [0m] Candidate invariants
[[34m  Info  [0m] force-time-->res120._2 + -11 <= 0
[[34m  Info  [0m] checked VC inst... in 0.022s
[[34m  Info  [0m] Function: force-time--Found candidate invariant is not a real invariant! 
[[34m  Info  [0m] # of atomic predicates: 9 + 17
[[34m  Info  [0m] solving...
[[34m  Info  [0m] solved... in 0.008s
[[34m  Info  [0m] Candidate invariants
[[34m  Info  [0m] force-time-->res120._2 + -34 <= 0
[[34m  Info  [0m] checked VC inst... in 0.027s
[[34m  Info  [0m] Function: force-time--Found candidate invariant is not a real invariant! 
[[34m  Info  [0m] # of atomic predicates: 11 + 26
[[34m  Info  [0m] solving...
[[34m  Info  [0m] solved... in 0.008s
[[34m  Info  [0m] Candidate invariants
[[34m  Info  [0m] force-time-->res120._2 + -140 <= 0
[[34m  Info  [0m] checked VC inst... in 0.023s
[[34m  Info  [0m] Function: force-time--Found candidate invariant is not a real invariant! 
[[34m  Info  [0m] # of atomic predicates: 14 + 37
[[34m  Info  [0m] solving...
[[34m  Info  [0m] solved... in 0.01s
[[34m  Info  [0m] Candidate invariants
[[34m  Info  [0m] force-time-->res120._2 + -166 <= 0
[[34m  Info  [0m] checked VC inst... in 0.007s
[[34m  Info  [0m] minimizing...
[[34m  Info  [0m] Candidate invariants
[[34m  Info  [0m] force-time-->res120._2 + -165 <= 0
[[34m  Info  [0m] checked VC inst... in 0.016s
[[34m  Info  [0m] - Found inductive invariant: force-time --> time + BigInt(-165) <= BigInt(0)
[[34m  Info  [0m] - Verifying Invariants... 
[[34m  Info  [0m] - Invariant verified
[[34m  Info  [0m] - considering function forceTwice-time...
[[34m  Info  [0m] Candidate invariants
[[34m  Info  [0m] forceTwice-time-->x$219._2 <= 0
[[34m  Info  [0m] checked VC inst... in 0.026s
[[34m  Info  [0m] Function: forceTwice-time--Found candidate invariant is not a real invariant! 
[[34m  Info  [0m] # of atomic predicates: 13 + 1
[[34m  Info  [0m] solving...
[[34m  Info  [0m] solved... in 0.01s
[[34m  Info  [0m] Candidate invariants
[[34m  Info  [0m] forceTwice-time-->x$219._2 + -679 <= 0
[[34m  Info  [0m] checked VC inst... in 0.002s
[[34m  Info  [0m] minimizing...
[[34m  Info  [0m] Candidate invariants
[[34m  Info  [0m] forceTwice-time-->x$219._2 + -677 <= 0
[[34m  Info  [0m] checked VC inst... in 0.003s
[[34m  Info  [0m] - Found inductive invariant: forceTwice-time --> time + BigInt(-677) <= BigInt(0)
[[34m  Info  [0m] - Verifying Invariants... 
[[34m  Info  [0m] - Invariant verified
[[34m  Info  [0m] - considering function createQueue-time...
[[34m  Info  [0m] Candidate invariants
[[34m  Info  [0m] createQueue-time-->res127._2 <= 0
[[34m  Info  [0m] checked VC inst... in 0.06s
[[34m  Info  [0m] Function: createQueue-time--Found candidate invariant is not a real invariant! 
[[34m  Info  [0m] # of atomic predicates: 20 + 1
[[34m  Info  [0m] solving...
[[34m  Info  [0m] solved... in 0.007s
[[34m  Info  [0m] Candidate invariants
[[34m  Info  [0m] createQueue-time-->res127._2 + -11 <= 0
[[34m  Info  [0m] checked VC inst... in 0.058s
[[34m  Info  [0m] Function: createQueue-time--Found candidate invariant is not a real invariant! 
[[34m  Info  [0m] # of atomic predicates: 28 + 21
[[34m  Info  [0m] solving...
[[34m  Info  [0m] solved... in 0.011s
[[34m  Info  [0m] Candidate invariants
[[34m  Info  [0m] createQueue-time-->res127._2 + -182 <= 0
[[34m  Info  [0m] checked VC inst... in 0.01s
[[34m  Info  [0m] minimizing...
[[34m  Info  [0m] Candidate invariants
[[34m  Info  [0m] createQueue-time-->res127._2 + -181 <= 0
[[34m  Info  [0m] checked VC inst... in 0.004s
[[34m  Info  [0m] - Found inductive invariant: createQueue-time --> time + BigInt(-181) <= BigInt(0)
[[34m  Info  [0m] - Verifying Invariants... 
[[34m  Info  [0m] - Invariant verified
[[34m  Info  [0m] - Nothing to solve for empty-time
[[34m  Info  [0m] - considering function tailSub-time...
[[34m  Info  [0m] Candidate invariants
[[34m  Info  [0m] tailSub-time-->res119._2 <= 0
[[34m  Info  [0m] checked VC inst... in 0.025s
[[34m  Info  [0m] Function: tailSub-time--Found candidate invariant is not a real invariant! 
[[34m  Info  [0m] # of atomic predicates: 6 + 1
[[34m  Info  [0m] solving...
[[34m  Info  [0m] solved... in 0.007s
[[34m  Info  [0m] - More unrollings for invariant inference
[[34m  Info  [0m] Candidate invariants
[[34m  Info  [0m] tailSub-time-->res119._2 <= 0
[[34m  Info  [0m] checked VC inst... in 0.317s
[[34m  Info  [0m] Function: tailSub-time--Found candidate invariant is not a real invariant! 
[[34m  Info  [0m] # of atomic predicates: 34 + 1
[[34m  Info  [0m] solving...
[[34m  Info  [0m] solved... in 0.009s
[[34m  Info  [0m] Candidate invariants
[[34m  Info  [0m] tailSub-time-->res119._2 + -882 <= 0
[[34m  Info  [0m] checked VC inst... in 0.093s
[[34m  Info  [0m] Function: tailSub-time--Found candidate invariant is not a real invariant! 
[[34m  Info  [0m] # of atomic predicates: 34 + 35
[[34m  Info  [0m] solving...
[[34m  Info  [0m] solved... in 0.008s
[[34m  Info  [0m] Candidate invariants
[[34m  Info  [0m] tailSub-time-->res119._2 + -884 <= 0
[[34m  Info  [0m] checked VC inst... in 0.012s
[[34m  Info  [0m] minimizing...
[[34m  Info  [0m] Candidate invariants
[[34m  Info  [0m] tailSub-time-->res119._2 + -883 <= 0
[[34m  Info  [0m] checked VC inst... in 0.011s
[[34m  Info  [0m] - Found inductive invariant: tailSub-time --> time + BigInt(-883) <= BigInt(0)
[[34m  Info  [0m] - Verifying Invariants... 
[[34m  Info  [0m] - Invariant verified
[[34m  Info  [0m] - considering function tail-time...
[[34m  Info  [0m] Candidate invariants
[[34m  Info  [0m] tail-time-->res124._2 <= 0
[[34m  Info  [0m] checked VC inst... in 0.007s
[[34m  Info  [0m] Function: tail-time--Found candidate invariant is not a real invariant! 
[[34m  Info  [0m] # of atomic predicates: 9 + 1
[[34m  Info  [0m] solving...
[[34m  Info  [0m] solved... in 0.007s
[[34m  Info  [0m] Candidate invariants
[[34m  Info  [0m] tail-time-->res124._2 + -1057 <= 0
[[34m  Info  [0m] checked VC inst... in 0.001s
[[34m  Info  [0m] minimizing...
[[34m  Info  [0m] Candidate invariants
[[34m  Info  [0m] tail-time-->res124._2 + -1055 <= 0
[[34m  Info  [0m] checked VC inst... in 0.001s
[[34m  Info  [0m] - Found inductive invariant: tail-time --> time + BigInt(-1055) <= BigInt(0)
[[34m  Info  [0m] - Verifying Invariants... 
[[34m  Info  [0m] - Invariant verified
[[34m  Info  [0m] - considering function cons-time...
[[34m  Info  [0m] Candidate invariants
[[34m  Info  [0m] cons-time-->res121._2 <= 0
[[34m  Info  [0m] checked VC inst... in 0.014s
[[34m  Info  [0m] Function: cons-time--Found candidate invariant is not a real invariant! 
[[34m  Info  [0m] # of atomic predicates: 17 + 1
[[34m  Info  [0m] solving...
[[34m  Info  [0m] solved... in 0.008s
[[34m  Info  [0m] Candidate invariants
[[34m  Info  [0m] cons-time-->res121._2 + -530 <= 0
[[34m  Info  [0m] checked VC inst... in 0.001s
[[34m  Info  [0m] minimizing...
[[34m  Info  [0m] Candidate invariants
[[34m  Info  [0m] cons-time-->res121._2 + -528 <= 0
[[34m  Info  [0m] checked VC inst... in 0.001s
[[34m  Info  [0m] - Found inductive invariant: cons-time --> time + BigInt(-528) <= BigInt(0)
[[34m  Info  [0m] - Verifying Invariants... 
[[34m  Info  [0m] - Invariant verified
[[34m  Info  [0m] - considering function reverse-time...
[[34m  Info  [0m] Candidate invariants
[[34m  Info  [0m] reverse-time-->x$46._2 <= 0
[[34m  Info  [0m] checked VC inst... in 0.002s
[[34m  Info  [0m] Function: reverse-time--Found candidate invariant is not a real invariant! 
[[34m  Info  [0m] # of atomic predicates: 6 + 1
[[34m  Info  [0m] solving...
[[34m  Info  [0m] solved... in 0.007s
[[34m  Info  [0m] Candidate invariants
[[34m  Info  [0m] reverse-time-->x$46._2 + -9 <= 0
[[34m  Info  [0m] checked VC inst... in 0.0s
[[34m  Info  [0m] minimizing...
[[34m  Info  [0m] Candidate invariants
[[34m  Info  [0m] reverse-time-->x$46._2 + -7 <= 0
[[34m  Info  [0m] checked VC inst... in 0.0s
[[34m  Info  [0m] - Found inductive invariant: reverse-time --> time + BigInt(-7) <= BigInt(0)
[[34m  Info  [0m] - Verifying Invariants... 
[[34m  Info  [0m] - Invariant verified
Resource Verification Results: 
. ┌─────────━
╔═╡ Summary ════════════════════════════════════════════════╗
║ └─────────┘                                               ║
║ cons-           time <= 528                 2.909         ║
║ createQueue-    time <= 181                 2.435         ║
║ drop-           time <= 16 * n + 2          1.024         ║
║ force-          time <= 165                 1.240         ║
║ forceTwice-     time <= 677                 3.572         ║
║ revAppend-      time <= 15 * l1.size + 2    2.030         ║
║ reverse-        time <= 7                   0.122         ║
║ rotateDrop-     time <= 149                 126.091       ║
║ rotateRev-      time <= 123                 5.793         ║
║ tail-           time <= 1055                1.641         ║
║ tailSub-        time <= 883                 2.895         ║
║ take-           time <= 18 * n + 3          0.954         ║
║ takeLazy-       time <= 17                  2.715         ║
╟┄┄┄┄┄┄┄┄┄┄┄┄┄┄┄┄┄┄┄┄┄┄┄┄┄┄┄┄┄┄┄┄┄┄┄┄┄┄┄┄┄┄┄┄┄┄┄┄┄┄┄┄┄┄┄┄┄┄┄╢
║ total: 13    inferred: 13    unknown: 0     time: 153.421 ║
╚════════════════════════════════════════════════════════════
[[34m  Info  [0m] Stats dumped to file: Deque-stats.txt
