[[33mWarning [0m] warning: there were two feature warnings; re-run with -feature for details
[[34m  Info  [0m] Output written on leon.out
[[34m  Info  [0m] Output written on leon.out
[[34m  Info  [0m] Output written on leon.out
[[34m  Info  [0m] Output written on leon.out
[[34m  Info  [0m] Output written on leon.out
instfuncs: bottomup,knapSackSol,maxValue,knapSack-mem,invoke instFuncTypes: 
[[34m  Info  [0m] Output written on leon.out
[[34m  Info  [0m] Output written on leon.out
[[34m  Info  [0m] Output written on leon.out
[[34m  Info  [0m]  - Now considering 'postcondition' VC for deps4 @?:?...
[[34m  Info  [0m]  => VALID
[[34m  Info  [0m]  - Now considering 'precond. (call deps4(i - BigInt(1), items, st@))' VC for deps4 @?:?...
[[34m  Info  [0m]  => VALID
[[34m  Info  [0m]  - Now considering 'postcondition' VC for maxValue4 @?:?...
[[34m  Info  [0m]  => VALID
[[34m  Info  [0m]  - Now considering 'precond. (call deps4(w - BigInt(1), items, st@))' VC for maxValue4 @?:?...
[[34m  Info  [0m]  => VALID
[[34m  Info  [0m]  - Now considering 'precond. (call depsLem4(w - wi, w - BigInt(1), items, s ...)' VC for maxValue4 @?:?...
[[34m  Info  [0m]  => VALID
[[34m  Info  [0m]  - Now considering 'precond. (call maxValue4(items, w, tail, st@))' VC for maxValue4 @?:?...
[[34m  Info  [0m]  => VALID
[[34m  Info  [0m]  - Now considering 'precond. (call knapSack-mem3(w - wi, items, oldMax1._2))' VC for maxValue4 @?:?...
[[34m  Info  [0m]  => VALID
[[34m  Info  [0m]  - Now considering 'match exhaustiveness' VC for maxValue4 @?:?...
[[34m  Info  [0m]  => VALID
[[34m  Info  [0m]  - Now considering 'match exhaustiveness' VC for maxValue4 @?:?...
[[34m  Info  [0m]  => VALID
[[34m  Info  [0m]  - Now considering 'postcondition' VC for knapSack-mem3 @?:?...
[[34m  Info  [0m]  => VALID
[[34m  Info  [0m]  - Now considering 'precond. (call deps4(w - BigInt(1), items, st@))' VC for knapSack-mem3 @?:?...
[[34m  Info  [0m]  => VALID
[[34m  Info  [0m]  - Now considering 'precond. (call maxValue4(items, w, items, st@))' VC for knapSack-mem3 @?:?...
[[34m  Info  [0m]  => VALID
[[34m  Info  [0m]  - Now considering 'postcondition' VC for invoke4 @?:?...
[[34m  Info  [0m]  => VALID
[[34m  Info  [0m]  - Now considering 'precond. (call deps4(i - BigInt(1), items, st@))' VC for invoke4 @?:?...
[[34m  Info  [0m]  => VALID
[[34m  Info  [0m]  - Now considering 'precond. (call knapSack-mem3(i, items, st@))' VC for invoke4 @?:?...
[[34m  Info  [0m]  => VALID
[[34m  Info  [0m]  - Now considering 'precond. (call depsMono4(i - BigInt(1), items, st@, res ...)' VC for invoke4 @?:?...
[[34m  Info  [0m]  => VALID
[[34m  Info  [0m]  - Now considering 'precond. (call deps4(i - BigInt(1), items, res._2))' VC for invoke4 @?:?...
[[34m  Info  [0m]  => VALID
[[34m  Info  [0m]  - Now considering 'postcondition' VC for bottomup4 @?:?...
[[34m  Info  [0m]  => VALID
[[34m  Info  [0m]  - Now considering 'precond. (call deps4(i - BigInt(1), items, st@))' VC for bottomup4 @?:?...
[[34m  Info  [0m]  => VALID
[[34m  Info  [0m]  - Now considering 'precond. (call invoke4(i, items, st@))' VC for bottomup4 @?:?...
[[34m  Info  [0m]  => VALID
[[34m  Info  [0m]  - Now considering 'precond. (call bottomup4(i + BigInt(1), w, items, ri1._ ...)' VC for bottomup4 @?:?...
[[34m  Info  [0m]  => VALID
[[34m  Info  [0m]  - Now considering 'postcondition' VC for knapSackSol4 @?:?...
[[34m  Info  [0m]  => VALID
[[34m  Info  [0m]  - Now considering 'precond. (call bottomup4(BigInt(0), w, items, st@))' VC for knapSackSol4 @?:?...
[[34m  Info  [0m]  => VALID
[[34m  Info  [0m]  - Now considering 'tact (postcondition)' VC for depsMono4 @?:?...
[[34m  Info  [0m]  => VALID
[[34m  Info  [0m]  - Now considering 'tact (precond. (call depsMono-VCTact(i - BigInt(1), items, st ...))' VC for depsMono4 @?:?...
[[34m  Info  [0m]  => VALID
[[34m  Info  [0m]  - Now considering 'tact (precond. (call deps4(i, items, st1)))' VC for depsMono4 @?:?...
[[34m  Info  [0m]  => VALID
[[34m  Info  [0m]  - Now considering 'tact (precond. (call deps4(i, items, st2)))' VC for depsMono4 @?:?...
[[34m  Info  [0m]  => VALID
[[34m  Info  [0m]  - Now considering 'precond. (call deps4(i, items, st1))' VC for depsMono4 @?:?...
[[34m  Info  [0m]  => VALID
[[34m  Info  [0m]  - Now considering 'precond. (call deps4(i, items, st2))' VC for depsMono4 @?:?...
[[34m  Info  [0m]  => VALID
[[34m  Info  [0m]  - Now considering 'tact (postcondition)' VC for depsLem4 @?:?...
[[34m  Info  [0m]  => VALID
[[34m  Info  [0m]  - Now considering 'tact (precond. (call depsLem-VCTact(x, y - BigInt(1), items,  ...))' VC for depsLem4 @?:?...
[[34m  Info  [0m]  => VALID
[[34m  Info  [0m]  - Now considering 'tact (precond. (call deps4(y, items, st@)))' VC for depsLem4 @?:?...
[[34m  Info  [0m]  => VALID
[[34m  Info  [0m]  - Now considering 'tact (precond. (call deps4(x, items, st@)))' VC for depsLem4 @?:?...
[[34m  Info  [0m]  => VALID
[[34m  Info  [0m]  - Now considering 'precond. (call deps4(y, items, st@))' VC for depsLem4 @?:?...
[[34m  Info  [0m]  => VALID
[[34m  Info  [0m]  - Now considering 'precond. (call deps4(x, items, st@))' VC for depsLem4 @?:?...
[[34m  Info  [0m]  => VALID
[[34m  Info  [0m]  - Now considering 'postcondition' VC for size7 @?:?...
[[34m  Info  [0m]  => VALID
[[34m  Info  [0m]  - Now considering 'match exhaustiveness' VC for size7 @?:?...
[[34m  Info  [0m]  => VALID
  ┌──────────────────────━
╔═╡ Verification Summary ╞═════════════════════════════════════════════════════════════════════════════════════════════════════╗
║ └──────────────────────┘                                                                                                     ║
║ Knapscak.bottomup4      postcondition                                                        ?:?  valid  U:smt-z3      0.044 ║
║ Knapscak.bottomup4      precond. (call bottomup4(i + BigInt(1), w, items, ri1._ ...)         ?:?  valid  U:smt-z3      0.034 ║
║ Knapscak.bottomup4      precond. (call deps4(i - BigInt(1), items, st@))                     ?:?  valid  U:smt-z3      0.011 ║
║ Knapscak.bottomup4      precond. (call invoke4(i, items, st@))                               ?:?  valid  U:smt-z3      0.016 ║
║ Knapscak.deps4          postcondition                                                        ?:?  valid  U:smt-cvc4    0.584 ║
║ Knapscak.deps4          precond. (call deps4(i - BigInt(1), items, st@))                     ?:?  valid  U:smt-z3      0.016 ║
║ Knapscak.depsLem4       precond. (call deps4(x, items, st@))                                 ?:?  valid  U:smt-z3      0.012 ║
║ Knapscak.depsLem4       precond. (call deps4(y, items, st@))                                 ?:?  valid  U:smt-z3      0.012 ║
║ Knapscak.depsLem4       tact (postcondition)                                                 ?:?  valid  U:smt-z3      0.027 ║
║ Knapscak.depsLem4       tact (precond. (call deps4(x, items, st@)))                          ?:?  valid  U:smt-cvc4    0.015 ║
║ Knapscak.depsLem4       tact (precond. (call deps4(y, items, st@)))                          ?:?  valid  U:smt-cvc4    0.015 ║
║ Knapscak.depsLem4       tact (precond. (call depsLem-VCTact(x, y - BigInt(1), items,  ...))  ?:?  valid  U:smt-z3      0.010 ║
║ Knapscak.depsMono4      precond. (call deps4(i, items, st1))                                 ?:?  valid  U:smt-z3      0.011 ║
║ Knapscak.depsMono4      precond. (call deps4(i, items, st2))                                 ?:?  valid  U:smt-z3      0.013 ║
║ Knapscak.depsMono4      tact (postcondition)                                                 ?:?  valid  U:smt-z3      0.039 ║
║ Knapscak.depsMono4      tact (precond. (call deps4(i, items, st1)))                          ?:?  valid  U:smt-z3      0.013 ║
║ Knapscak.depsMono4      tact (precond. (call deps4(i, items, st2)))                          ?:?  valid  U:smt-z3      0.015 ║
║ Knapscak.depsMono4      tact (precond. (call depsMono-VCTact(i - BigInt(1), items, st ...))  ?:?  valid  U:smt-z3      0.009 ║
║ Knapscak.invoke4        postcondition                                                        ?:?  valid  U:smt-z3      0.038 ║
║ Knapscak.invoke4        precond. (call deps4(i - BigInt(1), items, res._2))                  ?:?  valid  U:smt-z3      0.021 ║
║ Knapscak.invoke4        precond. (call deps4(i - BigInt(1), items, st@))                     ?:?  valid  U:smt-z3      0.009 ║
║ Knapscak.invoke4        precond. (call depsMono4(i - BigInt(1), items, st@, res ...)         ?:?  valid  U:smt-z3      0.017 ║
║ Knapscak.invoke4        precond. (call knapSack-mem3(i, items, st@))                         ?:?  valid  U:smt-z3      0.016 ║
║ Knapscak.knapSack-mem3  postcondition                                                        ?:?  valid  U:smt-z3      0.047 ║
║ Knapscak.knapSack-mem3  precond. (call deps4(w - BigInt(1), items, st@))                     ?:?  valid  U:smt-z3      0.015 ║
║ Knapscak.knapSack-mem3  precond. (call maxValue4(items, w, items, st@))                      ?:?  valid  U:smt-z3      0.030 ║
║ Knapscak.knapSackSol4   postcondition                                                        ?:?  valid  U:smt-z3      0.027 ║
║ Knapscak.knapSackSol4   precond. (call bottomup4(BigInt(0), w, items, st@))                  ?:?  valid  U:smt-cvc4    0.014 ║
║ Knapscak.maxValue4      match exhaustiveness                                                 ?:?  valid  U:smt-z3      0.021 ║
║ Knapscak.maxValue4      match exhaustiveness                                                 ?:?  valid  U:smt-z3      0.017 ║
║ Knapscak.maxValue4      postcondition                                                        ?:?  valid  U:smt-z3      0.303 ║
║ Knapscak.maxValue4      precond. (call deps4(w - BigInt(1), items, st@))                     ?:?  valid  U:smt-cvc4    0.012 ║
║ Knapscak.maxValue4      precond. (call depsLem4(w - wi, w - BigInt(1), items, s ...)         ?:?  valid  U:smt-z3      0.024 ║
║ Knapscak.maxValue4      precond. (call knapSack-mem3(w - wi, items, oldMax1._2))             ?:?  valid  U:smt-z3      0.096 ║
║ Knapscak.maxValue4      precond. (call maxValue4(items, w, tail, st@))                       ?:?  valid  U:smt-z3      0.048 ║
║ IList.size7             match exhaustiveness                                                 ?:?  valid  U:smt-z3      0.014 ║
║ IList.size7             postcondition                                                        ?:?  valid  U:smt-z3      0.022 ║
╟┄┄┄┄┄┄┄┄┄┄┄┄┄┄┄┄┄┄┄┄┄┄┄┄┄┄┄┄┄┄┄┄┄┄┄┄┄┄┄┄┄┄┄┄┄┄┄┄┄┄┄┄┄┄┄┄┄┄┄┄┄┄┄┄┄┄┄┄┄┄┄┄┄┄┄┄┄┄┄┄┄┄┄┄┄┄┄┄┄┄┄┄┄┄┄┄┄┄┄┄┄┄┄┄┄┄┄┄┄┄┄┄┄┄┄┄┄┄┄┄┄┄┄┄┄┄╢
║ total: 37     valid: 37     invalid: 0      unknown 0                                                                  1.687 ║
╚═══════════════════════════════════════════════════════════════════════════════════════════════════════════════════════════════
instfuncs:  instFuncTypes: 
[[34m  Info  [0m] - considering function maxValue-time...
[[34m  Info  [0m] Candidate invariants
[[34m  Info  [0m] maxValue-time-->x$218._2 <= 0
[[34m  Info  [0m] checked VC inst... in 0.052s
[[34m  Info  [0m] Function: maxValue-time--Found candidate invariant is not a real invariant! 
[[34m  Info  [0m] # of atomic predicates: 10 + 1
[[34m  Info  [0m] solving...
[[34m  Info  [0m] solved... in 0.03s
[[34m  Info  [0m] Candidate invariants
[[34m  Info  [0m] maxValue-time-->(x$218._2 + -1 * currList.size) + -7 <= 0
[[34m  Info  [0m] checked VC inst... in 0.019s
[[34m  Info  [0m] Function: maxValue-time--Found candidate invariant is not a real invariant! 
[[34m  Info  [0m] # of atomic predicates: 10 + 11
[[34m  Info  [0m] solving...
[[34m  Info  [0m] solved... in 0.011s
[[34m  Info  [0m] - More unrollings for invariant inference
[[34m  Info  [0m] Candidate invariants
[[34m  Info  [0m] maxValue-time-->x$218._2 <= 0
[[34m  Info  [0m] checked VC inst... in 0.024s
[[34m  Info  [0m] Function: maxValue-time--Found candidate invariant is not a real invariant! 
[[34m  Info  [0m] # of atomic predicates: 8 + 1
[[34m  Info  [0m] solving...
[[34m  Info  [0m] solved... in 0.009s
[[34m  Info  [0m] Candidate invariants
[[34m  Info  [0m] maxValue-time-->x$218._2 + -7 <= 0
[[34m  Info  [0m] checked VC inst... in 0.017s
[[34m  Info  [0m] Function: maxValue-time--Found candidate invariant is not a real invariant! 
[[34m  Info  [0m] # of atomic predicates: 14 + 9
[[34m  Info  [0m] solving...
[[34m  Info  [0m] solved... in 0.01s
[[34m  Info  [0m] Candidate invariants
[[34m  Info  [0m] maxValue-time-->(x$218._2 + -14 * currList.size) + -7 <= 0
[[34m  Info  [0m] checked VC inst... in 0.015s
[[34m  Info  [0m] Function: maxValue-time--Found candidate invariant is not a real invariant! 
[[34m  Info  [0m] # of atomic predicates: 18 + 23
[[34m  Info  [0m] solving...
[[34m  Info  [0m] solved... in 0.01s
[[34m  Info  [0m] Candidate invariants
[[34m  Info  [0m] maxValue-time-->(x$218._2 + -22 * currList.size) + -7 <= 0
[[34m  Info  [0m] checked VC inst... in 0.023s
[[34m  Info  [0m] Function: maxValue-time--Found candidate invariant is not a real invariant! 
[[34m  Info  [0m] # of atomic predicates: 24 + 41
[[34m  Info  [0m] solving...
[[34m  Info  [0m] solved... in 0.01s
[[34m  Info  [0m] - More unrollings for invariant inference
[[34m  Info  [0m] Creating VC for knapSack-mem-time
[[34m  Info  [0m] Candidate invariants
[[34m  Info  [0m] maxValue-time-->x$218._2 <= 0
[[34m  Info  [0m] knapSack-mem-time-->x$39._2 <= 0
[[34m  Info  [0m] checked VC inst... in 0.031s
[[34m  Info  [0m] Function: maxValue-time--Found candidate invariant is not a real invariant! 
[[34m  Info  [0m] checked VC inst... in 0.008s
[[34m  Info  [0m] Function: knapSack-mem-time--Found candidate invariant is not a real invariant! 
[[34m  Info  [0m] # of atomic predicates: 16 + 1
[[34m  Info  [0m] solving...
[[34m  Info  [0m] solved... in 0.011s
[[34m  Info  [0m] Candidate invariants
[[34m  Info  [0m] maxValue-time-->x$218._2 + -7 <= 0
[[34m  Info  [0m] knapSack-mem-time-->(-1 * items.size + x$39._2) + -4 <= 0
[[34m  Info  [0m] checked VC inst... in 0.02s
[[34m  Info  [0m] Function: maxValue-time--Found candidate invariant is not a real invariant! 
[[34m  Info  [0m] checked VC inst... in 0.006s
[[34m  Info  [0m] Function: knapSack-mem-time--Found candidate invariant is not a real invariant! 
[[34m  Info  [0m] # of atomic predicates: 29 + 17
[[34m  Info  [0m] solving...
[[34m  Info  [0m] solved... in 0.009s
[[34m  Info  [0m] - More unrollings for invariant inference
[[34m  Info  [0m] Candidate invariants
[[34m  Info  [0m] maxValue-time-->x$218._2 <= 0
[[34m  Info  [0m] knapSack-mem-time-->x$39._2 <= 0
[[34m  Info  [0m] checked VC inst... in 0.143s
[[34m  Info  [0m] Function: maxValue-time--Found candidate invariant is not a real invariant! 
[[34m  Info  [0m] checked VC inst... in 0.047s
[[34m  Info  [0m] Function: knapSack-mem-time--Found candidate invariant is not a real invariant! 
[[34m  Info  [0m] # of atomic predicates: 17 + 1
[[34m  Info  [0m] solving...
[[34m  Info  [0m] solved... in 0.009s
[[34m  Info  [0m] Candidate invariants
[[34m  Info  [0m] maxValue-time-->x$218._2 + -7 <= 0
[[34m  Info  [0m] knapSack-mem-time-->(-2 * items.size + x$39._2) + -3 <= 0
[[34m  Info  [0m] checked VC inst... in 0.039s
[[34m  Info  [0m] Function: maxValue-time--Found candidate invariant is not a real invariant! 
[[34m  Info  [0m] checked VC inst... in 0.017s
[[34m  Info  [0m] Function: knapSack-mem-time--Found candidate invariant is not a real invariant! 
[[34m  Info  [0m] # of atomic predicates: 36 + 18
[[34m  Info  [0m] solving...
[[34m  Info  [0m] solved... in 0.012s
[[34m  Info  [0m] Candidate invariants
[[34m  Info  [0m] maxValue-time-->(x$218._2 + -14 * currList.size) + -6 <= 0
[[34m  Info  [0m] knapSack-mem-time-->(-15 * items.size + x$39._2) + -9 <= 0
[[34m  Info  [0m] checked VC inst... in 0.067s
[[34m  Info  [0m] Function: maxValue-time--Found candidate invariant is not a real invariant! 
[[34m  Info  [0m] checked VC inst... in 0.006s
[[34m  Info  [0m] # of atomic predicates: 21 + 54
[[34m  Info  [0m] solving...
[[34m  Info  [0m] solved... in 0.015s
[[34m  Info  [0m] Candidate invariants
[[34m  Info  [0m] maxValue-time-->(2 * x$218._2 + -44 * currList.size) + -11 <= 0
[[34m  Info  [0m] knapSack-mem-time-->(-23 * items.size + x$39._2) + -8 <= 0
[[34m  Info  [0m] checked VC inst... in 0.098s
[[34m  Info  [0m] Function: maxValue-time--Found candidate invariant is not a real invariant! 
[[34m  Info  [0m] checked VC inst... in 0.008s
[[34m  Info  [0m] # of atomic predicates: 29 + 75
[[34m  Info  [0m] solving...
[[34m  Info  [0m] solved... in 0.019s
[[34m  Info  [0m] Candidate invariants
[[34m  Info  [0m] maxValue-time-->(x$218._2 + -26 * currList.size) + -6 <= 0
[[34m  Info  [0m] knapSack-mem-time-->(-70 * items.size + 2 * x$39._2) + -1 <= 0
[[34m  Info  [0m] checked VC inst... in 0.075s
[[34m  Info  [0m] Function: maxValue-time--Found candidate invariant is not a real invariant! 
[[34m  Info  [0m] checked VC inst... in 0.023s
[[34m  Info  [0m] Function: knapSack-mem-time--Found candidate invariant is not a real invariant! 
[[34m  Info  [0m] # of atomic predicates: 56 + 104
[[34m  Info  [0m] solving...
[[34m  Info  [0m] solved... in 0.021s
[[34m  Info  [0m] - More unrollings for invariant inference
[[34m  Info  [0m] Candidate invariants
[[34m  Info  [0m] maxValue-time-->x$218._2 <= 0
[[34m  Info  [0m] knapSack-mem-time-->x$39._2 <= 0
[[34m  Info  [0m] checked VC inst... in 0.095s
[[34m  Info  [0m] Function: maxValue-time--Found candidate invariant is not a real invariant! 
[[34m  Info  [0m] checked VC inst... in 0.03s
[[34m  Info  [0m] Function: knapSack-mem-time--Found candidate invariant is not a real invariant! 
[[34m  Info  [0m] # of atomic predicates: 17 + 1
[[34m  Info  [0m] solving...
[[34m  Info  [0m] solved... in 0.01s
[[34m  Info  [0m] Candidate invariants
[[34m  Info  [0m] maxValue-time-->x$218._2 + -7 <= 0
[[34m  Info  [0m] knapSack-mem-time-->(-2 * items.size + x$39._2) + -3 <= 0
[[34m  Info  [0m] checked VC inst... in 0.038s
[[34m  Info  [0m] Function: maxValue-time--Found candidate invariant is not a real invariant! 
[[34m  Info  [0m] checked VC inst... in 0.019s
[[34m  Info  [0m] Function: knapSack-mem-time--Found candidate invariant is not a real invariant! 
[[34m  Info  [0m] # of atomic predicates: 44 + 18
[[34m  Info  [0m] solving...
[[34m  Info  [0m] solved... in 0.013s
[[34m  Info  [0m] Candidate invariants
[[34m  Info  [0m] maxValue-time-->(x$218._2 + -16 * currList.size) + -6 <= 0
[[34m  Info  [0m] knapSack-mem-time-->(-25 * items.size + x$39._2) + 1 <= 0
[[34m  Info  [0m] checked VC inst... in 0.053s
[[34m  Info  [0m] Function: maxValue-time--Found candidate invariant is not a real invariant! 
[[34m  Info  [0m] checked VC inst... in 0.018s
[[34m  Info  [0m] Function: knapSack-mem-time--Found candidate invariant is not a real invariant! 
[[34m  Info  [0m] # of atomic predicates: 42 + 62
[[34m  Info  [0m] solving...
[[34m  Info  [0m] solved... in 0.019s
[[34m  Info  [0m] Candidate invariants
[[34m  Info  [0m] maxValue-time-->(x$218._2 + -21 * currList.size) + -6 <= 0
[[34m  Info  [0m] knapSack-mem-time-->(-124 * items.size + 4 * x$39._2) + 1 <= 0
[[34m  Info  [0m] checked VC inst... in 0.115s
[[34m  Info  [0m] checked VC inst... in 0.016s
[[34m  Info  [0m] Function: knapSack-mem-time--Found candidate invariant is not a real invariant! 
[[34m  Info  [0m] # of atomic predicates: 8 + 104
[[34m  Info  [0m] solving...
[[34m  Info  [0m] solved... in 0.019s
[[34m  Info  [0m] Candidate invariants
[[34m  Info  [0m] maxValue-time-->(2 * x$218._2 + -41 * currList.size) + -12 <= 0
[[34m  Info  [0m] knapSack-mem-time-->(-27 * items.size + x$39._2) + -3 <= 0
[[34m  Info  [0m] checked VC inst... in 0.129s
[[34m  Info  [0m] Function: maxValue-time--Found candidate invariant is not a real invariant! 
[[34m  Info  [0m] checked VC inst... in 0.018s
[[34m  Info  [0m] Function: knapSack-mem-time--Found candidate invariant is not a real invariant! 
[[34m  Info  [0m] # of atomic predicates: 45 + 112
[[34m  Info  [0m] solving...
[[34m  Info  [0m] solved... in 0.023s
[[34m  Info  [0m] Candidate invariants
[[34m  Info  [0m] maxValue-time-->(x$218._2 + -21 * currList.size) + -6 <= 0
[[34m  Info  [0m] knapSack-mem-time-->(-21 * items.size + x$39._2) + -9 <= 0
[[34m  Info  [0m] checked VC inst... in 0.13s
[[34m  Info  [0m] checked VC inst... in 0.004s
[[34m  Info  [0m] minimizing...
[[34m  Info  [0m] Candidate invariants
[[34m  Info  [0m] maxValue-time-->(x$218._2 + -21 * currList.size) + -5 <= 0
[[34m  Info  [0m] knapSack-mem-time-->(-22 * items.size + x$39._2) + -9 <= 0
[[34m  Info  [0m] checked VC inst... in 0.105s
[[34m  Info  [0m] checked VC inst... in 0.004s
[[34m  Info  [0m] - Found inductive invariant: maxValue-time --> (time + BigInt(-21) * currList.size) + BigInt(-5) <= BigInt(0)
[[34m  Info  [0m] - Found inductive invariant: knapSack-mem-time --> (BigInt(-22) * items.size + time) + BigInt(-9) <= BigInt(0)
[[34m  Info  [0m] - Verifying Invariants... 
[[34m  Info  [0m] - Invariant verified
[[34m  Info  [0m] - considering function knapSack-mem-time...
[[34m  Info  [0m] - considering function invoke-time...
[[34m  Info  [0m] Candidate invariants
[[34m  Info  [0m] invoke-time-->res66._2 <= 0
[[34m  Info  [0m] checked VC inst... in 0.005s
[[34m  Info  [0m] Function: invoke-time--Found candidate invariant is not a real invariant! 
[[34m  Info  [0m] # of atomic predicates: 10 + 1
[[34m  Info  [0m] solving...
[[34m  Info  [0m] solved... in 0.008s
[[34m  Info  [0m] Candidate invariants
[[34m  Info  [0m] invoke-time-->(res66._2 + -1 * items.size) + -4 <= 0
[[34m  Info  [0m] checked VC inst... in 0.003s
[[34m  Info  [0m] Function: invoke-time--Found candidate invariant is not a real invariant! 
[[34m  Info  [0m] # of atomic predicates: 9 + 11
[[34m  Info  [0m] solving...
[[34m  Info  [0m] solved... in 0.008s
[[34m  Info  [0m] Candidate invariants
[[34m  Info  [0m] invoke-time-->(res66._2 + -23 * items.size) + -13 <= 0
[[34m  Info  [0m] checked VC inst... in 0.002s
[[34m  Info  [0m] minimizing...
[[34m  Info  [0m] Candidate invariants
[[34m  Info  [0m] invoke-time-->(res66._2 + -22 * items.size) + -12 <= 0
[[34m  Info  [0m] checked VC inst... in 0.001s
[[34m  Info  [0m] - Found inductive invariant: invoke-time --> (time + BigInt(-22) * items.size) + BigInt(-12) <= BigInt(0)
[[34m  Info  [0m] - Verifying Invariants... 
[[34m  Info  [0m] - Invariant verified
[[34m  Info  [0m] - considering function bottomup-time...
[[34m  Info  [0m] Candidate invariants
[[34m  Info  [0m] bottomup-time-->items.size > 10 || (x$47._2 + 0 * i) + 0 * w <= 0
[[34m  Info  [0m] checked VC inst... in 0.009s
[[34m  Info  [0m] Function: bottomup-time--Found candidate invariant is not a real invariant! 
[[34m  Info  [0m] # of atomic predicates: 13 + 1
[[34m  Info  [0m] solving...
[[34m  Info  [0m] solved... in 0.007s
[[34m  Info  [0m] Candidate invariants
[[34m  Info  [0m] bottomup-time-->items.size > 10 || ((x$47._2 + 251 * i) + -251 * w) + -251 <= 0
[[34m  Info  [0m] checked VC inst... in 0.006s
[[34m  Info  [0m] Function: bottomup-time--Found candidate invariant is not a real invariant! 
[[34m  Info  [0m] # of atomic predicates: 16 + 14
[[34m  Info  [0m] solving...
[[34m  Info  [0m] solved... in 0.008s
[[34m  Info  [0m] - More unrollings for invariant inference
[[34m  Info  [0m] Candidate invariants
[[34m  Info  [0m] bottomup-time-->items.size > 10 || (x$47._2 + 0 * i) + 0 * w <= 0
[[34m  Info  [0m] checked VC inst... in 0.016s
[[34m  Info  [0m] Function: bottomup-time--Found candidate invariant is not a real invariant! 
[[34m  Info  [0m] # of atomic predicates: 17 + 1
[[34m  Info  [0m] solving...
[[34m  Info  [0m] solved... in 0.01s
[[34m  Info  [0m] Candidate invariants
[[34m  Info  [0m] bottomup-time-->items.size > 10 || ((x$47._2 + 20 * i) + -20 * w) + -20 <= 0
[[34m  Info  [0m] checked VC inst... in 0.01s
[[34m  Info  [0m] Function: bottomup-time--Found candidate invariant is not a real invariant! 
[[34m  Info  [0m] # of atomic predicates: 15 + 18
[[34m  Info  [0m] solving...
[[34m  Info  [0m] solved... in 0.009s
[[34m  Info  [0m] Candidate invariants
[[34m  Info  [0m] bottomup-time-->items.size > 10 || ((x$47._2 + 240 * i) + -240 * w) + -240 <= 0
[[34m  Info  [0m] checked VC inst... in 0.011s
[[34m  Info  [0m] Function: bottomup-time--Found candidate invariant is not a real invariant! 
[[34m  Info  [0m] # of atomic predicates: 22 + 33
[[34m  Info  [0m] solving...
[[34m  Info  [0m] solved... in 0.01s
[[34m  Info  [0m] Candidate invariants
[[34m  Info  [0m] bottomup-time-->items.size > 10 || ((x$47._2 + 242 * i) + -242 * w) + -242 <= 0
[[34m  Info  [0m] checked VC inst... in 0.003s
[[34m  Info  [0m] minimizing...
[[34m  Info  [0m] Candidate invariants
[[34m  Info  [0m] bottomup-time-->items.size > 10 || ((x$47._2 + 241 * i) + -241 * w) + -241 <= 0
[[34m  Info  [0m] checked VC inst... in 0.003s
[[34m  Info  [0m] - Found inductive invariant: bottomup-time --> items.size > BigInt(10) || ((time + BigInt(241) * i) + BigInt(-241) * w) + BigInt(-241) <= BigInt(0)
[[34m  Info  [0m] - Verifying Invariants... 
[[34m  Info  [0m] - Invariant verified
[[34m  Info  [0m] - considering function knapSackSol-time...
[[34m  Info  [0m] Candidate invariants
[[34m  Info  [0m] knapSackSol-time-->0 * w + x$55._2 <= 0
[[34m  Info  [0m] checked VC inst... in 0.004s
[[34m  Info  [0m] Function: knapSackSol-time--Found candidate invariant is not a real invariant! 
[[34m  Info  [0m] # of atomic predicates: 12 + 1
[[34m  Info  [0m] solving...
[[34m  Info  [0m] solved... in 0.01s
[[34m  Info  [0m] Candidate invariants
[[34m  Info  [0m] knapSackSol-time-->(-242 * w + x$55._2) + -254 <= 0
[[34m  Info  [0m] checked VC inst... in 0.001s
[[34m  Info  [0m] minimizing...
[[34m  Info  [0m] Candidate invariants
[[34m  Info  [0m] knapSackSol-time-->(-241 * w + x$55._2) + -242 <= 0
[[34m  Info  [0m] checked VC inst... in 0.001s
[[34m  Info  [0m] - Found inductive invariant: knapSackSol-time --> (BigInt(-241) * w + time) + BigInt(-242) <= BigInt(0)
[[34m  Info  [0m] - Verifying Invariants... 
[[34m  Info  [0m] - Invariant verified
Resource Verification Results: 
. ┌─────────━
╔═╡ Summary ╞═════════════════════════════════════════════════════════════════╗
║ └─────────┘                                                                 ║
║ bottomup-       items.size > 10 || time + 241 * i <= 241 * w + 241    0.319 ║
║ invoke-         time <= 22 * items.size + 12                          0.165 ║
║ knapSack-mem    time <= 22 * items.size + 9                           0.000 ║
║ knapSackSol-    time <= 241 * w + 242                                 0.159 ║
║ maxValue-       time <= 21 * currList.size + 5                        3.968 ║
╟┄┄┄┄┄┄┄┄┄┄┄┄┄┄┄┄┄┄┄┄┄┄┄┄┄┄┄┄┄┄┄┄┄┄┄┄┄┄┄┄┄┄┄┄┄┄┄┄┄┄┄┄┄┄┄┄┄┄┄┄┄┄┄┄┄┄┄┄┄┄┄┄┄┄┄┄┄╢
║ total: 5     inferred: 5     unknown: 0     time: 4.611                     ║
╚══════════════════════════════════════════════════════════════════════════════
[[34m  Info  [0m] Stats dumped to file: Knapsack-stats.txt
