[[33mWarning [0m] warning: there were three feature warnings; re-run with -feature for details
[[33mWarning [0m] Inlining recursive functions only once 'recSizePost'!
[[33mWarning [0m] Inlining recursive functions only once 'recSizeL'!
[[33mWarning [0m] Inlining recursive functions only once 'size'!
[[34m  Info  [0m]  - Now considering 'postcondition' VC for log$5 @?:?...
[[34m  Info  [0m]  => VALID
[[34m  Info  [0m]  - Now considering 'division by zero' VC for log$5 @?:?...
[[34m  Info  [0m]  => VALID
[[34m  Info  [0m]  - Now considering 'postcondition' VC for logMonotonicity$5 @?:?...
[[34m  Info  [0m]  => VALID
[[34m  Info  [0m]  - Now considering 'precond. (call logMonotonicity$5({ ...)' VC for logMonotonicity$5 @?:?...
[[34m  Info  [0m]  => VALID
[[34m  Info  [0m]  - Now considering 'division by zero' VC for logMonotonicity$5 @?:?...
[[34m  Info  [0m]  => VALID
[[34m  Info  [0m]  - Now considering 'division by zero' VC for logMonotonicity$5 @?:?...
[[34m  Info  [0m]  => VALID
[[34m  Info  [0m]  - Now considering 'postcondition' VC for recSize$5 @?:?...
[[34m  Info  [0m]  => VALID
[[34m  Info  [0m]  - Now considering 'precond. (call recSize$5(t$452))' VC for recSize$5 @?:?...
[[34m  Info  [0m]  => VALID
[[34m  Info  [0m]  - Now considering 'precond. (call recSize$5(b$23))' VC for recSize$5 @?:?...
[[34m  Info  [0m]  => VALID
[[34m  Info  [0m]  - Now considering 'precond. (call logMonotonicity$5(BigInt(2) * ({ ...)' VC for recSize$5 @?:?...
[[34m  Info  [0m]  => VALID
[[34m  Info  [0m]  - Now considering 'precond. (call recSize$5(t$453))' VC for recSize$5 @?:?...
[[34m  Info  [0m]  => VALID
[[34m  Info  [0m]  - Now considering 'precond. (call logMonotonicity$5(BigInt(2) * (recSize$5 ...)' VC for recSize$5 @?:?...
[[34m  Info  [0m]  => VALID
[[34m  Info  [0m]  - Now considering 'precond. (call recSize$5(b$24))' VC for recSize$5 @?:?...
[[34m  Info  [0m]  => VALID
[[34m  Info  [0m]  - Now considering 'match exhaustiveness' VC for recSize$5 @?:?...
[[34m  Info  [0m]  => VALID
[[34m  Info  [0m]  - Now considering 'match exhaustiveness' VC for recSize$5 @?:?...
[[34m  Info  [0m]  => VALID
[[34m  Info  [0m]  - Now considering 'match exhaustiveness' VC for recSize$5 @?:?...
[[34m  Info  [0m]  => VALID
[[34m  Info  [0m]  - Now considering 'match exhaustiveness' VC for recSize$5 @?:?...
[[34m  Info  [0m]  => VALID
[[34m  Info  [0m]  - Now considering 'postcondition' VC for logHeightProperty$5 @?:?...
[[34m  Info  [0m]  => VALID
[[34m  Info  [0m]  - Now considering 'precond. (call recSize$5(t$454))' VC for logHeightProperty$5 @?:?...
[[34m  Info  [0m]  => VALID
[[34m  Info  [0m]  - Now considering 'precond. (call logMonotonicity$5(lsz - BigInt(2), lsz - ...)' VC for logHeightProperty$5 @?:?...
[[34m  Info  [0m]  => VALID
[[34m  Info  [0m]  - Now considering 'match exhaustiveness' VC for logHeightProperty$5 @?:?...
[[34m  Info  [0m]  => VALID
[[34m  Info  [0m]  - Now considering 'postcondition' VC for constructMergeTree$5 @?:?...
[[34m  Info  [0m]  => VALID
[[34m  Info  [0m]  - Now considering 'precond. (call constructMergeTree$5(l, from, mid, st@))' VC for constructMergeTree$5 @?:?...
[[34m  Info  [0m]  => VALID
[[34m  Info  [0m]  - Now considering 'precond. (call constructMergeTree$5(midlist$2, mid + Bi ...)' VC for constructMergeTree$5 @?:?...
[[34m  Info  [0m]  => VALID
[[34m  Info  [0m]  - Now considering 'match exhaustiveness' VC for constructMergeTree$5 @?:?...
[[34m  Info  [0m]  => VALID
[[34m  Info  [0m]  - Now considering 'division by zero' VC for constructMergeTree$5 @?:?...
[[34m  Info  [0m]  => VALID
[[34m  Info  [0m]  - Now considering 'match exhaustiveness' VC for constructMergeTree$5 @?:?...
[[34m  Info  [0m]  => VALID
[[34m  Info  [0m]  - Now considering 'match exhaustiveness' VC for constructMergeTree$5 @?:?...
[[34m  Info  [0m]  => VALID
[[34m  Info  [0m]  - Now considering 'match exhaustiveness' VC for constructMergeTree$5 @?:?...
[[34m  Info  [0m]  => VALID
[[34m  Info  [0m]  - Now considering 'postcondition' VC for merge$5 @?:?...
[[34m  Info  [0m]  => VALID
[[34m  Info  [0m]  - Now considering 'match exhaustiveness' VC for merge$5 @?:?...
[[34m  Info  [0m]  => VALID
[[34m  Info  [0m]  - Now considering 'match exhaustiveness' VC for merge$5 @?:?...
[[34m  Info  [0m]  => VALID
[[34m  Info  [0m]  - Now considering 'postcondition' VC for MergeSuspL@mergePre$2 @?:?...
[[34m  Info  [0m]  => VALID
[[34m  Info  [0m]  - Now considering 'postcondition' VC for MergeSuspL@mergePre$3 @?:?...
[[34m  Info  [0m]  => VALID
[[34m  Info  [0m]  - Now considering 'postcondition' VC for mergeSusp$5 @?:?...
[[34m  Info  [0m]  => VALID
[[34m  Info  [0m]  - Now considering 'postcondition' VC for mergeSort$5 @?:?...
[[34m  Info  [0m]  => VALID
[[34m  Info  [0m]  - Now considering 'precond. (call constructMergeTree$5(l, BigInt(0), l.len ...)' VC for mergeSort$5 @?:?...
[[34m  Info  [0m]  => VALID
[[34m  Info  [0m]  - Now considering 'precond. (call logHeightProperty$5(res$222))' VC for mergeSort$5 @?:?...
[[34m  Info  [0m]  => VALID
[[34m  Info  [0m]  - Now considering 'match exhaustiveness' VC for mergeSort$5 @?:?...
[[34m  Info  [0m]  => VALID
[[34m  Info  [0m]  - Now considering 'postcondition' VC for kthMinRec$5 @?:?...
[[34m  Info  [0m]  => VALID
[[34m  Info  [0m]  - Now considering 'precond. (call kthMinRec$5(dres$2._1, k - BigInt(1), dr ...)' VC for kthMinRec$5 @?:?...
[[34m  Info  [0m]  => VALID
[[34m  Info  [0m]  - Now considering 'match exhaustiveness' VC for kthMinRec$5 @?:?...
[[34m  Info  [0m]  => VALID
[[34m  Info  [0m]  - Now considering 'postcondition' VC for kthMin$5 @?:?...
[[34m  Info  [0m]  => VALID
[[34m  Info  [0m]  - Now considering 'precond. (call kthMinRec$5(mergeSort$5(l, st@), k, st@))' VC for kthMin$5 @?:?...
[[34m  Info  [0m]  => VALID
[[34m  Info  [0m]  - Now considering 'postcondition' VC for size$22 @?:?...
[[34m  Info  [0m]  => VALID
[[34m  Info  [0m]  - Now considering 'match exhaustiveness' VC for size$22 @?:?...
[[34m  Info  [0m]  => VALID
[[34m  Info  [0m]  - Now considering 'postcondition' VC for length$8 @?:?...
[[34m  Info  [0m]  => VALID
[[34m  Info  [0m]  - Now considering 'match exhaustiveness' VC for length$8 @?:?...
[[34m  Info  [0m]  => VALID
[[34m  Info  [0m]  - Now considering 'postcondition' VC for size$23 @?:?...
[[34m  Info  [0m]  => VALID
[[34m  Info  [0m]  - Now considering 'match exhaustiveness' VC for size$23 @?:?...
[[34m  Info  [0m]  => VALID
[[34m  Info  [0m]  - Now considering 'postcondition' VC for height$13 @?:?...
[[34m  Info  [0m]  => VALID
[[34m  Info  [0m]  - Now considering 'match exhaustiveness' VC for height$13 @?:?...
[[34m  Info  [0m]  => VALID
[[34m  Info  [0m]  - Now considering 'postcondition' VC for weightBalanced$12 @?:?...
[[34m  Info  [0m]  => VALID
[[34m  Info  [0m]  - Now considering 'match exhaustiveness' VC for weightBalanced$12 @?:?...
[[34m  Info  [0m]  => VALID
[[34m  Info  [0m]  - Now considering 'postcondition' VC for list-mem$3 @?:?...
[[34m  Info  [0m]  => VALID
[[34m  Info  [0m]  - Now considering 'postcondition' VC for height$14 @?:?...
[[34m  Info  [0m]  => VALID
[[34m  Info  [0m]  - Now considering 'match exhaustiveness' VC for height$14 @?:?...
[[34m  Info  [0m]  => VALID
[[34m  Info  [0m]  - Now considering 'postcondition' VC for weightBalanced$13 @?:?...
[[34m  Info  [0m]  => VALID
[[34m  Info  [0m]  - Now considering 'match exhaustiveness' VC for weightBalanced$13 @?:?...
[[34m  Info  [0m]  => VALID
  ┌──────────────────────━
╔═╡ Verification Summary ╞══════════════════════════════════════════════════════════════════════════════════════════════════════════════════════════════╗
║ └──────────────────────┘                                                                                                                              ║
║ BottomUpMergeSortPrecise.MergeSuspL@mergePre$3  postcondition                                                 ?:?  valid  U:orb-smt-z3          0.032 ║
║ BottomUpMergeSortPrecise.MergeSuspL@mergePre$2  postcondition                                                 ?:?  valid  U:orb-smt-z3          0.054 ║
║ BottomUpMergeSortPrecise.constructMergeTree$5   division by zero                                              ?:?  valid  U:orb-smt-z3          0.043 ║
║ BottomUpMergeSortPrecise.constructMergeTree$5   match exhaustiveness                                          ?:?  valid  U:orb-smt-z3          0.045 ║
║ BottomUpMergeSortPrecise.constructMergeTree$5   match exhaustiveness                                          ?:?  valid  U:orb-smt-z3          0.034 ║
║ BottomUpMergeSortPrecise.constructMergeTree$5   postcondition                                                 ?:?  valid  U:orb-smt-z3          0.705 ║
║ BottomUpMergeSortPrecise.constructMergeTree$5   precond. (call constructMergeTree$5(l, from, mid, st@))       ?:?  valid  U:orb-smt-z3          0.043 ║
║ BottomUpMergeSortPrecise.constructMergeTree$5   precond. (call constructMergeTree$5(midlist$2, mid + Bi ...)  ?:?  valid  U:orb-smt-z3          0.113 ║
║ Stream.height$14                                match exhaustiveness                                          ?:?  valid  U:orb-smt-z3          0.028 ║
║ LList.height$13                                 match exhaustiveness                                          ?:?  valid  U:orb-smt-z3          0.033 ║
║ LList.height$13                                 postcondition                                                 ?:?  valid  U:orb-smt-z3          0.058 ║
║ Stream.height$14                                postcondition                                                 ?:?  valid  U:orb-smt-z3          0.043 ║
║ BottomUpMergeSortPrecise.kthMin$5               postcondition                                                 ?:?  valid  U:orb-smt-orb-cvc4    0.143 ║
║ BottomUpMergeSortPrecise.kthMin$5               precond. (call kthMinRec$5(mergeSort$5(l, st@), k, st@))      ?:?  valid  U:orb-smt-z3          0.028 ║
║ BottomUpMergeSortPrecise.kthMinRec$5            match exhaustiveness                                          ?:?  valid  U:orb-smt-z3          0.051 ║
║ BottomUpMergeSortPrecise.kthMinRec$5            postcondition                                                 ?:?  valid  U:orb-smt-orb-cvc4    0.096 ║
║ BottomUpMergeSortPrecise.kthMinRec$5            precond. (call kthMinRec$5(dres$2._1, k - BigInt(1), dr ...)  ?:?  valid  U:orb-smt-z3          0.045 ║
║ List.length$8                                   match exhaustiveness                                          ?:?  valid  U:orb-smt-z3          0.027 ║
║ List.length$8                                   postcondition                                                 ?:?  valid  U:orb-smt-z3          0.070 ║
║ Stream.list-mem$3                               postcondition                                                 ?:?  valid  U:orb-smt-orb-cvc4    0.077 ║
║ BottomUpMergeSortPrecise.log$5                  division by zero                                              ?:?  valid  U:orb-smt-z3          0.033 ║
║ BottomUpMergeSortPrecise.log$5                  postcondition                                                 ?:?  valid  U:orb-smt-z3          0.231 ║
║ BottomUpMergeSortPrecise.logHeightProperty$5    match exhaustiveness                                          ?:?  valid  U:orb-smt-z3          0.043 ║
║ BottomUpMergeSortPrecise.logHeightProperty$5    postcondition                                                 ?:?  valid  U:orb-smt-z3          0.121 ║
║ BottomUpMergeSortPrecise.logHeightProperty$5    precond. (call logMonotonicity$5(lsz - BigInt(2), lsz - ...)  ?:?  valid  U:orb-smt-z3          0.056 ║
║ BottomUpMergeSortPrecise.logHeightProperty$5    precond. (call recSize$5(t$454))                              ?:?  valid  U:orb-smt-z3          0.061 ║
║ BottomUpMergeSortPrecise.logMonotonicity$5      division by zero                                              ?:?  valid  U:orb-smt-z3          0.035 ║
║ BottomUpMergeSortPrecise.logMonotonicity$5      postcondition                                                 ?:?  valid  U:orb-smt-z3          0.096 ║
║ BottomUpMergeSortPrecise.logMonotonicity$5      precond. (call logMonotonicity$5({ ...)                       ?:?  valid  U:orb-smt-z3          0.042 ║
║ BottomUpMergeSortPrecise.merge$5                match exhaustiveness                                          ?:?  valid  U:orb-smt-z3          0.045 ║
║ BottomUpMergeSortPrecise.merge$5                match exhaustiveness                                          ?:?  valid  U:orb-smt-z3          0.042 ║
║ BottomUpMergeSortPrecise.merge$5                postcondition                                                 ?:?  valid  U:orb-smt-orb-cvc4    0.618 ║
║ BottomUpMergeSortPrecise.mergeSort$5            match exhaustiveness                                          ?:?  valid  U:orb-smt-z3          0.029 ║
║ BottomUpMergeSortPrecise.mergeSort$5            postcondition                                                 ?:?  valid  U:orb-smt-z3          0.163 ║
║ BottomUpMergeSortPrecise.mergeSort$5            precond. (call constructMergeTree$5(l, BigInt(0), l.len ...)  ?:?  valid  U:orb-smt-z3          0.045 ║
║ BottomUpMergeSortPrecise.mergeSort$5            precond. (call logHeightProperty$5(res$222))                  ?:?  valid  U:orb-smt-z3          0.058 ║
║ BottomUpMergeSortPrecise.mergeSusp$5            postcondition                                                 ?:?  valid  U:orb-smt-z3          0.213 ║
║ BottomUpMergeSortPrecise.recSize$5              match exhaustiveness                                          ?:?  valid  U:orb-smt-z3          0.153 ║
║ BottomUpMergeSortPrecise.recSize$5              match exhaustiveness                                          ?:?  valid  U:orb-smt-z3          0.091 ║
║ BottomUpMergeSortPrecise.recSize$5              match exhaustiveness                                          ?:?  valid  U:orb-smt-z3          0.063 ║
║ BottomUpMergeSortPrecise.recSize$5              match exhaustiveness                                          ?:?  valid  U:orb-smt-z3          0.065 ║
║ BottomUpMergeSortPrecise.recSize$5              postcondition                                                 ?:?  valid  U:orb-smt-z3          4.953 ║
║ BottomUpMergeSortPrecise.recSize$5              precond. (call logMonotonicity$5(BigInt(2) * (recSize$5 ...)  ?:?  valid  U:orb-smt-z3          0.232 ║
║ BottomUpMergeSortPrecise.recSize$5              precond. (call logMonotonicity$5(BigInt(2) * ({ ...)          ?:?  valid  U:orb-smt-z3          0.187 ║
║ BottomUpMergeSortPrecise.recSize$5              precond. (call recSize$5(b$23))                               ?:?  valid  U:orb-smt-z3          0.093 ║
║ BottomUpMergeSortPrecise.recSize$5              precond. (call recSize$5(b$24))                               ?:?  valid  U:orb-smt-z3          0.200 ║
║ BottomUpMergeSortPrecise.recSize$5              precond. (call recSize$5(t$452))                              ?:?  valid  U:orb-smt-z3          0.087 ║
║ BottomUpMergeSortPrecise.recSize$5              precond. (call recSize$5(t$453))                              ?:?  valid  U:orb-smt-z3          0.155 ║
║ List.size$22                                    match exhaustiveness                                          ?:?  valid  U:orb-smt-z3          0.039 ║
║ LList.size$23                                   match exhaustiveness                                          ?:?  valid  U:orb-smt-z3          0.032 ║
║ LList.size$23                                   postcondition                                                 ?:?  valid  U:orb-smt-z3          0.059 ║
║ List.size$22                                    postcondition                                                 ?:?  valid  U:orb-smt-z3          0.048 ║
║ Stream.weightBalanced$13                        match exhaustiveness                                          ?:?  valid  U:orb-smt-z3          0.028 ║
║ LList.weightBalanced$12                         match exhaustiveness                                          ?:?  valid  U:orb-smt-z3          0.027 ║
║ Stream.weightBalanced$13                        postcondition                                                 ?:?  valid  U:orb-smt-z3          0.054 ║
║ LList.weightBalanced$12                         postcondition                                                 ?:?  valid  U:orb-smt-z3          0.053 ║
╟┄┄┄┄┄┄┄┄┄┄┄┄┄┄┄┄┄┄┄┄┄┄┄┄┄┄┄┄┄┄┄┄┄┄┄┄┄┄┄┄┄┄┄┄┄┄┄┄┄┄┄┄┄┄┄┄┄┄┄┄┄┄┄┄┄┄┄┄┄┄┄┄┄┄┄┄┄┄┄┄┄┄┄┄┄┄┄┄┄┄┄┄┄┄┄┄┄┄┄┄┄┄┄┄┄┄┄┄┄┄┄┄┄┄┄┄┄┄┄┄┄┄┄┄┄┄┄┄┄┄┄┄┄┄┄┄┄┄┄┄┄┄┄┄┄┄┄┄┄┄┄╢
║ total: 56     valid: 56     invalid: 0      unknown 0                                                                                          10.318 ║
╚════════════════════════════════════════════════════════════════════════════════════════════════════════════════════════════════════════════════════════
[[34m  Info  [0m] - considering function merge-steps...
[[34m  Info  [0m] Candidate invariants
[[34m  Info  [0m] merge-steps-->1 * res$223._2 + 0 <= 0
[[34m  Info  [0m] checked VC inst... in 0.006s
[[34m  Info  [0m] Function: merge-steps--Found candidate invariant is not a real invariant! 
[[34m  Info  [0m] # of atomic predicates: 6 + 1
[[34m  Info  [0m] Candidate invariants
[[34m  Info  [0m] merge-steps-->1 * res$223._2 + -4 <= 0
[[34m  Info  [0m] checked VC inst... in 0.007s
[[34m  Info  [0m] Function: merge-steps--Found candidate invariant is not a real invariant! 
[[34m  Info  [0m] # of atomic predicates: 6 + 7
[[34m  Info  [0m] Candidate invariants
[[34m  Info  [0m] merge-steps-->1 * res$223._2 + -8 <= 0
[[34m  Info  [0m] checked VC inst... in 0.009s
[[34m  Info  [0m] Function: merge-steps--Found candidate invariant is not a real invariant! 
[[34m  Info  [0m] # of atomic predicates: 6 + 13
[[34m  Info  [0m] Candidate invariants
[[34m  Info  [0m] merge-steps-->1 * res$223._2 + -17 <= 0
[[34m  Info  [0m] checked VC inst... in 0.005s
[[34m  Info  [0m] minimizing...
[[34m  Info  [0m] Candidate invariants
[[34m  Info  [0m] merge-steps-->1 * res$223._2 + -16 <= 0
[[34m  Info  [0m] checked VC inst... in 0.003s
[[34m  Info  [0m] - Found inductive invariant: merge-steps --> steps + BigInt(-16) <= BigInt(0)
[[34m  Info  [0m] - Verifying Invariants... 
[[34m  Info  [0m] - Invariant verified
[[34m  Info  [0m] - considering function mergeSusp-steps...
[[34m  Info  [0m] Candidate invariants
[[34m  Info  [0m] mergeSusp-steps-->(1 * res$226._2 + 0 * b.height) + 0 <= 0
[[34m  Info  [0m] checked VC inst... in 0.007s
[[34m  Info  [0m] Function: mergeSusp-steps--Found candidate invariant is not a real invariant! 
[[34m  Info  [0m] # of atomic predicates: 9 + 1
[[34m  Info  [0m] Candidate invariants
[[34m  Info  [0m] mergeSusp-steps-->(1 * res$226._2 + -1 * b.height) + -20 <= 0
[[34m  Info  [0m] checked VC inst... in 0.003s
[[34m  Info  [0m] Function: mergeSusp-steps--Found candidate invariant is not a real invariant! 
[[34m  Info  [0m] # of atomic predicates: 10 + 10
[[34m  Info  [0m] - More unrollings for invariant inference
[[34m  Info  [0m] Candidate invariants
[[34m  Info  [0m] mergeSusp-steps-->(1 * res$226._2 + 0 * b.height) + 0 <= 0
[[34m  Info  [0m] checked VC inst... in 0.024s
[[34m  Info  [0m] Function: mergeSusp-steps--Found candidate invariant is not a real invariant! 
[[34m  Info  [0m] # of atomic predicates: 19 + 1
[[34m  Info  [0m] Candidate invariants
[[34m  Info  [0m] mergeSusp-steps-->(1 * res$226._2 + 0 * b.height) + -20 <= 0
[[34m  Info  [0m] checked VC inst... in 0.019s
[[34m  Info  [0m] Function: mergeSusp-steps--Found candidate invariant is not a real invariant! 
[[34m  Info  [0m] # of atomic predicates: 19 + 20
[[34m  Info  [0m] - More unrollings for invariant inference
[[34m  Info  [0m] Candidate invariants
[[34m  Info  [0m] mergeSusp-steps-->(1 * res$226._2 + 0 * b.height) + 0 <= 0
[[34m  Info  [0m] checked VC inst... in 0.035s
[[34m  Info  [0m] Function: mergeSusp-steps--Found candidate invariant is not a real invariant! 
[[34m  Info  [0m] # of atomic predicates: 9 + 1
[[34m  Info  [0m] Candidate invariants
[[34m  Info  [0m] mergeSusp-steps-->(1 * res$226._2 + 0 * b.height) + -20 <= 0
[[34m  Info  [0m] checked VC inst... in 0.033s
[[34m  Info  [0m] Function: mergeSusp-steps--Found candidate invariant is not a real invariant! 
[[34m  Info  [0m] # of atomic predicates: 9 + 10
[[34m  Info  [0m] Candidate invariants
[[34m  Info  [0m] mergeSusp-steps-->(1 * res$226._2 + 0 * b.height) + -24 <= 0
[[34m  Info  [0m] checked VC inst... in 0.029s
[[34m  Info  [0m] Function: mergeSusp-steps--Found candidate invariant is not a real invariant! 
[[34m  Info  [0m] # of atomic predicates: 24 + 19
[[34m  Info  [0m] - More unrollings for invariant inference
[[34m  Info  [0m] Candidate invariants
[[34m  Info  [0m] mergeSusp-steps-->(1 * res$226._2 + 0 * b.height) + 0 <= 0
[[34m  Info  [0m] checked VC inst... in 0.072s
[[34m  Info  [0m] Function: mergeSusp-steps--Found candidate invariant is not a real invariant! 
[[34m  Info  [0m] # of atomic predicates: 9 + 1
[[34m  Info  [0m] Candidate invariants
[[34m  Info  [0m] mergeSusp-steps-->(1 * res$226._2 + 0 * b.height) + -20 <= 0
[[34m  Info  [0m] checked VC inst... in 0.072s
[[34m  Info  [0m] Function: mergeSusp-steps--Found candidate invariant is not a real invariant! 
[[34m  Info  [0m] # of atomic predicates: 9 + 10
[[34m  Info  [0m] Candidate invariants
[[34m  Info  [0m] mergeSusp-steps-->(1 * res$226._2 + 0 * b.height) + -24 <= 0
[[34m  Info  [0m] checked VC inst... in 0.068s
[[34m  Info  [0m] Function: mergeSusp-steps--Found candidate invariant is not a real invariant! 
[[34m  Info  [0m] # of atomic predicates: 41 + 19
[[34m  Info  [0m] Candidate invariants
[[34m  Info  [0m] mergeSusp-steps-->(1 * res$226._2 + -23 * b.height) + -24 <= 0
[[34m  Info  [0m] checked VC inst... in 0.027s
[[34m  Info  [0m] minimizing...
[[34m  Info  [0m] Candidate invariants
[[34m  Info  [0m] mergeSusp-steps-->(1 * res$226._2 + 99 * b.height) + -23 <= 0
[[34m  Info  [0m] checked VC inst... in 0.053s
[[34m  Info  [0m] Function: mergeSusp-steps--Found candidate invariant is not a real invariant! 
[[34m  Info  [0m] # of atomic predicates: 37 + 60
[[34m  Info  [0m] Candidate invariants
[[34m  Info  [0m] mergeSusp-steps-->(1 * res$226._2 + -23 * b.height) + -24 <= 0
[[34m  Info  [0m] checked VC inst... in 0.03s
[[34m  Info  [0m] minimizing...
[[34m  Info  [0m] Candidate invariants
[[34m  Info  [0m] mergeSusp-steps-->(1 * res$226._2 + -22 * b.height) + -23 <= 0
[[34m  Info  [0m] checked VC inst... in 0.014s
[[34m  Info  [0m] - Found inductive invariant: mergeSusp-steps --> (steps + BigInt(-22) * b.height) + BigInt(-23) <= BigInt(0)
[[34m  Info  [0m] - Verifying Invariants... 
[[34m  Info  [0m] - Invariant verified
[[34m  Info  [0m] - considering function list-mem-steps...
[[34m  Info  [0m] - considering function constructMergeTree-steps...
[[34m  Info  [0m] Candidate invariants
[[34m  Info  [0m] constructMergeTree-steps-->((1 * res$227._2 + 0 * from) + 0 * to) + 0 <= 0
[[34m  Info  [0m] checked VC inst... in 0.018s
[[34m  Info  [0m] Function: constructMergeTree-steps--Found candidate invariant is not a real invariant! 
[[34m  Info  [0m] # of atomic predicates: 10 + 1
[[34m  Info  [0m] Candidate invariants
[[34m  Info  [0m] constructMergeTree-steps-->((1 * res$227._2 + 1 * from) + -1 * to) + -7 <= 0
[[34m  Info  [0m] checked VC inst... in 0.009s
[[34m  Info  [0m] Function: constructMergeTree-steps--Found candidate invariant is not a real invariant! 
[[34m  Info  [0m] # of atomic predicates: 10 + 11
[[34m  Info  [0m] Candidate invariants
[[34m  Info  [0m] constructMergeTree-steps-->((1 * res$227._2 + 1 * from) + -1 * to) + -13 <= 0
[[34m  Info  [0m] checked VC inst... in 0.013s
[[34m  Info  [0m] Function: constructMergeTree-steps--Found candidate invariant is not a real invariant! 
[[34m  Info  [0m] # of atomic predicates: 21 + 21
[[34m  Info  [0m] - More unrollings for invariant inference
[[34m  Info  [0m] Candidate invariants
[[34m  Info  [0m] constructMergeTree-steps-->((1 * res$227._2 + 0 * from) + 0 * to) + 0 <= 0
[[34m  Info  [0m] checked VC inst... in 0.045s
[[34m  Info  [0m] Function: constructMergeTree-steps--Found candidate invariant is not a real invariant! 
[[34m  Info  [0m] # of atomic predicates: 14 + 1
[[34m  Info  [0m] Candidate invariants
[[34m  Info  [0m] constructMergeTree-steps-->((2 * res$227._2 + 3 * from) + -3 * to) + -28 <= 0
[[34m  Info  [0m] checked VC inst... in 0.031s
[[34m  Info  [0m] Function: constructMergeTree-steps--Found candidate invariant is not a real invariant! 
[[34m  Info  [0m] # of atomic predicates: 28 + 15
[[34m  Info  [0m] Candidate invariants
[[34m  Info  [0m] constructMergeTree-steps-->((1 * res$227._2 + 56 * from) + -56 * to) + -14 <= 0
[[34m  Info  [0m] checked VC inst... in 0.006s
[[34m  Info  [0m] minimizing...
[[34m  Info  [0m] Candidate invariants
[[34m  Info  [0m] constructMergeTree-steps-->((1 * res$227._2 + 53 * from) + -53 * to) + -12 <= 0
[[34m  Info  [0m] checked VC inst... in 0.007s
[[34m  Info  [0m] - Found inductive invariant: constructMergeTree-steps --> ((steps + BigInt(53) * from) + BigInt(-53) * to) + BigInt(-12) <= BigInt(0)
[[34m  Info  [0m] - Verifying Invariants... 
[[34m  Info  [0m] - Invariant verified
[[34m  Info  [0m] - considering function mergeSort-steps...
[[34m  Info  [0m] Candidate invariants
[[34m  Info  [0m] mergeSort-steps-->(1 * res$224._2 + 0 * l.size) + 0 <= 0
[[34m  Info  [0m] checked VC inst... in 0.006s
[[34m  Info  [0m] Function: mergeSort-steps--Found candidate invariant is not a real invariant! 
[[34m  Info  [0m] # of atomic predicates: 8 + 1
[[34m  Info  [0m] Candidate invariants
[[34m  Info  [0m] mergeSort-steps-->(1 * res$224._2 + -1 * l.size) + -5 <= 0
[[34m  Info  [0m] checked VC inst... in 0.005s
[[34m  Info  [0m] Function: mergeSort-steps--Found candidate invariant is not a real invariant! 
[[34m  Info  [0m] # of atomic predicates: 10 + 9
[[34m  Info  [0m] Candidate invariants
[[34m  Info  [0m] mergeSort-steps-->(1 * res$224._2 + -54 * l.size) + -4 <= 0
[[34m  Info  [0m] checked VC inst... in 0.002s
[[34m  Info  [0m] minimizing...
[[34m  Info  [0m] Candidate invariants
[[34m  Info  [0m] mergeSort-steps-->(1 * res$224._2 + -53 * l.size) + -3 <= 0
[[34m  Info  [0m] checked VC inst... in 0.002s
[[34m  Info  [0m] - Found inductive invariant: mergeSort-steps --> (steps + BigInt(-53) * l.size) + BigInt(-3) <= BigInt(0)
[[34m  Info  [0m] - Verifying Invariants... 
[[34m  Info  [0m] - Invariant verified
[[34m  Info  [0m] - considering function kthMinRec-steps...
[[34m  Info  [0m] Candidate invariants
[[34m  Info  [0m] kthMinRec-steps-->(1 * x$10$3._2 + 0 * mult(k, l.height)) + 0 <= 0
[[34m  Info  [0m] checked VC inst... in 0.013s
[[34m  Info  [0m] Function: kthMinRec-steps--Found candidate invariant is not a real invariant! 
[[34m  Info  [0m] # of atomic predicates: 7 + 1
[[34m  Info  [0m] Candidate invariants
[[34m  Info  [0m] kthMinRec-steps-->(1 * x$10$3._2 + 0 * mult(k, l.height)) + -8 <= 0
[[34m  Info  [0m] checked VC inst... in 0.009s
[[34m  Info  [0m] Function: kthMinRec-steps--Found candidate invariant is not a real invariant! 
[[34m  Info  [0m] # of atomic predicates: 10 + 8
[[34m  Info  [0m] - More unrollings for invariant inference
[[34m  Info  [0m] Candidate invariants
[[34m  Info  [0m] kthMinRec-steps-->(1 * x$10$3._2 + 0 * mult(k, l.height)) + 0 <= 0
[[34m  Info  [0m] checked VC inst... in 0.017s
[[34m  Info  [0m] Function: kthMinRec-steps--Found candidate invariant is not a real invariant! 
[[34m  Info  [0m] # of atomic predicates: 10 + 1
[[34m  Info  [0m] Candidate invariants
[[34m  Info  [0m] kthMinRec-steps-->(1 * x$10$3._2 + -1 * mult(k, l.height)) + -8 <= 0
[[34m  Info  [0m] checked VC inst... in 0.014s
[[34m  Info  [0m] Function: kthMinRec-steps--Found candidate invariant is not a real invariant! 
[[34m  Info  [0m] # of atomic predicates: 16 + 11
[[34m  Info  [0m] - More unrollings for invariant inference
[[34m  Info  [0m] Candidate invariants
[[34m  Info  [0m] kthMinRec-steps-->(1 * x$10$3._2 + 0 * mult(k, l.height)) + 0 <= 0
[[34m  Info  [0m] checked VC inst... in 0.038s
[[34m  Info  [0m] Function: kthMinRec-steps--Found candidate invariant is not a real invariant! 
[[34m  Info  [0m] # of atomic predicates: 13 + 1
[[34m  Info  [0m] Candidate invariants
[[34m  Info  [0m] kthMinRec-steps-->(1 * x$10$3._2 + 0 * mult(k, l.height)) + -8 <= 0
[[34m  Info  [0m] checked VC inst... in 0.043s
[[34m  Info  [0m] Function: kthMinRec-steps--Found candidate invariant is not a real invariant! 
[[34m  Info  [0m] # of atomic predicates: 34 + 14
[[34m  Info  [0m] Candidate invariants
[[34m  Info  [0m] kthMinRec-steps-->(1 * x$10$3._2 + -9 * mult(k, l.height)) + -8 <= 0
[[34m  Info  [0m] checked VC inst... in 0.026s
[[34m  Info  [0m] Function: kthMinRec-steps--Found candidate invariant is not a real invariant! 
[[34m  Info  [0m] # of atomic predicates: 33 + 48
[[34m  Info  [0m] Candidate invariants
[[34m  Info  [0m] kthMinRec-steps-->(1 * x$10$3._2 + -30 * mult(k, l.height)) + -8 <= 0
[[34m  Info  [0m] checked VC inst... in 0.035s
[[34m  Info  [0m] Function: kthMinRec-steps--Found candidate invariant is not a real invariant! 
[[34m  Info  [0m] # of atomic predicates: 25 + 81
[[34m  Info  [0m] Candidate invariants
[[34m  Info  [0m] kthMinRec-steps-->(1 * x$10$3._2 + -37 * mult(k, l.height)) + -8 <= 0
[[34m  Info  [0m] checked VC inst... in 0.035s
[[34m  Info  [0m] Function: kthMinRec-steps--Found candidate invariant is not a real invariant! 
[[34m  Info  [0m] # of atomic predicates: 13 + 106
[[34m  Info  [0m] - More unrollings for invariant inference
[[34m  Info  [0m] Candidate invariants
[[34m  Info  [0m] kthMinRec-steps-->(1 * x$10$3._2 + 0 * mult(k, l.height)) + 0 <= 0
[[34m  Info  [0m] checked VC inst... in 0.067s
[[34m  Info  [0m] Function: kthMinRec-steps--Found candidate invariant is not a real invariant! 
[[34m  Info  [0m] # of atomic predicates: 13 + 1
[[34m  Info  [0m] Candidate invariants
[[34m  Info  [0m] kthMinRec-steps-->(1 * x$10$3._2 + 0 * mult(k, l.height)) + -8 <= 0
[[34m  Info  [0m] checked VC inst... in 0.038s
[[34m  Info  [0m] Function: kthMinRec-steps--Found candidate invariant is not a real invariant! 
[[34m  Info  [0m] # of atomic predicates: 17 + 14
[[34m  Info  [0m] Candidate invariants
[[34m  Info  [0m] kthMinRec-steps-->(1 * x$10$3._2 + -37 * mult(k, l.height)) + -8 <= 0
[[34m  Info  [0m] checked VC inst... in 0.051s
[[34m  Info  [0m] Function: kthMinRec-steps--Found candidate invariant is not a real invariant! 
[[34m  Info  [0m] # of atomic predicates: 13 + 31
[[34m  Info  [0m] - More unrollings for invariant inference
[[34m  Info  [0m] Candidate invariants
[[34m  Info  [0m] kthMinRec-steps-->(1 * x$10$3._2 + 0 * mult(k, l.height)) + 0 <= 0
[[34m  Info  [0m] checked VC inst... in 0.103s
[[34m  Info  [0m] Function: kthMinRec-steps--Found candidate invariant is not a real invariant! 
[[34m  Info  [0m] # of atomic predicates: 13 + 1
[[34m  Info  [0m] Candidate invariants
[[34m  Info  [0m] kthMinRec-steps-->(1 * x$10$3._2 + 0 * mult(k, l.height)) + -8 <= 0
[[34m  Info  [0m] checked VC inst... in 0.047s
[[34m  Info  [0m] Function: kthMinRec-steps--Found candidate invariant is not a real invariant! 
[[34m  Info  [0m] # of atomic predicates: 17 + 14
[[34m  Info  [0m] Candidate invariants
[[34m  Info  [0m] kthMinRec-steps-->(1 * x$10$3._2 + -37 * mult(k, l.height)) + -8 <= 0
[[34m  Info  [0m] checked VC inst... in 0.114s
[[34m  Info  [0m] Function: kthMinRec-steps--Found candidate invariant is not a real invariant! 
[[34m  Info  [0m] # of atomic predicates: 13 + 31
[[34m  Info  [0m] - More unrollings for invariant inference
[[34m  Info  [0m] Candidate invariants
[[34m  Info  [0m] kthMinRec-steps-->(1 * x$10$3._2 + 0 * mult(k, l.height)) + 0 <= 0
[[34m  Info  [0m] checked VC inst... in 0.242s
[[34m  Info  [0m] Function: kthMinRec-steps--Found candidate invariant is not a real invariant! 
[[34m  Info  [0m] # of atomic predicates: 17 + 1
[[34m  Info  [0m] Candidate invariants
[[34m  Info  [0m] kthMinRec-steps-->(1 * x$10$3._2 + 0 * mult(k, l.height)) + -8 <= 0
[[34m  Info  [0m] checked VC inst... in 0.179s
[[34m  Info  [0m] Function: kthMinRec-steps--Found candidate invariant is not a real invariant! 
[[34m  Info  [0m] # of atomic predicates: 17 + 18
[[34m  Info  [0m] Candidate invariants
[[34m  Info  [0m] kthMinRec-steps-->(1 * x$10$3._2 + -36 * mult(k, l.height)) + -7 <= 0
[[34m  Info  [0m] checked VC inst... in 0.377s
[[34m  Info  [0m] Function: kthMinRec-steps--Found candidate invariant is not a real invariant! 
[[34m  Info  [0m] # of atomic predicates: 13 + 35
[[34m  Info  [0m] Candidate invariants
[[34m  Info  [0m] kthMinRec-steps-->(1 * x$10$3._2 + -37 * mult(k, l.height)) + -13 <= 0
[[34m  Info  [0m] checked VC inst... in 0.448s
[[34m  Info  [0m] Function: kthMinRec-steps--Found candidate invariant is not a real invariant! 
[[34m  Info  [0m] # of atomic predicates: 13 + 48
[[34m  Info  [0m] Candidate invariants
[[34m  Info  [0m] kthMinRec-steps-->(1 * x$10$3._2 + -37 * mult(k, l.height)) + -18 <= 0
[[34m  Info  [0m] checked VC inst... in 0.129s
[[34m  Info  [0m] minimizing...
[[34m  Info  [0m] Candidate invariants
[[34m  Info  [0m] kthMinRec-steps-->(1 * x$10$3._2 + 100 * mult(k, l.height)) + -115 <= 0
[[34m  Info  [0m] checked VC inst... in 0.27s
[[34m  Info  [0m] Function: kthMinRec-steps--Found candidate invariant is not a real invariant! 
[[34m  Info  [0m] # of atomic predicates: 16 + 61
[[34m  Info  [0m] Candidate invariants
[[34m  Info  [0m] kthMinRec-steps-->(1 * x$10$3._2 + -60 * mult(k, l.height)) + -18 <= 0
[[34m  Info  [0m] checked VC inst... in 0.556s
[[34m  Info  [0m] minimizing...
[[34m  Info  [0m] Candidate invariants
[[34m  Info  [0m] kthMinRec-steps-->(1 * x$10$3._2 + 100 * mult(k, l.height)) + -142 <= 0
[[34m  Info  [0m] checked VC inst... in 0.306s
[[34m  Info  [0m] Function: kthMinRec-steps--Found candidate invariant is not a real invariant! 
[[34m  Info  [0m] # of atomic predicates: 19 + 77
[[34m  Info  [0m] Candidate invariants
[[34m  Info  [0m] kthMinRec-steps-->(1 * x$10$3._2 + -37 * mult(k, l.height)) + -18 <= 0
[[34m  Info  [0m] checked VC inst... in 0.155s
[[34m  Info  [0m] minimizing...
[[34m  Info  [0m] Candidate invariants
[[34m  Info  [0m] kthMinRec-steps-->(4 * x$10$3._2 + -19 * mult(k, l.height)) + -152 <= 0
[[34m  Info  [0m] checked VC inst... in 0.198s
[[34m  Info  [0m] Function: kthMinRec-steps--Found candidate invariant is not a real invariant! 
[[34m  Info  [0m] # of atomic predicates: 18 + 96
[[34m  Info  [0m] Candidate invariants
[[34m  Info  [0m] kthMinRec-steps-->(1 * x$10$3._2 + -37 * mult(k, l.height)) + -18 <= 0
[[34m  Info  [0m] checked VC inst... in 0.141s
[[34m  Info  [0m] minimizing...
[[34m  Info  [0m] Candidate invariants
[[34m  Info  [0m] kthMinRec-steps-->(1 * x$10$3._2 + -18 * mult(k, l.height)) + -24 <= 0
[[34m  Info  [0m] checked VC inst... in 0.326s
[[34m  Info  [0m] Function: kthMinRec-steps--Found candidate invariant is not a real invariant! 
[[34m  Info  [0m] # of atomic predicates: 20 + 114
[[34m  Info  [0m] Candidate invariants
[[34m  Info  [0m] kthMinRec-steps-->(1 * x$10$3._2 + -24 * mult(k, l.height)) + -18 <= 0
[[34m  Info  [0m] checked VC inst... in 0.482s
[[34m  Info  [0m] Function: kthMinRec-steps--Found candidate invariant is not a real invariant! 
[[34m  Info  [0m] # of atomic predicates: 27 + 134
[[34m  Info  [0m] Candidate invariants
[[34m  Info  [0m] kthMinRec-steps-->(1 * x$10$3._2 + -37 * mult(k, l.height)) + -18 <= 0
[[34m  Info  [0m] checked VC inst... in 0.222s
[[34m  Info  [0m] minimizing...
[[34m  Info  [0m] Candidate invariants
[[34m  Info  [0m] kthMinRec-steps-->(1 * x$10$3._2 + -36 * mult(k, l.height)) + -17 <= 0
[[34m  Info  [0m] checked VC inst... in 0.13s
[[34m  Info  [0m] - Found inductive invariant: kthMinRec-steps --> (steps + BigInt(-36) * (k * l.height)) + BigInt(-17) <= BigInt(0)
[[34m  Info  [0m] - Verifying Invariants... 
[[31m Error  [0m] - Unable to prove or disprove invariant, the invariant is probably true
[[34m  Info  [0m] - considering function kthMin-steps...
[[34m  Info  [0m] Candidate invariants
[[34m  Info  [0m] kthMin-steps-->((0 * mult(k, log(l.size - 1)) + 0 * l.size) + 1 * x$11$3._2) + 0 <= 0
[[34m  Info  [0m] checked VC inst... in 0.008s
[[34m  Info  [0m] Function: kthMin-steps--Found candidate invariant is not a real invariant! 
[[34m  Info  [0m] # of atomic predicates: 16 + 1
[[34m  Info  [0m] - More unrollings for invariant inference
[[34m  Info  [0m] Candidate invariants
[[34m  Info  [0m] kthMin-steps-->((0 * mult(k, log(l.size - 1)) + 0 * l.size) + 1 * x$11$3._2) + 0 <= 0
[[34m  Info  [0m] checked VC inst... in 0.04s
[[34m  Info  [0m] Function: kthMin-steps--Found candidate invariant is not a real invariant! 
[[34m  Info  [0m] # of atomic predicates: 15 + 1
[[34m  Info  [0m] Candidate invariants
[[34m  Info  [0m] kthMin-steps-->((-72 * mult(k, log(l.size - 1)) + 0 * l.size) + 36 * x$11$3._2) + -367 <= 0
[[34m  Info  [0m] checked VC inst... in 0.04s
[[34m  Info  [0m] Function: kthMin-steps--Found candidate invariant is not a real invariant! 
[[34m  Info  [0m] # of atomic predicates: 20 + 16
[[34m  Info  [0m] Candidate invariants
[[34m  Info  [0m] kthMin-steps-->((-2 * mult(k, log(l.size - 1)) + -60 * l.size) + 1 * x$11$3._2) + -10 <= 0
[[34m  Info  [0m] checked VC inst... in 0.019s
[[34m  Info  [0m] Function: kthMin-steps--Found candidate invariant is not a real invariant! 
[[34m  Info  [0m] # of atomic predicates: 20 + 36
[[34m  Info  [0m] Candidate invariants
[[34m  Info  [0m] kthMin-steps-->((-73 * mult(k, log(l.size - 1)) + -90 * l.size) + 1 * x$11$3._2) + -9 <= 0
[[34m  Info  [0m] checked VC inst... in 0.027s
[[34m  Info  [0m] minimizing...
[[34m  Info  [0m] Candidate invariants
[[34m  Info  [0m] kthMin-steps-->((-36 * mult(k, log(l.size - 1)) + 100 * l.size) + 1 * x$11$3._2) + -175 <= 0
[[34m  Info  [0m] checked VC inst... in 0.027s
[[34m  Info  [0m] Function: kthMin-steps--Found candidate invariant is not a real invariant! 
[[34m  Info  [0m] # of atomic predicates: 30 + 56
[[34m  Info  [0m] Candidate invariants
[[34m  Info  [0m] kthMin-steps-->((-73 * mult(k, log(l.size - 1)) + -135 * l.size) + 1 * x$11$3._2) + -9 <= 0
[[34m  Info  [0m] checked VC inst... in 0.028s
[[34m  Info  [0m] minimizing...
[[34m  Info  [0m] Candidate invariants
[[34m  Info  [0m] kthMin-steps-->((-36 * mult(k, log(l.size - 1)) + -53 * l.size) + 1 * x$11$3._2) + -22 <= 0
[[34m  Info  [0m] checked VC inst... in 0.011s
[[34m  Info  [0m] - Found inductive invariant: kthMin-steps --> ((BigInt(-36) * (k * log(l.size - BigInt(1))) + BigInt(-53) * l.size) + steps) + BigInt(-22) <= BigInt(0)
[[34m  Info  [0m] - Verifying Invariants... 
[[31m Error  [0m] - Unable to prove or disprove invariant, the invariant is probably true
Resource Verification Results: 
. ┌─────────━
╔═╡ Summary ╞════════════════════════════════════════════════════════════════════════╗
║ └─────────┘                                                                        ║
║ constructMerge… steps <= 53 * ((to - from) + 1) + -41                       0.938  ║
║ kthMin          steps <= (36 * (k * log(l.size - 1)) + 53 * l.size) + 22    16.423 ║
║ kthMinRec       steps <= 36 * (k * l.height) + 17                           24.558 ║
║ merge           steps <= 16                                                 0.400  ║
║ mergeSort       steps <= 53 * l.size + 3                                    0.387  ║
║ mergeSusp       steps <= 22 * b.height + 23                                 2.226  ║
╟┄┄┄┄┄┄┄┄┄┄┄┄┄┄┄┄┄┄┄┄┄┄┄┄┄┄┄┄┄┄┄┄┄┄┄┄┄┄┄┄┄┄┄┄┄┄┄┄┄┄┄┄┄┄┄┄┄┄┄┄┄┄┄┄┄┄┄┄┄┄┄┄┄┄┄┄┄┄┄┄┄┄┄┄╢
║ total: 6     inferred: 6     unknown: 0     time: 44.932                           ║
╚═════════════════════════════════════════════════════════════════════════════════════
[[34m  Info  [0m] Stats dumped to file: BottomUpMergeSort-stats.txt
