[[33mWarning [0m] warning: there were three feature warnings; re-run with -feature for details
[[34m  Info  [0m] Output written on leon.out
[[34m  Info  [0m] Output written on leon.out
[[34m  Info  [0m]  - Now considering 'postcondition' VC for zipWithFun$5 @?:?...
[[34m  Info  [0m]  => VALID
[[34m  Info  [0m]  - Now considering 'match exhaustiveness' VC for zipWithFun$5 @?:?...
[[34m  Info  [0m]  => VALID
[[34m  Info  [0m]  - Now considering 'postcondition' VC for zipWithSusp$5 @?:?...
[[34m  Info  [0m]  => VALID
[[34m  Info  [0m]  - Now considering 'match exhaustiveness' VC for zipWithSusp$5 @?:?...
[[34m  Info  [0m]  => VALID
[[34m  Info  [0m]  - Now considering 'match exhaustiveness' VC for zipWithSusp$5 @?:?...
[[34m  Info  [0m]  => VALID
[[34m  Info  [0m]  - Now considering 'postcondition' VC for argChainingProp$5 @?:?...
[[34m  Info  [0m]  => VALID
[[34m  Info  [0m]  - Now considering 'match exhaustiveness' VC for argChainingProp$5 @?:?...
[[34m  Info  [0m]  => VALID
[[34m  Info  [0m]  - Now considering 'match exhaustiveness' VC for argChainingProp$5 @?:?...
[[34m  Info  [0m]  => VALID
[[34m  Info  [0m]  - Now considering 'match exhaustiveness' VC for argChainingProp$5 @?:?...
[[34m  Info  [0m]  => VALID
[[34m  Info  [0m]  - Now considering 'match exhaustiveness' VC for argChainingProp$5 @?:?...
[[34m  Info  [0m]  => VALID
[[34m  Info  [0m]  - Now considering 'postcondition' VC for argChainedStreamProp$5 @?:?...
[[34m  Info  [0m]  => VALID
[[34m  Info  [0m]  - Now considering 'precond. (call argChainedStreamProp$5(s.tailFun match { ...)' VC for argChainedStreamProp$5 @?:?...
[[34m  Info  [0m]  => VALID
[[34m  Info  [0m]  - Now considering 'match exhaustiveness' VC for argChainedStreamProp$5 @?:?...
[[34m  Info  [0m]  => VALID
[[34m  Info  [0m]  - Now considering 'postcondition' VC for argChainingIsTransitive$5 @?:?...
[[34m  Info  [0m]  => VALID
[[34m  Info  [0m]  - Now considering 'precond. (call argChainingIsTransitive$5(s.tailFun matc ...)' VC for argChainingIsTransitive$5 @?:?...
[[34m  Info  [0m]  => VALID
[[34m  Info  [0m]  - Now considering 'precond. (call argChainedStreamProp$5(s, n))' VC for argChainingIsTransitive$5 @?:?...
[[34m  Info  [0m]  => VALID
[[34m  Info  [0m]  - Now considering 'match exhaustiveness' VC for argChainingIsTransitive$5 @?:?...
[[34m  Info  [0m]  => VALID
[[34m  Info  [0m]  - Now considering 'postcondition' VC for next$7 @?:?...
[[34m  Info  [0m]  => VALID
[[34m  Info  [0m]  - Now considering 'match exhaustiveness' VC for next$7 @?:?...
[[34m  Info  [0m]  => VALID
[[34m  Info  [0m]  - Now considering 'match exhaustiveness' VC for next$7 @?:?...
[[34m  Info  [0m]  => VALID
[[34m  Info  [0m]  - Now considering 'match exhaustiveness' VC for next$7 @?:?...
[[34m  Info  [0m]  => VALID
[[34m  Info  [0m]  - Now considering 'match exhaustiveness' VC for next$7 @?:?...
[[34m  Info  [0m]  => VALID
[[34m  Info  [0m]  - Now considering 'match exhaustiveness' VC for next$7 @?:?...
[[34m  Info  [0m]  => VALID
[[34m  Info  [0m]  - Now considering 'postcondition' VC for nthElemAfterThird$5 @?:?...
[[34m  Info  [0m]  => VALID
[[34m  Info  [0m]  - Now considering 'precond. (call argChainedStreamProp$5(f, n))' VC for nthElemAfterThird$5 @?:?...
[[34m  Info  [0m]  => VALID
[[34m  Info  [0m]  - Now considering 'precond. (call next$7(f, s, t, st@))' VC for nthElemAfterThird$5 @?:?...
[[34m  Info  [0m]  => VALID
[[34m  Info  [0m]  - Now considering 'precond. (call nthElemAfterThird$5(n - BigInt(1), s, t, ...)' VC for nthElemAfterThird$5 @?:?...
[[34m  Info  [0m]  => VALID
[[34m  Info  [0m]  - Now considering 'match exhaustiveness' VC for nthElemAfterThird$5 @?:?...
[[34m  Info  [0m]  => VALID
[[34m  Info  [0m]  - Now considering 'match exhaustiveness' VC for nthElemAfterThird$5 @?:?...
[[34m  Info  [0m]  => VALID
[[34m  Info  [0m]  - Now considering 'match exhaustiveness' VC for nthElemAfterThird$5 @?:?...
[[34m  Info  [0m]  => VALID
[[34m  Info  [0m]  - Now considering 'match exhaustiveness' VC for nthElemAfterThird$5 @?:?...
[[34m  Info  [0m]  => VALID
[[34m  Info  [0m]  - Now considering 'match exhaustiveness' VC for nthElemAfterThird$5 @?:?...
[[34m  Info  [0m]  => VALID
[[34m  Info  [0m]  - Now considering 'postcondition' VC for fibstream$5 @?:?...
[[34m  Info  [0m]  => VALID
[[34m  Info  [0m]  - Now considering 'postcondition' VC for genNext$5 @?:?...
[[34m  Info  [0m]  => VALID
[[34m  Info  [0m]  - Now considering 'match exhaustiveness' VC for genNext$5 @?:?...
[[34m  Info  [0m]  => VALID
[[34m  Info  [0m]  - Now considering 'postcondition' VC for fibStreamSatisfiesProp$5 @?:?...
[[34m  Info  [0m]  => VALID
[[34m  Info  [0m]  - Now considering 'precond. (call argChainingIsTransitive$5(fibs$3, n))' VC for fibStreamSatisfiesProp$5 @?:?...
[[34m  Info  [0m]  => VALID
[[34m  Info  [0m]  - Now considering 'precond. (call argChainedStreamProp$5(fibs$3, n))' VC for fibStreamSatisfiesProp$5 @?:?...
[[34m  Info  [0m]  => VALID
[[34m  Info  [0m]  - Now considering 'postcondition' VC for nthFib$5 @?:?...
[[34m  Info  [0m]  => VALID
[[34m  Info  [0m]  - Now considering 'precond. (call fibStreamSatisfiesProp$5(n))' VC for nthFib$5 @?:?...
[[34m  Info  [0m]  => VALID
[[34m  Info  [0m]  - Now considering 'precond. (call nthElemAfterThird$5(n, first$3, second$3 ...)' VC for nthFib$5 @?:?...
[[34m  Info  [0m]  => VALID
[[34m  Info  [0m]  - Now considering 'match exhaustiveness' VC for nthFib$5 @?:?...
[[34m  Info  [0m]  => VALID
[[34m  Info  [0m]  - Now considering 'match exhaustiveness' VC for nthFib$5 @?:?...
[[34m  Info  [0m]  => VALID
[[34m  Info  [0m]  - Now considering 'postcondition' VC for fval-mem$3 @?:?...
[[34m  Info  [0m]  => VALID
[[34m  Info  [0m]  - Now considering 'match exhaustiveness' VC for fval-mem$3 @?:?...
[[34m  Info  [0m]  => VALID
  ┌──────────────────────━
╔═╡ Verification Summary ╞═════════════════════════════════════════════════════════════════════════════════════════════════════════════════════════════╗
║ └──────────────────────┘                                                                                                                             ║
║ ZipWithAndFibStream.argChainedStreamProp$5     match exhaustiveness                                          ?:?  valid  U:orb-smt-z3          0.067 ║
║ ZipWithAndFibStream.argChainedStreamProp$5     postcondition                                                 ?:?  valid  U:orb-smt-z3          0.072 ║
║ ZipWithAndFibStream.argChainedStreamProp$5     precond. (call argChainedStreamProp$5(s.tailFun match { ...)  ?:?  valid  U:orb-smt-z3          0.055 ║
║ ZipWithAndFibStream.argChainingIsTransitive$5  match exhaustiveness                                          ?:?  valid  U:orb-smt-z3          0.062 ║
║ ZipWithAndFibStream.argChainingIsTransitive$5  postcondition                                                 ?:?  valid  U:orb-smt-z3          0.316 ║
║ ZipWithAndFibStream.argChainingIsTransitive$5  precond. (call argChainedStreamProp$5(s, n))                  ?:?  valid  U:orb-smt-z3          0.093 ║
║ ZipWithAndFibStream.argChainingIsTransitive$5  precond. (call argChainingIsTransitive$5(s.tailFun matc ...)  ?:?  valid  U:orb-smt-orb-cvc4    1.131 ║
║ ZipWithAndFibStream.argChainingProp$5          match exhaustiveness                                          ?:?  valid  U:orb-smt-z3          0.071 ║
║ ZipWithAndFibStream.argChainingProp$5          match exhaustiveness                                          ?:?  valid  U:orb-smt-z3          0.071 ║
║ ZipWithAndFibStream.argChainingProp$5          match exhaustiveness                                          ?:?  valid  U:orb-smt-z3          0.053 ║
║ ZipWithAndFibStream.argChainingProp$5          match exhaustiveness                                          ?:?  valid  U:orb-smt-orb-cvc4    0.067 ║
║ ZipWithAndFibStream.argChainingProp$5          postcondition                                                 ?:?  valid  U:orb-smt-z3          0.104 ║
║ ZipWithAndFibStream.fibStreamSatisfiesProp$5   postcondition                                                 ?:?  valid  U:orb-smt-z3          0.180 ║
║ ZipWithAndFibStream.fibStreamSatisfiesProp$5   precond. (call argChainedStreamProp$5(fibs$3, n))             ?:?  valid  U:orb-smt-z3          0.056 ║
║ ZipWithAndFibStream.fibStreamSatisfiesProp$5   precond. (call argChainingIsTransitive$5(fibs$3, n))          ?:?  valid  U:orb-smt-orb-cvc4    0.525 ║
║ ZipWithAndFibStream.fibstream$5                postcondition                                                 ?:?  valid  U:orb-smt-z3          0.040 ║
║ ValOrSusp.fval-mem$3                           match exhaustiveness                                          ?:?  valid  U:orb-smt-z3          0.039 ║
║ ValOrSusp.fval-mem$3                           postcondition                                                 ?:?  valid  U:orb-smt-orb-cvc4    0.142 ║
║ ZipWithAndFibStream.genNext$5                  match exhaustiveness                                          ?:?  valid  U:orb-smt-z3          0.036 ║
║ ZipWithAndFibStream.genNext$5                  postcondition                                                 ?:?  valid  U:orb-smt-orb-cvc4    0.119 ║
║ ZipWithAndFibStream.next$7                     match exhaustiveness                                          ?:?  valid  U:orb-smt-z3          0.058 ║
║ ZipWithAndFibStream.next$7                     match exhaustiveness                                          ?:?  valid  U:orb-smt-z3          0.072 ║
║ ZipWithAndFibStream.next$7                     match exhaustiveness                                          ?:?  valid  U:orb-smt-z3          0.054 ║
║ ZipWithAndFibStream.next$7                     match exhaustiveness                                          ?:?  valid  U:orb-smt-z3          0.039 ║
║ ZipWithAndFibStream.next$7                     match exhaustiveness                                          ?:?  valid  U:orb-smt-z3          0.060 ║
║ ZipWithAndFibStream.next$7                     postcondition                                                 ?:?  valid  U:orb-smt-z3          0.220 ║
║ ZipWithAndFibStream.nthElemAfterThird$5        match exhaustiveness                                          ?:?  valid  U:orb-smt-z3          0.079 ║
║ ZipWithAndFibStream.nthElemAfterThird$5        match exhaustiveness                                          ?:?  valid  U:orb-smt-z3          0.048 ║
║ ZipWithAndFibStream.nthElemAfterThird$5        match exhaustiveness                                          ?:?  valid  U:orb-smt-z3          0.030 ║
║ ZipWithAndFibStream.nthElemAfterThird$5        match exhaustiveness                                          ?:?  valid  U:orb-smt-z3          0.061 ║
║ ZipWithAndFibStream.nthElemAfterThird$5        match exhaustiveness                                          ?:?  valid  U:orb-smt-z3          0.066 ║
║ ZipWithAndFibStream.nthElemAfterThird$5        postcondition                                                 ?:?  valid  U:orb-smt-z3          0.385 ║
║ ZipWithAndFibStream.nthElemAfterThird$5        precond. (call argChainedStreamProp$5(f, n))                  ?:?  valid  U:orb-smt-z3          0.069 ║
║ ZipWithAndFibStream.nthElemAfterThird$5        precond. (call next$7(f, s, t, st@))                          ?:?  valid  U:orb-smt-z3          0.191 ║
║ ZipWithAndFibStream.nthElemAfterThird$5        precond. (call nthElemAfterThird$5(n - BigInt(1), s, t, ...)  ?:?  valid  U:orb-smt-z3          0.319 ║
║ ZipWithAndFibStream.nthFib$5                   match exhaustiveness                                          ?:?  valid  U:orb-smt-z3          0.047 ║
║ ZipWithAndFibStream.nthFib$5                   match exhaustiveness                                          ?:?  valid  U:orb-smt-z3          0.057 ║
║ ZipWithAndFibStream.nthFib$5                   postcondition                                                 ?:?  valid  U:orb-smt-orb-cvc4    0.538 ║
║ ZipWithAndFibStream.nthFib$5                   precond. (call fibStreamSatisfiesProp$5(n))                   ?:?  valid  U:orb-smt-z3          0.027 ║
║ ZipWithAndFibStream.nthFib$5                   precond. (call nthElemAfterThird$5(n, first$3, second$3 ...)  ?:?  valid  U:orb-smt-z3          0.260 ║
║ ZipWithAndFibStream.zipWithFun$5               match exhaustiveness                                          ?:?  valid  U:orb-smt-orb-cvc4    0.046 ║
║ ZipWithAndFibStream.zipWithFun$5               postcondition                                                 ?:?  valid  U:orb-smt-z3          0.237 ║
║ ZipWithAndFibStream.zipWithSusp$5              match exhaustiveness                                          ?:?  valid  U:orb-smt-z3          0.035 ║
║ ZipWithAndFibStream.zipWithSusp$5              match exhaustiveness                                          ?:?  valid  U:orb-smt-z3          0.038 ║
║ ZipWithAndFibStream.zipWithSusp$5              postcondition                                                 ?:?  valid  U:orb-smt-z3          0.276 ║
╟┄┄┄┄┄┄┄┄┄┄┄┄┄┄┄┄┄┄┄┄┄┄┄┄┄┄┄┄┄┄┄┄┄┄┄┄┄┄┄┄┄┄┄┄┄┄┄┄┄┄┄┄┄┄┄┄┄┄┄┄┄┄┄┄┄┄┄┄┄┄┄┄┄┄┄┄┄┄┄┄┄┄┄┄┄┄┄┄┄┄┄┄┄┄┄┄┄┄┄┄┄┄┄┄┄┄┄┄┄┄┄┄┄┄┄┄┄┄┄┄┄┄┄┄┄┄┄┄┄┄┄┄┄┄┄┄┄┄┄┄┄┄┄┄┄┄┄┄┄┄╢
║ total: 45     valid: 45     invalid: 0      unknown 0                                                                                          6.611 ║
╚═══════════════════════════════════════════════════════════════════════════════════════════════════════════════════════════════════════════════════════
[[34m  Info  [0m] Output written on leon.out
[[34m  Info  [0m] - considering function zipWithFun-steps...
[[34m  Info  [0m] Candidate invariants
[[34m  Info  [0m] zipWithFun-steps-->1 * res$214._2 + 0 <= 0
[[34m  Info  [0m] checked VC inst... in 0.006s
[[34m  Info  [0m] Function: zipWithFun-steps--Found candidate invariant is not a real invariant! 
[[34m  Info  [0m] # of atomic predicates: 7 + 1
[[34m  Info  [0m] - More unrollings for invariant inference
[[34m  Info  [0m] Candidate invariants
[[34m  Info  [0m] zipWithFun-steps-->1 * res$214._2 + 0 <= 0
[[34m  Info  [0m] checked VC inst... in 0.006s
[[34m  Info  [0m] Function: zipWithFun-steps--Found candidate invariant is not a real invariant! 
[[34m  Info  [0m] # of atomic predicates: 6 + 1
[[34m  Info  [0m] Candidate invariants
[[34m  Info  [0m] zipWithFun-steps-->1 * res$214._2 + -17 <= 0
[[34m  Info  [0m] checked VC inst... in 0.001s
[[34m  Info  [0m] minimizing...
[[34m  Info  [0m] Candidate invariants
[[34m  Info  [0m] zipWithFun-steps-->1 * res$214._2 + -15 <= 0
[[34m  Info  [0m] checked VC inst... in 0.001s
[[34m  Info  [0m] - Found inductive invariant: zipWithFun-steps --> steps + BigInt(-15) <= BigInt(0)
[[34m  Info  [0m] - Verifying Invariants... 
[[34m  Info  [0m] - Invariant verified
[[34m  Info  [0m] - considering function zipWithSusp-steps...
[[34m  Info  [0m] - considering function fval-mem-steps...
[[34m  Info  [0m] - considering function next-steps...
[[34m  Info  [0m] Candidate invariants
[[34m  Info  [0m] next-steps-->1 * x$1$31._2 + 0 <= 0
[[34m  Info  [0m] checked VC inst... in 0.021s
[[34m  Info  [0m] Function: next-steps--Found candidate invariant is not a real invariant! 
[[34m  Info  [0m] # of atomic predicates: 6 + 1
[[34m  Info  [0m] Candidate invariants
[[34m  Info  [0m] next-steps-->1 * x$1$31._2 + -7 <= 0
[[34m  Info  [0m] checked VC inst... in 0.014s
[[34m  Info  [0m] Function: next-steps--Found candidate invariant is not a real invariant! 
[[34m  Info  [0m] # of atomic predicates: 6 + 7
[[34m  Info  [0m] - More unrollings for invariant inference
[[34m  Info  [0m] Candidate invariants
[[34m  Info  [0m] next-steps-->1 * x$1$31._2 + 0 <= 0
[[34m  Info  [0m] checked VC inst... in 0.052s
[[34m  Info  [0m] Function: next-steps--Found candidate invariant is not a real invariant! 
[[34m  Info  [0m] # of atomic predicates: 8 + 1
[[34m  Info  [0m] Candidate invariants
[[34m  Info  [0m] next-steps-->1 * x$1$31._2 + -7 <= 0
[[34m  Info  [0m] checked VC inst... in 0.077s
[[34m  Info  [0m] Function: next-steps--Found candidate invariant is not a real invariant! 
[[34m  Info  [0m] # of atomic predicates: 7 + 9
[[34m  Info  [0m] - More unrollings for invariant inference
[[34m  Info  [0m] Candidate invariants
[[34m  Info  [0m] next-steps-->1 * x$1$31._2 + 0 <= 0
[[34m  Info  [0m] checked VC inst... in 0.148s
[[34m  Info  [0m] Function: next-steps--Found candidate invariant is not a real invariant! 
[[34m  Info  [0m] # of atomic predicates: 10 + 1
[[34m  Info  [0m] Candidate invariants
[[34m  Info  [0m] next-steps-->1 * x$1$31._2 + -7 <= 0
[[34m  Info  [0m] checked VC inst... in 0.32s
[[34m  Info  [0m] Function: next-steps--Found candidate invariant is not a real invariant! 
[[34m  Info  [0m] # of atomic predicates: 9 + 11
[[34m  Info  [0m] - More unrollings for invariant inference
[[34m  Info  [0m] Candidate invariants
[[34m  Info  [0m] next-steps-->1 * x$1$31._2 + 0 <= 0
[[34m  Info  [0m] checked VC inst... in 6.9s
[[34m  Info  [0m] Function: next-steps--Found candidate invariant is not a real invariant! 
[[34m  Info  [0m] # of atomic predicates: 11 + 1
[[34m  Info  [0m] Candidate invariants
[[34m  Info  [0m] next-steps-->1 * x$1$31._2 + -33 <= 0
[[34m  Info  [0m] checked VC inst... in 15.026s
[[34m  Info  [0m] VC solving failed!...retrying with a bigger model...
[[34m  Info  [0m] # of atomic predicates: 2 + 12
[[34m  Info  [0m] Candidate invariants
[[34m  Info  [0m] next-steps-->1 * x$1$31._2 + -67 <= 0
[[34m  Info  [0m] checked VC inst... in 0.113s
[[34m  Info  [0m] minimizing...
[[34m  Info  [0m] Candidate invariants
[[34m  Info  [0m] next-steps-->1 * x$1$31._2 + -34 <= 0
[[34m  Info  [0m] checked VC inst... in 15.017s
[[34m  Info  [0m] VC solving failed during minimization!...continuing search with bigger model...
[[34m  Info  [0m] # of atomic predicates: 2 + 13
[[34m  Info  [0m] Candidate invariants
[[34m  Info  [0m] next-steps-->1 * x$1$31._2 + -51 <= 0
[[34m  Info  [0m] checked VC inst... in 0.135s
[[34m  Info  [0m] minimizing...
[[34m  Info  [0m] Candidate invariants
[[34m  Info  [0m] next-steps-->1 * x$1$31._2 + -35 <= 0
[[34m  Info  [0m] checked VC inst... in 15.026s
[[34m  Info  [0m] VC solving failed during minimization!...continuing search with bigger model...
[[34m  Info  [0m] # of atomic predicates: 2 + 14
[[34m  Info  [0m] Candidate invariants
[[34m  Info  [0m] next-steps-->1 * x$1$31._2 + -44 <= 0
[[34m  Info  [0m] checked VC inst... in 0.101s
[[34m  Info  [0m] minimizing...
[[34m  Info  [0m] Candidate invariants
[[34m  Info  [0m] next-steps-->1 * x$1$31._2 + -36 <= 0
[[34m  Info  [0m] checked VC inst... in 15.023s
[[34m  Info  [0m] VC solving failed during minimization!...continuing search with bigger model...
[[34m  Info  [0m] # of atomic predicates: 2 + 15
[[34m  Info  [0m] Candidate invariants
[[34m  Info  [0m] next-steps-->1 * x$1$31._2 + -41 <= 0
[[34m  Info  [0m] checked VC inst... in 0.101s
[[34m  Info  [0m] minimizing...
[[34m  Info  [0m] Candidate invariants
[[34m  Info  [0m] next-steps-->1 * x$1$31._2 + -37 <= 0
[[34m  Info  [0m] checked VC inst... in 0.046s
[[34m  Info  [0m] - Found inductive invariant: next-steps --> steps + BigInt(-37) <= BigInt(0)
[[34m  Info  [0m] - Verifying Invariants... 
[[34m  Info  [0m] - Invariant verified
[[34m  Info  [0m] - considering function nthElemAfterThird-steps...
[[34m  Info  [0m] Candidate invariants
[[34m  Info  [0m] nthElemAfterThird-steps-->(1 * x$2$20._2 + 0 * n) + 0 <= 0
[[34m  Info  [0m] checked VC inst... in 0.031s
[[34m  Info  [0m] Function: nthElemAfterThird-steps--Found candidate invariant is not a real invariant! 
[[34m  Info  [0m] # of atomic predicates: 10 + 1
[[34m  Info  [0m] Candidate invariants
[[34m  Info  [0m] nthElemAfterThird-steps-->(8 * x$2$20._2 + -16 * n) + -339 <= 0
[[34m  Info  [0m] checked VC inst... in 0.022s
[[34m  Info  [0m] Function: nthElemAfterThird-steps--Found candidate invariant is not a real invariant! 
[[34m  Info  [0m] # of atomic predicates: 12 + 11
[[34m  Info  [0m] - More unrollings for invariant inference
[[34m  Info  [0m] Candidate invariants
[[34m  Info  [0m] nthElemAfterThird-steps-->(1 * x$2$20._2 + 0 * n) + 0 <= 0
[[34m  Info  [0m] checked VC inst... in 0.086s
[[34m  Info  [0m] Function: nthElemAfterThird-steps--Found candidate invariant is not a real invariant! 
[[34m  Info  [0m] # of atomic predicates: 10 + 1
[[34m  Info  [0m] Candidate invariants
[[34m  Info  [0m] nthElemAfterThird-steps-->(8 * x$2$20._2 + -16 * n) + -339 <= 0
[[34m  Info  [0m] checked VC inst... in 0.112s
[[34m  Info  [0m] Function: nthElemAfterThird-steps--Found candidate invariant is not a real invariant! 
[[34m  Info  [0m] # of atomic predicates: 16 + 11
[[34m  Info  [0m] Candidate invariants
[[34m  Info  [0m] nthElemAfterThird-steps-->(2 * x$2$20._2 + -92 * n) + -87 <= 0
[[34m  Info  [0m] checked VC inst... in 0.008s
[[34m  Info  [0m] minimizing...
[[34m  Info  [0m] Candidate invariants
[[34m  Info  [0m] nthElemAfterThird-steps-->(1 * x$2$20._2 + -45 * n) + 92 <= 0
[[34m  Info  [0m] checked VC inst... in 0.007s
[[34m  Info  [0m] - Found inductive invariant: nthElemAfterThird-steps --> (steps + BigInt(-45) * n) + BigInt(92) <= BigInt(0)
[[34m  Info  [0m] - Verifying Invariants... 
[[34m  Info  [0m] - Invariant verified
[[34m  Info  [0m] - considering function genNext-steps...
[[34m  Info  [0m] Candidate invariants
[[34m  Info  [0m] genNext-steps-->1 * x$5$6._2 + 0 <= 0
[[34m  Info  [0m] checked VC inst... in 0.016s
[[34m  Info  [0m] Function: genNext-steps--Found candidate invariant is not a real invariant! 
[[34m  Info  [0m] # of atomic predicates: 7 + 1
[[34m  Info  [0m] Candidate invariants
[[34m  Info  [0m] genNext-steps-->1 * x$5$6._2 + -26 <= 0
[[34m  Info  [0m] checked VC inst... in 0.01s
[[34m  Info  [0m] Function: genNext-steps--Found candidate invariant is not a real invariant! 
[[34m  Info  [0m] # of atomic predicates: 8 + 8
[[34m  Info  [0m] - More unrollings for invariant inference
[[34m  Info  [0m] Candidate invariants
[[34m  Info  [0m] genNext-steps-->1 * x$5$6._2 + 0 <= 0
[[34m  Info  [0m] checked VC inst... in 0.016s
[[34m  Info  [0m] Function: genNext-steps--Found candidate invariant is not a real invariant! 
[[34m  Info  [0m] # of atomic predicates: 8 + 1
[[34m  Info  [0m] Candidate invariants
[[34m  Info  [0m] genNext-steps-->1 * x$5$6._2 + -27 <= 0
[[34m  Info  [0m] checked VC inst... in 0.002s
[[34m  Info  [0m] minimizing...
[[34m  Info  [0m] Candidate invariants
[[34m  Info  [0m] genNext-steps-->1 * x$5$6._2 + -24 <= 0
[[34m  Info  [0m] checked VC inst... in 0.001s
[[34m  Info  [0m] - Found inductive invariant: genNext-steps --> steps + BigInt(-24) <= BigInt(0)
[[34m  Info  [0m] - Verifying Invariants... 
[[34m  Info  [0m] - Invariant verified
[[34m  Info  [0m] - considering function nthFib-steps...
[[34m  Info  [0m] Candidate invariants
[[34m  Info  [0m] nthFib-steps-->(1 * x$6$6._2 + 0 * n) + 0 <= 0
[[34m  Info  [0m] checked VC inst... in 0.067s
[[34m  Info  [0m] Function: nthFib-steps--Found candidate invariant is not a real invariant! 
[[34m  Info  [0m] # of atomic predicates: 8 + 1
[[34m  Info  [0m] Candidate invariants
[[34m  Info  [0m] nthFib-steps-->(1 * x$6$6._2 + 0 * n) + -6 <= 0
[[34m  Info  [0m] checked VC inst... in 0.067s
[[34m  Info  [0m] Function: nthFib-steps--Found candidate invariant is not a real invariant! 
[[34m  Info  [0m] # of atomic predicates: 9 + 9
[[34m  Info  [0m] Candidate invariants
[[34m  Info  [0m] nthFib-steps-->(1 * x$6$6._2 + -9 * n) + -5 <= 0
[[34m  Info  [0m] checked VC inst... in 0.11s
[[34m  Info  [0m] Function: nthFib-steps--Found candidate invariant is not a real invariant! 
[[34m  Info  [0m] # of atomic predicates: 12 + 18
[[34m  Info  [0m] Candidate invariants
[[34m  Info  [0m] nthFib-steps-->(1 * x$6$6._2 + -46 * n) + -5 <= 0
[[34m  Info  [0m] checked VC inst... in 0.121s
[[34m  Info  [0m] Function: nthFib-steps--Found candidate invariant is not a real invariant! 
[[34m  Info  [0m] # of atomic predicates: 9 + 30
[[34m  Info  [0m] - More unrollings for invariant inference
[[34m  Info  [0m] Candidate invariants
[[34m  Info  [0m] nthFib-steps-->(1 * x$6$6._2 + 0 * n) + 0 <= 0
[[34m  Info  [0m] checked VC inst... in 0.041s
[[34m  Info  [0m] Function: nthFib-steps--Found candidate invariant is not a real invariant! 
[[34m  Info  [0m] # of atomic predicates: 8 + 1
[[34m  Info  [0m] Candidate invariants
[[34m  Info  [0m] nthFib-steps-->(1 * x$6$6._2 + 0 * n) + -6 <= 0
[[34m  Info  [0m] checked VC inst... in 0.031s
[[34m  Info  [0m] Function: nthFib-steps--Found candidate invariant is not a real invariant! 
[[34m  Info  [0m] # of atomic predicates: 9 + 9
[[34m  Info  [0m] Candidate invariants
[[34m  Info  [0m] nthFib-steps-->(1 * x$6$6._2 + -9 * n) + -5 <= 0
[[34m  Info  [0m] checked VC inst... in 0.061s
[[34m  Info  [0m] Function: nthFib-steps--Found candidate invariant is not a real invariant! 
[[34m  Info  [0m] # of atomic predicates: 10 + 18
[[34m  Info  [0m] - More unrollings for invariant inference
[[34m  Info  [0m] Candidate invariants
[[34m  Info  [0m] nthFib-steps-->(1 * x$6$6._2 + 0 * n) + 0 <= 0
[[34m  Info  [0m] checked VC inst... in 0.048s
[[34m  Info  [0m] Function: nthFib-steps--Found candidate invariant is not a real invariant! 
[[34m  Info  [0m] # of atomic predicates: 8 + 1
[[34m  Info  [0m] Candidate invariants
[[34m  Info  [0m] nthFib-steps-->(1 * x$6$6._2 + 0 * n) + -6 <= 0
[[34m  Info  [0m] checked VC inst... in 0.044s
[[34m  Info  [0m] Function: nthFib-steps--Found candidate invariant is not a real invariant! 
[[34m  Info  [0m] # of atomic predicates: 9 + 9
[[34m  Info  [0m] Candidate invariants
[[34m  Info  [0m] nthFib-steps-->(1 * x$6$6._2 + -9 * n) + -5 <= 0
[[34m  Info  [0m] checked VC inst... in 0.055s
[[34m  Info  [0m] Function: nthFib-steps--Found candidate invariant is not a real invariant! 
[[34m  Info  [0m] # of atomic predicates: 11 + 18
[[34m  Info  [0m] - More unrollings for invariant inference
[[34m  Info  [0m] Candidate invariants
[[34m  Info  [0m] nthFib-steps-->(1 * x$6$6._2 + 0 * n) + 0 <= 0
[[34m  Info  [0m] checked VC inst... in 0.127s
[[34m  Info  [0m] Function: nthFib-steps--Found candidate invariant is not a real invariant! 
[[34m  Info  [0m] # of atomic predicates: 8 + 1
[[34m  Info  [0m] Candidate invariants
[[34m  Info  [0m] nthFib-steps-->(1 * x$6$6._2 + 0 * n) + -6 <= 0
[[34m  Info  [0m] checked VC inst... in 0.099s
[[34m  Info  [0m] Function: nthFib-steps--Found candidate invariant is not a real invariant! 
[[34m  Info  [0m] # of atomic predicates: 9 + 9
[[34m  Info  [0m] Candidate invariants
[[34m  Info  [0m] nthFib-steps-->(1 * x$6$6._2 + -9 * n) + -5 <= 0
[[34m  Info  [0m] checked VC inst... in 0.138s
[[34m  Info  [0m] Function: nthFib-steps--Found candidate invariant is not a real invariant! 
[[34m  Info  [0m] # of atomic predicates: 10 + 18
[[34m  Info  [0m] Candidate invariants
[[34m  Info  [0m] nthFib-steps-->(1 * x$6$6._2 + -11 * n) + -5 <= 0
[[34m  Info  [0m] checked VC inst... in 0.102s
[[34m  Info  [0m] Function: nthFib-steps--Found candidate invariant is not a real invariant! 
[[34m  Info  [0m] # of atomic predicates: 12 + 28
[[34m  Info  [0m] Candidate invariants
[[34m  Info  [0m] nthFib-steps-->(1 * x$6$6._2 + -46 * n) + -5 <= 0
[[34m  Info  [0m] checked VC inst... in 0.012s
[[34m  Info  [0m] minimizing...
[[34m  Info  [0m] Candidate invariants
[[34m  Info  [0m] nthFib-steps-->(1 * x$6$6._2 + -45 * n) + -4 <= 0
[[34m  Info  [0m] checked VC inst... in 0.012s
[[34m  Info  [0m] - Found inductive invariant: nthFib-steps --> (steps + BigInt(-45) * n) + BigInt(-4) <= BigInt(0)
[[34m  Info  [0m] - Verifying Invariants... 
[[34m  Info  [0m] - Invariant verified
Resource Verification Results: 
. ┌─────────━
╔═╡ Summary ╞══════════════════════════════════════════════╗
║ └─────────┘                                              ║
║ genNext         steps <= 24              0.447           ║
║ next            steps <= 37              70.615          ║
║ nthElemAfterTh… steps <= 45 * n + -92    1.297           ║
║ nthFib          steps <= 45 * n + 4      2.736           ║
║ zipWithFun      steps <= 15              0.375           ║
╟┄┄┄┄┄┄┄┄┄┄┄┄┄┄┄┄┄┄┄┄┄┄┄┄┄┄┄┄┄┄┄┄┄┄┄┄┄┄┄┄┄┄┄┄┄┄┄┄┄┄┄┄┄┄┄┄┄┄╢
║ total: 5     inferred: 5     unknown: 0     time: 75.470 ║
╚═══════════════════════════════════════════════════════════
[[34m  Info  [0m] Stats dumped to file: CyclicFibStream-stats.txt
