[[33mWarning [0m] warning: there were three feature warnings; re-run with -feature for details
[[34m  Info  [0m]  - Now considering 'postcondition' VC for isConcrete$5 @?:?...
[[34m  Info  [0m]  => VALID
[[34m  Info  [0m]  - Now considering 'match exhaustiveness' VC for isConcrete$5 @?:?...
[[34m  Info  [0m]  => VALID
[[34m  Info  [0m]  - Now considering 'match exhaustiveness' VC for isConcrete$5 @?:?...
[[34m  Info  [0m]  => VALID
[[34m  Info  [0m]  - Now considering 'match exhaustiveness' VC for isConcrete$5 @?:?...
[[34m  Info  [0m]  => VALID
[[34m  Info  [0m]  - Now considering 'postcondition' VC for takeLazy$5 @?:?...
[[34m  Info  [0m]  => VALID
[[34m  Info  [0m]  - Now considering 'match exhaustiveness' VC for takeLazy$5 @?:?...
[[34m  Info  [0m]  => VALID
[[34m  Info  [0m]  - Now considering 'match exhaustiveness' VC for takeLazy$5 @?:?...
[[34m  Info  [0m]  => VALID
[[34m  Info  [0m]  - Now considering 'postcondition' VC for revAppend$5 @?:?...
[[34m  Info  [0m]  => VALID
[[34m  Info  [0m]  - Now considering 'precond. (call revAppend$5[T](a$220._1, SCons[T](x, Val ...)' VC for revAppend$5 @?:?...
[[34m  Info  [0m]  => VALID
[[34m  Info  [0m]  - Now considering 'match exhaustiveness' VC for revAppend$5 @?:?...
[[34m  Info  [0m]  => VALID
[[34m  Info  [0m]  - Now considering 'match exhaustiveness' VC for revAppend$5 @?:?...
[[34m  Info  [0m]  => VALID
[[34m  Info  [0m]  - Now considering 'postcondition' VC for drop$9 @?:?...
[[34m  Info  [0m]  => VALID
[[34m  Info  [0m]  - Now considering 'precond. (call drop$9[T](n - BigInt(1), a$221._1, a$221 ...)' VC for drop$9 @?:?...
[[34m  Info  [0m]  => VALID
[[34m  Info  [0m]  - Now considering 'match exhaustiveness' VC for drop$9 @?:?...
[[34m  Info  [0m]  => VALID
[[34m  Info  [0m]  - Now considering 'match exhaustiveness' VC for drop$9 @?:?...
[[34m  Info  [0m]  => VALID
[[34m  Info  [0m]  - Now considering 'postcondition' VC for take$9 @?:?...
[[34m  Info  [0m]  => VALID
[[34m  Info  [0m]  - Now considering 'precond. (call take$9[T](n - BigInt(1), a$222._1, a$222 ...)' VC for take$9 @?:?...
[[34m  Info  [0m]  => VALID
[[34m  Info  [0m]  - Now considering 'match exhaustiveness' VC for take$9 @?:?...
[[34m  Info  [0m]  => VALID
[[34m  Info  [0m]  - Now considering 'match exhaustiveness' VC for take$9 @?:?...
[[34m  Info  [0m]  => VALID
[[34m  Info  [0m]  - Now considering 'postcondition' VC for rotateRev$5 @?:?...
[[34m  Info  [0m]  => VALID
[[34m  Info  [0m]  - Now considering 'precond. (call revAppend$5[T](f, a, st@))' VC for rotateRev$5 @?:?...
[[34m  Info  [0m]  => VALID
[[34m  Info  [0m]  - Now considering 'precond. (call drop$9[T](BigInt(2), f, nr$17._2))' VC for rotateRev$5 @?:?...
[[34m  Info  [0m]  => VALID
[[34m  Info  [0m]  - Now considering 'precond. (call take$9[T](BigInt(2), f, nf$17._2))' VC for rotateRev$5 @?:?...
[[34m  Info  [0m]  => VALID
[[34m  Info  [0m]  - Now considering 'precond. (call revAppend$5[T](a$225._1, a, a$225._2))' VC for rotateRev$5 @?:?...
[[34m  Info  [0m]  => VALID
[[34m  Info  [0m]  - Now considering 'match exhaustiveness' VC for rotateRev$5 @?:?...
[[34m  Info  [0m]  => VALID
[[34m  Info  [0m]  - Now considering 'match exhaustiveness' VC for rotateRev$5 @?:?...
[[34m  Info  [0m]  => VALID
[[34m  Info  [0m]  - Now considering 'postcondition' VC for rotateDrop$5 @?:?...
[[34m  Info  [0m]  => VALID
[[34m  Info  [0m]  - Now considering 'precond. (call drop$9[T](i, f, st@))' VC for rotateDrop$5 @?:?...
[[34m  Info  [0m]  => VALID
[[34m  Info  [0m]  - Now considering 'precond. (call rotateRev$5[T](r, a$227._1, SNil[T](), a ...)' VC for rotateDrop$5 @?:?...
[[34m  Info  [0m]  => VALID
[[34m  Info  [0m]  - Now considering 'precond. (call drop$9[T](BigInt(2), f, nr$19._2))' VC for rotateDrop$5 @?:?...
[[34m  Info  [0m]  => VALID
[[34m  Info  [0m]  - Now considering 'match exhaustiveness' VC for rotateDrop$5 @?:?...
[[34m  Info  [0m]  => VALID
[[34m  Info  [0m]  - Now considering 'match exhaustiveness' VC for rotateDrop$5 @?:?...
[[34m  Info  [0m]  => VALID
[[34m  Info  [0m]  - Now considering 'postcondition' VC for TakeLazyL@takeLazyPre$1 @?:?...
[[34m  Info  [0m]  => VALID
[[34m  Info  [0m]  - Now considering 'match exhaustiveness' VC for TakeLazyL@takeLazyPre$1 @?:?...
[[34m  Info  [0m]  => VALID
[[34m  Info  [0m]  - Now considering 'postcondition' VC for RotateRevL@rotateRevPre$1 @?:?...
[[34m  Info  [0m]  => VALID
[[34m  Info  [0m]  - Now considering 'precond. (call drop$9[T](BigInt(2), f, nr$17._2))' VC for RotateRevL@rotateRevPre$1 @?:?...
[[34m  Info  [0m]  => VALID
[[34m  Info  [0m]  - Now considering 'precond. (call take$9[T](BigInt(2), f, nf$17._2))' VC for RotateRevL@rotateRevPre$1 @?:?...
[[34m  Info  [0m]  => VALID
[[34m  Info  [0m]  - Now considering 'precond. (call revAppend$5[T](a$225._1, a, a$225._2))' VC for RotateRevL@rotateRevPre$1 @?:?...
[[34m  Info  [0m]  => VALID
[[34m  Info  [0m]  - Now considering 'match exhaustiveness' VC for RotateRevL@rotateRevPre$1 @?:?...
[[34m  Info  [0m]  => VALID
[[34m  Info  [0m]  - Now considering 'postcondition' VC for RotateDropL@rotateDropPre$1 @?:?...
[[34m  Info  [0m]  => VALID
[[34m  Info  [0m]  - Now considering 'precond. (call drop$9[T](BigInt(2), f, nr$19._2))' VC for RotateDropL@rotateDropPre$1 @?:?...
[[34m  Info  [0m]  => VALID
[[34m  Info  [0m]  - Now considering 'match exhaustiveness' VC for RotateDropL@rotateDropPre$1 @?:?...
[[34m  Info  [0m]  => VALID
[[34m  Info  [0m]  - Now considering 'postcondition' VC for firstUneval$5 @?:?...
[[34m  Info  [0m]  => VALID
[[34m  Info  [0m]  - Now considering 'match exhaustiveness' VC for firstUneval$5 @?:?...
[[34m  Info  [0m]  => VALID
[[34m  Info  [0m]  - Now considering 'match exhaustiveness' VC for firstUneval$5 @?:?...
[[34m  Info  [0m]  => VALID
[[34m  Info  [0m]  - Now considering 'match exhaustiveness' VC for firstUneval$5 @?:?...
[[34m  Info  [0m]  => VALID
[[34m  Info  [0m]  - Now considering 'match exhaustiveness' VC for firstUneval$5 @?:?...
[[34m  Info  [0m]  => VALID
[[34m  Info  [0m]  - Now considering 'match exhaustiveness' VC for firstUneval$5 @?:?...
[[34m  Info  [0m]  => VALID
[[34m  Info  [0m]  - Now considering 'match exhaustiveness' VC for firstUneval$5 @?:?...
[[34m  Info  [0m]  => VALID
[[34m  Info  [0m]  - Now considering 'postcondition' VC for createQueue$5 @?:?...
[[34m  Info  [0m]  => VALID
[[34m  Info  [0m]  - Now considering 'precond. (call rotateDrop$5[T](r, i, f, st@))' VC for createQueue$5 @?:?...
[[34m  Info  [0m]  => VALID
[[34m  Info  [0m]  - Now considering 'precond. (call takeLazy$5[T](i, f, nr$20._2))' VC for createQueue$5 @?:?...
[[34m  Info  [0m]  => VALID
[[34m  Info  [0m]  - Now considering 'precond. (call rotateDrop$5[T](f, j, r, st@))' VC for createQueue$5 @?:?...
[[34m  Info  [0m]  => VALID
[[34m  Info  [0m]  - Now considering 'precond. (call takeLazy$5[T](j, r, nf$21._2))' VC for createQueue$5 @?:?...
[[34m  Info  [0m]  => VALID
[[34m  Info  [0m]  - Now considering 'division by zero' VC for createQueue$5 @?:?...
[[34m  Info  [0m]  => VALID
[[34m  Info  [0m]  - Now considering 'division by zero' VC for createQueue$5 @?:?...
[[34m  Info  [0m]  => VALID
[[34m  Info  [0m]  - Now considering 'postcondition' VC for funeEqual$5 @?:?...
[[34m  Info  [0m]  => VALID
[[34m  Info  [0m]  - Now considering 'postcondition' VC for force$5 @?:?...
[[34m  Info  [0m]  => VALID
[[34m  Info  [0m]  - Now considering 'precond. (call funeMonotone$5[T](tar, htar, st@, out$1))' VC for force$5 @?:?...
[[34m  Info  [0m]  => VALID
[[34m  Info  [0m]  - Now considering 'precond. (call funeMonotone$5[T](other, hother, st@, ou ...)' VC for force$5 @?:?...
[[34m  Info  [0m]  => VALID
[[34m  Info  [0m]  - Now considering 'match exhaustiveness' VC for force$5 @?:?...
[[34m  Info  [0m]  => VALID
[[34m  Info  [0m]  - Now considering 'match exhaustiveness' VC for force$5 @?:?...
[[34m  Info  [0m]  => VALID
[[34m  Info  [0m]  - Now considering 'postcondition' VC for forceTwice$5 @?:?...
[[34m  Info  [0m]  => VALID
[[34m  Info  [0m]  - Now considering 'precond. (call force$5[T](q.sf, q.f, q.r, q.sr, st@))' VC for forceTwice$5 @?:?...
[[34m  Info  [0m]  => VALID
[[34m  Info  [0m]  - Now considering 'precond. (call force$5[T](a$230._1, q.f, q.r, q.sr, a$2 ...)' VC for forceTwice$5 @?:?...
[[34m  Info  [0m]  => VALID
[[34m  Info  [0m]  - Now considering 'precond. (call force$5[T](q.sr, q.r, q.f, nsf$6._1, nsf ...)' VC for forceTwice$5 @?:?...
[[34m  Info  [0m]  => VALID
[[34m  Info  [0m]  - Now considering 'precond. (call force$5[T](a$231._1, q.r, q.f, nsf$6._1, ...)' VC for forceTwice$5 @?:?...
[[34m  Info  [0m]  => VALID
[[34m  Info  [0m]  - Now considering 'match exhaustiveness' VC for forceTwice$5 @?:?...
[[34m  Info  [0m]  => VALID
[[34m  Info  [0m]  - Now considering 'postcondition' VC for empty$8 @?:?...
[[34m  Info  [0m]  => VALID
[[34m  Info  [0m]  - Now considering 'postcondition' VC for head$15 @?:?...
[[34m  Info  [0m]  => VALID
[[34m  Info  [0m]  - Now considering 'match exhaustiveness' VC for head$15 @?:?...
[[34m  Info  [0m]  => VALID
[[34m  Info  [0m]  - Now considering 'postcondition' VC for cons$5 @?:?...
[[34m  Info  [0m]  => VALID
[[34m  Info  [0m]  - Now considering 'precond. (call force$5[T](q.sf, q.f, q.r, q.sr, st@))' VC for cons$5 @?:?...
[[34m  Info  [0m]  => VALID
[[34m  Info  [0m]  - Now considering 'precond. (call force$5[T](q.sr, q.r, q.f, nsf$7._1, nsf ...)' VC for cons$5 @?:?...
[[34m  Info  [0m]  => VALID
[[34m  Info  [0m]  - Now considering 'precond. (call createQueue$5[T](SCons[T](x, Val[T](q.f) ...)' VC for cons$5 @?:?...
[[34m  Info  [0m]  => VALID
[[34m  Info  [0m]  - Now considering 'postcondition' VC for tail$20 @?:?...
[[34m  Info  [0m]  => VALID
[[34m  Info  [0m]  - Now considering 'precond. (call tailSub$5[T](q, st@))' VC for tail$20 @?:?...
[[34m  Info  [0m]  => VALID
[[34m  Info  [0m]  - Now considering 'postcondition' VC for tailSub$5 @?:?...
[[34m  Info  [0m]  => VALID
[[34m  Info  [0m]  - Now considering 'precond. (call forceTwice$5[T](q, st@))' VC for tailSub$5 @?:?...
[[34m  Info  [0m]  => VALID
[[34m  Info  [0m]  - Now considering 'precond. (call createQueue$5[T](a$232._1, q.lenf - BigI ...)' VC for tailSub$5 @?:?...
[[34m  Info  [0m]  => VALID
[[34m  Info  [0m]  - Now considering 'match exhaustiveness' VC for tailSub$5 @?:?...
[[34m  Info  [0m]  => VALID
[[34m  Info  [0m]  - Now considering 'match exhaustiveness' VC for tailSub$5 @?:?...
[[34m  Info  [0m]  => VALID
[[34m  Info  [0m]  - Now considering 'match exhaustiveness' VC for tailSub$5 @?:?...
[[34m  Info  [0m]  => VALID
[[34m  Info  [0m]  - Now considering 'postcondition' VC for reverse$7 @?:?...
[[34m  Info  [0m]  => VALID
[[34m  Info  [0m]  - Now considering 'postcondition' VC for snoc$5 @?:?...
[[34m  Info  [0m]  => VALID
[[34m  Info  [0m]  - Now considering 'precond. (call cons$5[T](x, reverse$7[T](q, st@), st@))' VC for snoc$5 @?:?...
[[34m  Info  [0m]  => VALID
[[34m  Info  [0m]  - Now considering 'precond. (call reverse$7[T](q, st@))' VC for snoc$5 @?:?...
[[34m  Info  [0m]  => VALID
[[34m  Info  [0m]  - Now considering 'precond. (call reverse$7[T](a$233._1, a$233._2))' VC for snoc$5 @?:?...
[[34m  Info  [0m]  => VALID
[[34m  Info  [0m]  - Now considering 'tact (postcondition)' VC for funeCompose$5 @?:?...
[[34m  Info  [0m]  => VALID
[[34m  Info  [0m]  - Now considering 'tact (precond. (call funeCompose-VCTact[T](c match { ...))' VC for funeCompose$5 @?:?...
[[34m  Info  [0m]  => VALID
[[34m  Info  [0m]  - Now considering 'tact (match exhaustiveness)' VC for funeCompose$5 @?:?...
[[34m  Info  [0m]  => VALID
[[34m  Info  [0m]  - Now considering 'tact (match exhaustiveness)' VC for funeCompose$5 @?:?...
[[34m  Info  [0m]  => VALID
[[34m  Info  [0m]  - Now considering 'tact (match exhaustiveness)' VC for funeCompose$5 @?:?...
[[34m  Info  [0m]  => VALID
[[34m  Info  [0m]  - Now considering 'tact (match exhaustiveness)' VC for funeCompose$5 @?:?...
[[34m  Info  [0m]  => VALID
[[34m  Info  [0m]  - Now considering 'tact (match exhaustiveness)' VC for funeCompose$5 @?:?...
[[34m  Info  [0m]  => VALID
[[34m  Info  [0m]  - Now considering 'postcondition' VC for funeMonotone$5 @?:?...
[[34m  Info  [0m]  => VALID
[[34m  Info  [0m]  - Now considering 'precond. (call funeCompose$5[T](l1, st1, st2))' VC for funeMonotone$5 @?:?...
[[34m  Info  [0m]  => VALID
[[34m  Info  [0m]  - Now considering 'precond. (call funeCompose$5[T](l2, st1, st2))' VC for funeMonotone$5 @?:?...
[[34m  Info  [0m]  => VALID
[[34m  Info  [0m]  - Now considering 'postcondition' VC for size$10 @?:?...
[[34m  Info  [0m]  => VALID
[[34m  Info  [0m]  - Now considering 'match exhaustiveness' VC for size$10 @?:?...
[[34m  Info  [0m]  => VALID
[[34m  Info  [0m]  - Now considering 'match exhaustiveness' VC for size$10 @?:?...
[[34m  Info  [0m]  => VALID
[[34m  Info  [0m]  - Now considering 'postcondition' VC for get-mem$3 @?:?...
[[34m  Info  [0m]  => VALID
[[34m  Info  [0m]  - Now considering 'match exhaustiveness' VC for get-mem$3 @?:?...
[[34m  Info  [0m]  => VALID
[[34m  Info  [0m]  - Now considering 'postcondition' VC for isEmpty$13 @?:?...
[[34m  Info  [0m]  => VALID
[[34m  Info  [0m]  - Now considering 'postcondition' VC for valid$6 @?:?...
[[34m  Info  [0m]  => VALID
  ┌──────────────────────━
╔═╡ Verification Summary ══════════════════════════════════════════════════════════════════════════════════════════════════════════════════════════╗
║ └──────────────────────┘                                                                                                                         ║
║ RealTimeDeque.RotateDropL@rotateDropPre$1  match exhaustiveness                                          ?:?  valid  U:orb-smt-z3          0.088 ║
║ RealTimeDeque.RotateDropL@rotateDropPre$1  postcondition                                                 ?:?  valid  U:orb-smt-z3          2.106 ║
║ RealTimeDeque.RotateDropL@rotateDropPre$1  precond. (call drop$9[T](BigInt(2), f, nr$19._2))             ?:?  valid  U:orb-smt-orb-cvc4    1.628 ║
║ RealTimeDeque.RotateRevL@rotateRevPre$1    match exhaustiveness                                          ?:?  valid  U:orb-smt-z3          0.081 ║
║ RealTimeDeque.RotateRevL@rotateRevPre$1    postcondition                                                 ?:?  valid  U:orb-smt-orb-cvc4    3.581 ║
║ RealTimeDeque.RotateRevL@rotateRevPre$1    precond. (call drop$9[T](BigInt(2), f, nr$17._2))             ?:?  valid  U:orb-smt-z3          1.392 ║
║ RealTimeDeque.RotateRevL@rotateRevPre$1    precond. (call revAppend$5[T](a$225._1, a, a$225._2))         ?:?  valid  U:orb-smt-orb-cvc4    4.042 ║
║ RealTimeDeque.RotateRevL@rotateRevPre$1    precond. (call take$9[T](BigInt(2), f, nf$17._2))             ?:?  valid  U:orb-smt-z3          0.559 ║
║ RealTimeDeque.TakeLazyL@takeLazyPre$1      match exhaustiveness                                          ?:?  valid  U:orb-smt-z3          0.099 ║
║ RealTimeDeque.TakeLazyL@takeLazyPre$1      postcondition                                                 ?:?  valid  U:orb-smt-orb-cvc4    1.299 ║
║ RealTimeDeque.cons$5                       postcondition                                                 ?:?  valid  U:orb-smt-z3          2.432 ║
║ RealTimeDeque.cons$5                       precond. (call createQueue$5[T](SCons[T](x, Val[T](q.f) ...)  ?:?  valid  U:orb-smt-z3          2.249 ║
║ RealTimeDeque.cons$5                       precond. (call force$5[T](q.sf, q.f, q.r, q.sr, st@))         ?:?  valid  U:orb-smt-z3          0.398 ║
║ RealTimeDeque.cons$5                       precond. (call force$5[T](q.sr, q.r, q.f, nsf$7._1, nsf ...)  ?:?  valid  U:orb-smt-z3          1.021 ║
║ RealTimeDeque.createQueue$5                division by zero                                              ?:?  valid  U:orb-smt-z3          0.094 ║
║ RealTimeDeque.createQueue$5                division by zero                                              ?:?  valid  U:orb-smt-z3          0.103 ║
║ RealTimeDeque.createQueue$5                postcondition                                                 ?:?  valid  U:orb-smt-z3          2.020 ║
║ RealTimeDeque.createQueue$5                precond. (call rotateDrop$5[T](f, j, r, st@))                 ?:?  valid  U:orb-smt-z3          1.181 ║
║ RealTimeDeque.createQueue$5                precond. (call rotateDrop$5[T](r, i, f, st@))                 ?:?  valid  U:orb-smt-z3          0.980 ║
║ RealTimeDeque.createQueue$5                precond. (call takeLazy$5[T](i, f, nr$20._2))                 ?:?  valid  U:orb-smt-z3          1.352 ║
║ RealTimeDeque.createQueue$5                precond. (call takeLazy$5[T](j, r, nf$21._2))                 ?:?  valid  U:orb-smt-z3          1.409 ║
║ RealTimeDeque.drop$9                       match exhaustiveness                                          ?:?  valid  U:orb-smt-z3          0.085 ║
║ RealTimeDeque.drop$9                       match exhaustiveness                                          ?:?  valid  U:orb-smt-z3          0.081 ║
║ RealTimeDeque.drop$9                       postcondition                                                 ?:?  valid  U:orb-smt-z3          0.595 ║
║ RealTimeDeque.drop$9                       precond. (call drop$9[T](n - BigInt(1), a$221._1, a$221 ...)  ?:?  valid  U:orb-smt-orb-cvc4    1.205 ║
║ RealTimeDeque.empty$8                      postcondition                                                 ?:?  valid  U:orb-smt-z3          0.457 ║
║ RealTimeDeque.firstUneval$5                match exhaustiveness                                          ?:?  valid  U:orb-smt-z3          0.104 ║
║ RealTimeDeque.firstUneval$5                match exhaustiveness                                          ?:?  valid  U:orb-smt-z3          0.038 ║
║ RealTimeDeque.firstUneval$5                match exhaustiveness                                          ?:?  valid  U:orb-smt-z3          0.035 ║
║ RealTimeDeque.firstUneval$5                match exhaustiveness                                          ?:?  valid  U:orb-smt-z3          0.096 ║
║ RealTimeDeque.firstUneval$5                match exhaustiveness                                          ?:?  valid  U:orb-smt-z3          0.034 ║
║ RealTimeDeque.firstUneval$5                match exhaustiveness                                          ?:?  valid  U:orb-smt-z3          0.094 ║
║ RealTimeDeque.firstUneval$5                postcondition                                                 ?:?  valid  U:orb-smt-z3          1.073 ║
║ RealTimeDeque.force$5                      match exhaustiveness                                          ?:?  valid  U:orb-smt-z3          0.079 ║
║ RealTimeDeque.force$5                      match exhaustiveness                                          ?:?  valid  U:orb-smt-z3          0.079 ║
║ RealTimeDeque.force$5                      postcondition                                                 ?:?  valid  U:orb-smt-z3          1.794 ║
║ RealTimeDeque.force$5                      precond. (call funeMonotone$5[T](other, hother, st@, ou ...)  ?:?  valid  U:orb-smt-z3          1.056 ║
║ RealTimeDeque.force$5                      precond. (call funeMonotone$5[T](tar, htar, st@, out$1))      ?:?  valid  U:orb-smt-z3          0.824 ║
║ RealTimeDeque.forceTwice$5                 match exhaustiveness                                          ?:?  valid  U:orb-smt-z3          0.114 ║
║ RealTimeDeque.forceTwice$5                 postcondition                                                 ?:?  valid  U:orb-smt-z3          2.318 ║
║ RealTimeDeque.forceTwice$5                 precond. (call force$5[T](a$230._1, q.f, q.r, q.sr, a$2 ...)  ?:?  valid  U:orb-smt-z3          1.121 ║
║ RealTimeDeque.forceTwice$5                 precond. (call force$5[T](a$231._1, q.r, q.f, nsf$6._1, ...)  ?:?  valid  U:orb-smt-z3          2.012 ║
║ RealTimeDeque.forceTwice$5                 precond. (call force$5[T](q.sf, q.f, q.r, q.sr, st@))         ?:?  valid  U:orb-smt-z3          0.387 ║
║ RealTimeDeque.forceTwice$5                 precond. (call force$5[T](q.sr, q.r, q.f, nsf$6._1, nsf ...)  ?:?  valid  U:orb-smt-z3          1.586 ║
║ RealTimeDeque.funeCompose$5                tact (match exhaustiveness)                                   ?:?  valid  U:orb-smt-z3          0.055 ║
║ RealTimeDeque.funeCompose$5                tact (match exhaustiveness)                                   ?:?  valid  U:orb-smt-z3          0.057 ║
║ RealTimeDeque.funeCompose$5                tact (match exhaustiveness)                                   ?:?  valid  U:orb-smt-z3          0.038 ║
║ RealTimeDeque.funeCompose$5                tact (match exhaustiveness)                                   ?:?  valid  U:orb-smt-z3          0.031 ║
║ RealTimeDeque.funeCompose$5                tact (match exhaustiveness)                                   ?:?  valid  U:orb-smt-z3          0.029 ║
║ RealTimeDeque.funeCompose$5                tact (postcondition)                                          ?:?  valid  U:orb-smt-z3          1.165 ║
║ RealTimeDeque.funeCompose$5                tact (precond. (call funeCompose-VCTact[T](c match { ...))    ?:?  valid  U:orb-smt-z3          0.051 ║
║ RealTimeDeque.funeEqual$5                  postcondition                                                 ?:?  valid  U:orb-smt-z3          0.091 ║
║ RealTimeDeque.funeMonotone$5               postcondition                                                 ?:?  valid  U:orb-smt-z3          0.991 ║
║ RealTimeDeque.funeMonotone$5               precond. (call funeCompose$5[T](l1, st1, st2))                ?:?  valid  U:orb-smt-z3          0.087 ║
║ RealTimeDeque.funeMonotone$5               precond. (call funeCompose$5[T](l2, st1, st2))                ?:?  valid  U:orb-smt-z3          0.093 ║
║ ValOrFun.get-mem$3                         match exhaustiveness                                          ?:?  valid  U:orb-smt-z3          0.028 ║
║ ValOrFun.get-mem$3                         postcondition                                                 ?:?  valid  U:orb-smt-orb-cvc4    0.638 ║
║ RealTimeDeque.head$15                      match exhaustiveness                                          ?:?  valid  U:orb-smt-z3          0.385 ║
║ RealTimeDeque.head$15                      postcondition                                                 ?:?  valid  U:orb-smt-z3          0.434 ║
║ RealTimeDeque.isConcrete$5                 match exhaustiveness                                          ?:?  valid  U:orb-smt-z3          0.050 ║
║ RealTimeDeque.isConcrete$5                 match exhaustiveness                                          ?:?  valid  U:orb-smt-z3          0.038 ║
║ RealTimeDeque.isConcrete$5                 match exhaustiveness                                          ?:?  valid  U:orb-smt-z3          0.039 ║
║ RealTimeDeque.isConcrete$5                 postcondition                                                 ?:?  valid  U:orb-smt-orb-cvc4    0.260 ║
║ Queue.isEmpty$13                           postcondition                                                 ?:?  valid  U:orb-smt-orb-cvc4    0.044 ║
║ RealTimeDeque.revAppend$5                  match exhaustiveness                                          ?:?  valid  U:orb-smt-z3          0.102 ║
║ RealTimeDeque.revAppend$5                  match exhaustiveness                                          ?:?  valid  U:orb-smt-z3          0.091 ║
║ RealTimeDeque.revAppend$5                  postcondition                                                 ?:?  valid  U:orb-smt-z3          0.780 ║
║ RealTimeDeque.revAppend$5                  precond. (call revAppend$5[T](a$220._1, SCons[T](x, Val ...)  ?:?  valid  U:orb-smt-orb-cvc4    1.303 ║
║ RealTimeDeque.reverse$7                    postcondition                                                 ?:?  valid  U:orb-smt-z3          0.407 ║
║ RealTimeDeque.rotateDrop$5                 match exhaustiveness                                          ?:?  valid  U:orb-smt-z3          0.084 ║
║ RealTimeDeque.rotateDrop$5                 match exhaustiveness                                          ?:?  valid  U:orb-smt-z3          0.092 ║
║ RealTimeDeque.rotateDrop$5                 postcondition                                                 ?:?  valid  U:orb-smt-z3          1.153 ║
║ RealTimeDeque.rotateDrop$5                 precond. (call drop$9[T](BigInt(2), f, nr$19._2))             ?:?  valid  U:orb-smt-z3          0.688 ║
║ RealTimeDeque.rotateDrop$5                 precond. (call drop$9[T](i, f, st@))                          ?:?  valid  U:orb-smt-z3          0.083 ║
║ RealTimeDeque.rotateDrop$5                 precond. (call rotateRev$5[T](r, a$227._1, SNil[T](), a ...)  ?:?  valid  U:orb-smt-z3          0.502 ║
║ RealTimeDeque.rotateRev$5                  match exhaustiveness                                          ?:?  valid  U:orb-smt-z3          0.093 ║
║ RealTimeDeque.rotateRev$5                  match exhaustiveness                                          ?:?  valid  U:orb-smt-z3          0.083 ║
║ RealTimeDeque.rotateRev$5                  postcondition                                                 ?:?  valid  U:orb-smt-z3          1.340 ║
║ RealTimeDeque.rotateRev$5                  precond. (call drop$9[T](BigInt(2), f, nr$17._2))             ?:?  valid  U:orb-smt-orb-cvc4    0.782 ║
║ RealTimeDeque.rotateRev$5                  precond. (call revAppend$5[T](a$225._1, a, a$225._2))         ?:?  valid  U:orb-smt-orb-cvc4    4.094 ║
║ RealTimeDeque.rotateRev$5                  precond. (call revAppend$5[T](f, a, st@))                     ?:?  valid  U:orb-smt-z3          0.085 ║
║ RealTimeDeque.rotateRev$5                  precond. (call take$9[T](BigInt(2), f, nf$17._2))             ?:?  valid  U:orb-smt-z3          0.570 ║
║ Stream.size$10                             match exhaustiveness                                          ?:?  valid  U:orb-smt-z3          0.038 ║
║ Stream.size$10                             match exhaustiveness                                          ?:?  valid  U:orb-smt-z3          0.045 ║
║ Stream.size$10                             postcondition                                                 ?:?  valid  U:orb-smt-z3          0.316 ║
║ RealTimeDeque.snoc$5                       postcondition                                                 ?:?  valid  U:orb-smt-z3          1.908 ║
║ RealTimeDeque.snoc$5                       precond. (call cons$5[T](x, reverse$7[T](q, st@), st@))       ?:?  valid  U:orb-smt-z3          0.771 ║
║ RealTimeDeque.snoc$5                       precond. (call reverse$7[T](a$233._1, a$233._2))              ?:?  valid  U:orb-smt-z3          1.504 ║
║ RealTimeDeque.snoc$5                       precond. (call reverse$7[T](q, st@))                          ?:?  valid  U:orb-smt-z3          0.090 ║
║ RealTimeDeque.tail$20                      postcondition                                                 ?:?  valid  U:orb-smt-z3          1.404 ║
║ RealTimeDeque.tail$20                      precond. (call tailSub$5[T](q, st@))                          ?:?  valid  U:orb-smt-z3          0.089 ║
║ RealTimeDeque.tailSub$5                    match exhaustiveness                                          ?:?  valid  U:orb-smt-z3          0.042 ║
║ RealTimeDeque.tailSub$5                    match exhaustiveness                                          ?:?  valid  U:orb-smt-z3          0.098 ║
║ RealTimeDeque.tailSub$5                    match exhaustiveness                                          ?:?  valid  U:orb-smt-z3          0.095 ║
║ RealTimeDeque.tailSub$5                    postcondition                                                 ?:?  valid  U:orb-smt-z3          2.486 ║
║ RealTimeDeque.tailSub$5                    precond. (call createQueue$5[T](a$232._1, q.lenf - BigI ...)  ?:?  valid  U:orb-smt-z3          2.139 ║
║ RealTimeDeque.tailSub$5                    precond. (call forceTwice$5[T](q, st@))                       ?:?  valid  U:orb-smt-z3          0.084 ║
║ RealTimeDeque.take$9                       match exhaustiveness                                          ?:?  valid  U:orb-smt-z3          0.101 ║
║ RealTimeDeque.take$9                       match exhaustiveness                                          ?:?  valid  U:orb-smt-z3          0.090 ║
║ RealTimeDeque.take$9                       postcondition                                                 ?:?  valid  U:orb-smt-z3          0.652 ║
║ RealTimeDeque.take$9                       precond. (call take$9[T](n - BigInt(1), a$222._1, a$222 ...)  ?:?  valid  U:orb-smt-z3          0.716 ║
║ RealTimeDeque.takeLazy$5                   match exhaustiveness                                          ?:?  valid  U:orb-smt-z3          0.127 ║
║ RealTimeDeque.takeLazy$5                   match exhaustiveness                                          ?:?  valid  U:orb-smt-z3          0.236 ║
║ RealTimeDeque.takeLazy$5                   postcondition                                                 ?:?  valid  U:orb-smt-z3          0.625 ║
║ Queue.valid$6                              postcondition                                                 ?:?  valid  U:orb-smt-z3          0.100 ║
╟┄┄┄┄┄┄┄┄┄┄┄┄┄┄┄┄┄┄┄┄┄┄┄┄┄┄┄┄┄┄┄┄┄┄┄┄┄┄┄┄┄┄┄┄┄┄┄┄┄┄┄┄┄┄┄┄┄┄┄┄┄┄┄┄┄┄┄┄┄┄┄┄┄┄┄┄┄┄┄┄┄┄┄┄┄┄┄┄┄┄┄┄┄┄┄┄┄┄┄┄┄┄┄┄┄┄┄┄┄┄┄┄┄┄┄┄┄┄┄┄┄┄┄┄┄┄┄┄┄┄┄┄┄┄┄┄┄┄┄┄┄┄┄┄┄┄╢
║ total: 105    valid: 105    invalid: 0      unknown 0                                                                                     74.073 ║
╚═══════════════════════════════════════════════════════════════════════════════════════════════════════════════════════════════════════════════════
[[34m  Info  [0m] - considering function takeLazy-steps...
[[34m  Info  [0m] Candidate invariants
[[34m  Info  [0m] takeLazy-steps-->1 * res$269._2 + 0 <= 0
[[34m  Info  [0m] checked VC inst... in 0.021s
[[34m  Info  [0m] Function: takeLazy-steps--Found candidate invariant is not a real invariant! 
[[34m  Info  [0m] # of atomic predicates: 6 + 1
[[34m  Info  [0m] Candidate invariants
[[34m  Info  [0m] takeLazy-steps-->1 * res$269._2 + -10 <= 0
[[34m  Info  [0m] checked VC inst... in 0.022s
[[34m  Info  [0m] Function: takeLazy-steps--Found candidate invariant is not a real invariant! 
[[34m  Info  [0m] # of atomic predicates: 9 + 7
[[34m  Info  [0m] Candidate invariants
[[34m  Info  [0m] takeLazy-steps-->1 * res$269._2 + -16 <= 0
[[34m  Info  [0m] checked VC inst... in 0.034s
[[34m  Info  [0m] Function: takeLazy-steps--Found candidate invariant is not a real invariant! 
[[34m  Info  [0m] # of atomic predicates: 8 + 16
[[34m  Info  [0m] - More unrollings for invariant inference
[[34m  Info  [0m] Candidate invariants
[[34m  Info  [0m] takeLazy-steps-->1 * res$269._2 + 0 <= 0
[[34m  Info  [0m] checked VC inst... in 0.033s
[[34m  Info  [0m] Function: takeLazy-steps--Found candidate invariant is not a real invariant! 
[[34m  Info  [0m] # of atomic predicates: 9 + 1
[[34m  Info  [0m] Candidate invariants
[[34m  Info  [0m] takeLazy-steps-->1 * res$269._2 + -10 <= 0
[[34m  Info  [0m] checked VC inst... in 0.028s
[[34m  Info  [0m] Function: takeLazy-steps--Found candidate invariant is not a real invariant! 
[[34m  Info  [0m] # of atomic predicates: 13 + 10
[[34m  Info  [0m] Candidate invariants
[[34m  Info  [0m] takeLazy-steps-->1 * res$269._2 + -16 <= 0
[[34m  Info  [0m] checked VC inst... in 0.013s
[[34m  Info  [0m] Function: takeLazy-steps--Found candidate invariant is not a real invariant! 
[[34m  Info  [0m] # of atomic predicates: 13 + 23
[[34m  Info  [0m] Candidate invariants
[[34m  Info  [0m] takeLazy-steps-->1 * res$269._2 + -19 <= 0
[[34m  Info  [0m] checked VC inst... in 0.007s
[[34m  Info  [0m] minimizing...
[[34m  Info  [0m] Candidate invariants
[[34m  Info  [0m] takeLazy-steps-->1 * res$269._2 + -18 <= 0
[[34m  Info  [0m] checked VC inst... in 0.005s
[[34m  Info  [0m] - Found inductive invariant: takeLazy-steps --> steps + BigInt(-18) <= BigInt(0)
[[34m  Info  [0m] - Verifying Invariants... 
[[34m  Info  [0m] - Invariant verified
[[34m  Info  [0m] - considering function revAppend-steps...
[[34m  Info  [0m] Candidate invariants
[[34m  Info  [0m] revAppend-steps-->(0 * l1.size + 1 * res$276._2) + 0 <= 0
[[34m  Info  [0m] checked VC inst... in 0.02s
[[34m  Info  [0m] Function: revAppend-steps--Found candidate invariant is not a real invariant! 
[[34m  Info  [0m] # of atomic predicates: 8 + 1
[[34m  Info  [0m] Candidate invariants
[[34m  Info  [0m] revAppend-steps-->(-1 * l1.size + 1 * res$276._2) + -4 <= 0
[[34m  Info  [0m] checked VC inst... in 0.034s
[[34m  Info  [0m] Function: revAppend-steps--Found candidate invariant is not a real invariant! 
[[34m  Info  [0m] # of atomic predicates: 10 + 9
[[34m  Info  [0m] - More unrollings for invariant inference
[[34m  Info  [0m] Candidate invariants
[[34m  Info  [0m] revAppend-steps-->(0 * l1.size + 1 * res$276._2) + 0 <= 0
[[34m  Info  [0m] checked VC inst... in 0.165s
[[34m  Info  [0m] Function: revAppend-steps--Found candidate invariant is not a real invariant! 
[[34m  Info  [0m] # of atomic predicates: 8 + 1
[[34m  Info  [0m] Candidate invariants
[[34m  Info  [0m] revAppend-steps-->(0 * l1.size + 1 * res$276._2) + -4 <= 0
[[34m  Info  [0m] checked VC inst... in 0.311s
[[34m  Info  [0m] Function: revAppend-steps--Found candidate invariant is not a real invariant! 
[[34m  Info  [0m] # of atomic predicates: 13 + 9
[[34m  Info  [0m] Candidate invariants
[[34m  Info  [0m] revAppend-steps-->(-15 * l1.size + 1 * res$276._2) + -4 <= 0
[[34m  Info  [0m] checked VC inst... in 0.106s
[[34m  Info  [0m] Function: revAppend-steps--Found candidate invariant is not a real invariant! 
[[34m  Info  [0m] # of atomic predicates: 19 + 22
[[34m  Info  [0m] - More unrollings for invariant inference
[[34m  Info  [0m] Candidate invariants
[[34m  Info  [0m] revAppend-steps-->(0 * l1.size + 1 * res$276._2) + 0 <= 0
[[34m  Info  [0m] checked VC inst... in 0.476s
[[34m  Info  [0m] Function: revAppend-steps--Found candidate invariant is not a real invariant! 
[[34m  Info  [0m] # of atomic predicates: 8 + 1
[[34m  Info  [0m] Candidate invariants
[[34m  Info  [0m] revAppend-steps-->(0 * l1.size + 1 * res$276._2) + -4 <= 0
[[34m  Info  [0m] checked VC inst... in 0.317s
[[34m  Info  [0m] Function: revAppend-steps--Found candidate invariant is not a real invariant! 
[[34m  Info  [0m] # of atomic predicates: 14 + 9
[[34m  Info  [0m] Candidate invariants
[[34m  Info  [0m] revAppend-steps-->(-15 * l1.size + 1 * res$276._2) + -4 <= 0
[[34m  Info  [0m] checked VC inst... in 0.019s
[[34m  Info  [0m] minimizing...
[[34m  Info  [0m] Candidate invariants
[[34m  Info  [0m] revAppend-steps-->(-12 * l1.size + 1 * res$276._2) + -2 <= 0
[[34m  Info  [0m] checked VC inst... in 0.102s
[[34m  Info  [0m] Function: revAppend-steps--Found candidate invariant is not a real invariant! 
[[34m  Info  [0m] # of atomic predicates: 14 + 23
[[34m  Info  [0m] Candidate invariants
[[34m  Info  [0m] revAppend-steps-->(-17 * l1.size + 1 * res$276._2) + -4 <= 0
[[34m  Info  [0m] checked VC inst... in 0.026s
[[34m  Info  [0m] minimizing...
[[34m  Info  [0m] Candidate invariants
[[34m  Info  [0m] revAppend-steps-->(-15 * l1.size + 1 * res$276._2) + -2 <= 0
[[34m  Info  [0m] checked VC inst... in 0.017s
[[34m  Info  [0m] - Found inductive invariant: revAppend-steps --> (BigInt(-15) * l1.size + steps) + BigInt(-2) <= BigInt(0)
[[34m  Info  [0m] - Verifying Invariants... 
[[34m  Info  [0m] - Invariant verified
[[34m  Info  [0m] - considering function drop-steps...
[[34m  Info  [0m] Candidate invariants
[[34m  Info  [0m] drop-steps-->(0 * n + 1 * res$274._2) + 0 <= 0
[[34m  Info  [0m] checked VC inst... in 0.038s
[[34m  Info  [0m] Function: drop-steps--Found candidate invariant is not a real invariant! 
[[34m  Info  [0m] # of atomic predicates: 8 + 1
[[34m  Info  [0m] Candidate invariants
[[34m  Info  [0m] drop-steps-->(0 * n + 1 * res$274._2) + -4 <= 0
[[34m  Info  [0m] checked VC inst... in 0.04s
[[34m  Info  [0m] Function: drop-steps--Found candidate invariant is not a real invariant! 
[[34m  Info  [0m] # of atomic predicates: 11 + 9
[[34m  Info  [0m] - More unrollings for invariant inference
[[34m  Info  [0m] Candidate invariants
[[34m  Info  [0m] drop-steps-->(0 * n + 1 * res$274._2) + 0 <= 0
[[34m  Info  [0m] checked VC inst... in 0.11s
[[34m  Info  [0m] Function: drop-steps--Found candidate invariant is not a real invariant! 
[[34m  Info  [0m] # of atomic predicates: 9 + 1
[[34m  Info  [0m] Candidate invariants
[[34m  Info  [0m] drop-steps-->(0 * n + 1 * res$274._2) + -4 <= 0
[[34m  Info  [0m] checked VC inst... in 0.219s
[[34m  Info  [0m] Function: drop-steps--Found candidate invariant is not a real invariant! 
[[34m  Info  [0m] # of atomic predicates: 15 + 10
[[34m  Info  [0m] Candidate invariants
[[34m  Info  [0m] drop-steps-->(-16 * n + 1 * res$274._2) + -4 <= 0
[[34m  Info  [0m] checked VC inst... in 0.008s
[[34m  Info  [0m] minimizing...
[[34m  Info  [0m] Candidate invariants
[[34m  Info  [0m] drop-steps-->(-13 * n + 1 * res$274._2) + -2 <= 0
[[34m  Info  [0m] checked VC inst... in 0.034s
[[34m  Info  [0m] Function: drop-steps--Found candidate invariant is not a real invariant! 
[[34m  Info  [0m] # of atomic predicates: 15 + 25
[[34m  Info  [0m] Candidate invariants
[[34m  Info  [0m] drop-steps-->(-17 * n + 1 * res$274._2) + -4 <= 0
[[34m  Info  [0m] checked VC inst... in 0.007s
[[34m  Info  [0m] minimizing...
[[34m  Info  [0m] Candidate invariants
[[34m  Info  [0m] drop-steps-->(-16 * n + 1 * res$274._2) + -2 <= 0
[[34m  Info  [0m] checked VC inst... in 0.006s
[[34m  Info  [0m] - Found inductive invariant: drop-steps --> (BigInt(-16) * n + steps) + BigInt(-2) <= BigInt(0)
[[34m  Info  [0m] - Verifying Invariants... 
[[34m  Info  [0m] - Invariant verified
[[34m  Info  [0m] - considering function take-steps...
[[34m  Info  [0m] Candidate invariants
[[34m  Info  [0m] take-steps-->(0 * n + 1 * res$267._2) + 0 <= 0
[[34m  Info  [0m] checked VC inst... in 0.029s
[[34m  Info  [0m] Function: take-steps--Found candidate invariant is not a real invariant! 
[[34m  Info  [0m] # of atomic predicates: 8 + 1
[[34m  Info  [0m] Candidate invariants
[[34m  Info  [0m] take-steps-->(0 * n + 1 * res$267._2) + -5 <= 0
[[34m  Info  [0m] checked VC inst... in 0.025s
[[34m  Info  [0m] Function: take-steps--Found candidate invariant is not a real invariant! 
[[34m  Info  [0m] # of atomic predicates: 9 + 9
[[34m  Info  [0m] - More unrollings for invariant inference
[[34m  Info  [0m] Candidate invariants
[[34m  Info  [0m] take-steps-->(0 * n + 1 * res$267._2) + 0 <= 0
[[34m  Info  [0m] checked VC inst... in 0.094s
[[34m  Info  [0m] Function: take-steps--Found candidate invariant is not a real invariant! 
[[34m  Info  [0m] # of atomic predicates: 9 + 1
[[34m  Info  [0m] Candidate invariants
[[34m  Info  [0m] take-steps-->(0 * n + 1 * res$267._2) + -5 <= 0
[[34m  Info  [0m] checked VC inst... in 0.192s
[[34m  Info  [0m] Function: take-steps--Found candidate invariant is not a real invariant! 
[[34m  Info  [0m] # of atomic predicates: 15 + 10
[[34m  Info  [0m] Candidate invariants
[[34m  Info  [0m] take-steps-->(-18 * n + 1 * res$267._2) + -5 <= 0
[[34m  Info  [0m] checked VC inst... in 0.017s
[[34m  Info  [0m] minimizing...
[[34m  Info  [0m] Candidate invariants
[[34m  Info  [0m] take-steps-->(-15 * n + 1 * res$267._2) + -3 <= 0
[[34m  Info  [0m] checked VC inst... in 0.037s
[[34m  Info  [0m] Function: take-steps--Found candidate invariant is not a real invariant! 
[[34m  Info  [0m] # of atomic predicates: 15 + 25
[[34m  Info  [0m] Candidate invariants
[[34m  Info  [0m] take-steps-->(-19 * n + 1 * res$267._2) + -5 <= 0
[[34m  Info  [0m] checked VC inst... in 0.008s
[[34m  Info  [0m] minimizing...
[[34m  Info  [0m] Candidate invariants
[[34m  Info  [0m] take-steps-->(-18 * n + 1 * res$267._2) + -3 <= 0
[[34m  Info  [0m] checked VC inst... in 0.011s
[[34m  Info  [0m] - Found inductive invariant: take-steps --> (BigInt(-18) * n + steps) + BigInt(-3) <= BigInt(0)
[[34m  Info  [0m] - Verifying Invariants... 
[[34m  Info  [0m] - Invariant verified
[[34m  Info  [0m] - considering function rotateRev-steps...
[[34m  Info  [0m] Candidate invariants
[[34m  Info  [0m] rotateRev-steps-->1 * res$266._2 + 0 <= 0
[[34m  Info  [0m] checked VC inst... in 0.093s
[[34m  Info  [0m] Function: rotateRev-steps--Found candidate invariant is not a real invariant! 
[[34m  Info  [0m] # of atomic predicates: 14 + 1
[[34m  Info  [0m] - More unrollings for invariant inference
[[34m  Info  [0m] Candidate invariants
[[34m  Info  [0m] rotateRev-steps-->1 * res$266._2 + 0 <= 0
[[34m  Info  [0m] checked VC inst... in 3.052s
[[34m  Info  [0m] Function: rotateRev-steps--Found candidate invariant is not a real invariant! 
[[34m  Info  [0m] # of atomic predicates: 23 + 1
[[34m  Info  [0m] Candidate invariants
[[34m  Info  [0m] rotateRev-steps-->1 * res$266._2 + -125 <= 0
[[34m  Info  [0m] checked VC inst... in 0.057s
[[34m  Info  [0m] minimizing...
[[34m  Info  [0m] Candidate invariants
[[34m  Info  [0m] rotateRev-steps-->1 * res$266._2 + -121 <= 0
[[34m  Info  [0m] checked VC inst... in 0.557s
[[34m  Info  [0m] Function: rotateRev-steps--Found candidate invariant is not a real invariant! 
[[34m  Info  [0m] # of atomic predicates: 23 + 24
[[34m  Info  [0m] Candidate invariants
[[34m  Info  [0m] rotateRev-steps-->1 * res$266._2 + -125 <= 0
[[34m  Info  [0m] checked VC inst... in 0.02s
[[34m  Info  [0m] minimizing...
[[34m  Info  [0m] Candidate invariants
[[34m  Info  [0m] rotateRev-steps-->1 * res$266._2 + -124 <= 0
[[34m  Info  [0m] checked VC inst... in 0.026s
[[34m  Info  [0m] - Found inductive invariant: rotateRev-steps --> steps + BigInt(-124) <= BigInt(0)
[[34m  Info  [0m] - Verifying Invariants... 
[[34m  Info  [0m] - Invariant verified
[[34m  Info  [0m] - considering function rotateDrop-steps...
[[34m  Info  [0m] Candidate invariants
[[34m  Info  [0m] rotateDrop-steps-->1 * res$261._2 + 0 <= 0
[[34m  Info  [0m] checked VC inst... in 0.067s
[[34m  Info  [0m] Function: rotateDrop-steps--Found candidate invariant is not a real invariant! 
[[34m  Info  [0m] # of atomic predicates: 18 + 1
[[34m  Info  [0m] Candidate invariants
[[34m  Info  [0m] rotateDrop-steps-->1 * res$261._2 + -56 <= 0
[[34m  Info  [0m] checked VC inst... in 0.105s
[[34m  Info  [0m] Function: rotateDrop-steps--Found candidate invariant is not a real invariant! 
[[34m  Info  [0m] # of atomic predicates: 22 + 19
[[34m  Info  [0m] Candidate invariants
[[34m  Info  [0m] rotateDrop-steps-->1 * res$261._2 + -151 <= 0
[[34m  Info  [0m] checked VC inst... in 0.102s
[[34m  Info  [0m] Function: rotateDrop-steps--Found candidate invariant is not a real invariant! 
[[34m  Info  [0m] # of atomic predicates: 22 + 41
[[34m  Info  [0m] Candidate invariants
[[34m  Info  [0m] rotateDrop-steps-->1 * res$261._2 + -167 <= 0
[[34m  Info  [0m] checked VC inst... in 0.048s
[[34m  Info  [0m] Function: rotateDrop-steps--Found candidate invariant is not a real invariant! 
[[34m  Info  [0m] # of atomic predicates: 19 + 63
[[34m  Info  [0m] - More unrollings for invariant inference
[[34m  Info  [0m] Candidate invariants
[[34m  Info  [0m] rotateDrop-steps-->1 * res$261._2 + 0 <= 0
[[34m  Info  [0m] checked VC inst... in 6.923s
[[34m  Info  [0m] Function: rotateDrop-steps--Found candidate invariant is not a real invariant! 
[[34m  Info  [0m] # of atomic predicates: 14 + 1
[[34m  Info  [0m] Candidate invariants
[[34m  Info  [0m] rotateDrop-steps-->1 * res$261._2 + -105 <= 0
[[34m  Info  [0m] checked VC inst... in 8.327s
[[34m  Info  [0m] Function: rotateDrop-steps--Found candidate invariant is not a real invariant! 
[[34m  Info  [0m] # of atomic predicates: 25 + 15
[[34m  Info  [0m] Candidate invariants
[[34m  Info  [0m] rotateDrop-steps-->1 * res$261._2 + -132 <= 0
[[34m  Info  [0m] checked VC inst... in 15.036s
[[34m  Info  [0m] VC solving failed!...retrying with a bigger model...
[[34m  Info  [0m] # of atomic predicates: 2 + 40
[[34m  Info  [0m] Candidate invariants
[[34m  Info  [0m] rotateDrop-steps-->1 * res$261._2 + -265 <= 0
[[34m  Info  [0m] checked VC inst... in 0.052s
[[34m  Info  [0m] minimizing...
[[34m  Info  [0m] Candidate invariants
[[34m  Info  [0m] rotateDrop-steps-->1 * res$261._2 + -133 <= 0
[[34m  Info  [0m] checked VC inst... in 15.018s
[[34m  Info  [0m] VC solving failed during minimization!...continuing search with bigger model...
[[34m  Info  [0m] # of atomic predicates: 2 + 41
[[34m  Info  [0m] Candidate invariants
[[34m  Info  [0m] rotateDrop-steps-->1 * res$261._2 + -200 <= 0
[[34m  Info  [0m] checked VC inst... in 0.06s
[[34m  Info  [0m] minimizing...
[[34m  Info  [0m] Candidate invariants
[[34m  Info  [0m] rotateDrop-steps-->1 * res$261._2 + -134 <= 0
[[34m  Info  [0m] checked VC inst... in 15.02s
[[34m  Info  [0m] VC solving failed during minimization!...continuing search with bigger model...
[[34m  Info  [0m] # of atomic predicates: 2 + 42
[[34m  Info  [0m] Candidate invariants
[[34m  Info  [0m] rotateDrop-steps-->1 * res$261._2 + -168 <= 0
[[34m  Info  [0m] checked VC inst... in 0.055s
[[34m  Info  [0m] minimizing...
[[34m  Info  [0m] Candidate invariants
[[34m  Info  [0m] rotateDrop-steps-->1 * res$261._2 + -135 <= 0
[[34m  Info  [0m] checked VC inst... in 15.023s
[[34m  Info  [0m] VC solving failed during minimization!...continuing search with bigger model...
[[34m  Info  [0m] # of atomic predicates: 2 + 43
[[34m  Info  [0m] Candidate invariants
[[34m  Info  [0m] rotateDrop-steps-->1 * res$261._2 + -152 <= 0
[[34m  Info  [0m] checked VC inst... in 0.102s
[[34m  Info  [0m] minimizing...
[[34m  Info  [0m] Candidate invariants
[[34m  Info  [0m] rotateDrop-steps-->1 * res$261._2 + -136 <= 0
[[34m  Info  [0m] checked VC inst... in 15.021s
[[34m  Info  [0m] VC solving failed during minimization!...continuing search with bigger model...
[[34m  Info  [0m] # of atomic predicates: 2 + 44
[[34m  Info  [0m] Candidate invariants
[[34m  Info  [0m] rotateDrop-steps-->1 * res$261._2 + -145 <= 0
[[34m  Info  [0m] checked VC inst... in 4.344s
[[34m  Info  [0m] Function: rotateDrop-steps--Found candidate invariant is not a real invariant! 
[[34m  Info  [0m] # of atomic predicates: 34 + 45
[[34m  Info  [0m] Candidate invariants
[[34m  Info  [0m] rotateDrop-steps-->1 * res$261._2 + -148 <= 0
[[34m  Info  [0m] checked VC inst... in 15.031s
[[34m  Info  [0m] VC solving failed during minimization!...continuing search with bigger model...
[[34m  Info  [0m] # of atomic predicates: 2 + 79
[[34m  Info  [0m] Candidate invariants
[[34m  Info  [0m] rotateDrop-steps-->1 * res$261._2 + -151 <= 0
[[34m  Info  [0m] checked VC inst... in 0.099s
[[34m  Info  [0m] minimizing...
[[34m  Info  [0m] Candidate invariants
[[34m  Info  [0m] rotateDrop-steps-->2 * res$261._2 + -297 <= 0
[[34m  Info  [0m] checked VC inst... in 2.546s
[[34m  Info  [0m] Function: rotateDrop-steps--Found candidate invariant is not a real invariant! 
[[34m  Info  [0m] # of atomic predicates: 34 + 80
[[34m  Info  [0m] Candidate invariants
[[34m  Info  [0m] rotateDrop-steps-->1 * res$261._2 + -151 <= 0
[[34m  Info  [0m] checked VC inst... in 0.089s
[[34m  Info  [0m] minimizing...
[[34m  Info  [0m] Candidate invariants
[[34m  Info  [0m] rotateDrop-steps-->1 * res$261._2 + -150 <= 0
[[34m  Info  [0m] checked VC inst... in 0.048s
[[34m  Info  [0m] - Found inductive invariant: rotateDrop-steps --> steps + BigInt(-150) <= BigInt(0)
[[34m  Info  [0m] - Verifying Invariants... 
[[34m  Info  [0m] - Invariant verified
[[34m  Info  [0m] - considering function get-mem-steps...
[[34m  Info  [0m] - considering function head-steps...
[[34m  Info  [0m] Candidate invariants
[[34m  Info  [0m] head-steps-->1 * x$3$10._2 + 0 <= 0
[[34m  Info  [0m] checked VC inst... in 0.004s
[[34m  Info  [0m] Function: head-steps--Found candidate invariant is not a real invariant! 
[[34m  Info  [0m] # of atomic predicates: 6 + 1
[[34m  Info  [0m] Candidate invariants
[[34m  Info  [0m] head-steps-->1 * x$3$10._2 + -10 <= 0
[[34m  Info  [0m] checked VC inst... in 0.003s
[[34m  Info  [0m] Function: head-steps--Found candidate invariant is not a real invariant! 
[[34m  Info  [0m] # of atomic predicates: 6 + 7
[[34m  Info  [0m] Candidate invariants
[[34m  Info  [0m] head-steps-->1 * x$3$10._2 + -12 <= 0
[[34m  Info  [0m] checked VC inst... in 0.003s
[[34m  Info  [0m] Function: head-steps--Found candidate invariant is not a real invariant! 
[[34m  Info  [0m] # of atomic predicates: 6 + 13
[[34m  Info  [0m] - More unrollings for invariant inference
[[34m  Info  [0m] Candidate invariants
[[34m  Info  [0m] head-steps-->1 * x$3$10._2 + 0 <= 0
[[34m  Info  [0m] checked VC inst... in 0.03s
[[34m  Info  [0m] Function: head-steps--Found candidate invariant is not a real invariant! 
[[34m  Info  [0m] # of atomic predicates: 17 + 1
[[34m  Info  [0m] Candidate invariants
[[34m  Info  [0m] head-steps-->1 * x$3$10._2 + -10 <= 0
[[34m  Info  [0m] checked VC inst... in 0.021s
[[34m  Info  [0m] Function: head-steps--Found candidate invariant is not a real invariant! 
[[34m  Info  [0m] # of atomic predicates: 17 + 18
[[34m  Info  [0m] Candidate invariants
[[34m  Info  [0m] head-steps-->1 * x$3$10._2 + -12 <= 0
[[34m  Info  [0m] checked VC inst... in 0.022s
[[34m  Info  [0m] Function: head-steps--Found candidate invariant is not a real invariant! 
[[34m  Info  [0m] # of atomic predicates: 15 + 35
[[34m  Info  [0m] - More unrollings for invariant inference
[[34m  Info  [0m] Candidate invariants
[[34m  Info  [0m] head-steps-->1 * x$3$10._2 + 0 <= 0
[[34m  Info  [0m] checked VC inst... in 15.056s
[[34m  Info  [0m] VC solving failed!...retrying with a bigger model...
[[34m  Info  [0m] # of atomic predicates: 2 + 1
[[34m  Info  [0m] Candidate invariants
[[34m  Info  [0m] head-steps-->1 * x$3$10._2 + -1 <= 0
[[34m  Info  [0m] checked VC inst... in 15.057s
[[34m  Info  [0m] VC solving failed!...retrying with a bigger model...
[[34m  Info  [0m] # of atomic predicates: 2 + 2
[[34m  Info  [0m] Candidate invariants
[[34m  Info  [0m] head-steps-->1 * x$3$10._2 + -2 <= 0
[[34m  Info  [0m] checked VC inst... in 15.044s
[[34m  Info  [0m] VC solving failed!...retrying with a bigger model...
[[34m  Info  [0m] # of atomic predicates: 2 + 3
[[34m  Info  [0m] Candidate invariants
[[34m  Info  [0m] head-steps-->1 * x$3$10._2 + -4 <= 0
[[34m  Info  [0m] checked VC inst... in 15.052s
[[34m  Info  [0m] VC solving failed!...retrying with a bigger model...
[[34m  Info  [0m] # of atomic predicates: 2 + 4
[[34m  Info  [0m] Candidate invariants
[[34m  Info  [0m] head-steps-->1 * x$3$10._2 + -8 <= 0
[[34m  Info  [0m] checked VC inst... in 15.043s
[[34m  Info  [0m] VC solving failed!...retrying with a bigger model...
[[34m  Info  [0m] # of atomic predicates: 2 + 5
[[34m  Info  [0m] Candidate invariants
[[34m  Info  [0m] head-steps-->1 * x$3$10._2 + -16 <= 0
[[34m  Info  [0m] checked VC inst... in 0.046s
[[34m  Info  [0m] minimizing...
[[34m  Info  [0m] Candidate invariants
[[34m  Info  [0m] head-steps-->1 * x$3$10._2 + -9 <= 0
[[34m  Info  [0m] checked VC inst... in 0.519s
[[34m  Info  [0m] Function: head-steps--Found candidate invariant is not a real invariant! 
[[34m  Info  [0m] # of atomic predicates: 17 + 6
[[34m  Info  [0m] Candidate invariants
[[34m  Info  [0m] head-steps-->1 * x$3$10._2 + -12 <= 0
[[34m  Info  [0m] checked VC inst... in 0.068s
[[34m  Info  [0m] minimizing...
[[34m  Info  [0m] Candidate invariants
[[34m  Info  [0m] head-steps-->1 * x$3$10._2 + -11 <= 0
[[34m  Info  [0m] checked VC inst... in 0.025s
[[34m  Info  [0m] - Found inductive invariant: head-steps --> steps + BigInt(-11) <= BigInt(0)
[[34m  Info  [0m] - Verifying Invariants... 
[[34m  Info  [0m] - Invariant verified
[[34m  Info  [0m] - considering function reverse-steps...
[[34m  Info  [0m] Candidate invariants
[[34m  Info  [0m] reverse-steps-->1 * x$5$7._2 + 0 <= 0
[[34m  Info  [0m] checked VC inst... in 0.004s
[[34m  Info  [0m] Function: reverse-steps--Found candidate invariant is not a real invariant! 
[[34m  Info  [0m] # of atomic predicates: 6 + 1
[[34m  Info  [0m] Candidate invariants
[[34m  Info  [0m] reverse-steps-->1 * x$5$7._2 + -9 <= 0
[[34m  Info  [0m] checked VC inst... in 0.0s
[[34m  Info  [0m] minimizing...
[[34m  Info  [0m] Candidate invariants
[[34m  Info  [0m] reverse-steps-->1 * x$5$7._2 + -7 <= 0
[[34m  Info  [0m] checked VC inst... in 0.001s
[[34m  Info  [0m] - Found inductive invariant: reverse-steps --> steps + BigInt(-7) <= BigInt(0)
[[34m  Info  [0m] - Verifying Invariants... 
[[34m  Info  [0m] - Invariant verified
[[34m  Info  [0m] - considering function force-steps...
[[34m  Info  [0m] Candidate invariants
[[34m  Info  [0m] force-steps-->1 * res$263._2 + 0 <= 0
[[34m  Info  [0m] checked VC inst... in 0.01s
[[34m  Info  [0m] Function: force-steps--Found candidate invariant is not a real invariant! 
[[34m  Info  [0m] # of atomic predicates: 6 + 1
[[34m  Info  [0m] Candidate invariants
[[34m  Info  [0m] force-steps-->1 * res$263._2 + -9 <= 0
[[34m  Info  [0m] checked VC inst... in 0.008s
[[34m  Info  [0m] Function: force-steps--Found candidate invariant is not a real invariant! 
[[34m  Info  [0m] # of atomic predicates: 6 + 7
[[34m  Info  [0m] Candidate invariants
[[34m  Info  [0m] force-steps-->1 * res$263._2 + -11 <= 0
[[34m  Info  [0m] checked VC inst... in 0.007s
[[34m  Info  [0m] Function: force-steps--Found candidate invariant is not a real invariant! 
[[34m  Info  [0m] # of atomic predicates: 6 + 13
[[34m  Info  [0m] - More unrollings for invariant inference
[[34m  Info  [0m] Candidate invariants
[[34m  Info  [0m] force-steps-->1 * res$263._2 + 0 <= 0
[[34m  Info  [0m] checked VC inst... in 0.022s
[[34m  Info  [0m] Function: force-steps--Found candidate invariant is not a real invariant! 
[[34m  Info  [0m] # of atomic predicates: 6 + 1
[[34m  Info  [0m] Candidate invariants
[[34m  Info  [0m] force-steps-->1 * res$263._2 + -9 <= 0
[[34m  Info  [0m] checked VC inst... in 0.009s
[[34m  Info  [0m] Function: force-steps--Found candidate invariant is not a real invariant! 
[[34m  Info  [0m] # of atomic predicates: 8 + 7
[[34m  Info  [0m] Candidate invariants
[[34m  Info  [0m] force-steps-->1 * res$263._2 + -11 <= 0
[[34m  Info  [0m] checked VC inst... in 0.011s
[[34m  Info  [0m] Function: force-steps--Found candidate invariant is not a real invariant! 
[[34m  Info  [0m] # of atomic predicates: 7 + 15
[[34m  Info  [0m] - More unrollings for invariant inference
[[34m  Info  [0m] Candidate invariants
[[34m  Info  [0m] force-steps-->1 * res$263._2 + 0 <= 0
[[34m  Info  [0m] checked VC inst... in 0.067s
[[34m  Info  [0m] Function: force-steps--Found candidate invariant is not a real invariant! 
[[34m  Info  [0m] # of atomic predicates: 6 + 1
[[34m  Info  [0m] Candidate invariants
[[34m  Info  [0m] force-steps-->1 * res$263._2 + -9 <= 0
[[34m  Info  [0m] checked VC inst... in 0.034s
[[34m  Info  [0m] Function: force-steps--Found candidate invariant is not a real invariant! 
[[34m  Info  [0m] # of atomic predicates: 14 + 7
[[34m  Info  [0m] Candidate invariants
[[34m  Info  [0m] force-steps-->1 * res$263._2 + -11 <= 0
[[34m  Info  [0m] checked VC inst... in 0.027s
[[34m  Info  [0m] Function: force-steps--Found candidate invariant is not a real invariant! 
[[34m  Info  [0m] # of atomic predicates: 13 + 21
[[34m  Info  [0m] Candidate invariants
[[34m  Info  [0m] force-steps-->1 * res$263._2 + -141 <= 0
[[34m  Info  [0m] checked VC inst... in 0.033s
[[34m  Info  [0m] Function: force-steps--Found candidate invariant is not a real invariant! 
[[34m  Info  [0m] # of atomic predicates: 15 + 34
[[34m  Info  [0m] Candidate invariants
[[34m  Info  [0m] force-steps-->1 * res$263._2 + -167 <= 0
[[34m  Info  [0m] checked VC inst... in 0.012s
[[34m  Info  [0m] minimizing...
[[34m  Info  [0m] Candidate invariants
[[34m  Info  [0m] force-steps-->1 * res$263._2 + -166 <= 0
[[34m  Info  [0m] checked VC inst... in 0.013s
[[34m  Info  [0m] - Found inductive invariant: force-steps --> steps + BigInt(-166) <= BigInt(0)
[[34m  Info  [0m] - Verifying Invariants... 
[[34m  Info  [0m] - Invariant verified
[[34m  Info  [0m] - considering function createQueue-steps...
[[34m  Info  [0m] Candidate invariants
[[34m  Info  [0m] createQueue-steps-->1 * res$273._2 + 0 <= 0
[[34m  Info  [0m] checked VC inst... in 0.06s
[[34m  Info  [0m] Function: createQueue-steps--Found candidate invariant is not a real invariant! 
[[34m  Info  [0m] # of atomic predicates: 20 + 1
[[34m  Info  [0m] Candidate invariants
[[34m  Info  [0m] createQueue-steps-->1 * res$273._2 + -11 <= 0
[[34m  Info  [0m] checked VC inst... in 0.05s
[[34m  Info  [0m] Function: createQueue-steps--Found candidate invariant is not a real invariant! 
[[34m  Info  [0m] # of atomic predicates: 28 + 21
[[34m  Info  [0m] Candidate invariants
[[34m  Info  [0m] createQueue-steps-->1 * res$273._2 + -183 <= 0
[[34m  Info  [0m] checked VC inst... in 0.042s
[[34m  Info  [0m] Function: createQueue-steps--Found candidate invariant is not a real invariant! 
[[34m  Info  [0m] # of atomic predicates: 30 + 49
[[34m  Info  [0m] Candidate invariants
[[34m  Info  [0m] createQueue-steps-->1 * res$273._2 + -187 <= 0
[[34m  Info  [0m] checked VC inst... in 0.007s
[[34m  Info  [0m] minimizing...
[[34m  Info  [0m] Candidate invariants
[[34m  Info  [0m] createQueue-steps-->1 * res$273._2 + -186 <= 0
[[34m  Info  [0m] checked VC inst... in 0.007s
[[34m  Info  [0m] - Found inductive invariant: createQueue-steps --> steps + BigInt(-186) <= BigInt(0)
[[34m  Info  [0m] - Verifying Invariants... 
[[34m  Info  [0m] - Invariant verified
[[34m  Info  [0m] - considering function cons-steps...
[[34m  Info  [0m] Candidate invariants
[[34m  Info  [0m] cons-steps-->1 * res$270._2 + 0 <= 0
[[34m  Info  [0m] checked VC inst... in 0.018s
[[34m  Info  [0m] Function: cons-steps--Found candidate invariant is not a real invariant! 
[[34m  Info  [0m] # of atomic predicates: 17 + 1
[[34m  Info  [0m] Candidate invariants
[[34m  Info  [0m] cons-steps-->1 * res$270._2 + -537 <= 0
[[34m  Info  [0m] checked VC inst... in 0.001s
[[34m  Info  [0m] minimizing...
[[34m  Info  [0m] Candidate invariants
[[34m  Info  [0m] cons-steps-->1 * res$270._2 + -535 <= 0
[[34m  Info  [0m] checked VC inst... in 0.002s
[[34m  Info  [0m] - Found inductive invariant: cons-steps --> steps + BigInt(-535) <= BigInt(0)
[[34m  Info  [0m] - Verifying Invariants... 
[[34m  Info  [0m] - Invariant verified
[[34m  Info  [0m] - considering function snoc-steps...
[[34m  Info  [0m] Candidate invariants
[[34m  Info  [0m] snoc-steps-->1 * res$271._2 + 0 <= 0
[[34m  Info  [0m] checked VC inst... in 0.005s
[[34m  Info  [0m] Function: snoc-steps--Found candidate invariant is not a real invariant! 
[[34m  Info  [0m] # of atomic predicates: 11 + 1
[[34m  Info  [0m] Candidate invariants
[[34m  Info  [0m] snoc-steps-->1 * res$271._2 + -554 <= 0
[[34m  Info  [0m] checked VC inst... in 0.001s
[[34m  Info  [0m] minimizing...
[[34m  Info  [0m] Candidate invariants
[[34m  Info  [0m] snoc-steps-->1 * res$271._2 + -552 <= 0
[[34m  Info  [0m] checked VC inst... in 0.001s
[[34m  Info  [0m] - Found inductive invariant: snoc-steps --> steps + BigInt(-552) <= BigInt(0)
[[34m  Info  [0m] - Verifying Invariants... 
[[34m  Info  [0m] - Invariant verified
[[34m  Info  [0m] - considering function forceTwice-steps...
[[34m  Info  [0m] Candidate invariants
[[34m  Info  [0m] forceTwice-steps-->1 * x$2$21._2 + 0 <= 0
[[34m  Info  [0m] checked VC inst... in 0.021s
[[34m  Info  [0m] Function: forceTwice-steps--Found candidate invariant is not a real invariant! 
[[34m  Info  [0m] # of atomic predicates: 13 + 1
[[34m  Info  [0m] Candidate invariants
[[34m  Info  [0m] forceTwice-steps-->1 * x$2$21._2 + -683 <= 0
[[34m  Info  [0m] checked VC inst... in 0.001s
[[34m  Info  [0m] minimizing...
[[34m  Info  [0m] Candidate invariants
[[34m  Info  [0m] forceTwice-steps-->1 * x$2$21._2 + -681 <= 0
[[34m  Info  [0m] checked VC inst... in 0.002s
[[34m  Info  [0m] - Found inductive invariant: forceTwice-steps --> steps + BigInt(-681) <= BigInt(0)
[[34m  Info  [0m] - Verifying Invariants... 
[[34m  Info  [0m] - Invariant verified
[[34m  Info  [0m] - considering function empty-steps...
[[34m  Info  [0m] Candidate invariants
[[34m  Info  [0m] empty-steps-->1 * res$268._2 + 0 <= 0
[[34m  Info  [0m] checked VC inst... in 0.001s
[[34m  Info  [0m] Function: empty-steps--Found candidate invariant is not a real invariant! 
[[34m  Info  [0m] # of atomic predicates: 6 + 1
[[34m  Info  [0m] Candidate invariants
[[34m  Info  [0m] empty-steps-->1 * res$268._2 + -4 <= 0
[[34m  Info  [0m] checked VC inst... in 0.0s
[[34m  Info  [0m] minimizing...
[[34m  Info  [0m] Candidate invariants
[[34m  Info  [0m] empty-steps-->1 * res$268._2 + -2 <= 0
[[34m  Info  [0m] checked VC inst... in 0.001s
[[34m  Info  [0m] - Found inductive invariant: empty-steps --> steps + BigInt(-2) <= BigInt(0)
[[34m  Info  [0m] - Verifying Invariants... 
[[34m  Info  [0m] - Invariant verified
[[34m  Info  [0m] - considering function tailSub-steps...
[[34m  Info  [0m] Candidate invariants
[[34m  Info  [0m] tailSub-steps-->1 * res$264._2 + 0 <= 0
[[34m  Info  [0m] checked VC inst... in 0.032s
[[34m  Info  [0m] Function: tailSub-steps--Found candidate invariant is not a real invariant! 
[[34m  Info  [0m] # of atomic predicates: 7 + 1
[[34m  Info  [0m] Candidate invariants
[[34m  Info  [0m] tailSub-steps-->1 * res$264._2 + -9 <= 0
[[34m  Info  [0m] checked VC inst... in 0.026s
[[34m  Info  [0m] Function: tailSub-steps--Found candidate invariant is not a real invariant! 
[[34m  Info  [0m] # of atomic predicates: 13 + 8
[[34m  Info  [0m] Candidate invariants
[[34m  Info  [0m] tailSub-steps-->1 * res$264._2 + -890 <= 0
[[34m  Info  [0m] checked VC inst... in 0.017s
[[34m  Info  [0m] Function: tailSub-steps--Found candidate invariant is not a real invariant! 
[[34m  Info  [0m] # of atomic predicates: 13 + 21
[[34m  Info  [0m] Candidate invariants
[[34m  Info  [0m] tailSub-steps-->1 * res$264._2 + -893 <= 0
[[34m  Info  [0m] checked VC inst... in 0.004s
[[34m  Info  [0m] minimizing...
[[34m  Info  [0m] Candidate invariants
[[34m  Info  [0m] tailSub-steps-->1 * res$264._2 + -892 <= 0
[[34m  Info  [0m] checked VC inst... in 0.005s
[[34m  Info  [0m] - Found inductive invariant: tailSub-steps --> steps + BigInt(-892) <= BigInt(0)
[[34m  Info  [0m] - Verifying Invariants... 
[[34m  Info  [0m] - Invariant verified
[[34m  Info  [0m] - considering function tail-steps...
[[34m  Info  [0m] Candidate invariants
[[34m  Info  [0m] tail-steps-->1 * res$265._2 + 0 <= 0
[[34m  Info  [0m] checked VC inst... in 0.003s
[[34m  Info  [0m] Function: tail-steps--Found candidate invariant is not a real invariant! 
[[34m  Info  [0m] # of atomic predicates: 7 + 1
[[34m  Info  [0m] Candidate invariants
[[34m  Info  [0m] tail-steps-->1 * res$265._2 + -895 <= 0
[[34m  Info  [0m] checked VC inst... in 0.001s
[[34m  Info  [0m] minimizing...
[[34m  Info  [0m] Candidate invariants
[[34m  Info  [0m] tail-steps-->1 * res$265._2 + -893 <= 0
[[34m  Info  [0m] checked VC inst... in 0.001s
[[34m  Info  [0m] - Found inductive invariant: tail-steps --> steps + BigInt(-893) <= BigInt(0)
[[34m  Info  [0m] - Verifying Invariants... 
[[34m  Info  [0m] - Invariant verified
Resource Verification Results: 
. ┌─────────━
╔═╡ Summary ════════════════════════════════════════════════╗
║ └─────────┘                                               ║
║ cons            steps <= 535                 2.852        ║
║ createQueue     steps <= 186                 2.998        ║
║ drop            steps <= 16 * n + 2          1.739        ║
║ empty           steps <= 2                   0.299        ║
║ force           steps <= 166                 1.639        ║
║ forceTwice      steps <= 681                 3.174        ║
║ head            steps <= 11                  78.011       ║
║ revAppend       steps <= 15 * l1.size + 2    3.352        ║
║ reverse         steps <= 7                   0.485        ║
║ rotateDrop      steps <= 150                 117.311      ║
║ rotateRev       steps <= 124                 6.041        ║
║ snoc            steps <= 552                 1.942        ║
║ tail            steps <= 893                 1.652        ║
║ tailSub         steps <= 892                 3.013        ║
║ take            steps <= 18 * n + 3          1.740        ║
║ takeLazy        steps <= 18                  2.156        ║
╟┄┄┄┄┄┄┄┄┄┄┄┄┄┄┄┄┄┄┄┄┄┄┄┄┄┄┄┄┄┄┄┄┄┄┄┄┄┄┄┄┄┄┄┄┄┄┄┄┄┄┄┄┄┄┄┄┄┄┄╢
║ total: 16    inferred: 16    unknown: 0     time: 228.404 ║
╚════════════════════════════════════════════════════════════
[[34m  Info  [0m] Stats dumped to file: Deque-stats.txt
