[[33mWarning [0m] warning: there were two feature warnings; re-run with -feature for details
[[34m  Info  [0m]  - Now considering 'postcondition' VC for deps$5 @?:?...
[[34m  Info  [0m]  => VALID
[[34m  Info  [0m]  - Now considering 'precond. (call deps$5(i, j - BigInt(1), st@))' VC for deps$5 @?:?...
[[34m  Info  [0m]  => VALID
[[34m  Info  [0m]  - Now considering 'precond. (call deps$5(i - BigInt(1), j, st@))' VC for deps$5 @?:?...
[[34m  Info  [0m]  => VALID
[[34m  Info  [0m]  - Now considering 'precond. (call deps$5(i - BigInt(1), j, st@))' VC for deps$5 @?:?...
[[34m  Info  [0m]  => VALID
[[34m  Info  [0m]  - Now considering 'precond. (call deps$5(i, j - BigInt(1), st@))' VC for deps$5 @?:?...
[[34m  Info  [0m]  => VALID
[[34m  Info  [0m]  - Now considering 'tact (postcondition)' VC for depsMono$5 @?:?...
[[34m  Info  [0m]  => VALID
[[34m  Info  [0m]  - Now considering 'tact (precond. (call depsMono-VCTact(i, j - BigInt(1), st1, s ...))' VC for depsMono$5 @?:?...
[[34m  Info  [0m]  => VALID
[[34m  Info  [0m]  - Now considering 'tact (precond. (call depsMono-VCTact(i - BigInt(1), j, st1, s ...))' VC for depsMono$5 @?:?...
[[34m  Info  [0m]  => VALID
[[34m  Info  [0m]  - Now considering 'tact (precond. (call depsMono-VCTact(i - BigInt(1), j, st1, s ...))' VC for depsMono$5 @?:?...
[[34m  Info  [0m]  => VALID
[[34m  Info  [0m]  - Now considering 'tact (precond. (call depsMono-VCTact(i, j - BigInt(1), st1, s ...))' VC for depsMono$5 @?:?...
[[34m  Info  [0m]  => VALID
[[34m  Info  [0m]  - Now considering 'tact (precond. (call deps$5(i, j, st1)))' VC for depsMono$5 @?:?...
[[34m  Info  [0m]  => VALID
[[34m  Info  [0m]  - Now considering 'tact (precond. (call deps$5(i, j, st2)))' VC for depsMono$5 @?:?...
[[34m  Info  [0m]  => VALID
[[34m  Info  [0m]  - Now considering 'precond. (call deps$5(i, j, st1))' VC for depsMono$5 @?:?...
[[34m  Info  [0m]  => VALID
[[34m  Info  [0m]  - Now considering 'precond. (call deps$5(i, j, st2))' VC for depsMono$5 @?:?...
[[34m  Info  [0m]  => VALID
[[34m  Info  [0m]  - Now considering 'tact (postcondition)' VC for depsLem$5 @?:?...
[[34m  Info  [0m]  => VALID
[[34m  Info  [0m]  - Now considering 'tact (precond. (call depsLem-VCTact(i, j, m, n - BigInt(1), s ...))' VC for depsLem$5 @?:?...
[[34m  Info  [0m]  => VALID
[[34m  Info  [0m]  - Now considering 'tact (precond. (call depsLem-VCTact(i, j, m - BigInt(1), n, s ...))' VC for depsLem$5 @?:?...
[[34m  Info  [0m]  => VALID
[[34m  Info  [0m]  - Now considering 'tact (precond. (call depsLem-VCTact(i, j, m - BigInt(1), n, s ...))' VC for depsLem$5 @?:?...
[[34m  Info  [0m]  => VALID
[[34m  Info  [0m]  - Now considering 'tact (precond. (call depsLem-VCTact(i, j, m, n - BigInt(1), s ...))' VC for depsLem$5 @?:?...
[[34m  Info  [0m]  => VALID
[[34m  Info  [0m]  - Now considering 'tact (precond. (call deps$5(m, n, st@)))' VC for depsLem$5 @?:?...
[[34m  Info  [0m]  => VALID
[[34m  Info  [0m]  - Now considering 'tact (precond. (call deps$5(i, j, st@)))' VC for depsLem$5 @?:?...
[[34m  Info  [0m]  => VALID
[[34m  Info  [0m]  - Now considering 'precond. (call deps$5(m, n, st@))' VC for depsLem$5 @?:?...
[[34m  Info  [0m]  => VALID
[[34m  Info  [0m]  - Now considering 'precond. (call deps$5(i, j, st@))' VC for depsLem$5 @?:?...
[[34m  Info  [0m]  => VALID
[[34m  Info  [0m]  - Now considering 'postcondition' VC for levDist-mem$3 @?:?...
[[34m  Info  [0m]  => VALID
[[34m  Info  [0m]  - Now considering 'precond. (call deps$5(i - BigInt(1), j, st@))' VC for levDist-mem$3 @?:?...
[[34m  Info  [0m]  => VALID
[[34m  Info  [0m]  - Now considering 'precond. (call deps$5(i, j - BigInt(1), st@))' VC for levDist-mem$3 @?:?...
[[34m  Info  [0m]  => VALID
[[34m  Info  [0m]  - Now considering 'precond. (call levDist-mem$3(a$180, a$179, st@))' VC for levDist-mem$3 @?:?...
[[34m  Info  [0m]  => VALID
[[34m  Info  [0m]  - Now considering 'precond. (call levDist-mem$3(a$182, j, dres$1._2 ++ Set ...)' VC for levDist-mem$3 @?:?...
[[34m  Info  [0m]  => VALID
[[34m  Info  [0m]  - Now considering 'precond. (call levDist-mem$3(i, a$183, dres$2._2 ++ Set ...)' VC for levDist-mem$3 @?:?...
[[34m  Info  [0m]  => VALID
[[34m  Info  [0m]  - Now considering 'match exhaustiveness' VC for levDist-mem$3 @?:?...
[[34m  Info  [0m]  => VALID
[[34m  Info  [0m]  - Now considering 'postcondition' VC for invoke$5 @?:?...
[[34m  Info  [0m]  => VALID
[[34m  Info  [0m]  - Now considering 'precond. (call deps$5(i - BigInt(1), j, st@))' VC for invoke$5 @?:?...
[[34m  Info  [0m]  => VALID
[[34m  Info  [0m]  - Now considering 'precond. (call deps$5(i, j - BigInt(1), st@))' VC for invoke$5 @?:?...
[[34m  Info  [0m]  => VALID
[[34m  Info  [0m]  - Now considering 'precond. (call levDist-mem$3(i, j, st@))' VC for invoke$5 @?:?...
[[34m  Info  [0m]  => VALID
[[34m  Info  [0m]  - Now considering 'precond. (call depsMono$5(i - BigInt(1), j, st@, out$1))' VC for invoke$5 @?:?...
[[34m  Info  [0m]  => VALID
[[34m  Info  [0m]  - Now considering 'precond. (call depsMono$5(i - BigInt(1), n, st@, out$1))' VC for invoke$5 @?:?...
[[34m  Info  [0m]  => VALID
[[34m  Info  [0m]  - Now considering 'precond. (call depsMono$5(i, j - BigInt(1), st@, out$1))' VC for invoke$5 @?:?...
[[34m  Info  [0m]  => VALID
[[34m  Info  [0m]  - Now considering 'precond. (call deps$5(i, j, res._2))' VC for invoke$5 @?:?...
[[34m  Info  [0m]  => VALID
[[34m  Info  [0m]  - Now considering 'postcondition' VC for bottomup$5 @?:?...
[[34m  Info  [0m]  => VALID
[[34m  Info  [0m]  - Now considering 'precond. (call invoke$5(m, j, n, st@))' VC for bottomup$5 @?:?...
[[34m  Info  [0m]  => VALID
[[34m  Info  [0m]  - Now considering 'precond. (call bottomup$5(m - BigInt(1), n, n, st@))' VC for bottomup$5 @?:?...
[[34m  Info  [0m]  => VALID
[[34m  Info  [0m]  - Now considering 'precond. (call invoke$5(m, j, n, tail$18._2))' VC for bottomup$5 @?:?...
[[34m  Info  [0m]  => VALID
[[34m  Info  [0m]  - Now considering 'precond. (call bottomup$5(m, j - BigInt(1), n, st@))' VC for bottomup$5 @?:?...
[[34m  Info  [0m]  => VALID
[[34m  Info  [0m]  - Now considering 'precond. (call invoke$5(m, j, n, tail$17._2))' VC for bottomup$5 @?:?...
[[34m  Info  [0m]  => VALID
[[34m  Info  [0m]  - Now considering 'precond. (call bottomUpPost$5(m, j, n, x$4$7._2))' VC for bottomup$5 @?:?...
[[34m  Info  [0m]  => VALID
[[34m  Info  [0m]  - Now considering 'postcondition' VC for bottomUpPost$5 @?:?...
[[34m  Info  [0m]  => VALID
[[34m  Info  [0m]  - Now considering 'precond. (call deps$5(m - BigInt(1), n, st@))' VC for bottomUpPost$5 @?:?...
[[34m  Info  [0m]  => VALID
[[34m  Info  [0m]  - Now considering 'precond. (call depsLem$5(m - BigInt(1), j + BigInt(1),  ...)' VC for bottomUpPost$5 @?:?...
[[34m  Info  [0m]  => VALID
[[34m  Info  [0m]  - Now considering 'precond. (call deps$5(m, j, st@))' VC for bottomUpPost$5 @?:?...
[[34m  Info  [0m]  => VALID
[[34m  Info  [0m]  - Now considering 'precond. (call depsLem$5(m, BigInt(0), m, j, st@))' VC for bottomUpPost$5 @?:?...
[[34m  Info  [0m]  => VALID
[[34m  Info  [0m]  - Now considering 'postcondition' VC for levDistSols$5 @?:?...
[[34m  Info  [0m]  => VALID
[[34m  Info  [0m]  - Now considering 'precond. (call bottomup$5(m, n, n, st@))' VC for levDistSols$5 @?:?...
[[34m  Info  [0m]  => VALID
  ┌──────────────────────━
╔═╡ Verification Summary ╞═════════════════════════════════════════════════════════════════════════════════════════════════════════════════════════╗
║ └──────────────────────┘                                                                                                                         ║
║ LevenshteinDistance.bottomUpPost$5  postcondition                                                        ?:?  valid  U:orb-smt-z3          0.055 ║
║ LevenshteinDistance.bottomUpPost$5  precond. (call deps$5(m - BigInt(1), n, st@))                        ?:?  valid  U:orb-smt-z3          0.049 ║
║ LevenshteinDistance.bottomUpPost$5  precond. (call deps$5(m, j, st@))                                    ?:?  valid  U:orb-smt-z3          0.049 ║
║ LevenshteinDistance.bottomUpPost$5  precond. (call depsLem$5(m - BigInt(1), j + BigInt(1),  ...)         ?:?  valid  U:orb-smt-z3          0.049 ║
║ LevenshteinDistance.bottomUpPost$5  precond. (call depsLem$5(m, BigInt(0), m, j, st@))                   ?:?  valid  U:orb-smt-z3          0.056 ║
║ LevenshteinDistance.bottomup$5      postcondition                                                        ?:?  valid  U:orb-smt-z3          0.288 ║
║ LevenshteinDistance.bottomup$5      precond. (call bottomUpPost$5(m, j, n, x$4$7._2))                    ?:?  valid  U:orb-smt-z3          0.073 ║
║ LevenshteinDistance.bottomup$5      precond. (call bottomup$5(m - BigInt(1), n, n, st@))                 ?:?  valid  U:orb-smt-z3          0.030 ║
║ LevenshteinDistance.bottomup$5      precond. (call bottomup$5(m, j - BigInt(1), n, st@))                 ?:?  valid  U:orb-smt-z3          0.030 ║
║ LevenshteinDistance.bottomup$5      precond. (call invoke$5(m, j, n, st@))                               ?:?  valid  U:orb-smt-z3          0.040 ║
║ LevenshteinDistance.bottomup$5      precond. (call invoke$5(m, j, n, tail$17._2))                        ?:?  valid  U:orb-smt-z3          0.952 ║
║ LevenshteinDistance.bottomup$5      precond. (call invoke$5(m, j, n, tail$18._2))                        ?:?  valid  U:orb-smt-z3          0.990 ║
║ LevenshteinDistance.deps$5          postcondition                                                        ?:?  valid  U:orb-smt-z3          0.214 ║
║ LevenshteinDistance.deps$5          precond. (call deps$5(i - BigInt(1), j, st@))                        ?:?  valid  U:orb-smt-orb-cvc4    0.047 ║
║ LevenshteinDistance.deps$5          precond. (call deps$5(i - BigInt(1), j, st@))                        ?:?  valid  U:orb-smt-orb-cvc4    0.048 ║
║ LevenshteinDistance.deps$5          precond. (call deps$5(i, j - BigInt(1), st@))                        ?:?  valid  U:orb-smt-z3          0.042 ║
║ LevenshteinDistance.deps$5          precond. (call deps$5(i, j - BigInt(1), st@))                        ?:?  valid  U:orb-smt-z3          0.053 ║
║ LevenshteinDistance.depsLem$5       precond. (call deps$5(i, j, st@))                                    ?:?  valid  U:orb-smt-z3          0.046 ║
║ LevenshteinDistance.depsLem$5       precond. (call deps$5(m, n, st@))                                    ?:?  valid  U:orb-smt-z3          0.036 ║
║ LevenshteinDistance.depsLem$5       tact (postcondition)                                                 ?:?  valid  U:orb-smt-z3          0.138 ║
║ LevenshteinDistance.depsLem$5       tact (precond. (call deps$5(i, j, st@)))                             ?:?  valid  U:orb-smt-z3          0.059 ║
║ LevenshteinDistance.depsLem$5       tact (precond. (call deps$5(m, n, st@)))                             ?:?  valid  U:orb-smt-z3          0.051 ║
║ LevenshteinDistance.depsLem$5       tact (precond. (call depsLem-VCTact(i, j, m - BigInt(1), n, s ...))  ?:?  valid  U:orb-smt-z3          0.033 ║
║ LevenshteinDistance.depsLem$5       tact (precond. (call depsLem-VCTact(i, j, m - BigInt(1), n, s ...))  ?:?  valid  U:orb-smt-z3          0.033 ║
║ LevenshteinDistance.depsLem$5       tact (precond. (call depsLem-VCTact(i, j, m, n - BigInt(1), s ...))  ?:?  valid  U:orb-smt-z3          0.044 ║
║ LevenshteinDistance.depsLem$5       tact (precond. (call depsLem-VCTact(i, j, m, n - BigInt(1), s ...))  ?:?  valid  U:orb-smt-z3          0.033 ║
║ LevenshteinDistance.depsMono$5      precond. (call deps$5(i, j, st1))                                    ?:?  valid  U:orb-smt-orb-cvc4    0.035 ║
║ LevenshteinDistance.depsMono$5      precond. (call deps$5(i, j, st2))                                    ?:?  valid  U:orb-smt-z3          0.039 ║
║ LevenshteinDistance.depsMono$5      tact (postcondition)                                                 ?:?  valid  U:orb-smt-z3          0.218 ║
║ LevenshteinDistance.depsMono$5      tact (precond. (call deps$5(i, j, st1)))                             ?:?  valid  U:orb-smt-z3          0.059 ║
║ LevenshteinDistance.depsMono$5      tact (precond. (call deps$5(i, j, st2)))                             ?:?  valid  U:orb-smt-z3          0.064 ║
║ LevenshteinDistance.depsMono$5      tact (precond. (call depsMono-VCTact(i - BigInt(1), j, st1, s ...))  ?:?  valid  U:orb-smt-z3          0.034 ║
║ LevenshteinDistance.depsMono$5      tact (precond. (call depsMono-VCTact(i - BigInt(1), j, st1, s ...))  ?:?  valid  U:orb-smt-z3          0.033 ║
║ LevenshteinDistance.depsMono$5      tact (precond. (call depsMono-VCTact(i, j - BigInt(1), st1, s ...))  ?:?  valid  U:orb-smt-z3          0.039 ║
║ LevenshteinDistance.depsMono$5      tact (precond. (call depsMono-VCTact(i, j - BigInt(1), st1, s ...))  ?:?  valid  U:orb-smt-z3          0.048 ║
║ LevenshteinDistance.invoke$5        postcondition                                                        ?:?  valid  U:orb-smt-z3          0.168 ║
║ LevenshteinDistance.invoke$5        precond. (call deps$5(i - BigInt(1), j, st@))                        ?:?  valid  U:orb-smt-z3          0.035 ║
║ LevenshteinDistance.invoke$5        precond. (call deps$5(i, j - BigInt(1), st@))                        ?:?  valid  U:orb-smt-z3          0.070 ║
║ LevenshteinDistance.invoke$5        precond. (call deps$5(i, j, res._2))                                 ?:?  valid  U:orb-smt-z3          0.062 ║
║ LevenshteinDistance.invoke$5        precond. (call depsMono$5(i - BigInt(1), j, st@, out$1))             ?:?  valid  U:orb-smt-z3          0.075 ║
║ LevenshteinDistance.invoke$5        precond. (call depsMono$5(i - BigInt(1), n, st@, out$1))             ?:?  valid  U:orb-smt-z3          0.081 ║
║ LevenshteinDistance.invoke$5        precond. (call depsMono$5(i, j - BigInt(1), st@, out$1))             ?:?  valid  U:orb-smt-z3          0.087 ║
║ LevenshteinDistance.invoke$5        precond. (call levDist-mem$3(i, j, st@))                             ?:?  valid  U:orb-smt-z3          0.054 ║
║ LevenshteinDistance.levDist-mem$3   match exhaustiveness                                                 ?:?  valid  U:orb-smt-z3          0.026 ║
║ LevenshteinDistance.levDist-mem$3   postcondition                                                        ?:?  valid  U:orb-smt-z3          0.365 ║
║ LevenshteinDistance.levDist-mem$3   precond. (call deps$5(i - BigInt(1), j, st@))                        ?:?  valid  U:orb-smt-z3          0.030 ║
║ LevenshteinDistance.levDist-mem$3   precond. (call deps$5(i, j - BigInt(1), st@))                        ?:?  valid  U:orb-smt-z3          0.038 ║
║ LevenshteinDistance.levDist-mem$3   precond. (call levDist-mem$3(a$180, a$179, st@))                     ?:?  valid  U:orb-smt-z3          0.091 ║
║ LevenshteinDistance.levDist-mem$3   precond. (call levDist-mem$3(a$182, j, dres$1._2 ++ Set ...)         ?:?  valid  U:orb-smt-z3          0.263 ║
║ LevenshteinDistance.levDist-mem$3   precond. (call levDist-mem$3(i, a$183, dres$2._2 ++ Set ...)         ?:?  valid  U:orb-smt-z3          0.460 ║
║ LevenshteinDistance.levDistSols$5   postcondition                                                        ?:?  valid  U:orb-smt-z3          0.109 ║
║ LevenshteinDistance.levDistSols$5   precond. (call bottomup$5(m, n, n, st@))                             ?:?  valid  U:orb-smt-z3          0.028 ║
╟┄┄┄┄┄┄┄┄┄┄┄┄┄┄┄┄┄┄┄┄┄┄┄┄┄┄┄┄┄┄┄┄┄┄┄┄┄┄┄┄┄┄┄┄┄┄┄┄┄┄┄┄┄┄┄┄┄┄┄┄┄┄┄┄┄┄┄┄┄┄┄┄┄┄┄┄┄┄┄┄┄┄┄┄┄┄┄┄┄┄┄┄┄┄┄┄┄┄┄┄┄┄┄┄┄┄┄┄┄┄┄┄┄┄┄┄┄┄┄┄┄┄┄┄┄┄┄┄┄┄┄┄┄┄┄┄┄┄┄┄┄┄┄┄┄┄╢
║ total: 52     valid: 52     invalid: 0      unknown 0                                                                                      6.149 ║
╚═══════════════════════════════════════════════════════════════════════════════════════════════════════════════════════════════════════════════════
[[34m  Info  [0m] - considering function levDist-mem-steps...
[[34m  Info  [0m] Candidate invariants
[[34m  Info  [0m] levDist-mem-steps-->1 * x$3$10._2 + 0 <= 0
[[34m  Info  [0m] checked VC inst... in 0.026s
[[34m  Info  [0m] Function: levDist-mem-steps--Found candidate invariant is not a real invariant! 
[[34m  Info  [0m] # of atomic predicates: 6 + 1
[[34m  Info  [0m] Candidate invariants
[[34m  Info  [0m] levDist-mem-steps-->1 * x$3$10._2 + -4 <= 0
[[34m  Info  [0m] checked VC inst... in 0.026s
[[34m  Info  [0m] Function: levDist-mem-steps--Found candidate invariant is not a real invariant! 
[[34m  Info  [0m] # of atomic predicates: 9 + 7
[[34m  Info  [0m] Candidate invariants
[[34m  Info  [0m] levDist-mem-steps-->1 * x$3$10._2 + -23 <= 0
[[34m  Info  [0m] checked VC inst... in 0.06s
[[34m  Info  [0m] Function: levDist-mem-steps--Found candidate invariant is not a real invariant! 
[[34m  Info  [0m] # of atomic predicates: 13 + 16
[[34m  Info  [0m] - More unrollings for invariant inference
[[34m  Info  [0m] Candidate invariants
[[34m  Info  [0m] levDist-mem-steps-->1 * x$3$10._2 + 0 <= 0
[[34m  Info  [0m] checked VC inst... in 0.05s
[[34m  Info  [0m] Function: levDist-mem-steps--Found candidate invariant is not a real invariant! 
[[34m  Info  [0m] # of atomic predicates: 6 + 1
[[34m  Info  [0m] Candidate invariants
[[34m  Info  [0m] levDist-mem-steps-->1 * x$3$10._2 + -4 <= 0
[[34m  Info  [0m] checked VC inst... in 0.035s
[[34m  Info  [0m] Function: levDist-mem-steps--Found candidate invariant is not a real invariant! 
[[34m  Info  [0m] # of atomic predicates: 15 + 7
[[34m  Info  [0m] Candidate invariants
[[34m  Info  [0m] levDist-mem-steps-->1 * x$3$10._2 + -23 <= 0
[[34m  Info  [0m] checked VC inst... in 0.087s
[[34m  Info  [0m] Function: levDist-mem-steps--Found candidate invariant is not a real invariant! 
[[34m  Info  [0m] # of atomic predicates: 18 + 22
[[34m  Info  [0m] - More unrollings for invariant inference
[[34m  Info  [0m] Candidate invariants
[[34m  Info  [0m] levDist-mem-steps-->1 * x$3$10._2 + 0 <= 0
[[34m  Info  [0m] checked VC inst... in 0.041s
[[34m  Info  [0m] Function: levDist-mem-steps--Found candidate invariant is not a real invariant! 
[[34m  Info  [0m] # of atomic predicates: 6 + 1
[[34m  Info  [0m] Candidate invariants
[[34m  Info  [0m] levDist-mem-steps-->1 * x$3$10._2 + -4 <= 0
[[34m  Info  [0m] checked VC inst... in 0.026s
[[34m  Info  [0m] Function: levDist-mem-steps--Found candidate invariant is not a real invariant! 
[[34m  Info  [0m] # of atomic predicates: 15 + 7
[[34m  Info  [0m] Candidate invariants
[[34m  Info  [0m] levDist-mem-steps-->1 * x$3$10._2 + -23 <= 0
[[34m  Info  [0m] checked VC inst... in 0.06s
[[34m  Info  [0m] Function: levDist-mem-steps--Found candidate invariant is not a real invariant! 
[[34m  Info  [0m] # of atomic predicates: 18 + 22
[[34m  Info  [0m] - More unrollings for invariant inference
[[34m  Info  [0m] Candidate invariants
[[34m  Info  [0m] levDist-mem-steps-->1 * x$3$10._2 + 0 <= 0
[[34m  Info  [0m] checked VC inst... in 0.047s
[[34m  Info  [0m] Function: levDist-mem-steps--Found candidate invariant is not a real invariant! 
[[34m  Info  [0m] # of atomic predicates: 6 + 1
[[34m  Info  [0m] Candidate invariants
[[34m  Info  [0m] levDist-mem-steps-->1 * x$3$10._2 + -4 <= 0
[[34m  Info  [0m] checked VC inst... in 0.032s
[[34m  Info  [0m] Function: levDist-mem-steps--Found candidate invariant is not a real invariant! 
[[34m  Info  [0m] # of atomic predicates: 15 + 7
[[34m  Info  [0m] Candidate invariants
[[34m  Info  [0m] levDist-mem-steps-->1 * x$3$10._2 + -23 <= 0
[[34m  Info  [0m] checked VC inst... in 0.092s
[[34m  Info  [0m] Function: levDist-mem-steps--Found candidate invariant is not a real invariant! 
[[34m  Info  [0m] # of atomic predicates: 28 + 22
[[34m  Info  [0m] - More unrollings for invariant inference
[[34m  Info  [0m] Candidate invariants
[[34m  Info  [0m] levDist-mem-steps-->1 * x$3$10._2 + 0 <= 0
[[34m  Info  [0m] checked VC inst... in 0.061s
[[34m  Info  [0m] Function: levDist-mem-steps--Found candidate invariant is not a real invariant! 
[[34m  Info  [0m] # of atomic predicates: 6 + 1
[[34m  Info  [0m] Candidate invariants
[[34m  Info  [0m] levDist-mem-steps-->1 * x$3$10._2 + -4 <= 0
[[34m  Info  [0m] checked VC inst... in 0.076s
[[34m  Info  [0m] Function: levDist-mem-steps--Found candidate invariant is not a real invariant! 
[[34m  Info  [0m] # of atomic predicates: 15 + 7
[[34m  Info  [0m] Candidate invariants
[[34m  Info  [0m] levDist-mem-steps-->1 * x$3$10._2 + -23 <= 0
[[34m  Info  [0m] checked VC inst... in 0.201s
[[34m  Info  [0m] Function: levDist-mem-steps--Found candidate invariant is not a real invariant! 
[[34m  Info  [0m] # of atomic predicates: 31 + 22
[[34m  Info  [0m] - More unrollings for invariant inference
[[34m  Info  [0m] Candidate invariants
[[34m  Info  [0m] levDist-mem-steps-->1 * x$3$10._2 + 0 <= 0
[[34m  Info  [0m] checked VC inst... in 0.112s
[[34m  Info  [0m] Function: levDist-mem-steps--Found candidate invariant is not a real invariant! 
[[34m  Info  [0m] # of atomic predicates: 6 + 1
[[34m  Info  [0m] Candidate invariants
[[34m  Info  [0m] levDist-mem-steps-->1 * x$3$10._2 + -4 <= 0
[[34m  Info  [0m] checked VC inst... in 0.239s
[[34m  Info  [0m] Function: levDist-mem-steps--Found candidate invariant is not a real invariant! 
[[34m  Info  [0m] # of atomic predicates: 15 + 7
[[34m  Info  [0m] Candidate invariants
[[34m  Info  [0m] levDist-mem-steps-->1 * x$3$10._2 + -23 <= 0
[[34m  Info  [0m] checked VC inst... in 0.47s
[[34m  Info  [0m] minimizing...
[[34m  Info  [0m] Candidate invariants
[[34m  Info  [0m] levDist-mem-steps-->1 * x$3$10._2 + -22 <= 0
[[34m  Info  [0m] checked VC inst... in 0.201s
[[34m  Info  [0m] Function: levDist-mem-steps--Found candidate invariant is not a real invariant! 
[[34m  Info  [0m] # of atomic predicates: 18 + 22
[[34m  Info  [0m] Candidate invariants
[[34m  Info  [0m] levDist-mem-steps-->1 * x$3$10._2 + -23 <= 0
[[34m  Info  [0m] checked VC inst... in 0.475s
[[34m  Info  [0m] minimizing...
[[34m  Info  [0m] - Found inductive invariant: levDist-mem-steps --> steps + BigInt(-23) <= BigInt(0)
[[34m  Info  [0m] - Verifying Invariants... 
[[34m  Info  [0m] - Invariant verified
[[34m  Info  [0m] - considering function invoke-steps...
[[34m  Info  [0m] Candidate invariants
[[34m  Info  [0m] invoke-steps-->1 * res$203._2 + 0 <= 0
[[34m  Info  [0m] checked VC inst... in 0.005s
[[34m  Info  [0m] Function: invoke-steps--Found candidate invariant is not a real invariant! 
[[34m  Info  [0m] # of atomic predicates: 8 + 1
[[34m  Info  [0m] Candidate invariants
[[34m  Info  [0m] invoke-steps-->1 * res$203._2 + -3 <= 0
[[34m  Info  [0m] checked VC inst... in 0.003s
[[34m  Info  [0m] Function: invoke-steps--Found candidate invariant is not a real invariant! 
[[34m  Info  [0m] # of atomic predicates: 7 + 9
[[34m  Info  [0m] Candidate invariants
[[34m  Info  [0m] invoke-steps-->1 * res$203._2 + -27 <= 0
[[34m  Info  [0m] checked VC inst... in 0.002s
[[34m  Info  [0m] minimizing...
[[34m  Info  [0m] Candidate invariants
[[34m  Info  [0m] invoke-steps-->1 * res$203._2 + -26 <= 0
[[34m  Info  [0m] checked VC inst... in 0.002s
[[34m  Info  [0m] - Found inductive invariant: invoke-steps --> steps + BigInt(-26) <= BigInt(0)
[[34m  Info  [0m] - Verifying Invariants... 
[[34m  Info  [0m] - Invariant verified
[[34m  Info  [0m] - considering function bottomup-steps...
[[34m  Info  [0m] Candidate invariants
[[34m  Info  [0m] bottomup-steps-->(((0 * j + 1 * x$4$8._2) + 0 * mult(m, n)) + 0 * m) + 0 <= 0
[[34m  Info  [0m] checked VC inst... in 0.033s
[[34m  Info  [0m] Function: bottomup-steps--Found candidate invariant is not a real invariant! 
[[34m  Info  [0m] # of atomic predicates: 12 + 1
[[34m  Info  [0m] Candidate invariants
[[34m  Info  [0m] bottomup-steps-->(((0 * j + 1 * x$4$8._2) + 0 * mult(m, n)) + 0 * m) + -35 <= 0
[[34m  Info  [0m] checked VC inst... in 0.02s
[[34m  Info  [0m] Function: bottomup-steps--Found candidate invariant is not a real invariant! 
[[34m  Info  [0m] # of atomic predicates: 14 + 13
[[34m  Info  [0m] - More unrollings for invariant inference
[[34m  Info  [0m] Candidate invariants
[[34m  Info  [0m] bottomup-steps-->(((0 * j + 1 * x$4$8._2) + 0 * mult(m, n)) + 0 * m) + 0 <= 0
[[34m  Info  [0m] checked VC inst... in 0.038s
[[34m  Info  [0m] Function: bottomup-steps--Found candidate invariant is not a real invariant! 
[[34m  Info  [0m] # of atomic predicates: 23 + 1
[[34m  Info  [0m] Candidate invariants
[[34m  Info  [0m] bottomup-steps-->(((-38 * j + 1 * x$4$8._2) + 0 * mult(m, n)) + 0 * m) + 0 <= 0
[[34m  Info  [0m] checked VC inst... in 0.032s
[[34m  Info  [0m] Function: bottomup-steps--Found candidate invariant is not a real invariant! 
[[34m  Info  [0m] # of atomic predicates: 25 + 24
[[34m  Info  [0m] Candidate invariants
[[34m  Info  [0m] bottomup-steps-->(((-38 * j + 1 * x$4$8._2) + 0 * mult(m, n)) + -39 * m) + 0 <= 0
[[34m  Info  [0m] checked VC inst... in 0.034s
[[34m  Info  [0m] Function: bottomup-steps--Found candidate invariant is not a real invariant! 
[[34m  Info  [0m] # of atomic predicates: 26 + 49
[[34m  Info  [0m] - More unrollings for invariant inference
[[34m  Info  [0m] Candidate invariants
[[34m  Info  [0m] bottomup-steps-->(((0 * j + 1 * x$4$8._2) + 0 * mult(m, n)) + 0 * m) + 0 <= 0
[[34m  Info  [0m] checked VC inst... in 0.054s
[[34m  Info  [0m] Function: bottomup-steps--Found candidate invariant is not a real invariant! 
[[34m  Info  [0m] # of atomic predicates: 26 + 1
[[34m  Info  [0m] Candidate invariants
[[34m  Info  [0m] bottomup-steps-->(((-39 * j + 1 * x$4$8._2) + 0 * mult(m, n)) + 0 * m) + 0 <= 0
[[34m  Info  [0m] checked VC inst... in 0.031s
[[34m  Info  [0m] Function: bottomup-steps--Found candidate invariant is not a real invariant! 
[[34m  Info  [0m] # of atomic predicates: 31 + 27
[[34m  Info  [0m] Candidate invariants
[[34m  Info  [0m] bottomup-steps-->(((-39 * j + 1 * x$4$8._2) + -1 * mult(m, n)) + -41 * m) + 0 <= 0
[[34m  Info  [0m] checked VC inst... in 0.058s
[[34m  Info  [0m] Function: bottomup-steps--Found candidate invariant is not a real invariant! 
[[34m  Info  [0m] # of atomic predicates: 32 + 58
[[34m  Info  [0m] Candidate invariants
[[34m  Info  [0m] bottomup-steps-->(((-37 * j + 1 * x$4$8._2) + -37 * mult(m, n)) + -38 * m) + 0 <= 0
[[34m  Info  [0m] checked VC inst... in 0.033s
[[34m  Info  [0m] Function: bottomup-steps--Found candidate invariant is not a real invariant! 
[[34m  Info  [0m] # of atomic predicates: 17 + 90
[[34m  Info  [0m] Candidate invariants
[[34m  Info  [0m] bottomup-steps-->(((-37 * j + 1 * x$4$8._2) + -37 * mult(m, n)) + -38 * m) + -35 <= 0
[[34m  Info  [0m] checked VC inst... in 0.012s
[[34m  Info  [0m] minimizing...
[[34m  Info  [0m] Candidate invariants
[[34m  Info  [0m] bottomup-steps-->(((-36 * j + 1 * x$4$8._2) + 100 * mult(m, n)) + -172 * m) + -33 <= 0
[[34m  Info  [0m] checked VC inst... in 0.045s
[[34m  Info  [0m] Function: bottomup-steps--Found candidate invariant is not a real invariant! 
[[34m  Info  [0m] # of atomic predicates: 35 + 107
[[34m  Info  [0m] Candidate invariants
[[34m  Info  [0m] bottomup-steps-->(((-37 * j + 1 * x$4$8._2) + -39 * mult(m, n)) + -37 * m) + -35 <= 0
[[34m  Info  [0m] checked VC inst... in 0.013s
[[34m  Info  [0m] minimizing...
[[34m  Info  [0m] Candidate invariants
[[34m  Info  [0m] bottomup-steps-->(((-36 * j + 1 * x$4$8._2) + -36 * mult(m, n)) + -36 * m) + -33 <= 0
[[34m  Info  [0m] checked VC inst... in 0.009s
[[34m  Info  [0m] - Found inductive invariant: bottomup-steps --> (((BigInt(-36) * j + steps) + BigInt(-36) * (m * n)) + BigInt(-36) * m) + BigInt(-33) <= BigInt(0)
[[34m  Info  [0m] - Verifying Invariants... 
[[31m Error  [0m] - Unable to prove or disprove invariant, the invariant is probably true
[[34m  Info  [0m] - considering function levDistSols-steps...
[[34m  Info  [0m] Candidate invariants
[[34m  Info  [0m] levDistSols-steps-->(((1 * x$5$6._2 + 0 * mult(m, n)) + 0 * m) + 0 * n) + 0 <= 0
[[34m  Info  [0m] checked VC inst... in 0.004s
[[34m  Info  [0m] Function: levDistSols-steps--Found candidate invariant is not a real invariant! 
[[34m  Info  [0m] # of atomic predicates: 12 + 1
[[34m  Info  [0m] Candidate invariants
[[34m  Info  [0m] levDistSols-steps-->(((1 * x$5$6._2 + -36 * mult(m, n)) + -37 * m) + -37 * n) + -36 <= 0
[[34m  Info  [0m] checked VC inst... in 0.002s
[[34m  Info  [0m] minimizing...
[[34m  Info  [0m] Candidate invariants
[[34m  Info  [0m] levDistSols-steps-->(((1 * x$5$6._2 + -36 * mult(m, n)) + -36 * m) + -36 * n) + -34 <= 0
[[34m  Info  [0m] checked VC inst... in 0.001s
[[34m  Info  [0m] - Found inductive invariant: levDistSols-steps --> (((steps + BigInt(-36) * (m * n)) + BigInt(-36) * m) + BigInt(-36) * n) + BigInt(-34) <= BigInt(0)
[[34m  Info  [0m] - Verifying Invariants... 
[[34m  Info  [0m] - Invariant verified
Resource Verification Results: 
. ┌─────────━
╔═╡ Summary ╞════════════════════════════════════════════════════════════════╗
║ └─────────┘                                                                ║
║ bottomup        steps <= ((36 * (m * n) + 36 * m) + 36 * j) + 33    17.983 ║
║ invoke          steps <= 26                                         0.327  ║
║ levDist         steps <= 23                                         5.308  ║
║ levDistSols     steps <= ((36 * (m * n) + 36 * m) + 36 * n) + 34    0.580  ║
╟┄┄┄┄┄┄┄┄┄┄┄┄┄┄┄┄┄┄┄┄┄┄┄┄┄┄┄┄┄┄┄┄┄┄┄┄┄┄┄┄┄┄┄┄┄┄┄┄┄┄┄┄┄┄┄┄┄┄┄┄┄┄┄┄┄┄┄┄┄┄┄┄┄┄┄┄╢
║ total: 4     inferred: 4     unknown: 0     time: 24.198                   ║
╚═════════════════════════════════════════════════════════════════════════════
[[34m  Info  [0m] Stats dumped to file: LevenshteinDistance-stats.txt
