[[33mWarning [0m] warning: there were two feature warnings; re-run with -feature for details
[[34m  Info  [0m]  - Now considering 'postcondition' VC for pAdd-mem$3 @?:?...
[[34m  Info  [0m]  => VALID
[[34m  Info  [0m]  - Now considering 'precond. (call pMul-mem$3(i, st@))' VC for pAdd-mem$3 @?:?...
[[34m  Info  [0m]  => VALID
[[34m  Info  [0m]  - Now considering 'precond. (call pMul-mem$3(i, st@))' VC for pAdd-mem$3 @?:?...
[[34m  Info  [0m]  => VALID
[[34m  Info  [0m]  - Now considering 'precond. (call pAdd-mem$3(a$181, mulRes$1._2))' VC for pAdd-mem$3 @?:?...
[[34m  Info  [0m]  => VALID
[[34m  Info  [0m]  - Now considering 'match exhaustiveness' VC for pAdd-mem$3 @?:?...
[[34m  Info  [0m]  => VALID
[[34m  Info  [0m]  - Now considering 'match exhaustiveness' VC for pAdd-mem$3 @?:?...
[[34m  Info  [0m]  => VALID
[[34m  Info  [0m]  - Now considering 'match exhaustiveness' VC for pAdd-mem$3 @?:?...
[[34m  Info  [0m]  => VALID
[[34m  Info  [0m]  - Now considering 'postcondition' VC for pMul-mem$3 @?:?...
[[34m  Info  [0m]  => VALID
[[34m  Info  [0m]  - Now considering 'precond. (call pPrim-mem$3(i, st@))' VC for pMul-mem$3 @?:?...
[[34m  Info  [0m]  => VALID
[[34m  Info  [0m]  - Now considering 'precond. (call pPrim-mem$3(i, st@))' VC for pMul-mem$3 @?:?...
[[34m  Info  [0m]  => VALID
[[34m  Info  [0m]  - Now considering 'precond. (call pMul-mem$3(a$188, primRes$1._2))' VC for pMul-mem$3 @?:?...
[[34m  Info  [0m]  => VALID
[[34m  Info  [0m]  - Now considering 'match exhaustiveness' VC for pMul-mem$3 @?:?...
[[34m  Info  [0m]  => VALID
[[34m  Info  [0m]  - Now considering 'match exhaustiveness' VC for pMul-mem$3 @?:?...
[[34m  Info  [0m]  => VALID
[[34m  Info  [0m]  - Now considering 'match exhaustiveness' VC for pMul-mem$3 @?:?...
[[34m  Info  [0m]  => VALID
[[34m  Info  [0m]  - Now considering 'postcondition' VC for pPrim-mem$3 @?:?...
[[34m  Info  [0m]  => VALID
[[34m  Info  [0m]  - Now considering 'precond. (call pAdd-mem$3(a$185, st@))' VC for pPrim-mem$3 @?:?...
[[34m  Info  [0m]  => VALID
[[34m  Info  [0m]  - Now considering 'match exhaustiveness' VC for pPrim-mem$3 @?:?...
[[34m  Info  [0m]  => VALID
[[34m  Info  [0m]  - Now considering 'match exhaustiveness' VC for pPrim-mem$3 @?:?...
[[34m  Info  [0m]  => VALID
[[34m  Info  [0m]  - Now considering 'postcondition' VC for depsEval$5 @?:?...
[[34m  Info  [0m]  => VALID
[[34m  Info  [0m]  - Now considering 'precond. (call allEval$5(i - BigInt(1), st@))' VC for depsEval$5 @?:?...
[[34m  Info  [0m]  => VALID
[[34m  Info  [0m]  - Now considering 'postcondition' VC for allEval$5 @?:?...
[[34m  Info  [0m]  => VALID
[[34m  Info  [0m]  - Now considering 'precond. (call allEval$5(i - BigInt(1), st@))' VC for allEval$5 @?:?...
[[34m  Info  [0m]  => VALID
[[34m  Info  [0m]  - Now considering 'tact (postcondition)' VC for evalMono$5 @?:?...
[[34m  Info  [0m]  => VALID
[[34m  Info  [0m]  - Now considering 'tact (precond. (call evalMono-VCTact(i - BigInt(1), st1, st2)))' VC for evalMono$5 @?:?...
[[34m  Info  [0m]  => VALID
[[34m  Info  [0m]  - Now considering 'tact (precond. (call allEval$5(i, st1)))' VC for evalMono$5 @?:?...
[[34m  Info  [0m]  => VALID
[[34m  Info  [0m]  - Now considering 'tact (precond. (call allEval$5(i, st2)))' VC for evalMono$5 @?:?...
[[34m  Info  [0m]  => VALID
[[34m  Info  [0m]  - Now considering 'precond. (call allEval$5(i, st1))' VC for evalMono$5 @?:?...
[[34m  Info  [0m]  => VALID
[[34m  Info  [0m]  - Now considering 'precond. (call allEval$5(i, st2))' VC for evalMono$5 @?:?...
[[34m  Info  [0m]  => VALID
[[34m  Info  [0m]  - Now considering 'tact (postcondition)' VC for depsLem$5 @?:?...
[[34m  Info  [0m]  => VALID
[[34m  Info  [0m]  - Now considering 'tact (precond. (call depsLem-VCTact(x, y - BigInt(1), st@)))' VC for depsLem$5 @?:?...
[[34m  Info  [0m]  => VALID
[[34m  Info  [0m]  - Now considering 'tact (precond. (call allEval$5(y, st@)))' VC for depsLem$5 @?:?...
[[34m  Info  [0m]  => VALID
[[34m  Info  [0m]  - Now considering 'tact (precond. (call allEval$5(x, st@)))' VC for depsLem$5 @?:?...
[[34m  Info  [0m]  => VALID
[[34m  Info  [0m]  - Now considering 'precond. (call allEval$5(y, st@))' VC for depsLem$5 @?:?...
[[34m  Info  [0m]  => VALID
[[34m  Info  [0m]  - Now considering 'precond. (call allEval$5(x, st@))' VC for depsLem$5 @?:?...
[[34m  Info  [0m]  => VALID
[[34m  Info  [0m]  - Now considering 'postcondition' VC for resEval$5 @?:?...
[[34m  Info  [0m]  => VALID
[[34m  Info  [0m]  - Now considering 'precond. (call depsLem$5(j, i - BigInt(1), st@))' VC for resEval$5 @?:?...
[[34m  Info  [0m]  => VALID
[[34m  Info  [0m]  - Now considering 'match exhaustiveness' VC for resEval$5 @?:?...
[[34m  Info  [0m]  => VALID
[[34m  Info  [0m]  - Now considering 'postcondition' VC for invokePrim$5 @?:?...
[[34m  Info  [0m]  => VALID
[[34m  Info  [0m]  - Now considering 'precond. (call pPrim-mem$3(i, st@))' VC for invokePrim$5 @?:?...
[[34m  Info  [0m]  => VALID
[[34m  Info  [0m]  - Now considering 'precond. (call evalMono$5(i - BigInt(1), st@, res._2))' VC for invokePrim$5 @?:?...
[[34m  Info  [0m]  => VALID
[[34m  Info  [0m]  - Now considering 'postcondition' VC for invokeMul$5 @?:?...
[[34m  Info  [0m]  => VALID
[[34m  Info  [0m]  - Now considering 'precond. (call invokePrim$5(i, st@))' VC for invokeMul$5 @?:?...
[[34m  Info  [0m]  => VALID
[[34m  Info  [0m]  - Now considering 'precond. (call pMul-mem$3(i, scr._2))' VC for invokeMul$5 @?:?...
[[34m  Info  [0m]  => VALID
[[34m  Info  [0m]  - Now considering 'precond. (call evalMono$5(i - BigInt(1), st@, res._2))' VC for invokeMul$5 @?:?...
[[34m  Info  [0m]  => VALID
[[34m  Info  [0m]  - Now considering 'match exhaustiveness' VC for invokeMul$5 @?:?...
[[34m  Info  [0m]  => VALID
[[34m  Info  [0m]  - Now considering 'postcondition' VC for invoke$5 @?:?...
[[34m  Info  [0m]  => VALID
[[34m  Info  [0m]  - Now considering 'precond. (call invokeMul$5(i, st@))' VC for invoke$5 @?:?...
[[34m  Info  [0m]  => VALID
[[34m  Info  [0m]  - Now considering 'precond. (call pAdd-mem$3(i, scr._2))' VC for invoke$5 @?:?...
[[34m  Info  [0m]  => VALID
[[34m  Info  [0m]  - Now considering 'precond. (call evalMono$5(i - BigInt(1), st@, res._2))' VC for invoke$5 @?:?...
[[34m  Info  [0m]  => VALID
[[34m  Info  [0m]  - Now considering 'precond. (call allEval$5(i, res._2))' VC for invoke$5 @?:?...
[[34m  Info  [0m]  => VALID
[[34m  Info  [0m]  - Now considering 'match exhaustiveness' VC for invoke$5 @?:?...
[[34m  Info  [0m]  => VALID
[[34m  Info  [0m]  - Now considering 'postcondition' VC for parse$5 @?:?...
[[34m  Info  [0m]  => VALID
[[34m  Info  [0m]  - Now considering 'precond. (call invoke$5(n, st@))' VC for parse$5 @?:?...
[[34m  Info  [0m]  => VALID
[[34m  Info  [0m]  - Now considering 'precond. (call parse$5(n - BigInt(1), st@))' VC for parse$5 @?:?...
[[34m  Info  [0m]  => VALID
[[34m  Info  [0m]  - Now considering 'precond. (call invoke$5(n, scr._2))' VC for parse$5 @?:?...
[[34m  Info  [0m]  => VALID
[[34m  Info  [0m]  - Now considering 'precond. (call allEval$5(n, x$2._2))' VC for parse$5 @?:?...
[[34m  Info  [0m]  => VALID
[[34m  Info  [0m]  - Now considering 'match exhaustiveness' VC for parse$5 @?:?...
[[34m  Info  [0m]  => VALID
  ┌──────────────────────━
╔═╡ Verification Summary ═══════════════════════════════════════════════════════════════════════════════════════════════════════════════╗
║ └──────────────────────┘                                                                                                              ║
║ PackratParsing.allEval$5     postcondition                                                    ?:?  valid  U:orb-smt-z3          0.047 ║
║ PackratParsing.allEval$5     precond. (call allEval$5(i - BigInt(1), st@))                    ?:?  valid  U:orb-smt-z3          0.034 ║
║ PackratParsing.depsEval$5    postcondition                                                    ?:?  valid  U:orb-smt-z3          0.032 ║
║ PackratParsing.depsEval$5    precond. (call allEval$5(i - BigInt(1), st@))                    ?:?  valid  U:orb-smt-z3          0.029 ║
║ PackratParsing.depsLem$5     precond. (call allEval$5(x, st@))                                ?:?  valid  U:orb-smt-z3          0.034 ║
║ PackratParsing.depsLem$5     precond. (call allEval$5(y, st@))                                ?:?  valid  U:orb-smt-z3          0.028 ║
║ PackratParsing.depsLem$5     tact (postcondition)                                             ?:?  valid  U:orb-smt-z3          0.075 ║
║ PackratParsing.depsLem$5     tact (precond. (call allEval$5(x, st@)))                         ?:?  valid  U:orb-smt-z3          0.040 ║
║ PackratParsing.depsLem$5     tact (precond. (call allEval$5(y, st@)))                         ?:?  valid  U:orb-smt-z3          0.037 ║
║ PackratParsing.depsLem$5     tact (precond. (call depsLem-VCTact(x, y - BigInt(1), st@)))     ?:?  valid  U:orb-smt-z3          0.030 ║
║ PackratParsing.evalMono$5    precond. (call allEval$5(i, st1))                                ?:?  valid  U:orb-smt-z3          0.028 ║
║ PackratParsing.evalMono$5    precond. (call allEval$5(i, st2))                                ?:?  valid  U:orb-smt-z3          0.033 ║
║ PackratParsing.evalMono$5    tact (postcondition)                                             ?:?  valid  U:orb-smt-z3          0.096 ║
║ PackratParsing.evalMono$5    tact (precond. (call allEval$5(i, st1)))                         ?:?  valid  U:orb-smt-z3          0.043 ║
║ PackratParsing.evalMono$5    tact (precond. (call allEval$5(i, st2)))                         ?:?  valid  U:orb-smt-z3          0.042 ║
║ PackratParsing.evalMono$5    tact (precond. (call evalMono-VCTact(i - BigInt(1), st1, st2)))  ?:?  valid  U:orb-smt-z3          0.028 ║
║ PackratParsing.invoke$5      match exhaustiveness                                             ?:?  valid  U:orb-smt-z3          0.043 ║
║ PackratParsing.invoke$5      postcondition                                                    ?:?  valid  U:orb-smt-z3          0.328 ║
║ PackratParsing.invoke$5      precond. (call allEval$5(i, res._2))                             ?:?  valid  U:orb-smt-z3          0.317 ║
║ PackratParsing.invoke$5      precond. (call evalMono$5(i - BigInt(1), st@, res._2))           ?:?  valid  U:orb-smt-z3          0.093 ║
║ PackratParsing.invoke$5      precond. (call invokeMul$5(i, st@))                              ?:?  valid  U:orb-smt-z3          0.033 ║
║ PackratParsing.invoke$5      precond. (call pAdd-mem$3(i, scr._2))                            ?:?  valid  U:orb-smt-z3          0.280 ║
║ PackratParsing.invokeMul$5   match exhaustiveness                                             ?:?  valid  U:orb-smt-z3          0.026 ║
║ PackratParsing.invokeMul$5   postcondition                                                    ?:?  valid  U:orb-smt-z3          0.260 ║
║ PackratParsing.invokeMul$5   precond. (call evalMono$5(i - BigInt(1), st@, res._2))           ?:?  valid  U:orb-smt-z3          0.074 ║
║ PackratParsing.invokeMul$5   precond. (call invokePrim$5(i, st@))                             ?:?  valid  U:orb-smt-z3          0.035 ║
║ PackratParsing.invokeMul$5   precond. (call pMul-mem$3(i, scr._2))                            ?:?  valid  U:orb-smt-z3          0.253 ║
║ PackratParsing.invokePrim$5  postcondition                                                    ?:?  valid  U:orb-smt-z3          0.213 ║
║ PackratParsing.invokePrim$5  precond. (call evalMono$5(i - BigInt(1), st@, res._2))           ?:?  valid  U:orb-smt-z3          0.054 ║
║ PackratParsing.invokePrim$5  precond. (call pPrim-mem$3(i, st@))                              ?:?  valid  U:orb-smt-z3          0.031 ║
║ PackratParsing.pAdd-mem$3    match exhaustiveness                                             ?:?  valid  U:orb-smt-z3          0.082 ║
║ PackratParsing.pAdd-mem$3    match exhaustiveness                                             ?:?  valid  U:orb-smt-z3          0.069 ║
║ PackratParsing.pAdd-mem$3    match exhaustiveness                                             ?:?  valid  U:orb-smt-z3          0.066 ║
║ PackratParsing.pAdd-mem$3    postcondition                                                    ?:?  valid  U:orb-smt-orb-cvc4    1.973 ║
║ PackratParsing.pAdd-mem$3    precond. (call pAdd-mem$3(a$181, mulRes$1._2))                   ?:?  valid  U:orb-smt-orb-cvc4    0.716 ║
║ PackratParsing.pAdd-mem$3    precond. (call pMul-mem$3(i, st@))                               ?:?  valid  U:orb-smt-z3          0.264 ║
║ PackratParsing.pAdd-mem$3    precond. (call pMul-mem$3(i, st@))                               ?:?  valid  U:orb-smt-z3          0.356 ║
║ PackratParsing.pMul-mem$3    match exhaustiveness                                             ?:?  valid  U:orb-smt-z3          0.061 ║
║ PackratParsing.pMul-mem$3    match exhaustiveness                                             ?:?  valid  U:orb-smt-z3          0.096 ║
║ PackratParsing.pMul-mem$3    match exhaustiveness                                             ?:?  valid  U:orb-smt-z3          0.072 ║
║ PackratParsing.pMul-mem$3    postcondition                                                    ?:?  valid  U:orb-smt-orb-cvc4    0.801 ║
║ PackratParsing.pMul-mem$3    precond. (call pMul-mem$3(a$188, primRes$1._2))                  ?:?  valid  U:orb-smt-orb-cvc4    0.945 ║
║ PackratParsing.pMul-mem$3    precond. (call pPrim-mem$3(i, st@))                              ?:?  valid  U:orb-smt-z3          0.080 ║
║ PackratParsing.pMul-mem$3    precond. (call pPrim-mem$3(i, st@))                              ?:?  valid  U:orb-smt-z3          0.034 ║
║ PackratParsing.pPrim-mem$3   match exhaustiveness                                             ?:?  valid  U:orb-smt-z3          0.053 ║
║ PackratParsing.pPrim-mem$3   match exhaustiveness                                             ?:?  valid  U:orb-smt-z3          0.101 ║
║ PackratParsing.pPrim-mem$3   postcondition                                                    ?:?  valid  U:orb-smt-z3          0.281 ║
║ PackratParsing.pPrim-mem$3   precond. (call pAdd-mem$3(a$185, st@))                           ?:?  valid  U:orb-smt-z3          0.205 ║
║ PackratParsing.parse$5       match exhaustiveness                                             ?:?  valid  U:orb-smt-z3          0.027 ║
║ PackratParsing.parse$5       postcondition                                                    ?:?  valid  U:orb-smt-z3          0.509 ║
║ PackratParsing.parse$5       precond. (call allEval$5(n, x$2._2))                             ?:?  valid  U:orb-smt-z3          0.065 ║
║ PackratParsing.parse$5       precond. (call invoke$5(n, scr._2))                              ?:?  valid  U:orb-smt-z3          0.239 ║
║ PackratParsing.parse$5       precond. (call invoke$5(n, st@))                                 ?:?  valid  U:orb-smt-z3          0.052 ║
║ PackratParsing.parse$5       precond. (call parse$5(n - BigInt(1), st@))                      ?:?  valid  U:orb-smt-z3          0.028 ║
║ PackratParsing.resEval$5     match exhaustiveness                                             ?:?  valid  U:orb-smt-z3          0.045 ║
║ PackratParsing.resEval$5     postcondition                                                    ?:?  valid  U:orb-smt-z3          0.057 ║
║ PackratParsing.resEval$5     precond. (call depsLem$5(j, i - BigInt(1), st@))                 ?:?  valid  U:orb-smt-z3          0.046 ║
╟┄┄┄┄┄┄┄┄┄┄┄┄┄┄┄┄┄┄┄┄┄┄┄┄┄┄┄┄┄┄┄┄┄┄┄┄┄┄┄┄┄┄┄┄┄┄┄┄┄┄┄┄┄┄┄┄┄┄┄┄┄┄┄┄┄┄┄┄┄┄┄┄┄┄┄┄┄┄┄┄┄┄┄┄┄┄┄┄┄┄┄┄┄┄┄┄┄┄┄┄┄┄┄┄┄┄┄┄┄┄┄┄┄┄┄┄┄┄┄┄┄┄┄┄┄┄┄┄┄┄┄┄┄┄┄╢
║ total: 57     valid: 57     invalid: 0      unknown 0                                                                          10.019 ║
╚════════════════════════════════════════════════════════════════════════════════════════════════════════════════════════════════════════
[[34m  Info  [0m] - considering function pAdd-mem-steps...
[[34m  Info  [0m] Candidate invariants
[[34m  Info  [0m] pAdd-mem-steps-->1 * res$219._2 + 0 <= 0
[[34m  Info  [0m] checked VC inst... in 0.031s
[[34m  Info  [0m] Function: pAdd-mem-steps--Found candidate invariant is not a real invariant! 
[[34m  Info  [0m] # of atomic predicates: 6 + 1
[[34m  Info  [0m] Candidate invariants
[[34m  Info  [0m] pAdd-mem-steps-->1 * res$219._2 + -5 <= 0
[[34m  Info  [0m] checked VC inst... in 0.038s
[[34m  Info  [0m] Function: pAdd-mem-steps--Found candidate invariant is not a real invariant! 
[[34m  Info  [0m] # of atomic predicates: 9 + 7
[[34m  Info  [0m] Candidate invariants
[[34m  Info  [0m] pAdd-mem-steps-->1 * res$219._2 + -11 <= 0
[[34m  Info  [0m] checked VC inst... in 0.039s
[[34m  Info  [0m] Function: pAdd-mem-steps--Found candidate invariant is not a real invariant! 
[[34m  Info  [0m] # of atomic predicates: 9 + 16
[[34m  Info  [0m] Candidate invariants
[[34m  Info  [0m] pAdd-mem-steps-->1 * res$219._2 + -15 <= 0
[[34m  Info  [0m] checked VC inst... in 0.215s
[[34m  Info  [0m] Function: pAdd-mem-steps--Found candidate invariant is not a real invariant! 
[[34m  Info  [0m] # of atomic predicates: 10 + 25
[[34m  Info  [0m] - More unrollings for invariant inference
[[34m  Info  [0m] Creating VC for pMul-mem-steps
[[34m  Info  [0m] Candidate invariants
[[34m  Info  [0m] pAdd-mem-steps-->1 * res$219._2 + 0 <= 0
[[34m  Info  [0m] pMul-mem-steps-->1 * res$223._2 + 0 <= 0
[[34m  Info  [0m] checked VC inst... in 0.056s
[[34m  Info  [0m] Function: pAdd-mem-steps--Found candidate invariant is not a real invariant! 
[[34m  Info  [0m] checked VC inst... in 0.018s
[[34m  Info  [0m] Function: pMul-mem-steps--Found candidate invariant is not a real invariant! 
[[34m  Info  [0m] # of atomic predicates: 16 + 1
[[34m  Info  [0m] Candidate invariants
[[34m  Info  [0m] pAdd-mem-steps-->1 * res$219._2 + -5 <= 0
[[34m  Info  [0m] pMul-mem-steps-->1 * res$223._2 + -5 <= 0
[[34m  Info  [0m] checked VC inst... in 0.047s
[[34m  Info  [0m] Function: pAdd-mem-steps--Found candidate invariant is not a real invariant! 
[[34m  Info  [0m] checked VC inst... in 0.013s
[[34m  Info  [0m] Function: pMul-mem-steps--Found candidate invariant is not a real invariant! 
[[34m  Info  [0m] # of atomic predicates: 23 + 17
[[34m  Info  [0m] Candidate invariants
[[34m  Info  [0m] pAdd-mem-steps-->1 * res$219._2 + -11 <= 0
[[34m  Info  [0m] pMul-mem-steps-->1 * res$223._2 + -11 <= 0
[[34m  Info  [0m] checked VC inst... in 0.046s
[[34m  Info  [0m] Function: pAdd-mem-steps--Found candidate invariant is not a real invariant! 
[[34m  Info  [0m] checked VC inst... in 0.018s
[[34m  Info  [0m] Function: pMul-mem-steps--Found candidate invariant is not a real invariant! 
[[34m  Info  [0m] # of atomic predicates: 26 + 40
[[34m  Info  [0m] Candidate invariants
[[34m  Info  [0m] pAdd-mem-steps-->1 * res$219._2 + -15 <= 0
[[34m  Info  [0m] pMul-mem-steps-->1 * res$223._2 + -15 <= 0
[[34m  Info  [0m] checked VC inst... in 0.318s
[[34m  Info  [0m] Function: pAdd-mem-steps--Found candidate invariant is not a real invariant! 
[[34m  Info  [0m] checked VC inst... in 0.041s
[[34m  Info  [0m] Function: pMul-mem-steps--Found candidate invariant is not a real invariant! 
[[34m  Info  [0m] # of atomic predicates: 27 + 66
[[34m  Info  [0m] - More unrollings for invariant inference
[[34m  Info  [0m] Creating VC for pPrim-mem-steps
[[34m  Info  [0m] Candidate invariants
[[34m  Info  [0m] pAdd-mem-steps-->1 * res$219._2 + 0 <= 0
[[34m  Info  [0m] pMul-mem-steps-->1 * res$223._2 + 0 <= 0
[[34m  Info  [0m] pPrim-mem-steps-->1 * res$221._2 + 0 <= 0
[[34m  Info  [0m] checked VC inst... in 0.141s
[[34m  Info  [0m] Function: pAdd-mem-steps--Found candidate invariant is not a real invariant! 
[[34m  Info  [0m] checked VC inst... in 0.03s
[[34m  Info  [0m] Function: pMul-mem-steps--Found candidate invariant is not a real invariant! 
[[34m  Info  [0m] checked VC inst... in 0.008s
[[34m  Info  [0m] Function: pPrim-mem-steps--Found candidate invariant is not a real invariant! 
[[34m  Info  [0m] # of atomic predicates: 32 + 1
[[34m  Info  [0m] Candidate invariants
[[34m  Info  [0m] pAdd-mem-steps-->1 * res$219._2 + -5 <= 0
[[34m  Info  [0m] pMul-mem-steps-->1 * res$223._2 + -4 <= 0
[[34m  Info  [0m] pPrim-mem-steps-->1 * res$221._2 + -8 <= 0
[[34m  Info  [0m] checked VC inst... in 0.119s
[[34m  Info  [0m] Function: pAdd-mem-steps--Found candidate invariant is not a real invariant! 
[[34m  Info  [0m] checked VC inst... in 0.024s
[[34m  Info  [0m] Function: pMul-mem-steps--Found candidate invariant is not a real invariant! 
[[34m  Info  [0m] checked VC inst... in 0.002s
[[34m  Info  [0m] # of atomic predicates: 32 + 33
[[34m  Info  [0m] Candidate invariants
[[34m  Info  [0m] pAdd-mem-steps-->1 * res$219._2 + -11 <= 0
[[34m  Info  [0m] pMul-mem-steps-->1 * res$223._2 + -11 <= 0
[[34m  Info  [0m] pPrim-mem-steps-->1 * res$221._2 + -8 <= 0
[[34m  Info  [0m] checked VC inst... in 0.085s
[[34m  Info  [0m] Function: pAdd-mem-steps--Found candidate invariant is not a real invariant! 
[[34m  Info  [0m] checked VC inst... in 0.017s
[[34m  Info  [0m] Function: pMul-mem-steps--Found candidate invariant is not a real invariant! 
[[34m  Info  [0m] checked VC inst... in 0.002s
[[34m  Info  [0m] # of atomic predicates: 40 + 65
[[34m  Info  [0m] Candidate invariants
[[34m  Info  [0m] pAdd-mem-steps-->1 * res$219._2 + -15 <= 0
[[34m  Info  [0m] pMul-mem-steps-->1 * res$223._2 + -15 <= 0
[[34m  Info  [0m] pPrim-mem-steps-->1 * res$221._2 + -8 <= 0
[[34m  Info  [0m] checked VC inst... in 0.085s
[[34m  Info  [0m] Function: pAdd-mem-steps--Found candidate invariant is not a real invariant! 
[[34m  Info  [0m] checked VC inst... in 0.02s
[[34m  Info  [0m] Function: pMul-mem-steps--Found candidate invariant is not a real invariant! 
[[34m  Info  [0m] checked VC inst... in 0.001s
[[34m  Info  [0m] # of atomic predicates: 40 + 105
[[34m  Info  [0m] - More unrollings for invariant inference
[[34m  Info  [0m] Candidate invariants
[[34m  Info  [0m] pAdd-mem-steps-->1 * res$219._2 + 0 <= 0
[[34m  Info  [0m] pMul-mem-steps-->1 * res$223._2 + 0 <= 0
[[34m  Info  [0m] pPrim-mem-steps-->1 * res$221._2 + 0 <= 0
[[34m  Info  [0m] checked VC inst... in 0.47s
[[34m  Info  [0m] Function: pAdd-mem-steps--Found candidate invariant is not a real invariant! 
[[34m  Info  [0m] checked VC inst... in 0.081s
[[34m  Info  [0m] Function: pMul-mem-steps--Found candidate invariant is not a real invariant! 
[[34m  Info  [0m] checked VC inst... in 0.023s
[[34m  Info  [0m] Function: pPrim-mem-steps--Found candidate invariant is not a real invariant! 
[[34m  Info  [0m] # of atomic predicates: 34 + 1
[[34m  Info  [0m] Candidate invariants
[[34m  Info  [0m] pAdd-mem-steps-->1 * res$219._2 + -5 <= 0
[[34m  Info  [0m] pMul-mem-steps-->1 * res$223._2 + -4 <= 0
[[34m  Info  [0m] pPrim-mem-steps-->1 * res$221._2 + -7 <= 0
[[34m  Info  [0m] checked VC inst... in 0.377s
[[34m  Info  [0m] Function: pAdd-mem-steps--Found candidate invariant is not a real invariant! 
[[34m  Info  [0m] checked VC inst... in 0.051s
[[34m  Info  [0m] Function: pMul-mem-steps--Found candidate invariant is not a real invariant! 
[[34m  Info  [0m] checked VC inst... in 0.021s
[[34m  Info  [0m] Function: pPrim-mem-steps--Found candidate invariant is not a real invariant! 
[[34m  Info  [0m] # of atomic predicates: 45 + 35
[[34m  Info  [0m] Candidate invariants
[[34m  Info  [0m] pAdd-mem-steps-->1 * res$219._2 + -11 <= 0
[[34m  Info  [0m] pMul-mem-steps-->1 * res$223._2 + -11 <= 0
[[34m  Info  [0m] pPrim-mem-steps-->1 * res$221._2 + -9 <= 0
[[34m  Info  [0m] checked VC inst... in 0.225s
[[34m  Info  [0m] Function: pAdd-mem-steps--Found candidate invariant is not a real invariant! 
[[34m  Info  [0m] checked VC inst... in 0.049s
[[34m  Info  [0m] Function: pMul-mem-steps--Found candidate invariant is not a real invariant! 
[[34m  Info  [0m] checked VC inst... in 0.002s
[[34m  Info  [0m] # of atomic predicates: 46 + 80
[[34m  Info  [0m] Candidate invariants
[[34m  Info  [0m] pAdd-mem-steps-->1 * res$219._2 + -15 <= 0
[[34m  Info  [0m] pMul-mem-steps-->1 * res$223._2 + -15 <= 0
[[34m  Info  [0m] pPrim-mem-steps-->1 * res$221._2 + -9 <= 0
[[34m  Info  [0m] checked VC inst... in 0.174s
[[34m  Info  [0m] Function: pAdd-mem-steps--Found candidate invariant is not a real invariant! 
[[34m  Info  [0m] checked VC inst... in 0.035s
[[34m  Info  [0m] Function: pMul-mem-steps--Found candidate invariant is not a real invariant! 
[[34m  Info  [0m] checked VC inst... in 0.002s
[[34m  Info  [0m] # of atomic predicates: 46 + 126
[[34m  Info  [0m] - More unrollings for invariant inference
[[34m  Info  [0m] Candidate invariants
[[34m  Info  [0m] pAdd-mem-steps-->1 * res$219._2 + 0 <= 0
[[34m  Info  [0m] pMul-mem-steps-->1 * res$223._2 + 0 <= 0
[[34m  Info  [0m] pPrim-mem-steps-->1 * res$221._2 + 0 <= 0
[[34m  Info  [0m] checked VC inst... in 0.681s
[[34m  Info  [0m] Function: pAdd-mem-steps--Found candidate invariant is not a real invariant! 
[[34m  Info  [0m] checked VC inst... in 0.087s
[[34m  Info  [0m] Function: pMul-mem-steps--Found candidate invariant is not a real invariant! 
[[34m  Info  [0m] checked VC inst... in 0.026s
[[34m  Info  [0m] Function: pPrim-mem-steps--Found candidate invariant is not a real invariant! 
[[34m  Info  [0m] # of atomic predicates: 34 + 1
[[34m  Info  [0m] Candidate invariants
[[34m  Info  [0m] pAdd-mem-steps-->1 * res$219._2 + -5 <= 0
[[34m  Info  [0m] pMul-mem-steps-->1 * res$223._2 + -4 <= 0
[[34m  Info  [0m] pPrim-mem-steps-->1 * res$221._2 + -7 <= 0
[[34m  Info  [0m] checked VC inst... in 0.532s
[[34m  Info  [0m] Function: pAdd-mem-steps--Found candidate invariant is not a real invariant! 
[[34m  Info  [0m] checked VC inst... in 0.082s
[[34m  Info  [0m] Function: pMul-mem-steps--Found candidate invariant is not a real invariant! 
[[34m  Info  [0m] checked VC inst... in 0.02s
[[34m  Info  [0m] Function: pPrim-mem-steps--Found candidate invariant is not a real invariant! 
[[34m  Info  [0m] # of atomic predicates: 43 + 35
[[34m  Info  [0m] Candidate invariants
[[34m  Info  [0m] pAdd-mem-steps-->1 * res$219._2 + -11 <= 0
[[34m  Info  [0m] pMul-mem-steps-->1 * res$223._2 + -11 <= 0
[[34m  Info  [0m] pPrim-mem-steps-->1 * res$221._2 + -9 <= 0
[[34m  Info  [0m] checked VC inst... in 0.225s
[[34m  Info  [0m] Function: pAdd-mem-steps--Found candidate invariant is not a real invariant! 
[[34m  Info  [0m] checked VC inst... in 0.067s
[[34m  Info  [0m] Function: pMul-mem-steps--Found candidate invariant is not a real invariant! 
[[34m  Info  [0m] checked VC inst... in 0.007s
[[34m  Info  [0m] # of atomic predicates: 48 + 78
[[34m  Info  [0m] Candidate invariants
[[34m  Info  [0m] pAdd-mem-steps-->1 * res$219._2 + -15 <= 0
[[34m  Info  [0m] pMul-mem-steps-->1 * res$223._2 + -15 <= 0
[[34m  Info  [0m] pPrim-mem-steps-->1 * res$221._2 + -9 <= 0
[[34m  Info  [0m] checked VC inst... in 0.231s
[[34m  Info  [0m] Function: pAdd-mem-steps--Found candidate invariant is not a real invariant! 
[[34m  Info  [0m] checked VC inst... in 0.049s
[[34m  Info  [0m] Function: pMul-mem-steps--Found candidate invariant is not a real invariant! 
[[34m  Info  [0m] checked VC inst... in 0.002s
[[34m  Info  [0m] # of atomic predicates: 48 + 126
[[34m  Info  [0m] - More unrollings for invariant inference
[[34m  Info  [0m] Candidate invariants
[[34m  Info  [0m] pAdd-mem-steps-->1 * res$219._2 + 0 <= 0
[[34m  Info  [0m] pMul-mem-steps-->1 * res$223._2 + 0 <= 0
[[34m  Info  [0m] pPrim-mem-steps-->1 * res$221._2 + 0 <= 0
[[34m  Info  [0m] checked VC inst... in 0.768s
[[34m  Info  [0m] Function: pAdd-mem-steps--Found candidate invariant is not a real invariant! 
[[34m  Info  [0m] checked VC inst... in 0.08s
[[34m  Info  [0m] Function: pMul-mem-steps--Found candidate invariant is not a real invariant! 
[[34m  Info  [0m] checked VC inst... in 0.047s
[[34m  Info  [0m] Function: pPrim-mem-steps--Found candidate invariant is not a real invariant! 
[[34m  Info  [0m] # of atomic predicates: 34 + 1
[[34m  Info  [0m] Candidate invariants
[[34m  Info  [0m] pAdd-mem-steps-->1 * res$219._2 + -5 <= 0
[[34m  Info  [0m] pMul-mem-steps-->1 * res$223._2 + -4 <= 0
[[34m  Info  [0m] pPrim-mem-steps-->1 * res$221._2 + -7 <= 0
[[34m  Info  [0m] checked VC inst... in 0.609s
[[34m  Info  [0m] Function: pAdd-mem-steps--Found candidate invariant is not a real invariant! 
[[34m  Info  [0m] checked VC inst... in 0.074s
[[34m  Info  [0m] Function: pMul-mem-steps--Found candidate invariant is not a real invariant! 
[[34m  Info  [0m] checked VC inst... in 0.025s
[[34m  Info  [0m] Function: pPrim-mem-steps--Found candidate invariant is not a real invariant! 
[[34m  Info  [0m] # of atomic predicates: 43 + 35
[[34m  Info  [0m] Candidate invariants
[[34m  Info  [0m] pAdd-mem-steps-->1 * res$219._2 + -11 <= 0
[[34m  Info  [0m] pMul-mem-steps-->1 * res$223._2 + -11 <= 0
[[34m  Info  [0m] pPrim-mem-steps-->1 * res$221._2 + -9 <= 0
[[34m  Info  [0m] checked VC inst... in 0.243s
[[34m  Info  [0m] Function: pAdd-mem-steps--Found candidate invariant is not a real invariant! 
[[34m  Info  [0m] checked VC inst... in 0.063s
[[34m  Info  [0m] Function: pMul-mem-steps--Found candidate invariant is not a real invariant! 
[[34m  Info  [0m] checked VC inst... in 0.004s
[[34m  Info  [0m] # of atomic predicates: 50 + 78
[[34m  Info  [0m] Candidate invariants
[[34m  Info  [0m] pAdd-mem-steps-->1 * res$219._2 + -15 <= 0
[[34m  Info  [0m] pMul-mem-steps-->1 * res$223._2 + -15 <= 0
[[34m  Info  [0m] pPrim-mem-steps-->1 * res$221._2 + -9 <= 0
[[34m  Info  [0m] checked VC inst... in 0.218s
[[34m  Info  [0m] Function: pAdd-mem-steps--Found candidate invariant is not a real invariant! 
[[34m  Info  [0m] checked VC inst... in 0.053s
[[34m  Info  [0m] Function: pMul-mem-steps--Found candidate invariant is not a real invariant! 
[[34m  Info  [0m] checked VC inst... in 0.002s
[[34m  Info  [0m] # of atomic predicates: 50 + 128
[[34m  Info  [0m] - More unrollings for invariant inference
[[34m  Info  [0m] Candidate invariants
[[34m  Info  [0m] pAdd-mem-steps-->1 * res$219._2 + 0 <= 0
[[34m  Info  [0m] pMul-mem-steps-->1 * res$223._2 + 0 <= 0
[[34m  Info  [0m] pPrim-mem-steps-->1 * res$221._2 + 0 <= 0
[[34m  Info  [0m] checked VC inst... in 0.829s
[[34m  Info  [0m] Function: pAdd-mem-steps--Found candidate invariant is not a real invariant! 
[[34m  Info  [0m] checked VC inst... in 0.102s
[[34m  Info  [0m] Function: pMul-mem-steps--Found candidate invariant is not a real invariant! 
[[34m  Info  [0m] checked VC inst... in 0.042s
[[34m  Info  [0m] Function: pPrim-mem-steps--Found candidate invariant is not a real invariant! 
[[34m  Info  [0m] # of atomic predicates: 34 + 1
[[34m  Info  [0m] Candidate invariants
[[34m  Info  [0m] pAdd-mem-steps-->1 * res$219._2 + -5 <= 0
[[34m  Info  [0m] pMul-mem-steps-->1 * res$223._2 + -4 <= 0
[[34m  Info  [0m] pPrim-mem-steps-->1 * res$221._2 + -7 <= 0
[[34m  Info  [0m] checked VC inst... in 0.618s
[[34m  Info  [0m] Function: pAdd-mem-steps--Found candidate invariant is not a real invariant! 
[[34m  Info  [0m] checked VC inst... in 0.115s
[[34m  Info  [0m] Function: pMul-mem-steps--Found candidate invariant is not a real invariant! 
[[34m  Info  [0m] checked VC inst... in 0.027s
[[34m  Info  [0m] Function: pPrim-mem-steps--Found candidate invariant is not a real invariant! 
[[34m  Info  [0m] # of atomic predicates: 43 + 35
[[34m  Info  [0m] Candidate invariants
[[34m  Info  [0m] pAdd-mem-steps-->1 * res$219._2 + -11 <= 0
[[34m  Info  [0m] pMul-mem-steps-->1 * res$223._2 + -11 <= 0
[[34m  Info  [0m] pPrim-mem-steps-->1 * res$221._2 + -9 <= 0
[[34m  Info  [0m] checked VC inst... in 0.269s
[[34m  Info  [0m] Function: pAdd-mem-steps--Found candidate invariant is not a real invariant! 
[[34m  Info  [0m] checked VC inst... in 0.108s
[[34m  Info  [0m] Function: pMul-mem-steps--Found candidate invariant is not a real invariant! 
[[34m  Info  [0m] checked VC inst... in 0.003s
[[34m  Info  [0m] # of atomic predicates: 50 + 78
[[34m  Info  [0m] Candidate invariants
[[34m  Info  [0m] pAdd-mem-steps-->1 * res$219._2 + -15 <= 0
[[34m  Info  [0m] pMul-mem-steps-->1 * res$223._2 + -15 <= 0
[[34m  Info  [0m] pPrim-mem-steps-->1 * res$221._2 + -9 <= 0
[[34m  Info  [0m] checked VC inst... in 0.232s
[[34m  Info  [0m] Function: pAdd-mem-steps--Found candidate invariant is not a real invariant! 
[[34m  Info  [0m] checked VC inst... in 0.113s
[[34m  Info  [0m] Function: pMul-mem-steps--Found candidate invariant is not a real invariant! 
[[34m  Info  [0m] checked VC inst... in 0.002s
[[34m  Info  [0m] # of atomic predicates: 53 + 128
[[34m  Info  [0m] - More unrollings for invariant inference
[[34m  Info  [0m] Candidate invariants
[[34m  Info  [0m] pAdd-mem-steps-->1 * res$219._2 + 0 <= 0
[[34m  Info  [0m] pMul-mem-steps-->1 * res$223._2 + 0 <= 0
[[34m  Info  [0m] pPrim-mem-steps-->1 * res$221._2 + 0 <= 0
[[34m  Info  [0m] checked VC inst... in 2.536s
[[34m  Info  [0m] Function: pAdd-mem-steps--Found candidate invariant is not a real invariant! 
[[34m  Info  [0m] checked VC inst... in 0.102s
[[34m  Info  [0m] Function: pMul-mem-steps--Found candidate invariant is not a real invariant! 
[[34m  Info  [0m] checked VC inst... in 0.037s
[[34m  Info  [0m] Function: pPrim-mem-steps--Found candidate invariant is not a real invariant! 
[[34m  Info  [0m] # of atomic predicates: 34 + 1
[[34m  Info  [0m] Candidate invariants
[[34m  Info  [0m] pAdd-mem-steps-->1 * res$219._2 + -5 <= 0
[[34m  Info  [0m] pMul-mem-steps-->1 * res$223._2 + -4 <= 0
[[34m  Info  [0m] pPrim-mem-steps-->1 * res$221._2 + -7 <= 0
[[34m  Info  [0m] checked VC inst... in 2.056s
[[34m  Info  [0m] Function: pAdd-mem-steps--Found candidate invariant is not a real invariant! 
[[34m  Info  [0m] checked VC inst... in 0.125s
[[34m  Info  [0m] Function: pMul-mem-steps--Found candidate invariant is not a real invariant! 
[[34m  Info  [0m] checked VC inst... in 0.03s
[[34m  Info  [0m] Function: pPrim-mem-steps--Found candidate invariant is not a real invariant! 
[[34m  Info  [0m] # of atomic predicates: 43 + 35
[[34m  Info  [0m] Candidate invariants
[[34m  Info  [0m] pAdd-mem-steps-->1 * res$219._2 + -11 <= 0
[[34m  Info  [0m] pMul-mem-steps-->1 * res$223._2 + -11 <= 0
[[34m  Info  [0m] pPrim-mem-steps-->1 * res$221._2 + -9 <= 0
[[34m  Info  [0m] checked VC inst... in 0.516s
[[34m  Info  [0m] Function: pAdd-mem-steps--Found candidate invariant is not a real invariant! 
[[34m  Info  [0m] checked VC inst... in 0.11s
[[34m  Info  [0m] Function: pMul-mem-steps--Found candidate invariant is not a real invariant! 
[[34m  Info  [0m] checked VC inst... in 0.004s
[[34m  Info  [0m] # of atomic predicates: 50 + 78
[[34m  Info  [0m] Candidate invariants
[[34m  Info  [0m] pAdd-mem-steps-->1 * res$219._2 + -15 <= 0
[[34m  Info  [0m] pMul-mem-steps-->1 * res$223._2 + -15 <= 0
[[34m  Info  [0m] pPrim-mem-steps-->1 * res$221._2 + -9 <= 0
[[34m  Info  [0m] checked VC inst... in 0.527s
[[34m  Info  [0m] Function: pAdd-mem-steps--Found candidate invariant is not a real invariant! 
[[34m  Info  [0m] checked VC inst... in 0.109s
[[34m  Info  [0m] Function: pMul-mem-steps--Found candidate invariant is not a real invariant! 
[[34m  Info  [0m] checked VC inst... in 0.003s
[[34m  Info  [0m] # of atomic predicates: 56 + 128
[[34m  Info  [0m] Candidate invariants
[[34m  Info  [0m] pAdd-mem-steps-->1 * res$219._2 + -17 <= 0
[[34m  Info  [0m] pMul-mem-steps-->1 * res$223._2 + -17 <= 0
[[34m  Info  [0m] pPrim-mem-steps-->1 * res$221._2 + -9 <= 0
[[34m  Info  [0m] checked VC inst... in 1.194s
[[34m  Info  [0m] checked VC inst... in 0.194s
[[34m  Info  [0m] checked VC inst... in 0.003s
[[34m  Info  [0m] minimizing...
[[34m  Info  [0m] Candidate invariants
[[34m  Info  [0m] pAdd-mem-steps-->1 * res$219._2 + -16 <= 0
[[34m  Info  [0m] pMul-mem-steps-->1 * res$223._2 + -17 <= 0
[[34m  Info  [0m] pPrim-mem-steps-->1 * res$221._2 + -9 <= 0
[[34m  Info  [0m] checked VC inst... in 0.651s
[[34m  Info  [0m] checked VC inst... in 0.067s
[[34m  Info  [0m] checked VC inst... in 0.003s
[[34m  Info  [0m] - Found inductive invariant: pAdd-mem-steps --> steps + BigInt(-16) <= BigInt(0)
[[34m  Info  [0m] - Found inductive invariant: pMul-mem-steps --> steps + BigInt(-17) <= BigInt(0)
[[34m  Info  [0m] - Found inductive invariant: pPrim-mem-steps --> steps + BigInt(-9) <= BigInt(0)
[[34m  Info  [0m] - Verifying Invariants... 
[[34m  Info  [0m] - Invariant verified
[[34m  Info  [0m] - considering function pMul-mem-steps...
[[34m  Info  [0m] - considering function pPrim-mem-steps...
[[34m  Info  [0m] - considering function invokePrim-steps...
[[34m  Info  [0m] Candidate invariants
[[34m  Info  [0m] invokePrim-steps-->1 * res$220._2 + 0 <= 0
[[34m  Info  [0m] checked VC inst... in 0.004s
[[34m  Info  [0m] Function: invokePrim-steps--Found candidate invariant is not a real invariant! 
[[34m  Info  [0m] # of atomic predicates: 8 + 1
[[34m  Info  [0m] Candidate invariants
[[34m  Info  [0m] invokePrim-steps-->1 * res$220._2 + -3 <= 0
[[34m  Info  [0m] checked VC inst... in 0.002s
[[34m  Info  [0m] Function: invokePrim-steps--Found candidate invariant is not a real invariant! 
[[34m  Info  [0m] # of atomic predicates: 7 + 9
[[34m  Info  [0m] Candidate invariants
[[34m  Info  [0m] invokePrim-steps-->1 * res$220._2 + -13 <= 0
[[34m  Info  [0m] checked VC inst... in 0.003s
[[34m  Info  [0m] minimizing...
[[34m  Info  [0m] Candidate invariants
[[34m  Info  [0m] invokePrim-steps-->1 * res$220._2 + -12 <= 0
[[34m  Info  [0m] checked VC inst... in 0.002s
[[34m  Info  [0m] - Found inductive invariant: invokePrim-steps --> steps + BigInt(-12) <= BigInt(0)
[[34m  Info  [0m] - Verifying Invariants... 
[[34m  Info  [0m] - Invariant verified
[[34m  Info  [0m] - considering function invokeMul-steps...
[[34m  Info  [0m] Candidate invariants
[[34m  Info  [0m] invokeMul-steps-->1 * res$222._2 + 0 <= 0
[[34m  Info  [0m] checked VC inst... in 0.01s
[[34m  Info  [0m] Function: invokeMul-steps--Found candidate invariant is not a real invariant! 
[[34m  Info  [0m] # of atomic predicates: 9 + 1
[[34m  Info  [0m] Candidate invariants
[[34m  Info  [0m] invokeMul-steps-->1 * res$222._2 + -17 <= 0
[[34m  Info  [0m] checked VC inst... in 0.005s
[[34m  Info  [0m] Function: invokeMul-steps--Found candidate invariant is not a real invariant! 
[[34m  Info  [0m] # of atomic predicates: 9 + 10
[[34m  Info  [0m] Candidate invariants
[[34m  Info  [0m] invokeMul-steps-->1 * res$222._2 + -35 <= 0
[[34m  Info  [0m] checked VC inst... in 0.002s
[[34m  Info  [0m] minimizing...
[[34m  Info  [0m] Candidate invariants
[[34m  Info  [0m] invokeMul-steps-->1 * res$222._2 + -34 <= 0
[[34m  Info  [0m] checked VC inst... in 0.001s
[[34m  Info  [0m] - Found inductive invariant: invokeMul-steps --> steps + BigInt(-34) <= BigInt(0)
[[34m  Info  [0m] - Verifying Invariants... 
[[34m  Info  [0m] - Invariant verified
[[34m  Info  [0m] - considering function invoke-steps...
[[34m  Info  [0m] Candidate invariants
[[34m  Info  [0m] invoke-steps-->1 * res$224._2 + 0 <= 0
[[34m  Info  [0m] checked VC inst... in 0.009s
[[34m  Info  [0m] Function: invoke-steps--Found candidate invariant is not a real invariant! 
[[34m  Info  [0m] # of atomic predicates: 9 + 1
[[34m  Info  [0m] Candidate invariants
[[34m  Info  [0m] invoke-steps-->1 * res$224._2 + -39 <= 0
[[34m  Info  [0m] checked VC inst... in 0.006s
[[34m  Info  [0m] Function: invoke-steps--Found candidate invariant is not a real invariant! 
[[34m  Info  [0m] # of atomic predicates: 9 + 10
[[34m  Info  [0m] Candidate invariants
[[34m  Info  [0m] invoke-steps-->1 * res$224._2 + -56 <= 0
[[34m  Info  [0m] checked VC inst... in 0.002s
[[34m  Info  [0m] minimizing...
[[34m  Info  [0m] Candidate invariants
[[34m  Info  [0m] invoke-steps-->1 * res$224._2 + -55 <= 0
[[34m  Info  [0m] checked VC inst... in 0.001s
[[34m  Info  [0m] - Found inductive invariant: invoke-steps --> steps + BigInt(-55) <= BigInt(0)
[[34m  Info  [0m] - Verifying Invariants... 
[[34m  Info  [0m] - Invariant verified
[[34m  Info  [0m] - considering function parse-steps...
[[34m  Info  [0m] Candidate invariants
[[34m  Info  [0m] parse-steps-->(1 * x$2$20._2 + 0 * n) + 0 <= 0
[[34m  Info  [0m] checked VC inst... in 0.01s
[[34m  Info  [0m] Function: parse-steps--Found candidate invariant is not a real invariant! 
[[34m  Info  [0m] # of atomic predicates: 11 + 1
[[34m  Info  [0m] - More unrollings for invariant inference
[[34m  Info  [0m] Candidate invariants
[[34m  Info  [0m] parse-steps-->(1 * x$2$20._2 + 0 * n) + 0 <= 0
[[34m  Info  [0m] checked VC inst... in 0.028s
[[34m  Info  [0m] Function: parse-steps--Found candidate invariant is not a real invariant! 
[[34m  Info  [0m] # of atomic predicates: 10 + 1
[[34m  Info  [0m] Candidate invariants
[[34m  Info  [0m] parse-steps-->(1 * x$2$20._2 + 0 * n) + -60 <= 0
[[34m  Info  [0m] checked VC inst... in 0.044s
[[34m  Info  [0m] Function: parse-steps--Found candidate invariant is not a real invariant! 
[[34m  Info  [0m] # of atomic predicates: 14 + 11
[[34m  Info  [0m] Candidate invariants
[[34m  Info  [0m] parse-steps-->(1 * x$2$20._2 + -9 * n) + -60 <= 0
[[34m  Info  [0m] checked VC inst... in 0.044s
[[34m  Info  [0m] Function: parse-steps--Found candidate invariant is not a real invariant! 
[[34m  Info  [0m] # of atomic predicates: 18 + 25
[[34m  Info  [0m] Candidate invariants
[[34m  Info  [0m] parse-steps-->(1 * x$2$20._2 + -44 * n) + -60 <= 0
[[34m  Info  [0m] checked VC inst... in 0.136s
[[34m  Info  [0m] Function: parse-steps--Found candidate invariant is not a real invariant! 
[[34m  Info  [0m] # of atomic predicates: 18 + 43
[[34m  Info  [0m] Candidate invariants
[[34m  Info  [0m] parse-steps-->(1 * x$2$20._2 + -62 * n) + -60 <= 0
[[34m  Info  [0m] checked VC inst... in 0.008s
[[34m  Info  [0m] minimizing...
[[34m  Info  [0m] Candidate invariants
[[34m  Info  [0m] parse-steps-->(1 * x$2$20._2 + -61 * n) + -58 <= 0
[[34m  Info  [0m] checked VC inst... in 0.007s
[[34m  Info  [0m] - Found inductive invariant: parse-steps --> (steps + BigInt(-61) * n) + BigInt(-58) <= BigInt(0)
[[34m  Info  [0m] - Verifying Invariants... 
[[34m  Info  [0m] - Invariant verified
Resource Verification Results: 
. ┌─────────━
╔═╡ Summary ═══════════════════════════════════════════════╗
║ └─────────┘                                              ║
║ invoke          steps <= 55             0.632            ║
║ invokeMul       steps <= 34             0.526            ║
║ invokePrim      steps <= 12             0.405            ║
║ pAdd            steps <= 16             35.873           ║
║ pMul            steps <= 17             0.000            ║
║ pPrim           steps <= 9              0.000            ║
║ parse           steps <= 61 * n + 58    1.555            ║
╟┄┄┄┄┄┄┄┄┄┄┄┄┄┄┄┄┄┄┄┄┄┄┄┄┄┄┄┄┄┄┄┄┄┄┄┄┄┄┄┄┄┄┄┄┄┄┄┄┄┄┄┄┄┄┄┄┄┄╢
║ total: 7     inferred: 7     unknown: 0     time: 38.991 ║
╚═══════════════════════════════════════════════════════════
[[34m  Info  [0m] Stats dumped to file: PackratParsing-stats.txt
