[[33mWarning [0m] warning: there were three feature warnings; re-run with -feature for details
[[33mWarning [0m] ./testcases/lazy-datastructures/withOrb/CyclicHammingStream.scala:99:15: Tree a.tailFun match {
[[33mWarning [0m]   case Susp(fun) =>
[[33mWarning [0m]     toFmatch[() => SCons](fun).fmatch[(BigInt) => BigInt, SCons, Boolean]((x0$1 : (BigInt) => BigInt, x1$1 : SCons) => (x0$1, x1$1) match {
[[33mWarning [0m]       case (f, xs) if toIs[() => SCons](fun).is[() => SCons](() => mapSusp(f, xs)) =>
[[33mWarning [0m]         xs.tailCached
[[33mWarning [0m]       case _ =>
[[33mWarning [0m]         false
[[33mWarning [0m]     })
[[33mWarning [0m]   case _ =>
[[33mWarning [0m]     false
[[33mWarning [0m] } is not properly typed (./testcases/lazy-datastructures/withOrb/CyclicHammingStream.scala:99:15)
               a.tailFun match {
                         [31m^[0m
[[33mWarning [0m] ./testcases/lazy-datastructures/withOrb/CyclicHammingStream.scala:101:13: Tree toFmatch[() => SCons](fun).fmatch[(BigInt) => BigInt, SCons, Boolean]((x0$1 : (BigInt) => BigInt, x1$1 : SCons) => (x0$1, x1$1) match {
[[33mWarning [0m]   case (f, xs) if toIs[() => SCons](fun).is[() => SCons](() => mapSusp(f, xs)) =>
[[33mWarning [0m]     xs.tailCached
[[33mWarning [0m]   case _ =>
[[33mWarning [0m]     false
[[33mWarning [0m] }) is not properly typed (./testcases/lazy-datastructures/withOrb/CyclicHammingStream.scala:101:13)
                   fun fmatch[BigInt => BigInt, SCons, Boolean] {
                       [31m^^^^^^[0m
[[33mWarning [0m] ./testcases/lazy-datastructures/withOrb/CyclicHammingStream.scala:114:22: Tree mergeArg.tailFun match {
[[33mWarning [0m]   case Susp(fun) =>
[[33mWarning [0m]     toFmatch[() => SCons](fun).fmatch[(BigInt) => BigInt, SCons, Boolean]((x0$2 : (BigInt) => BigInt, x1$2 : SCons) => (x0$2, x1$2) match {
[[33mWarning [0m]       case (f, xs) if toIs[() => SCons](fun).is[() => SCons](() => mapSusp(f, xs)) =>
[[33mWarning [0m]         xs == first
[[33mWarning [0m]       case _ =>
[[33mWarning [0m]         false
[[33mWarning [0m]     })
[[33mWarning [0m]   case _ =>
[[33mWarning [0m]     false
[[33mWarning [0m] } is not properly typed (./testcases/lazy-datastructures/withOrb/CyclicHammingStream.scala:114:22)
               mergeArg.tailFun match {
                                [31m^[0m
[[33mWarning [0m] ./testcases/lazy-datastructures/withOrb/CyclicHammingStream.scala:116:13: Tree toFmatch[() => SCons](fun).fmatch[(BigInt) => BigInt, SCons, Boolean]((x0$2 : (BigInt) => BigInt, x1$2 : SCons) => (x0$2, x1$2) match {
[[33mWarning [0m]   case (f, xs) if toIs[() => SCons](fun).is[() => SCons](() => mapSusp(f, xs)) =>
[[33mWarning [0m]     xs == first
[[33mWarning [0m]   case _ =>
[[33mWarning [0m]     false
[[33mWarning [0m] }) is not properly typed (./testcases/lazy-datastructures/withOrb/CyclicHammingStream.scala:116:13)
                   fun fmatch[BigInt => BigInt, SCons, Boolean] {
                       [31m^^^^^^[0m
[[33mWarning [0m] ./testcases/lazy-datastructures/withOrb/CyclicHammingStream.scala:125:5: Tree val first = s
[[33mWarning [0m] val second = first.tailVal
[[33mWarning [0m] second.tailFun match {
[[33mWarning [0m]   case Susp(fun) =>
[[33mWarning [0m]     toFmatch[() => SCons](fun).fmatch[SCons, SCons, SCons, Boolean]((x0$3 : SCons, x1$3 : SCons, x2$1 : SCons) => (x0$3, x1$3, x2$1) match {
[[33mWarning [0m]       case (a, b, c) if toIs[() => SCons](fun).is[() => SCons](() => mergeSusp(a, b, c)) =>
[[33mWarning [0m]         mergeUsesMap(first, a) && mergeUsesMap(first, b) && mergeUsesMap(first, c)
[[33mWarning [0m]       case _ =>
[[33mWarning [0m]         false
[[33mWarning [0m]     })
[[33mWarning [0m]   case _ =>
[[33mWarning [0m]     false
[[33mWarning [0m] } is not properly typed (./testcases/lazy-datastructures/withOrb/CyclicHammingStream.scala:125:5)
               val first = s
               [31m^^^^[0m
[[33mWarning [0m] ./testcases/lazy-datastructures/withOrb/CyclicHammingStream.scala:126:5: Tree val second = first.tailVal
[[33mWarning [0m] second.tailFun match {
[[33mWarning [0m]   case Susp(fun) =>
[[33mWarning [0m]     toFmatch[() => SCons](fun).fmatch[SCons, SCons, SCons, Boolean]((x0$3 : SCons, x1$3 : SCons, x2$1 : SCons) => (x0$3, x1$3, x2$1) match {
[[33mWarning [0m]       case (a, b, c) if toIs[() => SCons](fun).is[() => SCons](() => mergeSusp(a, b, c)) =>
[[33mWarning [0m]         mergeUsesMap(first, a) && mergeUsesMap(first, b) && mergeUsesMap(first, c)
[[33mWarning [0m]       case _ =>
[[33mWarning [0m]         false
[[33mWarning [0m]     })
[[33mWarning [0m]   case _ =>
[[33mWarning [0m]     false
[[33mWarning [0m] } is not properly typed (./testcases/lazy-datastructures/withOrb/CyclicHammingStream.scala:126:5)
               val second = first.tailVal
               [31m^^^^[0m
[[33mWarning [0m] ./testcases/lazy-datastructures/withOrb/CyclicHammingStream.scala:127:20: Tree second.tailFun match {
[[33mWarning [0m]   case Susp(fun) =>
[[33mWarning [0m]     toFmatch[() => SCons](fun).fmatch[SCons, SCons, SCons, Boolean]((x0$3 : SCons, x1$3 : SCons, x2$1 : SCons) => (x0$3, x1$3, x2$1) match {
[[33mWarning [0m]       case (a, b, c) if toIs[() => SCons](fun).is[() => SCons](() => mergeSusp(a, b, c)) =>
[[33mWarning [0m]         mergeUsesMap(first, a) && mergeUsesMap(first, b) && mergeUsesMap(first, c)
[[33mWarning [0m]       case _ =>
[[33mWarning [0m]         false
[[33mWarning [0m]     })
[[33mWarning [0m]   case _ =>
[[33mWarning [0m]     false
[[33mWarning [0m] } is not properly typed (./testcases/lazy-datastructures/withOrb/CyclicHammingStream.scala:127:20)
               second.tailFun match {
                              [31m^[0m
[[33mWarning [0m] ./testcases/lazy-datastructures/withOrb/CyclicHammingStream.scala:129:13: Tree toFmatch[() => SCons](fun).fmatch[SCons, SCons, SCons, Boolean]((x0$3 : SCons, x1$3 : SCons, x2$1 : SCons) => (x0$3, x1$3, x2$1) match {
[[33mWarning [0m]   case (a, b, c) if toIs[() => SCons](fun).is[() => SCons](() => mergeSusp(a, b, c)) =>
[[33mWarning [0m]     mergeUsesMap(first, a) && mergeUsesMap(first, b) && mergeUsesMap(first, c)
[[33mWarning [0m]   case _ =>
[[33mWarning [0m]     false
[[33mWarning [0m] }) is not properly typed (./testcases/lazy-datastructures/withOrb/CyclicHammingStream.scala:129:13)
                   fun fmatch[SCons, SCons, SCons, Boolean] {
                       [31m^^^^^^[0m
[[34m  Info  [0m] Output written on leon.out
[[34m  Info  [0m] Output written on leon.out
[[34m  Info  [0m] Output written on leon.out
[[34m  Info  [0m] Output written on leon.out
[[34m  Info  [0m] Output written on leon.out
instfuncs: mapSusp,nthElemAfterSecond,map,hamGen,eval@BigInttBigInt@,fval-mem,min,merge,mergeSusp,next,nthHammingNumber,eval@tSCons@ instFuncTypes: 
[[34m  Info  [0m] Output written on leon.out
[[34m  Info  [0m] Output written on leon.out
[[34m  Info  [0m] Output written on leon.out
[[34m  Info  [0m]  - Now considering 'postcondition' VC for map10 @?:?...
[[34m  Info  [0m]  => VALID
[[34m  Info  [0m]  - Now considering 'match exhaustiveness' VC for map10 @?:?...
[[34m  Info  [0m]  => VALID
[[34m  Info  [0m]  - Now considering 'postcondition' VC for mapSusp4 @?:?...
[[34m  Info  [0m]  => VALID
[[34m  Info  [0m]  - Now considering 'match exhaustiveness' VC for mapSusp4 @?:?...
[[34m  Info  [0m]  => VALID
[[34m  Info  [0m]  - Now considering 'postcondition' VC for min6 @?:?...
[[34m  Info  [0m]  => VALID
[[34m  Info  [0m]  - Now considering 'postcondition' VC for merge4 @?:?...
[[34m  Info  [0m]  => VALID
[[34m  Info  [0m]  - Now considering 'postcondition' VC for mergeSusp4 @?:?...
[[34m  Info  [0m]  => VALID
[[34m  Info  [0m]  - Now considering 'match exhaustiveness' VC for mergeSusp4 @?:?...
[[34m  Info  [0m]  => VALID
[[34m  Info  [0m]  - Now considering 'match exhaustiveness' VC for mergeSusp4 @?:?...
[[34m  Info  [0m]  => VALID
[[34m  Info  [0m]  - Now considering 'match exhaustiveness' VC for mergeSusp4 @?:?...
[[34m  Info  [0m]  => VALID
[[34m  Info  [0m]  - Now considering 'postcondition' VC for constTimeArg4 @?:?...
[[34m  Info  [0m]  => VALID
[[34m  Info  [0m]  - Now considering 'match exhaustiveness' VC for constTimeArg4 @?:?...
[[34m  Info  [0m]  => VALID
[[34m  Info  [0m]  - Now considering 'match exhaustiveness' VC for constTimeArg4 @?:?...
[[34m  Info  [0m]  => VALID
[[34m  Info  [0m]  - Now considering 'match exhaustiveness' VC for constTimeArg4 @?:?...
[[34m  Info  [0m]  => VALID
[[34m  Info  [0m]  - Now considering 'postcondition' VC for mergeUsesMap4 @?:?...
[[34m  Info  [0m]  => VALID
[[34m  Info  [0m]  - Now considering 'match exhaustiveness' VC for mergeUsesMap4 @?:?...
[[34m  Info  [0m]  => VALID
[[34m  Info  [0m]  - Now considering 'match exhaustiveness' VC for mergeUsesMap4 @?:?...
[[34m  Info  [0m]  => VALID
[[34m  Info  [0m]  - Now considering 'postcondition' VC for mergeMapProp4 @?:?...
[[34m  Info  [0m]  => VALID
[[34m  Info  [0m]  - Now considering 'match exhaustiveness' VC for mergeMapProp4 @?:?...
[[34m  Info  [0m]  => VALID
[[34m  Info  [0m]  - Now considering 'match exhaustiveness' VC for mergeMapProp4 @?:?...
[[34m  Info  [0m]  => VALID
[[34m  Info  [0m]  - Now considering 'match exhaustiveness' VC for mergeMapProp4 @?:?...
[[34m  Info  [0m]  => VALID
[[34m  Info  [0m]  - Now considering 'postcondition' VC for argChainedStreamProp4 @?:?...
[[34m  Info  [0m]  => VALID
[[34m  Info  [0m]  - Now considering 'precond. (call argChainedStreamProp4(s.tailFun match { ...)' VC for argChainedStreamProp4 @?:?...
[[34m  Info  [0m]  => VALID
[[34m  Info  [0m]  - Now considering 'match exhaustiveness' VC for argChainedStreamProp4 @?:?...
[[34m  Info  [0m]  => VALID
[[34m  Info  [0m]  - Now considering 'postcondition' VC for argChainingIsTransitive4 @?:?...
[[34m  Info  [0m]  => VALID
[[34m  Info  [0m]  - Now considering 'precond. (call argChainingIsTransitive4(s.tailFun match ...)' VC for argChainingIsTransitive4 @?:?...
[[34m  Info  [0m]  => VALID
[[34m  Info  [0m]  - Now considering 'precond. (call argChainedStreamProp4(s, n))' VC for argChainingIsTransitive4 @?:?...
[[34m  Info  [0m]  => VALID
[[34m  Info  [0m]  - Now considering 'match exhaustiveness' VC for argChainingIsTransitive4 @?:?...
[[34m  Info  [0m]  => VALID
[[34m  Info  [0m]  - Now considering 'postcondition' VC for next6 @?:?...
[[34m  Info  [0m]  => VALID
[[34m  Info  [0m]  - Now considering 'match exhaustiveness' VC for next6 @?:?...
[[34m  Info  [0m]  => VALID
[[34m  Info  [0m]  - Now considering 'match exhaustiveness' VC for next6 @?:?...
[[34m  Info  [0m]  => VALID
[[34m  Info  [0m]  - Now considering 'match exhaustiveness' VC for next6 @?:?...
[[34m  Info  [0m]  => VALID
[[34m  Info  [0m]  - Now considering 'postcondition' VC for nthElemAfterSecond4 @?:?...
[[34m  Info  [0m]  => VALID
[[34m  Info  [0m]  - Now considering 'precond. (call argChainedStreamProp4(f, n))' VC for nthElemAfterSecond4 @?:?...
[[34m  Info  [0m]  => VALID
[[34m  Info  [0m]  - Now considering 'precond. (call next6(f, s, st@))' VC for nthElemAfterSecond4 @?:?...
[[34m  Info  [0m]  => VALID
[[34m  Info  [0m]  - Now considering 'precond. (call nthElemAfterSecond4(n - BigInt(1), s, t, ...)' VC for nthElemAfterSecond4 @?:?...
[[34m  Info  [0m]  => VALID
[[34m  Info  [0m]  - Now considering 'match exhaustiveness' VC for nthElemAfterSecond4 @?:?...
[[34m  Info  [0m]  => VALID
[[34m  Info  [0m]  - Now considering 'match exhaustiveness' VC for nthElemAfterSecond4 @?:?...
[[34m  Info  [0m]  => VALID
[[34m  Info  [0m]  - Now considering 'match exhaustiveness' VC for nthElemAfterSecond4 @?:?...
[[34m  Info  [0m]  => VALID
[[34m  Info  [0m]  - Now considering 'postcondition' VC for hamstream4 @?:?...
[[34m  Info  [0m]  => VALID
[[34m  Info  [0m]  - Now considering 'postcondition' VC for hamGen4 @?:?...
[[34m  Info  [0m]  => VALID
[[34m  Info  [0m]  - Now considering 'postcondition' VC for hamStreamSatisfiesProp4 @?:?...
[[34m  Info  [0m]  => VALID
[[34m  Info  [0m]  - Now considering 'precond. (call argChainingIsTransitive4(s, n))' VC for hamStreamSatisfiesProp4 @?:?...
[[34m  Info  [0m]  => VALID
[[34m  Info  [0m]  - Now considering 'precond. (call argChainedStreamProp4(s, n))' VC for hamStreamSatisfiesProp4 @?:?...
[[34m  Info  [0m]  => VALID
[[34m  Info  [0m]  - Now considering 'postcondition' VC for nthHammingNumber4 @?:?...
[[34m  Info  [0m]  => VALID
[[34m  Info  [0m]  - Now considering 'precond. (call hamStreamSatisfiesProp4(n))' VC for nthHammingNumber4 @?:?...
[[34m  Info  [0m]  => VALID
[[34m  Info  [0m]  - Now considering 'precond. (call nthElemAfterSecond4(n, first, second2._1 ...)' VC for nthHammingNumber4 @?:?...
[[34m  Info  [0m]  => VALID
[[34m  Info  [0m]  - Now considering 'match exhaustiveness' VC for nthHammingNumber4 @?:?...
[[34m  Info  [0m]  => VALID
[[34m  Info  [0m]  - Now considering 'postcondition' VC for fval-mem3 @?:?...
[[34m  Info  [0m]  => VALID
[[34m  Info  [0m]  - Now considering 'match exhaustiveness' VC for fval-mem3 @?:?...
[[34m  Info  [0m]  => VALID
  ┌──────────────────────━
╔═╡ Verification Summary ╞═══════════════════════════════════════════════════════════════════════════════════════════════════════════════════════╗
║ └──────────────────────┘                                                                                                                       ║
║ MergeAndHammingNumbers.argChainedStreamProp4     match exhaustiveness                                          ?:?  valid  U:smt-z3      0.013 ║
║ MergeAndHammingNumbers.argChainedStreamProp4     postcondition                                                 ?:?  valid  U:smt-cvc4    0.017 ║
║ MergeAndHammingNumbers.argChainedStreamProp4     precond. (call argChainedStreamProp4(s.tailFun match { ...)   ?:?  valid  U:smt-z3      0.013 ║
║ MergeAndHammingNumbers.argChainingIsTransitive4  match exhaustiveness                                          ?:?  valid  U:smt-z3      0.011 ║
║ MergeAndHammingNumbers.argChainingIsTransitive4  postcondition                                                 ?:?  valid  U:smt-z3      0.175 ║
║ MergeAndHammingNumbers.argChainingIsTransitive4  precond. (call argChainedStreamProp4(s, n))                   ?:?  valid  U:smt-z3      0.015 ║
║ MergeAndHammingNumbers.argChainingIsTransitive4  precond. (call argChainingIsTransitive4(s.tailFun match ...)  ?:?  valid  U:smt-cvc4    2.933 ║
║ MergeAndHammingNumbers.constTimeArg4             match exhaustiveness                                          ?:?  valid  U:smt-z3      0.012 ║
║ MergeAndHammingNumbers.constTimeArg4             match exhaustiveness                                          ?:?  valid  U:smt-cvc4    0.014 ║
║ MergeAndHammingNumbers.constTimeArg4             match exhaustiveness                                          ?:?  valid  U:smt-cvc4    0.011 ║
║ MergeAndHammingNumbers.constTimeArg4             postcondition                                                 ?:?  valid  U:smt-z3      0.039 ║
║ ValOrSusp.fval-mem3                              match exhaustiveness                                          ?:?  valid  U:smt-z3      0.009 ║
║ ValOrSusp.fval-mem3                              postcondition                                                 ?:?  valid  U:smt-z3      0.062 ║
║ MergeAndHammingNumbers.hamGen4                   postcondition                                                 ?:?  valid  U:smt-z3      0.022 ║
║ MergeAndHammingNumbers.hamStreamSatisfiesProp4   postcondition                                                 ?:?  valid  U:smt-z3      0.079 ║
║ MergeAndHammingNumbers.hamStreamSatisfiesProp4   precond. (call argChainedStreamProp4(s, n))                   ?:?  valid  U:smt-z3      0.010 ║
║ MergeAndHammingNumbers.hamStreamSatisfiesProp4   precond. (call argChainingIsTransitive4(s, n))                ?:?  valid  U:smt-z3      0.156 ║
║ MergeAndHammingNumbers.hamstream4                postcondition                                                 ?:?  valid  U:smt-z3      0.010 ║
║ MergeAndHammingNumbers.map10                     match exhaustiveness                                          ?:?  valid  U:smt-z3      0.015 ║
║ MergeAndHammingNumbers.map10                     postcondition                                                 ?:?  valid  U:smt-z3      0.758 ║
║ MergeAndHammingNumbers.mapSusp4                  match exhaustiveness                                          ?:?  valid  U:smt-cvc4    0.023 ║
║ MergeAndHammingNumbers.mapSusp4                  postcondition                                                 ?:?  valid  U:smt-z3      0.179 ║
║ MergeAndHammingNumbers.merge4                    postcondition                                                 ?:?  valid  U:smt-z3      0.016 ║
║ MergeAndHammingNumbers.mergeMapProp4             match exhaustiveness                                          ?:?  valid  U:smt-z3      0.014 ║
║ MergeAndHammingNumbers.mergeMapProp4             match exhaustiveness                                          ?:?  valid  U:smt-z3      0.010 ║
║ MergeAndHammingNumbers.mergeMapProp4             match exhaustiveness                                          ?:?  valid  U:smt-z3      0.015 ║
║ MergeAndHammingNumbers.mergeMapProp4             postcondition                                                 ?:?  valid  U:smt-z3      0.027 ║
║ MergeAndHammingNumbers.mergeSusp4                match exhaustiveness                                          ?:?  valid  U:smt-z3      0.027 ║
║ MergeAndHammingNumbers.mergeSusp4                match exhaustiveness                                          ?:?  valid  U:smt-z3      0.014 ║
║ MergeAndHammingNumbers.mergeSusp4                match exhaustiveness                                          ?:?  valid  U:smt-z3      0.020 ║
║ MergeAndHammingNumbers.mergeSusp4                postcondition                                                 ?:?  valid  U:smt-z3      0.185 ║
║ MergeAndHammingNumbers.mergeUsesMap4             match exhaustiveness                                          ?:?  valid  U:smt-z3      0.012 ║
║ MergeAndHammingNumbers.mergeUsesMap4             match exhaustiveness                                          ?:?  valid  U:smt-z3      0.012 ║
║ MergeAndHammingNumbers.mergeUsesMap4             postcondition                                                 ?:?  valid  U:smt-z3      0.012 ║
║ MergeAndHammingNumbers.min6                      postcondition                                                 ?:?  valid  U:smt-z3      0.014 ║
║ MergeAndHammingNumbers.next6                     match exhaustiveness                                          ?:?  valid  U:smt-z3      0.014 ║
║ MergeAndHammingNumbers.next6                     match exhaustiveness                                          ?:?  valid  U:smt-cvc4    0.014 ║
║ MergeAndHammingNumbers.next6                     match exhaustiveness                                          ?:?  valid  U:smt-z3      0.011 ║
║ MergeAndHammingNumbers.next6                     postcondition                                                 ?:?  valid  U:smt-z3      0.079 ║
║ MergeAndHammingNumbers.nthElemAfterSecond4       match exhaustiveness                                          ?:?  valid  U:smt-cvc4    0.014 ║
║ MergeAndHammingNumbers.nthElemAfterSecond4       match exhaustiveness                                          ?:?  valid  U:smt-cvc4    0.015 ║
║ MergeAndHammingNumbers.nthElemAfterSecond4       match exhaustiveness                                          ?:?  valid  U:smt-z3      0.009 ║
║ MergeAndHammingNumbers.nthElemAfterSecond4       postcondition                                                 ?:?  valid  U:smt-z3      0.188 ║
║ MergeAndHammingNumbers.nthElemAfterSecond4       precond. (call argChainedStreamProp4(f, n))                   ?:?  valid  U:smt-z3      0.014 ║
║ MergeAndHammingNumbers.nthElemAfterSecond4       precond. (call next6(f, s, st@))                              ?:?  valid  U:smt-z3      0.083 ║
║ MergeAndHammingNumbers.nthElemAfterSecond4       precond. (call nthElemAfterSecond4(n - BigInt(1), s, t, ...)  ?:?  valid  U:smt-z3      0.123 ║
║ MergeAndHammingNumbers.nthHammingNumber4         match exhaustiveness                                          ?:?  valid  U:smt-z3      0.012 ║
║ MergeAndHammingNumbers.nthHammingNumber4         postcondition                                                 ?:?  valid  U:smt-z3      0.137 ║
║ MergeAndHammingNumbers.nthHammingNumber4         precond. (call hamStreamSatisfiesProp4(n))                    ?:?  valid  U:smt-z3      0.009 ║
║ MergeAndHammingNumbers.nthHammingNumber4         precond. (call nthElemAfterSecond4(n, first, second2._1 ...)  ?:?  valid  U:smt-z3      0.126 ║
╟┄┄┄┄┄┄┄┄┄┄┄┄┄┄┄┄┄┄┄┄┄┄┄┄┄┄┄┄┄┄┄┄┄┄┄┄┄┄┄┄┄┄┄┄┄┄┄┄┄┄┄┄┄┄┄┄┄┄┄┄┄┄┄┄┄┄┄┄┄┄┄┄┄┄┄┄┄┄┄┄┄┄┄┄┄┄┄┄┄┄┄┄┄┄┄┄┄┄┄┄┄┄┄┄┄┄┄┄┄┄┄┄┄┄┄┄┄┄┄┄┄┄┄┄┄┄┄┄┄┄┄┄┄┄┄┄┄┄┄┄┄┄┄┄╢
║ total: 50     valid: 50     invalid: 0      unknown 0                                                                                    5.802 ║
╚═════════════════════════════════════════════════════════════════════════════════════════════════════════════════════════════════════════════════
instfuncs:  instFuncTypes: 
[[34m  Info  [0m] - considering function map-time...
[[34m  Info  [0m] Candidate invariants
[[34m  Info  [0m] map-time-->res78._2 <= 0
[[34m  Info  [0m] checked VC inst... in 0.036s
[[34m  Info  [0m] Function: map-time--Found candidate invariant is not a real invariant! 
[[34m  Info  [0m] # of atomic predicates: 6 + 1
[[34m  Info  [0m] solving...
[[34m  Info  [0m] solved... in 0.023s
[[34m  Info  [0m] - More unrollings for invariant inference
[[34m  Info  [0m] Candidate invariants
[[34m  Info  [0m] map-time-->res78._2 <= 0
[[34m  Info  [0m] checked VC inst... in 0.008s
[[34m  Info  [0m] Function: map-time--Found candidate invariant is not a real invariant! 
[[34m  Info  [0m] # of atomic predicates: 6 + 1
[[34m  Info  [0m] solving...
[[34m  Info  [0m] solved... in 0.017s
[[34m  Info  [0m] Candidate invariants
[[34m  Info  [0m] map-time-->res78._2 + -9 <= 0
[[34m  Info  [0m] checked VC inst... in 0.001s
[[34m  Info  [0m] minimizing...
[[34m  Info  [0m] Candidate invariants
[[34m  Info  [0m] map-time-->res78._2 + -7 <= 0
[[34m  Info  [0m] checked VC inst... in 0.0s
[[34m  Info  [0m] - Found inductive invariant: map-time --> time + BigInt(-7) <= BigInt(0)
[[34m  Info  [0m] - Verifying Invariants... 
[[34m  Info  [0m] - Invariant verified
[[34m  Info  [0m] - Nothing to solve for min-time
[[34m  Info  [0m] - considering function merge-time...
[[34m  Info  [0m] Candidate invariants
[[34m  Info  [0m] merge-time-->x$129._2 <= 0
[[34m  Info  [0m] checked VC inst... in 0.004s
[[34m  Info  [0m] Function: merge-time--Found candidate invariant is not a real invariant! 
[[34m  Info  [0m] # of atomic predicates: 6 + 1
[[34m  Info  [0m] solving...
[[34m  Info  [0m] solved... in 0.008s
[[34m  Info  [0m] - More unrollings for invariant inference
[[34m  Info  [0m] Candidate invariants
[[34m  Info  [0m] merge-time-->x$129._2 <= 0
[[34m  Info  [0m] checked VC inst... in 0.008s
[[34m  Info  [0m] Function: merge-time--Found candidate invariant is not a real invariant! 
[[34m  Info  [0m] # of atomic predicates: 6 + 1
[[34m  Info  [0m] solving...
[[34m  Info  [0m] solved... in 0.008s
[[34m  Info  [0m] Candidate invariants
[[34m  Info  [0m] merge-time-->x$129._2 + -13 <= 0
[[34m  Info  [0m] checked VC inst... in 0.003s
[[34m  Info  [0m] minimizing...
[[34m  Info  [0m] Candidate invariants
[[34m  Info  [0m] merge-time-->x$129._2 + -11 <= 0
[[34m  Info  [0m] checked VC inst... in 0.002s
[[34m  Info  [0m] - Found inductive invariant: merge-time --> time + BigInt(-11) <= BigInt(0)
[[34m  Info  [0m] - Verifying Invariants... 
[[34m  Info  [0m] - Invariant verified
[[34m  Info  [0m] - considering function hamGen-time...
[[34m  Info  [0m] Candidate invariants
[[34m  Info  [0m] hamGen-time-->x$83._2 <= 0
[[34m  Info  [0m] checked VC inst... in 0.008s
[[34m  Info  [0m] Function: hamGen-time--Found candidate invariant is not a real invariant! 
[[34m  Info  [0m] # of atomic predicates: 9 + 1
[[34m  Info  [0m] solving...
[[34m  Info  [0m] solved... in 0.008s
[[34m  Info  [0m] Candidate invariants
[[34m  Info  [0m] hamGen-time-->x$83._2 + -46 <= 0
[[34m  Info  [0m] checked VC inst... in 0.001s
[[34m  Info  [0m] minimizing...
[[34m  Info  [0m] Candidate invariants
[[34m  Info  [0m] hamGen-time-->x$83._2 + -44 <= 0
[[34m  Info  [0m] checked VC inst... in 0.001s
[[34m  Info  [0m] - Found inductive invariant: hamGen-time --> time + BigInt(-44) <= BigInt(0)
[[34m  Info  [0m] - Verifying Invariants... 
[[34m  Info  [0m] - Invariant verified
[[34m  Info  [0m] - considering function mapSusp-time...
[[34m  Info  [0m] - considering function mergeSusp-time...
[[34m  Info  [0m] Candidate invariants
[[34m  Info  [0m] mergeSusp-time-->if (constTimeArg(a, st@) && constTimeArg(b, st@) && constTimeArg(c, st@)) {
[[34m  Info  [0m]   x$218._2 <= 0
[[34m  Info  [0m] } else {
[[34m  Info  [0m]   true
[[34m  Info  [0m] }
[[34m  Info  [0m] checked VC inst... in 0.154s
[[34m  Info  [0m] Function: mergeSusp-time--Found candidate invariant is not a real invariant! 
[[34m  Info  [0m] # of atomic predicates: 8 + 1
[[34m  Info  [0m] solving...
[[34m  Info  [0m] solved... in 0.006s
[[34m  Info  [0m] - More unrollings for invariant inference
[[34m  Info  [0m] Candidate invariants
[[34m  Info  [0m] mergeSusp-time-->if (constTimeArg(a, st@) && constTimeArg(b, st@) && constTimeArg(c, st@)) {
[[34m  Info  [0m]   x$218._2 <= 0
[[34m  Info  [0m] } else {
[[34m  Info  [0m]   true
[[34m  Info  [0m] }
[[34m  Info  [0m] checked VC inst... in 0.047s
[[34m  Info  [0m] Function: mergeSusp-time--Found candidate invariant is not a real invariant! 
[[34m  Info  [0m] # of atomic predicates: 12 + 1
[[34m  Info  [0m] solving...
[[34m  Info  [0m] solved... in 0.008s
[[34m  Info  [0m] Candidate invariants
[[34m  Info  [0m] mergeSusp-time-->if (constTimeArg(a, st@) && constTimeArg(b, st@) && constTimeArg(c, st@)) {
[[34m  Info  [0m]   x$218._2 + -41 <= 0
[[34m  Info  [0m] } else {
[[34m  Info  [0m]   true
[[34m  Info  [0m] }
[[34m  Info  [0m] checked VC inst... in 0.088s
[[34m  Info  [0m] Function: mergeSusp-time--Found candidate invariant is not a real invariant! 
[[34m  Info  [0m] # of atomic predicates: 13 + 13
[[34m  Info  [0m] solving...
[[34m  Info  [0m] solved... in 0.01s
[[34m  Info  [0m] - More unrollings for invariant inference
[[34m  Info  [0m] Candidate invariants
[[34m  Info  [0m] mergeSusp-time-->if (constTimeArg(a, st@) && constTimeArg(b, st@) && constTimeArg(c, st@)) {
[[34m  Info  [0m]   x$218._2 <= 0
[[34m  Info  [0m] } else {
[[34m  Info  [0m]   true
[[34m  Info  [0m] }
[[34m  Info  [0m] checked VC inst... in 0.067s
[[34m  Info  [0m] Function: mergeSusp-time--Found candidate invariant is not a real invariant! 
[[34m  Info  [0m] # of atomic predicates: 10 + 1
[[34m  Info  [0m] solving...
[[34m  Info  [0m] solved... in 0.011s
[[34m  Info  [0m] Candidate invariants
[[34m  Info  [0m] mergeSusp-time-->if (constTimeArg(a, st@) && constTimeArg(b, st@) && constTimeArg(c, st@)) {
[[34m  Info  [0m]   x$218._2 + -41 <= 0
[[34m  Info  [0m] } else {
[[34m  Info  [0m]   true
[[34m  Info  [0m] }
[[34m  Info  [0m] checked VC inst... in 0.185s
[[34m  Info  [0m] Function: mergeSusp-time--Found candidate invariant is not a real invariant! 
[[34m  Info  [0m] # of atomic predicates: 11 + 11
[[34m  Info  [0m] solving...
[[34m  Info  [0m] solved... in 0.007s
[[34m  Info  [0m] - More unrollings for invariant inference
[[34m  Info  [0m] Candidate invariants
[[34m  Info  [0m] mergeSusp-time-->if (constTimeArg(a, st@) && constTimeArg(b, st@) && constTimeArg(c, st@)) {
[[34m  Info  [0m]   x$218._2 <= 0
[[34m  Info  [0m] } else {
[[34m  Info  [0m]   true
[[34m  Info  [0m] }
[[34m  Info  [0m] checked VC inst... in 0.065s
[[34m  Info  [0m] Function: mergeSusp-time--Found candidate invariant is not a real invariant! 
[[34m  Info  [0m] # of atomic predicates: 11 + 1
[[34m  Info  [0m] solving...
[[34m  Info  [0m] solved... in 0.007s
[[34m  Info  [0m] Candidate invariants
[[34m  Info  [0m] mergeSusp-time-->if (constTimeArg(a, st@) && constTimeArg(b, st@) && constTimeArg(c, st@)) {
[[34m  Info  [0m]   x$218._2 + -41 <= 0
[[34m  Info  [0m] } else {
[[34m  Info  [0m]   true
[[34m  Info  [0m] }
[[34m  Info  [0m] checked VC inst... in 0.223s
[[34m  Info  [0m] Function: mergeSusp-time--Found candidate invariant is not a real invariant! 
[[34m  Info  [0m] # of atomic predicates: 13 + 12
[[34m  Info  [0m] solving...
[[34m  Info  [0m] solved... in 0.008s
[[34m  Info  [0m] - More unrollings for invariant inference
[[34m  Info  [0m] Candidate invariants
[[34m  Info  [0m] mergeSusp-time-->if (constTimeArg(a, st@) && constTimeArg(b, st@) && constTimeArg(c, st@)) {
[[34m  Info  [0m]   x$218._2 <= 0
[[34m  Info  [0m] } else {
[[34m  Info  [0m]   true
[[34m  Info  [0m] }
[[34m  Info  [0m] checked VC inst... in 0.071s
[[34m  Info  [0m] Function: mergeSusp-time--Found candidate invariant is not a real invariant! 
[[34m  Info  [0m] # of atomic predicates: 12 + 1
[[34m  Info  [0m] solving...
[[34m  Info  [0m] solved... in 0.008s
[[34m  Info  [0m] Candidate invariants
[[34m  Info  [0m] mergeSusp-time-->if (constTimeArg(a, st@) && constTimeArg(b, st@) && constTimeArg(c, st@)) {
[[34m  Info  [0m]   x$218._2 + -41 <= 0
[[34m  Info  [0m] } else {
[[34m  Info  [0m]   true
[[34m  Info  [0m] }
[[34m  Info  [0m] checked VC inst... in 0.154s
[[34m  Info  [0m] Function: mergeSusp-time--Found candidate invariant is not a real invariant! 
[[34m  Info  [0m] # of atomic predicates: 13 + 13
[[34m  Info  [0m] solving...
[[34m  Info  [0m] solved... in 0.007s
[[34m  Info  [0m] - More unrollings for invariant inference
[[34m  Info  [0m] Candidate invariants
[[34m  Info  [0m] mergeSusp-time-->if (constTimeArg(a, st@) && constTimeArg(b, st@) && constTimeArg(c, st@)) {
[[34m  Info  [0m]   x$218._2 <= 0
[[34m  Info  [0m] } else {
[[34m  Info  [0m]   true
[[34m  Info  [0m] }
[[34m  Info  [0m] checked VC inst... in 0.295s
[[34m  Info  [0m] Function: mergeSusp-time--Found candidate invariant is not a real invariant! 
[[34m  Info  [0m] # of atomic predicates: 12 + 1
[[34m  Info  [0m] solving...
[[34m  Info  [0m] solved... in 0.009s
[[34m  Info  [0m] Candidate invariants
[[34m  Info  [0m] mergeSusp-time-->if (constTimeArg(a, st@) && constTimeArg(b, st@) && constTimeArg(c, st@)) {
[[34m  Info  [0m]   x$218._2 + -41 <= 0
[[34m  Info  [0m] } else {
[[34m  Info  [0m]   true
[[34m  Info  [0m] }
[[34m  Info  [0m] checked VC inst... in 0.469s
[[34m  Info  [0m] Function: mergeSusp-time--Found candidate invariant is not a real invariant! 
[[34m  Info  [0m] # of atomic predicates: 13 + 13
[[34m  Info  [0m] solving...
[[34m  Info  [0m] solved... in 0.011s
[[34m  Info  [0m] - More unrollings for invariant inference
[[34m  Info  [0m] Candidate invariants
[[34m  Info  [0m] mergeSusp-time-->if (constTimeArg(a, st@) && constTimeArg(b, st@) && constTimeArg(c, st@)) {
[[34m  Info  [0m]   x$218._2 <= 0
[[34m  Info  [0m] } else {
[[34m  Info  [0m]   true
[[34m  Info  [0m] }
[[34m  Info  [0m] checked VC inst... in 0.364s
[[34m  Info  [0m] Function: mergeSusp-time--Found candidate invariant is not a real invariant! 
[[34m  Info  [0m] # of atomic predicates: 11 + 1
[[34m  Info  [0m] solving...
[[34m  Info  [0m] solved... in 0.008s
[[34m  Info  [0m] Candidate invariants
[[34m  Info  [0m] mergeSusp-time-->if (constTimeArg(a, st@) && constTimeArg(b, st@) && constTimeArg(c, st@)) {
[[34m  Info  [0m]   x$218._2 + -41 <= 0
[[34m  Info  [0m] } else {
[[34m  Info  [0m]   true
[[34m  Info  [0m] }
[[34m  Info  [0m] checked VC inst... in 2.062s
[[34m  Info  [0m] Function: mergeSusp-time--Found candidate invariant is not a real invariant! 
[[34m  Info  [0m] # of atomic predicates: 12 + 12
[[34m  Info  [0m] solving...
[[34m  Info  [0m] solved... in 0.007s
[[34m  Info  [0m] - More unrollings for invariant inference
[[34m  Info  [0m] Candidate invariants
[[34m  Info  [0m] mergeSusp-time-->if (constTimeArg(a, st@) && constTimeArg(b, st@) && constTimeArg(c, st@)) {
[[34m  Info  [0m]   x$218._2 <= 0
[[34m  Info  [0m] } else {
[[34m  Info  [0m]   true
[[34m  Info  [0m] }
[[34m  Info  [0m] checked VC inst... in 1.648s
[[34m  Info  [0m] Function: mergeSusp-time--Found candidate invariant is not a real invariant! 
[[34m  Info  [0m] # of atomic predicates: 13 + 1
[[34m  Info  [0m] solving...
[[34m  Info  [0m] solved... in 0.016s
[[34m  Info  [0m] Candidate invariants
[[34m  Info  [0m] mergeSusp-time-->if (constTimeArg(a, st@) && constTimeArg(b, st@) && constTimeArg(c, st@)) {
[[34m  Info  [0m]   x$218._2 + -41 <= 0
[[34m  Info  [0m] } else {
[[34m  Info  [0m]   true
[[34m  Info  [0m] }
[[34m  Info  [0m] checked VC inst... in 16.84s
[[34m  Info  [0m] Function: mergeSusp-time--Found candidate invariant is not a real invariant! 
[[34m  Info  [0m] # of atomic predicates: 13 + 14
[[34m  Info  [0m] solving...
[[34m  Info  [0m] solved... in 0.007s
[[34m  Info  [0m] - More unrollings for invariant inference
[[34m  Info  [0m] Candidate invariants
[[34m  Info  [0m] mergeSusp-time-->if (constTimeArg(a, st@) && constTimeArg(b, st@) && constTimeArg(c, st@)) {
[[34m  Info  [0m]   x$218._2 <= 0
[[34m  Info  [0m] } else {
[[34m  Info  [0m]   true
[[34m  Info  [0m] }
[[34m  Info  [0m] checked VC inst... in 0.83s
[[34m  Info  [0m] Function: mergeSusp-time--Found candidate invariant is not a real invariant! 
[[34m  Info  [0m] # of atomic predicates: 10 + 1
[[34m  Info  [0m] solving...
[[34m  Info  [0m] solved... in 0.008s
[[34m  Info  [0m] Candidate invariants
[[34m  Info  [0m] mergeSusp-time-->if (constTimeArg(a, st@) && constTimeArg(b, st@) && constTimeArg(c, st@)) {
[[34m  Info  [0m]   x$218._2 + -41 <= 0
[[34m  Info  [0m] } else {
[[34m  Info  [0m]   true
[[34m  Info  [0m] }
[[34m  Info  [0m] checked VC inst... in 30.225s
[[34m  Info  [0m] Function: mergeSusp-time--Found candidate invariant is not a real invariant! 
[[34m  Info  [0m] # of atomic predicates: 11 + 11
[[34m  Info  [0m] solving...
[[34m  Info  [0m] solved... in 0.007s
[[34m  Info  [0m] - More unrollings for invariant inference
[[34m  Info  [0m] Candidate invariants
[[34m  Info  [0m] mergeSusp-time-->if (constTimeArg(a, st@) && constTimeArg(b, st@) && constTimeArg(c, st@)) {
[[34m  Info  [0m]   x$218._2 <= 0
[[34m  Info  [0m] } else {
[[34m  Info  [0m]   true
[[34m  Info  [0m] }
[[34m  Info  [0m] checked VC inst... in 4.708s
[[34m  Info  [0m] Function: mergeSusp-time--Found candidate invariant is not a real invariant! 
[[34m  Info  [0m] # of atomic predicates: 10 + 1
[[34m  Info  [0m] solving...
[[34m  Info  [0m] solved... in 0.008s
[[34m  Info  [0m] Candidate invariants
[[34m  Info  [0m] mergeSusp-time-->if (constTimeArg(a, st@) && constTimeArg(b, st@) && constTimeArg(c, st@)) {
[[34m  Info  [0m]   x$218._2 + -41 <= 0
[[34m  Info  [0m] } else {
[[34m  Info  [0m]   true
[[34m  Info  [0m] }
[[34m  Info  [0m] checked VC inst... in 35.024s
[[34m  Info  [0m] VC solving failed!...retrying with a bigger model...
[[34m  Info  [0m] # of atomic predicates: 1 + 11
[[34m  Info  [0m] solving...
[[34m  Info  [0m] solved... in 0.007s
[[34m  Info  [0m] Candidate invariants
[[34m  Info  [0m] mergeSusp-time-->if (constTimeArg(a, st@) && constTimeArg(b, st@) && constTimeArg(c, st@)) {
[[34m  Info  [0m]   x$218._2 + -83 <= 0
[[34m  Info  [0m] } else {
[[34m  Info  [0m]   true
[[34m  Info  [0m] }
[[34m  Info  [0m] checked VC inst... in 20.832s
[[34m  Info  [0m] Function: mergeSusp-time--Found candidate invariant is not a real invariant! 
[[34m  Info  [0m] # of atomic predicates: 11 + 12
[[34m  Info  [0m] solving...
[[34m  Info  [0m] solved... in 0.007s
[[34m  Info  [0m] - More unrollings for invariant inference
[[34m  Info  [0m] Candidate invariants
[[34m  Info  [0m] mergeSusp-time-->if (constTimeArg(a, st@) && constTimeArg(b, st@) && constTimeArg(c, st@)) {
[[34m  Info  [0m]   x$218._2 <= 0
[[34m  Info  [0m] } else {
[[34m  Info  [0m]   true
[[34m  Info  [0m] }
[[34m  Info  [0m] checked VC inst... in 2.53s
[[34m  Info  [0m] Function: mergeSusp-time--Found candidate invariant is not a real invariant! 
[[34m  Info  [0m] # of atomic predicates: 14 + 1
[[34m  Info  [0m] solving...
[[34m  Info  [0m] solved... in 0.008s
[[34m  Info  [0m] Candidate invariants
[[34m  Info  [0m] mergeSusp-time-->if (constTimeArg(a, st@) && constTimeArg(b, st@) && constTimeArg(c, st@)) {
[[34m  Info  [0m]   x$218._2 + -41 <= 0
[[34m  Info  [0m] } else {
[[34m  Info  [0m]   true
[[34m  Info  [0m] }
[[34m  Info  [0m] checked VC inst... in 15.593s
[[34m  Info  [0m] Function: mergeSusp-time--Found candidate invariant is not a real invariant! 
[[34m  Info  [0m] # of atomic predicates: 14 + 15
[[34m  Info  [0m] solving...
[[34m  Info  [0m] solved... in 0.008s
[[34m  Info  [0m] Candidate invariants
[[34m  Info  [0m] mergeSusp-time-->if (constTimeArg(a, st@) && constTimeArg(b, st@) && constTimeArg(c, st@)) {
[[34m  Info  [0m]   x$218._2 + -60 <= 0
[[34m  Info  [0m] } else {
[[34m  Info  [0m]   true
[[34m  Info  [0m] }
[[34m  Info  [0m] checked VC inst... in 1.586s
[[34m  Info  [0m] Function: mergeSusp-time--Found candidate invariant is not a real invariant! 
[[34m  Info  [0m] # of atomic predicates: 14 + 29
[[34m  Info  [0m] solving...
[[34m  Info  [0m] solved... in 0.009s
[[34m  Info  [0m] Candidate invariants
[[34m  Info  [0m] mergeSusp-time-->if (constTimeArg(a, st@) && constTimeArg(b, st@) && constTimeArg(c, st@)) {
[[34m  Info  [0m]   x$218._2 + -62 <= 0
[[34m  Info  [0m] } else {
[[34m  Info  [0m]   true
[[34m  Info  [0m] }
[[34m  Info  [0m] checked VC inst... in 1.361s
[[34m  Info  [0m] Function: mergeSusp-time--Found candidate invariant is not a real invariant! 
[[34m  Info  [0m] # of atomic predicates: 15 + 43
[[34m  Info  [0m] solving...
[[34m  Info  [0m] solved... in 0.01s
[[34m  Info  [0m] Candidate invariants
[[34m  Info  [0m] mergeSusp-time-->if (constTimeArg(a, st@) && constTimeArg(b, st@) && constTimeArg(c, st@)) {
[[34m  Info  [0m]   x$218._2 + -66 <= 0
[[34m  Info  [0m] } else {
[[34m  Info  [0m]   true
[[34m  Info  [0m] }
[[34m  Info  [0m] checked VC inst... in 35.036s
[[34m  Info  [0m] VC solving failed!...retrying with a bigger model...
[[34m  Info  [0m] # of atomic predicates: 1 + 58
[[34m  Info  [0m] solving...
[[34m  Info  [0m] solved... in 0.011s
[[34m  Info  [0m] Candidate invariants
[[34m  Info  [0m] mergeSusp-time-->if (constTimeArg(a, st@) && constTimeArg(b, st@) && constTimeArg(c, st@)) {
[[34m  Info  [0m]   x$218._2 + -133 <= 0
[[34m  Info  [0m] } else {
[[34m  Info  [0m]   true
[[34m  Info  [0m] }
[[34m  Info  [0m] checked VC inst... in 0.128s
[[34m  Info  [0m] minimizing...
[[34m  Info  [0m] - Found inductive invariant: mergeSusp-time --> if (constTimeArg(a, st@) && constTimeArg(b, st@) && constTimeArg(c, st@)) {
[[34m  Info  [0m]   time + BigInt(-133) <= BigInt(0)
[[34m  Info  [0m] } else {
[[34m  Info  [0m]   true
[[34m  Info  [0m] }
[[34m  Info  [0m] - Verifying Invariants... 
[[34m  Info  [0m] - Invariant verified
[[34m  Info  [0m] - considering function fval-mem-time...
[[34m  Info  [0m] - considering function next-time...
[[34m  Info  [0m] Candidate invariants
[[34m  Info  [0m] next-time-->x$39._2 <= 0
[[34m  Info  [0m] checked VC inst... in 0.015s
[[34m  Info  [0m] Function: next-time--Found candidate invariant is not a real invariant! 
[[34m  Info  [0m] # of atomic predicates: 6 + 1
[[34m  Info  [0m] solving...
[[34m  Info  [0m] solved... in 0.008s
[[34m  Info  [0m] Candidate invariants
[[34m  Info  [0m] next-time-->x$39._2 + -7 <= 0
[[34m  Info  [0m] checked VC inst... in 0.011s
[[34m  Info  [0m] Function: next-time--Found candidate invariant is not a real invariant! 
[[34m  Info  [0m] # of atomic predicates: 6 + 7
[[34m  Info  [0m] solving...
[[34m  Info  [0m] solved... in 0.007s
[[34m  Info  [0m] - More unrollings for invariant inference
[[34m  Info  [0m] Candidate invariants
[[34m  Info  [0m] next-time-->x$39._2 <= 0
[[34m  Info  [0m] checked VC inst... in 0.046s
[[34m  Info  [0m] Function: next-time--Found candidate invariant is not a real invariant! 
[[34m  Info  [0m] # of atomic predicates: 6 + 1
[[34m  Info  [0m] solving...
[[34m  Info  [0m] solved... in 0.009s
[[34m  Info  [0m] Candidate invariants
[[34m  Info  [0m] next-time-->x$39._2 + -8 <= 0
[[34m  Info  [0m] checked VC inst... in 0.036s
[[34m  Info  [0m] Function: next-time--Found candidate invariant is not a real invariant! 
[[34m  Info  [0m] # of atomic predicates: 6 + 7
[[34m  Info  [0m] solving...
[[34m  Info  [0m] solved... in 0.007s
[[34m  Info  [0m] - More unrollings for invariant inference
[[34m  Info  [0m] Candidate invariants
[[34m  Info  [0m] next-time-->x$39._2 <= 0
[[34m  Info  [0m] checked VC inst... in 0.2s
[[34m  Info  [0m] Function: next-time--Found candidate invariant is not a real invariant! 
[[34m  Info  [0m] # of atomic predicates: 6 + 1
[[34m  Info  [0m] solving...
[[34m  Info  [0m] solved... in 0.007s
[[34m  Info  [0m] Candidate invariants
[[34m  Info  [0m] next-time-->x$39._2 + -8 <= 0
[[34m  Info  [0m] checked VC inst... in 0.492s
[[34m  Info  [0m] Function: next-time--Found candidate invariant is not a real invariant! 
[[34m  Info  [0m] # of atomic predicates: 6 + 7
[[34m  Info  [0m] solving...
[[34m  Info  [0m] solved... in 0.008s
[[34m  Info  [0m] - More unrollings for invariant inference
[[34m  Info  [0m] Candidate invariants
[[34m  Info  [0m] next-time-->x$39._2 <= 0
[[34m  Info  [0m] checked VC inst... in 0.151s
[[34m  Info  [0m] Function: next-time--Found candidate invariant is not a real invariant! 
[[34m  Info  [0m] # of atomic predicates: 8 + 1
[[34m  Info  [0m] solving...
[[34m  Info  [0m] solved... in 0.008s
[[34m  Info  [0m] Candidate invariants
[[34m  Info  [0m] next-time-->x$39._2 + -8 <= 0
[[34m  Info  [0m] checked VC inst... in 0.141s
[[34m  Info  [0m] Function: next-time--Found candidate invariant is not a real invariant! 
[[34m  Info  [0m] # of atomic predicates: 7 + 9
[[34m  Info  [0m] solving...
[[34m  Info  [0m] solved... in 0.008s
[[34m  Info  [0m] Candidate invariants
[[34m  Info  [0m] next-time-->x$39._2 + -145 <= 0
[[34m  Info  [0m] checked VC inst... in 0.025s
[[34m  Info  [0m] minimizing...
[[34m  Info  [0m] Candidate invariants
[[34m  Info  [0m] next-time-->x$39._2 + -144 <= 0
[[34m  Info  [0m] checked VC inst... in 0.015s
[[34m  Info  [0m] - Found inductive invariant: next-time --> time + BigInt(-144) <= BigInt(0)
[[34m  Info  [0m] - Verifying Invariants... 
[[34m  Info  [0m] - Invariant verified
[[34m  Info  [0m] - considering function nthElemAfterSecond-time...
[[34m  Info  [0m] Candidate invariants
[[34m  Info  [0m] nthElemAfterSecond-time-->0 * n + x$46._2 <= 0
[[34m  Info  [0m] checked VC inst... in 0.016s
[[34m  Info  [0m] Function: nthElemAfterSecond-time--Found candidate invariant is not a real invariant! 
[[34m  Info  [0m] # of atomic predicates: 10 + 1
[[34m  Info  [0m] solving...
[[34m  Info  [0m] solved... in 0.012s
[[34m  Info  [0m] Candidate invariants
[[34m  Info  [0m] nthElemAfterSecond-time-->(-4 * n + 32 * x$46._2) + -4952 <= 0
[[34m  Info  [0m] checked VC inst... in 0.022s
[[34m  Info  [0m] Function: nthElemAfterSecond-time--Found candidate invariant is not a real invariant! 
[[34m  Info  [0m] # of atomic predicates: 12 + 11
[[34m  Info  [0m] solving...
[[34m  Info  [0m] solved... in 0.008s
[[34m  Info  [0m] - More unrollings for invariant inference
[[34m  Info  [0m] Candidate invariants
[[34m  Info  [0m] nthElemAfterSecond-time-->0 * n + x$46._2 <= 0
[[34m  Info  [0m] checked VC inst... in 0.052s
[[34m  Info  [0m] Function: nthElemAfterSecond-time--Found candidate invariant is not a real invariant! 
[[34m  Info  [0m] # of atomic predicates: 10 + 1
[[34m  Info  [0m] solving...
[[34m  Info  [0m] solved... in 0.009s
[[34m  Info  [0m] Candidate invariants
[[34m  Info  [0m] nthElemAfterSecond-time-->(-4 * n + 32 * x$46._2) + -4952 <= 0
[[34m  Info  [0m] checked VC inst... in 0.045s
[[34m  Info  [0m] Function: nthElemAfterSecond-time--Found candidate invariant is not a real invariant! 
[[34m  Info  [0m] # of atomic predicates: 16 + 11
[[34m  Info  [0m] solving...
[[34m  Info  [0m] solved... in 0.008s
[[34m  Info  [0m] Candidate invariants
[[34m  Info  [0m] nthElemAfterSecond-time-->(-155 * n + x$46._2) + 155 <= 0
[[34m  Info  [0m] checked VC inst... in 0.005s
[[34m  Info  [0m] minimizing...
[[34m  Info  [0m] Candidate invariants
[[34m  Info  [0m] nthElemAfterSecond-time-->(-153 * n + x$46._2) + 155 <= 0
[[34m  Info  [0m] checked VC inst... in 0.003s
[[34m  Info  [0m] - Found inductive invariant: nthElemAfterSecond-time --> (BigInt(-153) * n + time) + BigInt(155) <= BigInt(0)
[[34m  Info  [0m] - Verifying Invariants... 
[[34m  Info  [0m] - Invariant verified
[[34m  Info  [0m] - considering function nthHammingNumber-time...
[[34m  Info  [0m] Candidate invariants
[[34m  Info  [0m] nthHammingNumber-time-->0 * n + x$93._2 <= 0
[[34m  Info  [0m] checked VC inst... in 0.027s
[[34m  Info  [0m] Function: nthHammingNumber-time--Found candidate invariant is not a real invariant! 
[[34m  Info  [0m] # of atomic predicates: 8 + 1
[[34m  Info  [0m] solving...
[[34m  Info  [0m] solved... in 0.013s
[[34m  Info  [0m] Candidate invariants
[[34m  Info  [0m] nthHammingNumber-time-->(0 * n + x$93._2) + -7 <= 0
[[34m  Info  [0m] checked VC inst... in 0.028s
[[34m  Info  [0m] Function: nthHammingNumber-time--Found candidate invariant is not a real invariant! 
[[34m  Info  [0m] # of atomic predicates: 9 + 9
[[34m  Info  [0m] solving...
[[34m  Info  [0m] solved... in 0.009s
[[34m  Info  [0m] Candidate invariants
[[34m  Info  [0m] nthHammingNumber-time-->(-10 * n + x$93._2) + -6 <= 0
[[34m  Info  [0m] checked VC inst... in 0.027s
[[34m  Info  [0m] Function: nthHammingNumber-time--Found candidate invariant is not a real invariant! 
[[34m  Info  [0m] # of atomic predicates: 11 + 18
[[34m  Info  [0m] solving...
[[34m  Info  [0m] solved... in 0.014s
[[34m  Info  [0m] Candidate invariants
[[34m  Info  [0m] nthHammingNumber-time-->(-154 * n + x$93._2) + -6 <= 0
[[34m  Info  [0m] checked VC inst... in 0.028s
[[34m  Info  [0m] Function: nthHammingNumber-time--Found candidate invariant is not a real invariant! 
[[34m  Info  [0m] # of atomic predicates: 9 + 29
[[34m  Info  [0m] solving...
[[34m  Info  [0m] solved... in 0.012s
[[34m  Info  [0m] - More unrollings for invariant inference
[[34m  Info  [0m] Candidate invariants
[[34m  Info  [0m] nthHammingNumber-time-->0 * n + x$93._2 <= 0
[[34m  Info  [0m] checked VC inst... in 0.02s
[[34m  Info  [0m] Function: nthHammingNumber-time--Found candidate invariant is not a real invariant! 
[[34m  Info  [0m] # of atomic predicates: 8 + 1
[[34m  Info  [0m] solving...
[[34m  Info  [0m] solved... in 0.007s
[[34m  Info  [0m] Candidate invariants
[[34m  Info  [0m] nthHammingNumber-time-->(0 * n + x$93._2) + -7 <= 0
[[34m  Info  [0m] checked VC inst... in 0.014s
[[34m  Info  [0m] Function: nthHammingNumber-time--Found candidate invariant is not a real invariant! 
[[34m  Info  [0m] # of atomic predicates: 9 + 9
[[34m  Info  [0m] solving...
[[34m  Info  [0m] solved... in 0.011s
[[34m  Info  [0m] Candidate invariants
[[34m  Info  [0m] nthHammingNumber-time-->(-11 * n + x$93._2) + -6 <= 0
[[34m  Info  [0m] checked VC inst... in 0.013s
[[34m  Info  [0m] Function: nthHammingNumber-time--Found candidate invariant is not a real invariant! 
[[34m  Info  [0m] # of atomic predicates: 9 + 18
[[34m  Info  [0m] solving...
[[34m  Info  [0m] solved... in 0.008s
[[34m  Info  [0m] - More unrollings for invariant inference
[[34m  Info  [0m] Candidate invariants
[[34m  Info  [0m] nthHammingNumber-time-->0 * n + x$93._2 <= 0
[[34m  Info  [0m] checked VC inst... in 0.071s
[[34m  Info  [0m] Function: nthHammingNumber-time--Found candidate invariant is not a real invariant! 
[[34m  Info  [0m] # of atomic predicates: 8 + 1
[[34m  Info  [0m] solving...
[[34m  Info  [0m] solved... in 0.008s
[[34m  Info  [0m] Candidate invariants
[[34m  Info  [0m] nthHammingNumber-time-->(0 * n + x$93._2) + -7 <= 0
[[34m  Info  [0m] checked VC inst... in 0.224s
[[34m  Info  [0m] Function: nthHammingNumber-time--Found candidate invariant is not a real invariant! 
[[34m  Info  [0m] # of atomic predicates: 11 + 9
[[34m  Info  [0m] solving...
[[34m  Info  [0m] solved... in 0.009s
[[34m  Info  [0m] Candidate invariants
[[34m  Info  [0m] nthHammingNumber-time-->(-11 * n + x$93._2) + -6 <= 0
[[34m  Info  [0m] checked VC inst... in 0.07s
[[34m  Info  [0m] Function: nthHammingNumber-time--Found candidate invariant is not a real invariant! 
[[34m  Info  [0m] # of atomic predicates: 10 + 20
[[34m  Info  [0m] solving...
[[34m  Info  [0m] solved... in 0.01s
[[34m  Info  [0m] Candidate invariants
[[34m  Info  [0m] nthHammingNumber-time-->(-58 * n + x$93._2) + -6 <= 0
[[34m  Info  [0m] checked VC inst... in 0.228s
[[34m  Info  [0m] Function: nthHammingNumber-time--Found candidate invariant is not a real invariant! 
[[34m  Info  [0m] # of atomic predicates: 13 + 30
[[34m  Info  [0m] solving...
[[34m  Info  [0m] solved... in 0.01s
[[34m  Info  [0m] Candidate invariants
[[34m  Info  [0m] nthHammingNumber-time-->(-154 * n + x$93._2) + -6 <= 0
[[34m  Info  [0m] checked VC inst... in 0.008s
[[34m  Info  [0m] minimizing...
[[34m  Info  [0m] Candidate invariants
[[34m  Info  [0m] nthHammingNumber-time-->(-153 * n + x$93._2) + -5 <= 0
[[34m  Info  [0m] checked VC inst... in 0.005s
[[34m  Info  [0m] - Found inductive invariant: nthHammingNumber-time --> (BigInt(-153) * n + time) + BigInt(-5) <= BigInt(0)
[[34m  Info  [0m] - Verifying Invariants... 
[[34m  Info  [0m] - Invariant verified
Resource Verification Results: 
. ┌─────────━
╔═╡ Summary ╞════════════════════════════════════════════════════════════════════════════════════════════════════════════════════════════╗
║ └─────────┘                                                                                                                            ║
║ hamGen-         time <= 44                                                                                                     0.170   ║
║ map-            time <= 7                                                                                                      0.916   ║
║ merge-          time <= 11                                                                                                     0.144   ║
║ mergeSusp-      if (constTimeArg(a, st@) && constTimeArg(b, st@) && constTimeArg(c, st@)) {
  time <= 133
} else {
  true
}    172.730 ║
║ next-           time <= 144                                                                                                    2.195   ║
║ nthElemAfterSe… time + 155 <= 153 * n                                                                                          0.757   ║
║ nthHammingNumb… time <= 153 * n + 5                                                                                            1.777   ║
╟┄┄┄┄┄┄┄┄┄┄┄┄┄┄┄┄┄┄┄┄┄┄┄┄┄┄┄┄┄┄┄┄┄┄┄┄┄┄┄┄┄┄┄┄┄┄┄┄┄┄┄┄┄┄┄┄┄┄┄┄┄┄┄┄┄┄┄┄┄┄┄┄┄┄┄┄┄┄┄┄┄┄┄┄┄┄┄┄┄┄┄┄┄┄┄┄┄┄┄┄┄┄┄┄┄┄┄┄┄┄┄┄┄┄┄┄┄┄┄┄┄┄┄┄┄┄┄┄┄┄┄┄┄┄┄┄╢
║ total: 7     inferred: 7     unknown: 0     time: 178.689                                                                              ║
╚═════════════════════════════════════════════════════════════════════════════════════════════════════════════════════════════════════════
[[34m  Info  [0m] Stats dumped to file: CyclicHammingStream-stats.txt
