[[33mWarning [0m] warning: there were three feature warnings; re-run with -feature for details
[[34m  Info  [0m] Output written on leon.out
[[34m  Info  [0m] Output written on leon.out
Warning: Cannot find a non-placeholder in equivalence class Set(P@24) for fundef: 
 def new@tStreamT00[T11, P@24](cc0 : tStreamT0@0[T11], st@23 : Set[MemoFuns@0[P@24]]): tStreamT0@0[T11] = cc0
[[34m  Info  [0m] Output written on leon.out
[[34m  Info  [0m] Output written on leon.out
[[34m  Info  [0m] Output written on leon.out
instfuncs: force,cons,tail,forceTwice,eval@tStreamT0@,takeLazy,empty,get-mem,revAppend,createQueue,take,drop,tailSub,rotateRev,reverse,rotateDrop instFuncTypes: 
[[34m  Info  [0m] Output written on leon.out
[[34m  Info  [0m] Output written on leon.out
[[34m  Info  [0m] Output written on leon.out
[[34m  Info  [0m]  - Now considering 'postcondition' VC for isConcrete4 @?:?...
[[34m  Info  [0m]  => VALID
[[34m  Info  [0m]  - Now considering 'match exhaustiveness' VC for isConcrete4 @?:?...
[[34m  Info  [0m]  => VALID
[[34m  Info  [0m]  - Now considering 'match exhaustiveness' VC for isConcrete4 @?:?...
[[34m  Info  [0m]  => VALID
[[34m  Info  [0m]  - Now considering 'match exhaustiveness' VC for isConcrete4 @?:?...
[[34m  Info  [0m]  => VALID
[[34m  Info  [0m]  - Now considering 'postcondition' VC for takeLazy4 @?:?...
[[34m  Info  [0m]  => VALID
[[34m  Info  [0m]  - Now considering 'match exhaustiveness' VC for takeLazy4 @?:?...
[[34m  Info  [0m]  => VALID
[[34m  Info  [0m]  - Now considering 'match exhaustiveness' VC for takeLazy4 @?:?...
[[34m  Info  [0m]  => VALID
[[34m  Info  [0m]  - Now considering 'postcondition' VC for revAppend4 @?:?...
[[34m  Info  [0m]  => VALID
[[34m  Info  [0m]  - Now considering 'precond. (call revAppend4[T](a198._1, SCons[T](x, Val[T ...)' VC for revAppend4 @?:?...
[[34m  Info  [0m]  => VALID
[[34m  Info  [0m]  - Now considering 'match exhaustiveness' VC for revAppend4 @?:?...
[[34m  Info  [0m]  => VALID
[[34m  Info  [0m]  - Now considering 'match exhaustiveness' VC for revAppend4 @?:?...
[[34m  Info  [0m]  => VALID
[[34m  Info  [0m]  - Now considering 'postcondition' VC for drop6 @?:?...
[[34m  Info  [0m]  => VALID
[[34m  Info  [0m]  - Now considering 'precond. (call drop6[T](n - BigInt(1), a199._1, a199._2 ...)' VC for drop6 @?:?...
[[34m  Info  [0m]  => VALID
[[34m  Info  [0m]  - Now considering 'match exhaustiveness' VC for drop6 @?:?...
[[34m  Info  [0m]  => VALID
[[34m  Info  [0m]  - Now considering 'match exhaustiveness' VC for drop6 @?:?...
[[34m  Info  [0m]  => VALID
[[34m  Info  [0m]  - Now considering 'postcondition' VC for take6 @?:?...
[[34m  Info  [0m]  => VALID
[[34m  Info  [0m]  - Now considering 'precond. (call take6[T](n - BigInt(1), a200._1, a200._2 ...)' VC for take6 @?:?...
[[34m  Info  [0m]  => VALID
[[34m  Info  [0m]  - Now considering 'match exhaustiveness' VC for take6 @?:?...
[[34m  Info  [0m]  => VALID
[[34m  Info  [0m]  - Now considering 'match exhaustiveness' VC for take6 @?:?...
[[34m  Info  [0m]  => VALID
[[34m  Info  [0m]  - Now considering 'postcondition' VC for rotateRev4 @?:?...
[[34m  Info  [0m]  => VALID
[[34m  Info  [0m]  - Now considering 'precond. (call revAppend4[T](f, a, st@))' VC for rotateRev4 @?:?...
[[34m  Info  [0m]  => VALID
[[34m  Info  [0m]  - Now considering 'precond. (call drop6[T](BigInt(2), f, nr17._2))' VC for rotateRev4 @?:?...
[[34m  Info  [0m]  => VALID
[[34m  Info  [0m]  - Now considering 'precond. (call take6[T](BigInt(2), f, nf17._2))' VC for rotateRev4 @?:?...
[[34m  Info  [0m]  => VALID
[[34m  Info  [0m]  - Now considering 'precond. (call revAppend4[T](a203._1, a, a203._2))' VC for rotateRev4 @?:?...
[[34m  Info  [0m]  => VALID
[[34m  Info  [0m]  - Now considering 'match exhaustiveness' VC for rotateRev4 @?:?...
[[34m  Info  [0m]  => VALID
[[34m  Info  [0m]  - Now considering 'match exhaustiveness' VC for rotateRev4 @?:?...
[[34m  Info  [0m]  => VALID
[[34m  Info  [0m]  - Now considering 'postcondition' VC for rotateDrop4 @?:?...
[[34m  Info  [0m]  => VALID
[[34m  Info  [0m]  - Now considering 'precond. (call drop6[T](i, f, st@))' VC for rotateDrop4 @?:?...
[[34m  Info  [0m]  => VALID
[[34m  Info  [0m]  - Now considering 'precond. (call rotateRev4[T](r, a205._1, SNil[T](), a20 ...)' VC for rotateDrop4 @?:?...
[[34m  Info  [0m]  => VALID
[[34m  Info  [0m]  - Now considering 'precond. (call drop6[T](BigInt(2), f, nr19._2))' VC for rotateDrop4 @?:?...
[[34m  Info  [0m]  => VALID
[[34m  Info  [0m]  - Now considering 'match exhaustiveness' VC for rotateDrop4 @?:?...
[[34m  Info  [0m]  => VALID
[[34m  Info  [0m]  - Now considering 'match exhaustiveness' VC for rotateDrop4 @?:?...
[[34m  Info  [0m]  => VALID
[[34m  Info  [0m]  - Now considering 'postcondition' VC for TakeLazyL@takeLazyPre1 @?:?...
[[34m  Info  [0m]  => VALID
[[34m  Info  [0m]  - Now considering 'match exhaustiveness' VC for TakeLazyL@takeLazyPre1 @?:?...
[[34m  Info  [0m]  => VALID
[[34m  Info  [0m]  - Now considering 'postcondition' VC for RotateRevL@rotateRevPre1 @?:?...
[[34m  Info  [0m]  => VALID
[[34m  Info  [0m]  - Now considering 'precond. (call drop6[T](BigInt(2), f, nr17._2))' VC for RotateRevL@rotateRevPre1 @?:?...
[[34m  Info  [0m]  => VALID
[[34m  Info  [0m]  - Now considering 'precond. (call take6[T](BigInt(2), f, nf17._2))' VC for RotateRevL@rotateRevPre1 @?:?...
[[34m  Info  [0m]  => VALID
[[34m  Info  [0m]  - Now considering 'precond. (call revAppend4[T](a203._1, a, a203._2))' VC for RotateRevL@rotateRevPre1 @?:?...
[[34m  Info  [0m]  => VALID
[[34m  Info  [0m]  - Now considering 'match exhaustiveness' VC for RotateRevL@rotateRevPre1 @?:?...
[[34m  Info  [0m]  => VALID
[[34m  Info  [0m]  - Now considering 'postcondition' VC for RotateDropL@rotateDropPre1 @?:?...
[[34m  Info  [0m]  => VALID
[[34m  Info  [0m]  - Now considering 'precond. (call drop6[T](BigInt(2), f, nr19._2))' VC for RotateDropL@rotateDropPre1 @?:?...
[[34m  Info  [0m]  => VALID
[[34m  Info  [0m]  - Now considering 'match exhaustiveness' VC for RotateDropL@rotateDropPre1 @?:?...
[[34m  Info  [0m]  => VALID
[[34m  Info  [0m]  - Now considering 'postcondition' VC for firstUneval4 @?:?...
[[34m  Info  [0m]  => VALID
[[34m  Info  [0m]  - Now considering 'match exhaustiveness' VC for firstUneval4 @?:?...
[[34m  Info  [0m]  => VALID
[[34m  Info  [0m]  - Now considering 'match exhaustiveness' VC for firstUneval4 @?:?...
[[34m  Info  [0m]  => VALID
[[34m  Info  [0m]  - Now considering 'match exhaustiveness' VC for firstUneval4 @?:?...
[[34m  Info  [0m]  => VALID
[[34m  Info  [0m]  - Now considering 'match exhaustiveness' VC for firstUneval4 @?:?...
[[34m  Info  [0m]  => VALID
[[34m  Info  [0m]  - Now considering 'match exhaustiveness' VC for firstUneval4 @?:?...
[[34m  Info  [0m]  => VALID
[[34m  Info  [0m]  - Now considering 'match exhaustiveness' VC for firstUneval4 @?:?...
[[34m  Info  [0m]  => VALID
[[34m  Info  [0m]  - Now considering 'postcondition' VC for createQueue4 @?:?...
[[34m  Info  [0m]  => VALID
[[34m  Info  [0m]  - Now considering 'precond. (call rotateDrop4[T](r, i, f, st@))' VC for createQueue4 @?:?...
[[34m  Info  [0m]  => VALID
[[34m  Info  [0m]  - Now considering 'precond. (call takeLazy4[T](i, f, nr20._2))' VC for createQueue4 @?:?...
[[34m  Info  [0m]  => VALID
[[34m  Info  [0m]  - Now considering 'precond. (call rotateDrop4[T](f, j, r, st@))' VC for createQueue4 @?:?...
[[34m  Info  [0m]  => VALID
[[34m  Info  [0m]  - Now considering 'precond. (call takeLazy4[T](j, r, nf21._2))' VC for createQueue4 @?:?...
[[34m  Info  [0m]  => VALID
[[34m  Info  [0m]  - Now considering 'postcondition' VC for funeEqual4 @?:?...
[[34m  Info  [0m]  => VALID
[[34m  Info  [0m]  - Now considering 'postcondition' VC for force4 @?:?...
[[34m  Info  [0m]  => VALID
[[34m  Info  [0m]  - Now considering 'precond. (call funeMonotone4[T](tar, htar, st@, out1))' VC for force4 @?:?...
[[34m  Info  [0m]  => VALID
[[34m  Info  [0m]  - Now considering 'precond. (call funeMonotone4[T](other, hother, st@, out ...)' VC for force4 @?:?...
[[34m  Info  [0m]  => VALID
[[34m  Info  [0m]  - Now considering 'match exhaustiveness' VC for force4 @?:?...
[[34m  Info  [0m]  => VALID
[[34m  Info  [0m]  - Now considering 'match exhaustiveness' VC for force4 @?:?...
[[34m  Info  [0m]  => VALID
[[34m  Info  [0m]  - Now considering 'postcondition' VC for forceTwice4 @?:?...
[[34m  Info  [0m]  => VALID
[[34m  Info  [0m]  - Now considering 'precond. (call force4[T](q.sf, q.f, q.r, q.sr, st@))' VC for forceTwice4 @?:?...
[[34m  Info  [0m]  => VALID
[[34m  Info  [0m]  - Now considering 'precond. (call force4[T](a210._1, q.f, q.r, q.sr, a210. ...)' VC for forceTwice4 @?:?...
[[34m  Info  [0m]  => VALID
[[34m  Info  [0m]  - Now considering 'precond. (call force4[T](q.sr, q.r, q.f, nsf6._1, nsf6. ...)' VC for forceTwice4 @?:?...
[[34m  Info  [0m]  => VALID
[[34m  Info  [0m]  - Now considering 'precond. (call force4[T](a211._1, q.r, q.f, nsf6._1, a2 ...)' VC for forceTwice4 @?:?...
[[34m  Info  [0m]  => VALID
[[34m  Info  [0m]  - Now considering 'postcondition' VC for empty6 @?:?...
[[34m  Info  [0m]  => VALID
[[34m  Info  [0m]  - Now considering 'postcondition' VC for head6 @?:?...
[[34m  Info  [0m]  => VALID
[[34m  Info  [0m]  - Now considering 'match exhaustiveness' VC for head6 @?:?...
[[34m  Info  [0m]  => VALID
[[34m  Info  [0m]  - Now considering 'postcondition' VC for cons4 @?:?...
[[34m  Info  [0m]  => VALID
[[34m  Info  [0m]  - Now considering 'precond. (call force4[T](q.sf, q.f, q.r, q.sr, st@))' VC for cons4 @?:?...
[[34m  Info  [0m]  => VALID
[[34m  Info  [0m]  - Now considering 'precond. (call force4[T](q.sr, q.r, q.f, nsf7._1, nsf7. ...)' VC for cons4 @?:?...
[[34m  Info  [0m]  => VALID
[[34m  Info  [0m]  - Now considering 'precond. (call createQueue4[T](SCons[T](x, Val[T](q.f)) ...)' VC for cons4 @?:?...
[[34m  Info  [0m]  => VALID
[[34m  Info  [0m]  - Now considering 'postcondition' VC for tail10 @?:?...
[[34m  Info  [0m]  => VALID
[[34m  Info  [0m]  - Now considering 'precond. (call force4[T](q.f, q.sf, q.r, q.sr, st@))' VC for tail10 @?:?...
[[34m  Info  [0m]  => VALID
[[34m  Info  [0m]  - Now considering 'precond. (call tailSub4[T](q, scr2._2))' VC for tail10 @?:?...
[[34m  Info  [0m]  => VALID
[[34m  Info  [0m]  - Now considering 'match exhaustiveness' VC for tail10 @?:?...
[[34m  Info  [0m]  => VALID
[[34m  Info  [0m]  - Now considering 'postcondition' VC for tailSub4 @?:?...
[[34m  Info  [0m]  => VALID
[[34m  Info  [0m]  - Now considering 'precond. (call forceTwice4[T](q, st@))' VC for tailSub4 @?:?...
[[34m  Info  [0m]  => VALID
[[34m  Info  [0m]  - Now considering 'precond. (call createQueue4[T](a212._1, q.lenf - BigInt ...)' VC for tailSub4 @?:?...
[[34m  Info  [0m]  => VALID
[[34m  Info  [0m]  - Now considering 'match exhaustiveness' VC for tailSub4 @?:?...
[[34m  Info  [0m]  => VALID
[[34m  Info  [0m]  - Now considering 'match exhaustiveness' VC for tailSub4 @?:?...
[[34m  Info  [0m]  => VALID
[[34m  Info  [0m]  - Now considering 'match exhaustiveness' VC for tailSub4 @?:?...
[[34m  Info  [0m]  => VALID
[[34m  Info  [0m]  - Now considering 'match exhaustiveness' VC for tailSub4 @?:?...
[[34m  Info  [0m]  => VALID
[[34m  Info  [0m]  - Now considering 'postcondition' VC for reverse6 @?:?...
[[34m  Info  [0m]  => VALID
[[34m  Info  [0m]  - Now considering 'postcondition' VC for snoc4 @?:?...
[[34m  Info  [0m]  => VALID
[[34m  Info  [0m]  - Now considering 'precond. (call cons4[T](x, reverse6[T](q, st@), st@))' VC for snoc4 @?:?...
[[34m  Info  [0m]  => VALID
[[34m  Info  [0m]  - Now considering 'precond. (call reverse6[T](q, st@))' VC for snoc4 @?:?...
[[34m  Info  [0m]  => VALID
[[34m  Info  [0m]  - Now considering 'precond. (call reverse6[T](a213._1, a213._2))' VC for snoc4 @?:?...
[[34m  Info  [0m]  => VALID
[[34m  Info  [0m]  - Now considering 'tact (postcondition)' VC for funeCompose4 @?:?...
[[34m  Info  [0m]  => VALID
[[34m  Info  [0m]  - Now considering 'tact (precond. (call funeCompose-VCTact[T](c match { ...))' VC for funeCompose4 @?:?...
[[34m  Info  [0m]  => VALID
[[34m  Info  [0m]  - Now considering 'tact (match exhaustiveness)' VC for funeCompose4 @?:?...
[[34m  Info  [0m]  => VALID
[[34m  Info  [0m]  - Now considering 'tact (match exhaustiveness)' VC for funeCompose4 @?:?...
[[34m  Info  [0m]  => VALID
[[34m  Info  [0m]  - Now considering 'tact (match exhaustiveness)' VC for funeCompose4 @?:?...
[[34m  Info  [0m]  => VALID
[[34m  Info  [0m]  - Now considering 'tact (match exhaustiveness)' VC for funeCompose4 @?:?...
[[34m  Info  [0m]  => VALID
[[34m  Info  [0m]  - Now considering 'tact (match exhaustiveness)' VC for funeCompose4 @?:?...
[[34m  Info  [0m]  => VALID
[[34m  Info  [0m]  - Now considering 'postcondition' VC for funeMonotone4 @?:?...
[[34m  Info  [0m]  => VALID
[[34m  Info  [0m]  - Now considering 'precond. (call funeCompose4[T](l1, st1, st2))' VC for funeMonotone4 @?:?...
[[34m  Info  [0m]  => VALID
[[34m  Info  [0m]  - Now considering 'precond. (call funeCompose4[T](l2, st1, st2))' VC for funeMonotone4 @?:?...
[[34m  Info  [0m]  => VALID
[[34m  Info  [0m]  - Now considering 'postcondition' VC for size7 @?:?...
[[34m  Info  [0m]  => VALID
[[34m  Info  [0m]  - Now considering 'match exhaustiveness' VC for size7 @?:?...
[[34m  Info  [0m]  => VALID
[[34m  Info  [0m]  - Now considering 'match exhaustiveness' VC for size7 @?:?...
[[34m  Info  [0m]  => VALID
[[34m  Info  [0m]  - Now considering 'postcondition' VC for get-mem3 @?:?...
[[34m  Info  [0m]  => VALID
[[34m  Info  [0m]  - Now considering 'match exhaustiveness' VC for get-mem3 @?:?...
[[34m  Info  [0m]  => VALID
[[34m  Info  [0m]  - Now considering 'postcondition' VC for isEmpty11 @?:?...
[[34m  Info  [0m]  => VALID
[[34m  Info  [0m]  - Now considering 'postcondition' VC for valid5 @?:?...
[[34m  Info  [0m]  => VALID
  ┌──────────────────────━
╔═╡ Verification Summary ═════════════════════════════════════════════════════════════════════════════════════════════════════════════════╗
║ └──────────────────────┘                                                                                                                ║
║ RealTimeDeque.RotateDropL@rotateDropPre1  match exhaustiveness                                          ?:?  valid  U:smt-cvc4    0.016 ║
║ RealTimeDeque.RotateDropL@rotateDropPre1  postcondition                                                 ?:?  valid  U:smt-cvc4    3.240 ║
║ RealTimeDeque.RotateDropL@rotateDropPre1  precond. (call drop6[T](BigInt(2), f, nr19._2))               ?:?  valid  U:smt-cvc4    1.232 ║
║ RealTimeDeque.RotateRevL@rotateRevPre1    match exhaustiveness                                          ?:?  valid  U:smt-z3      0.016 ║
║ RealTimeDeque.RotateRevL@rotateRevPre1    postcondition                                                 ?:?  valid  U:smt-cvc4    5.879 ║
║ RealTimeDeque.RotateRevL@rotateRevPre1    precond. (call drop6[T](BigInt(2), f, nr17._2))               ?:?  valid  U:smt-cvc4    0.723 ║
║ RealTimeDeque.RotateRevL@rotateRevPre1    precond. (call revAppend4[T](a203._1, a, a203._2))            ?:?  valid  U:smt-cvc4    1.890 ║
║ RealTimeDeque.RotateRevL@rotateRevPre1    precond. (call take6[T](BigInt(2), f, nf17._2))               ?:?  valid  U:smt-z3      0.331 ║
║ RealTimeDeque.TakeLazyL@takeLazyPre1      match exhaustiveness                                          ?:?  valid  U:smt-z3      0.015 ║
║ RealTimeDeque.TakeLazyL@takeLazyPre1      postcondition                                                 ?:?  valid  U:smt-cvc4    0.954 ║
║ RealTimeDeque.cons4                       postcondition                                                 ?:?  valid  U:smt-z3      1.605 ║
║ RealTimeDeque.cons4                       precond. (call createQueue4[T](SCons[T](x, Val[T](q.f)) ...)  ?:?  valid  U:smt-z3      1.627 ║
║ RealTimeDeque.cons4                       precond. (call force4[T](q.sf, q.f, q.r, q.sr, st@))          ?:?  valid  U:smt-z3      0.205 ║
║ RealTimeDeque.cons4                       precond. (call force4[T](q.sr, q.r, q.f, nsf7._1, nsf7. ...)  ?:?  valid  U:smt-z3      0.657 ║
║ RealTimeDeque.createQueue4                postcondition                                                 ?:?  valid  U:smt-z3      1.513 ║
║ RealTimeDeque.createQueue4                precond. (call rotateDrop4[T](f, j, r, st@))                  ?:?  valid  U:smt-z3      0.547 ║
║ RealTimeDeque.createQueue4                precond. (call rotateDrop4[T](r, i, f, st@))                  ?:?  valid  U:smt-z3      0.641 ║
║ RealTimeDeque.createQueue4                precond. (call takeLazy4[T](i, f, nr20._2))                   ?:?  valid  U:smt-z3      0.806 ║
║ RealTimeDeque.createQueue4                precond. (call takeLazy4[T](j, r, nf21._2))                   ?:?  valid  U:smt-z3      0.791 ║
║ RealTimeDeque.drop6                       match exhaustiveness                                          ?:?  valid  U:smt-z3      0.015 ║
║ RealTimeDeque.drop6                       match exhaustiveness                                          ?:?  valid  U:smt-z3      0.013 ║
║ RealTimeDeque.drop6                       postcondition                                                 ?:?  valid  U:smt-z3      0.301 ║
║ RealTimeDeque.drop6                       precond. (call drop6[T](n - BigInt(1), a199._1, a199._2 ...)  ?:?  valid  U:smt-cvc4    0.941 ║
║ RealTimeDeque.empty6                      postcondition                                                 ?:?  valid  U:smt-z3      0.008 ║
║ RealTimeDeque.firstUneval4                match exhaustiveness                                          ?:?  valid  U:smt-z3      0.016 ║
║ RealTimeDeque.firstUneval4                match exhaustiveness                                          ?:?  valid  U:smt-z3      0.011 ║
║ RealTimeDeque.firstUneval4                match exhaustiveness                                          ?:?  valid  U:smt-z3      0.019 ║
║ RealTimeDeque.firstUneval4                match exhaustiveness                                          ?:?  valid  U:smt-z3      0.018 ║
║ RealTimeDeque.firstUneval4                match exhaustiveness                                          ?:?  valid  U:smt-z3      0.009 ║
║ RealTimeDeque.firstUneval4                match exhaustiveness                                          ?:?  valid  U:smt-cvc4    0.012 ║
║ RealTimeDeque.firstUneval4                postcondition                                                 ?:?  valid  U:smt-z3      0.612 ║
║ RealTimeDeque.force4                      match exhaustiveness                                          ?:?  valid  U:smt-z3      0.012 ║
║ RealTimeDeque.force4                      match exhaustiveness                                          ?:?  valid  U:smt-z3      0.011 ║
║ RealTimeDeque.force4                      postcondition                                                 ?:?  valid  U:smt-z3      1.029 ║
║ RealTimeDeque.force4                      precond. (call funeMonotone4[T](other, hother, st@, out ...)  ?:?  valid  U:smt-z3      0.597 ║
║ RealTimeDeque.force4                      precond. (call funeMonotone4[T](tar, htar, st@, out1))        ?:?  valid  U:smt-z3      0.473 ║
║ RealTimeDeque.forceTwice4                 postcondition                                                 ?:?  valid  U:smt-z3      1.476 ║
║ RealTimeDeque.forceTwice4                 precond. (call force4[T](a210._1, q.f, q.r, q.sr, a210. ...)  ?:?  valid  U:smt-z3      0.640 ║
║ RealTimeDeque.forceTwice4                 precond. (call force4[T](a211._1, q.r, q.f, nsf6._1, a2 ...)  ?:?  valid  U:smt-z3      1.243 ║
║ RealTimeDeque.forceTwice4                 precond. (call force4[T](q.sf, q.f, q.r, q.sr, st@))          ?:?  valid  U:smt-z3      0.201 ║
║ RealTimeDeque.forceTwice4                 precond. (call force4[T](q.sr, q.r, q.f, nsf6._1, nsf6. ...)  ?:?  valid  U:smt-z3      0.843 ║
║ RealTimeDeque.funeCompose4                tact (match exhaustiveness)                                   ?:?  valid  U:smt-z3      0.013 ║
║ RealTimeDeque.funeCompose4                tact (match exhaustiveness)                                   ?:?  valid  U:smt-z3      0.011 ║
║ RealTimeDeque.funeCompose4                tact (match exhaustiveness)                                   ?:?  valid  U:smt-z3      0.014 ║
║ RealTimeDeque.funeCompose4                tact (match exhaustiveness)                                   ?:?  valid  U:smt-z3      0.009 ║
║ RealTimeDeque.funeCompose4                tact (match exhaustiveness)                                   ?:?  valid  U:smt-z3      0.013 ║
║ RealTimeDeque.funeCompose4                tact (postcondition)                                          ?:?  valid  U:smt-z3      0.630 ║
║ RealTimeDeque.funeCompose4                tact (precond. (call funeCompose-VCTact[T](c match { ...))    ?:?  valid  U:smt-z3      0.012 ║
║ RealTimeDeque.funeEqual4                  postcondition                                                 ?:?  valid  U:smt-z3      0.011 ║
║ RealTimeDeque.funeMonotone4               postcondition                                                 ?:?  valid  U:smt-z3      0.552 ║
║ RealTimeDeque.funeMonotone4               precond. (call funeCompose4[T](l1, st1, st2))                 ?:?  valid  U:smt-z3      0.011 ║
║ RealTimeDeque.funeMonotone4               precond. (call funeCompose4[T](l2, st1, st2))                 ?:?  valid  U:smt-z3      0.011 ║
║ ValOrFun.get-mem3                         match exhaustiveness                                          ?:?  valid  U:smt-z3      0.009 ║
║ ValOrFun.get-mem3                         postcondition                                                 ?:?  valid  U:smt-z3      0.247 ║
║ RealTimeDeque.head6                       match exhaustiveness                                          ?:?  valid  U:smt-z3      0.181 ║
║ RealTimeDeque.head6                       postcondition                                                 ?:?  valid  U:smt-z3      0.174 ║
║ RealTimeDeque.isConcrete4                 match exhaustiveness                                          ?:?  valid  U:smt-z3      0.012 ║
║ RealTimeDeque.isConcrete4                 match exhaustiveness                                          ?:?  valid  U:smt-cvc4    0.033 ║
║ RealTimeDeque.isConcrete4                 match exhaustiveness                                          ?:?  valid  U:smt-z3      0.022 ║
║ RealTimeDeque.isConcrete4                 postcondition                                                 ?:?  valid  U:smt-cvc4    0.539 ║
║ Queue.isEmpty11                           postcondition                                                 ?:?  valid  U:smt-z3      0.009 ║
║ RealTimeDeque.revAppend4                  match exhaustiveness                                          ?:?  valid  U:smt-z3      0.013 ║
║ RealTimeDeque.revAppend4                  match exhaustiveness                                          ?:?  valid  U:smt-cvc4    0.012 ║
║ RealTimeDeque.revAppend4                  postcondition                                                 ?:?  valid  U:smt-z3      0.538 ║
║ RealTimeDeque.revAppend4                  precond. (call revAppend4[T](a198._1, SCons[T](x, Val[T ...)  ?:?  valid  U:smt-cvc4    1.261 ║
║ RealTimeDeque.reverse6                    postcondition                                                 ?:?  valid  U:smt-z3      0.195 ║
║ RealTimeDeque.rotateDrop4                 match exhaustiveness                                          ?:?  valid  U:smt-z3      0.014 ║
║ RealTimeDeque.rotateDrop4                 match exhaustiveness                                          ?:?  valid  U:smt-z3      0.013 ║
║ RealTimeDeque.rotateDrop4                 postcondition                                                 ?:?  valid  U:smt-z3      0.748 ║
║ RealTimeDeque.rotateDrop4                 precond. (call drop6[T](BigInt(2), f, nr19._2))               ?:?  valid  U:smt-cvc4    0.458 ║
║ RealTimeDeque.rotateDrop4                 precond. (call drop6[T](i, f, st@))                           ?:?  valid  U:smt-cvc4    0.015 ║
║ RealTimeDeque.rotateDrop4                 precond. (call rotateRev4[T](r, a205._1, SNil[T](), a20 ...)  ?:?  valid  U:smt-z3      0.252 ║
║ RealTimeDeque.rotateRev4                  match exhaustiveness                                          ?:?  valid  U:smt-z3      0.013 ║
║ RealTimeDeque.rotateRev4                  match exhaustiveness                                          ?:?  valid  U:smt-z3      0.014 ║
║ RealTimeDeque.rotateRev4                  postcondition                                                 ?:?  valid  U:smt-z3      0.963 ║
║ RealTimeDeque.rotateRev4                  precond. (call drop6[T](BigInt(2), f, nr17._2))               ?:?  valid  U:smt-cvc4    0.571 ║
║ RealTimeDeque.rotateRev4                  precond. (call revAppend4[T](a203._1, a, a203._2))            ?:?  valid  U:smt-cvc4    1.687 ║
║ RealTimeDeque.rotateRev4                  precond. (call revAppend4[T](f, a, st@))                      ?:?  valid  U:smt-z3      0.014 ║
║ RealTimeDeque.rotateRev4                  precond. (call take6[T](BigInt(2), f, nf17._2))               ?:?  valid  U:smt-z3      0.268 ║
║ Stream.size7                              match exhaustiveness                                          ?:?  valid  U:smt-z3      0.010 ║
║ Stream.size7                              match exhaustiveness                                          ?:?  valid  U:smt-z3      0.010 ║
║ Stream.size7                              postcondition                                                 ?:?  valid  U:smt-z3      0.157 ║
║ RealTimeDeque.snoc4                       postcondition                                                 ?:?  valid  U:smt-z3      0.788 ║
║ RealTimeDeque.snoc4                       precond. (call cons4[T](x, reverse6[T](q, st@), st@))         ?:?  valid  U:smt-z3      0.422 ║
║ RealTimeDeque.snoc4                       precond. (call reverse6[T](a213._1, a213._2))                 ?:?  valid  U:smt-z3      0.953 ║
║ RealTimeDeque.snoc4                       precond. (call reverse6[T](q, st@))                           ?:?  valid  U:smt-z3      0.010 ║
║ RealTimeDeque.tail10                      match exhaustiveness                                          ?:?  valid  U:smt-z3      0.007 ║
║ RealTimeDeque.tail10                      postcondition                                                 ?:?  valid  U:smt-z3      1.224 ║
║ RealTimeDeque.tail10                      precond. (call force4[T](q.f, q.sf, q.r, q.sr, st@))          ?:?  valid  U:smt-z3      0.207 ║
║ RealTimeDeque.tail10                      precond. (call tailSub4[T](q, scr2._2))                       ?:?  valid  U:smt-z3      0.717 ║
║ RealTimeDeque.tailSub4                    match exhaustiveness                                          ?:?  valid  U:smt-z3      0.013 ║
║ RealTimeDeque.tailSub4                    match exhaustiveness                                          ?:?  valid  U:smt-cvc4    0.015 ║
║ RealTimeDeque.tailSub4                    match exhaustiveness                                          ?:?  valid  U:smt-cvc4    0.010 ║
║ RealTimeDeque.tailSub4                    match exhaustiveness                                          ?:?  valid  U:smt-z3      0.012 ║
║ RealTimeDeque.tailSub4                    postcondition                                                 ?:?  valid  U:smt-z3      1.658 ║
║ RealTimeDeque.tailSub4                    precond. (call createQueue4[T](a212._1, q.lenf - BigInt ...)  ?:?  valid  U:smt-z3      1.487 ║
║ RealTimeDeque.tailSub4                    precond. (call forceTwice4[T](q, st@))                        ?:?  valid  U:smt-z3      0.012 ║
║ RealTimeDeque.take6                       match exhaustiveness                                          ?:?  valid  U:smt-z3      0.012 ║
║ RealTimeDeque.take6                       match exhaustiveness                                          ?:?  valid  U:smt-z3      0.013 ║
║ RealTimeDeque.take6                       postcondition                                                 ?:?  valid  U:smt-z3      0.301 ║
║ RealTimeDeque.take6                       precond. (call take6[T](n - BigInt(1), a200._1, a200._2 ...)  ?:?  valid  U:smt-cvc4    0.780 ║
║ RealTimeDeque.takeLazy4                   match exhaustiveness                                          ?:?  valid  U:smt-z3      0.018 ║
║ RealTimeDeque.takeLazy4                   match exhaustiveness                                          ?:?  valid  U:smt-z3      0.096 ║
║ RealTimeDeque.takeLazy4                   postcondition                                                 ?:?  valid  U:smt-z3      0.563 ║
║ Queue.valid5                              postcondition                                                 ?:?  valid  U:smt-z3      0.015 ║
╟┄┄┄┄┄┄┄┄┄┄┄┄┄┄┄┄┄┄┄┄┄┄┄┄┄┄┄┄┄┄┄┄┄┄┄┄┄┄┄┄┄┄┄┄┄┄┄┄┄┄┄┄┄┄┄┄┄┄┄┄┄┄┄┄┄┄┄┄┄┄┄┄┄┄┄┄┄┄┄┄┄┄┄┄┄┄┄┄┄┄┄┄┄┄┄┄┄┄┄┄┄┄┄┄┄┄┄┄┄┄┄┄┄┄┄┄┄┄┄┄┄┄┄┄┄┄┄┄┄┄┄┄┄┄┄┄┄╢
║ total: 105    valid: 105    invalid: 0      unknown 0                                                                            50.260 ║
╚══════════════════════════════════════════════════════════════════════════════════════════════════════════════════════════════════════════
instfuncs:  instFuncTypes: 
[[34m  Info  [0m] - considering function takeLazy-time...
[[34m  Info  [0m] Candidate invariants
[[34m  Info  [0m] takeLazy-time-->res123._2 <= 0
[[34m  Info  [0m] checked VC inst... in 0.068s
[[34m  Info  [0m] Function: takeLazy-time--Found candidate invariant is not a real invariant! 
[[34m  Info  [0m] # of atomic predicates: 6 + 1
[[34m  Info  [0m] solving...
[[34m  Info  [0m] solved... in 0.035s
[[34m  Info  [0m] Candidate invariants
[[34m  Info  [0m] takeLazy-time-->res123._2 + -10 <= 0
[[34m  Info  [0m] checked VC inst... in 0.025s
[[34m  Info  [0m] Function: takeLazy-time--Found candidate invariant is not a real invariant! 
[[34m  Info  [0m] # of atomic predicates: 9 + 7
[[34m  Info  [0m] solving...
[[34m  Info  [0m] solved... in 0.011s
[[34m  Info  [0m] Candidate invariants
[[34m  Info  [0m] takeLazy-time-->res123._2 + -16 <= 0
[[34m  Info  [0m] checked VC inst... in 0.017s
[[34m  Info  [0m] Function: takeLazy-time--Found candidate invariant is not a real invariant! 
[[34m  Info  [0m] # of atomic predicates: 8 + 16
[[34m  Info  [0m] solving...
[[34m  Info  [0m] solved... in 0.009s
[[34m  Info  [0m] - More unrollings for invariant inference
[[34m  Info  [0m] Candidate invariants
[[34m  Info  [0m] takeLazy-time-->res123._2 <= 0
[[34m  Info  [0m] checked VC inst... in 0.025s
[[34m  Info  [0m] Function: takeLazy-time--Found candidate invariant is not a real invariant! 
[[34m  Info  [0m] # of atomic predicates: 9 + 1
[[34m  Info  [0m] solving...
[[34m  Info  [0m] solved... in 0.009s
[[34m  Info  [0m] Candidate invariants
[[34m  Info  [0m] takeLazy-time-->res123._2 + -10 <= 0
[[34m  Info  [0m] checked VC inst... in 0.017s
[[34m  Info  [0m] Function: takeLazy-time--Found candidate invariant is not a real invariant! 
[[34m  Info  [0m] # of atomic predicates: 13 + 10
[[34m  Info  [0m] solving...
[[34m  Info  [0m] solved... in 0.008s
[[34m  Info  [0m] Candidate invariants
[[34m  Info  [0m] takeLazy-time-->res123._2 + -16 <= 0
[[34m  Info  [0m] checked VC inst... in 0.017s
[[34m  Info  [0m] Function: takeLazy-time--Found candidate invariant is not a real invariant! 
[[34m  Info  [0m] # of atomic predicates: 13 + 23
[[34m  Info  [0m] solving...
[[34m  Info  [0m] solved... in 0.01s
[[34m  Info  [0m] Candidate invariants
[[34m  Info  [0m] takeLazy-time-->res123._2 + -20 <= 0
[[34m  Info  [0m] checked VC inst... in 0.005s
[[34m  Info  [0m] minimizing...
[[34m  Info  [0m] Candidate invariants
[[34m  Info  [0m] takeLazy-time-->res123._2 + -19 <= 0
[[34m  Info  [0m] checked VC inst... in 0.006s
[[34m  Info  [0m] - Found inductive invariant: takeLazy-time --> time + BigInt(-19) <= BigInt(0)
[[34m  Info  [0m] - Verifying Invariants... 
[[34m  Info  [0m] - Invariant verified
[[34m  Info  [0m] - considering function revAppend-time...
[[34m  Info  [0m] Candidate invariants
[[34m  Info  [0m] revAppend-time-->res124._2 <= 0
[[34m  Info  [0m] checked VC inst... in 0.023s
[[34m  Info  [0m] Function: revAppend-time--Found candidate invariant is not a real invariant! 
[[34m  Info  [0m] # of atomic predicates: 8 + 1
[[34m  Info  [0m] solving...
[[34m  Info  [0m] solved... in 0.01s
[[34m  Info  [0m] Candidate invariants
[[34m  Info  [0m] revAppend-time-->(-1 * l1.size + res124._2) + -4 <= 0
[[34m  Info  [0m] checked VC inst... in 0.025s
[[34m  Info  [0m] Function: revAppend-time--Found candidate invariant is not a real invariant! 
[[34m  Info  [0m] # of atomic predicates: 8 + 9
[[34m  Info  [0m] solving...
[[34m  Info  [0m] solved... in 0.01s
[[34m  Info  [0m] - More unrollings for invariant inference
[[34m  Info  [0m] Candidate invariants
[[34m  Info  [0m] revAppend-time-->res124._2 <= 0
[[34m  Info  [0m] checked VC inst... in 0.061s
[[34m  Info  [0m] Function: revAppend-time--Found candidate invariant is not a real invariant! 
[[34m  Info  [0m] # of atomic predicates: 8 + 1
[[34m  Info  [0m] solving...
[[34m  Info  [0m] solved... in 0.007s
[[34m  Info  [0m] Candidate invariants
[[34m  Info  [0m] revAppend-time-->res124._2 + -4 <= 0
[[34m  Info  [0m] checked VC inst... in 0.053s
[[34m  Info  [0m] Function: revAppend-time--Found candidate invariant is not a real invariant! 
[[34m  Info  [0m] # of atomic predicates: 14 + 9
[[34m  Info  [0m] solving...
[[34m  Info  [0m] solved... in 0.008s
[[34m  Info  [0m] Candidate invariants
[[34m  Info  [0m] revAppend-time-->(-16 * l1.size + res124._2) + -4 <= 0
[[34m  Info  [0m] checked VC inst... in 0.057s
[[34m  Info  [0m] Function: revAppend-time--Found candidate invariant is not a real invariant! 
[[34m  Info  [0m] # of atomic predicates: 15 + 23
[[34m  Info  [0m] solving...
[[34m  Info  [0m] solved... in 0.01s
[[34m  Info  [0m] Candidate invariants
[[34m  Info  [0m] revAppend-time-->(-21 * l1.size + res124._2) + -4 <= 0
[[34m  Info  [0m] checked VC inst... in 0.585s
[[34m  Info  [0m] Function: revAppend-time--Found candidate invariant is not a real invariant! 
[[34m  Info  [0m] # of atomic predicates: 19 + 38
[[34m  Info  [0m] solving...
[[34m  Info  [0m] solved... in 0.01s
[[34m  Info  [0m] - More unrollings for invariant inference
[[34m  Info  [0m] Candidate invariants
[[34m  Info  [0m] revAppend-time-->res124._2 <= 0
[[34m  Info  [0m] checked VC inst... in 0.128s
[[34m  Info  [0m] Function: revAppend-time--Found candidate invariant is not a real invariant! 
[[34m  Info  [0m] # of atomic predicates: 8 + 1
[[34m  Info  [0m] solving...
[[34m  Info  [0m] solved... in 0.008s
[[34m  Info  [0m] Candidate invariants
[[34m  Info  [0m] revAppend-time-->res124._2 + -4 <= 0
[[34m  Info  [0m] checked VC inst... in 0.099s
[[34m  Info  [0m] Function: revAppend-time--Found candidate invariant is not a real invariant! 
[[34m  Info  [0m] # of atomic predicates: 14 + 9
[[34m  Info  [0m] solving...
[[34m  Info  [0m] solved... in 0.008s
[[34m  Info  [0m] Candidate invariants
[[34m  Info  [0m] revAppend-time-->(-16 * l1.size + res124._2) + -4 <= 0
[[34m  Info  [0m] checked VC inst... in 0.082s
[[34m  Info  [0m] Function: revAppend-time--Found candidate invariant is not a real invariant! 
[[34m  Info  [0m] # of atomic predicates: 15 + 23
[[34m  Info  [0m] solving...
[[34m  Info  [0m] solved... in 0.009s
[[34m  Info  [0m] Candidate invariants
[[34m  Info  [0m] revAppend-time-->(-21 * l1.size + res124._2) + -4 <= 0
[[34m  Info  [0m] checked VC inst... in 0.016s
[[34m  Info  [0m] minimizing...
[[34m  Info  [0m] Candidate invariants
[[34m  Info  [0m] revAppend-time-->(-17 * l1.size + res124._2) + -2 <= 0
[[34m  Info  [0m] checked VC inst... in 0.016s
[[34m  Info  [0m] - Found inductive invariant: revAppend-time --> (BigInt(-17) * l1.size + time) + BigInt(-2) <= BigInt(0)
[[34m  Info  [0m] - Verifying Invariants... 
[[34m  Info  [0m] - Invariant verified
[[34m  Info  [0m] - considering function drop-time...
[[34m  Info  [0m] Candidate invariants
[[34m  Info  [0m] drop-time-->0 * n + res127._2 <= 0
[[34m  Info  [0m] checked VC inst... in 0.018s
[[34m  Info  [0m] Function: drop-time--Found candidate invariant is not a real invariant! 
[[34m  Info  [0m] # of atomic predicates: 8 + 1
[[34m  Info  [0m] solving...
[[34m  Info  [0m] solved... in 0.008s
[[34m  Info  [0m] Candidate invariants
[[34m  Info  [0m] drop-time-->(0 * n + res127._2) + -4 <= 0
[[34m  Info  [0m] checked VC inst... in 0.017s
[[34m  Info  [0m] Function: drop-time--Found candidate invariant is not a real invariant! 
[[34m  Info  [0m] # of atomic predicates: 11 + 9
[[34m  Info  [0m] solving...
[[34m  Info  [0m] solved... in 0.007s
[[34m  Info  [0m] - More unrollings for invariant inference
[[34m  Info  [0m] Candidate invariants
[[34m  Info  [0m] drop-time-->0 * n + res127._2 <= 0
[[34m  Info  [0m] checked VC inst... in 0.052s
[[34m  Info  [0m] Function: drop-time--Found candidate invariant is not a real invariant! 
[[34m  Info  [0m] # of atomic predicates: 9 + 1
[[34m  Info  [0m] solving...
[[34m  Info  [0m] solved... in 0.007s
[[34m  Info  [0m] Candidate invariants
[[34m  Info  [0m] drop-time-->(0 * n + res127._2) + -4 <= 0
[[34m  Info  [0m] checked VC inst... in 0.039s
[[34m  Info  [0m] Function: drop-time--Found candidate invariant is not a real invariant! 
[[34m  Info  [0m] # of atomic predicates: 15 + 10
[[34m  Info  [0m] solving...
[[34m  Info  [0m] solved... in 0.01s
[[34m  Info  [0m] Candidate invariants
[[34m  Info  [0m] drop-time-->(-17 * n + res127._2) + -3 <= 0
[[34m  Info  [0m] checked VC inst... in 0.032s
[[34m  Info  [0m] Function: drop-time--Found candidate invariant is not a real invariant! 
[[34m  Info  [0m] # of atomic predicates: 15 + 25
[[34m  Info  [0m] solving...
[[34m  Info  [0m] solved... in 0.01s
[[34m  Info  [0m] Candidate invariants
[[34m  Info  [0m] drop-time-->(-19 * n + res127._2) + -3 <= 0
[[34m  Info  [0m] checked VC inst... in 0.009s
[[34m  Info  [0m] minimizing...
[[34m  Info  [0m] Candidate invariants
[[34m  Info  [0m] drop-time-->(-18 * n + res127._2) + -2 <= 0
[[34m  Info  [0m] checked VC inst... in 0.005s
[[34m  Info  [0m] - Found inductive invariant: drop-time --> (BigInt(-18) * n + time) + BigInt(-2) <= BigInt(0)
[[34m  Info  [0m] - Verifying Invariants... 
[[34m  Info  [0m] - Invariant verified
[[34m  Info  [0m] - considering function take-time...
[[34m  Info  [0m] Candidate invariants
[[34m  Info  [0m] take-time-->res126._2 + 0 * n <= 0
[[34m  Info  [0m] checked VC inst... in 0.022s
[[34m  Info  [0m] Function: take-time--Found candidate invariant is not a real invariant! 
[[34m  Info  [0m] # of atomic predicates: 8 + 1
[[34m  Info  [0m] solving...
[[34m  Info  [0m] solved... in 0.008s
[[34m  Info  [0m] Candidate invariants
[[34m  Info  [0m] take-time-->(res126._2 + 0 * n) + -5 <= 0
[[34m  Info  [0m] checked VC inst... in 0.032s
[[34m  Info  [0m] Function: take-time--Found candidate invariant is not a real invariant! 
[[34m  Info  [0m] # of atomic predicates: 9 + 9
[[34m  Info  [0m] solving...
[[34m  Info  [0m] solved... in 0.007s
[[34m  Info  [0m] - More unrollings for invariant inference
[[34m  Info  [0m] Candidate invariants
[[34m  Info  [0m] take-time-->res126._2 + 0 * n <= 0
[[34m  Info  [0m] checked VC inst... in 0.046s
[[34m  Info  [0m] Function: take-time--Found candidate invariant is not a real invariant! 
[[34m  Info  [0m] # of atomic predicates: 9 + 1
[[34m  Info  [0m] solving...
[[34m  Info  [0m] solved... in 0.01s
[[34m  Info  [0m] Candidate invariants
[[34m  Info  [0m] take-time-->(res126._2 + 0 * n) + -5 <= 0
[[34m  Info  [0m] checked VC inst... in 0.036s
[[34m  Info  [0m] Function: take-time--Found candidate invariant is not a real invariant! 
[[34m  Info  [0m] # of atomic predicates: 15 + 10
[[34m  Info  [0m] solving...
[[34m  Info  [0m] solved... in 0.01s
[[34m  Info  [0m] Candidate invariants
[[34m  Info  [0m] take-time-->(res126._2 + -21 * n) + -4 <= 0
[[34m  Info  [0m] checked VC inst... in 0.007s
[[34m  Info  [0m] minimizing...
[[34m  Info  [0m] Candidate invariants
[[34m  Info  [0m] take-time-->(res126._2 + -1 * n) + -3 <= 0
[[34m  Info  [0m] checked VC inst... in 0.031s
[[34m  Info  [0m] Function: take-time--Found candidate invariant is not a real invariant! 
[[34m  Info  [0m] # of atomic predicates: 15 + 25
[[34m  Info  [0m] solving...
[[34m  Info  [0m] solved... in 0.011s
[[34m  Info  [0m] Candidate invariants
[[34m  Info  [0m] take-time-->(res126._2 + -18 * n) + -4 <= 0
[[34m  Info  [0m] checked VC inst... in 0.026s
[[34m  Info  [0m] Function: take-time--Found candidate invariant is not a real invariant! 
[[34m  Info  [0m] # of atomic predicates: 15 + 40
[[34m  Info  [0m] solving...
[[34m  Info  [0m] solved... in 0.01s
[[34m  Info  [0m] Candidate invariants
[[34m  Info  [0m] take-time-->(res126._2 + -22 * n) + -4 <= 0
[[34m  Info  [0m] checked VC inst... in 0.006s
[[34m  Info  [0m] minimizing...
[[34m  Info  [0m] Candidate invariants
[[34m  Info  [0m] take-time-->(res126._2 + -21 * n) + -3 <= 0
[[34m  Info  [0m] checked VC inst... in 0.006s
[[34m  Info  [0m] - Found inductive invariant: take-time --> (time + BigInt(-21) * n) + BigInt(-3) <= BigInt(0)
[[34m  Info  [0m] - Verifying Invariants... 
[[34m  Info  [0m] - Invariant verified
[[34m  Info  [0m] - considering function rotateRev-time...
[[34m  Info  [0m] Candidate invariants
[[34m  Info  [0m] rotateRev-time-->res129._2 <= 0
[[34m  Info  [0m] checked VC inst... in 0.078s
[[34m  Info  [0m] Function: rotateRev-time--Found candidate invariant is not a real invariant! 
[[34m  Info  [0m] # of atomic predicates: 13 + 1
[[34m  Info  [0m] solving...
[[34m  Info  [0m] solved... in 0.008s
[[34m  Info  [0m] - More unrollings for invariant inference
[[34m  Info  [0m] Candidate invariants
[[34m  Info  [0m] rotateRev-time-->res129._2 <= 0
[[34m  Info  [0m] checked VC inst... in 3.617s
[[34m  Info  [0m] Function: rotateRev-time--Found candidate invariant is not a real invariant! 
[[34m  Info  [0m] # of atomic predicates: 23 + 1
[[34m  Info  [0m] solving...
[[34m  Info  [0m] solved... in 0.007s
[[34m  Info  [0m] Candidate invariants
[[34m  Info  [0m] rotateRev-time-->res129._2 + -142 <= 0
[[34m  Info  [0m] checked VC inst... in 0.057s
[[34m  Info  [0m] minimizing...
[[34m  Info  [0m] Candidate invariants
[[34m  Info  [0m] rotateRev-time-->res129._2 + -138 <= 0
[[34m  Info  [0m] checked VC inst... in 0.483s
[[34m  Info  [0m] Function: rotateRev-time--Found candidate invariant is not a real invariant! 
[[34m  Info  [0m] # of atomic predicates: 23 + 24
[[34m  Info  [0m] solving...
[[34m  Info  [0m] solved... in 0.009s
[[34m  Info  [0m] Candidate invariants
[[34m  Info  [0m] rotateRev-time-->res129._2 + -143 <= 0
[[34m  Info  [0m] checked VC inst... in 0.017s
[[34m  Info  [0m] minimizing...
[[34m  Info  [0m] Candidate invariants
[[34m  Info  [0m] rotateRev-time-->res129._2 + -142 <= 0
[[34m  Info  [0m] checked VC inst... in 0.012s
[[34m  Info  [0m] - Found inductive invariant: rotateRev-time --> time + BigInt(-142) <= BigInt(0)
[[34m  Info  [0m] - Verifying Invariants... 
[[34m  Info  [0m] - Invariant verified
[[34m  Info  [0m] - considering function rotateDrop-time...
[[34m  Info  [0m] Candidate invariants
[[34m  Info  [0m] rotateDrop-time-->res130._2 <= 0
[[34m  Info  [0m] checked VC inst... in 0.03s
[[34m  Info  [0m] Function: rotateDrop-time--Found candidate invariant is not a real invariant! 
[[34m  Info  [0m] # of atomic predicates: 18 + 1
[[34m  Info  [0m] solving...
[[34m  Info  [0m] solved... in 0.007s
[[34m  Info  [0m] Candidate invariants
[[34m  Info  [0m] rotateDrop-time-->res130._2 + -61 <= 0
[[34m  Info  [0m] checked VC inst... in 0.018s
[[34m  Info  [0m] Function: rotateDrop-time--Found candidate invariant is not a real invariant! 
[[34m  Info  [0m] # of atomic predicates: 18 + 19
[[34m  Info  [0m] solving...
[[34m  Info  [0m] solved... in 0.01s
[[34m  Info  [0m] Candidate invariants
[[34m  Info  [0m] rotateDrop-time-->res130._2 + -63 <= 0
[[34m  Info  [0m] checked VC inst... in 0.052s
[[34m  Info  [0m] Function: rotateDrop-time--Found candidate invariant is not a real invariant! 
[[34m  Info  [0m] # of atomic predicates: 19 + 37
[[34m  Info  [0m] solving...
[[34m  Info  [0m] solved... in 0.01s
[[34m  Info  [0m] - More unrollings for invariant inference
[[34m  Info  [0m] Candidate invariants
[[34m  Info  [0m] rotateDrop-time-->res130._2 <= 0
[[34m  Info  [0m] checked VC inst... in 0.383s
[[34m  Info  [0m] Function: rotateDrop-time--Found candidate invariant is not a real invariant! 
[[34m  Info  [0m] # of atomic predicates: 20 + 1
[[34m  Info  [0m] solving...
[[34m  Info  [0m] solved... in 0.008s
[[34m  Info  [0m] Candidate invariants
[[34m  Info  [0m] rotateDrop-time-->res130._2 + -218 <= 0
[[34m  Info  [0m] checked VC inst... in 0.019s
[[34m  Info  [0m] minimizing...
[[34m  Info  [0m] Candidate invariants
[[34m  Info  [0m] rotateDrop-time-->res130._2 + -171 <= 0
[[34m  Info  [0m] checked VC inst... in 1.675s
[[34m  Info  [0m] Function: rotateDrop-time--Found candidate invariant is not a real invariant! 
[[34m  Info  [0m] # of atomic predicates: 20 + 21
[[34m  Info  [0m] solving...
[[34m  Info  [0m] solved... in 0.009s
[[34m  Info  [0m] Candidate invariants
[[34m  Info  [0m] rotateDrop-time-->res130._2 + -192 <= 0
[[34m  Info  [0m] checked VC inst... in 0.042s
[[34m  Info  [0m] minimizing...
[[34m  Info  [0m] Candidate invariants
[[34m  Info  [0m] rotateDrop-time-->res130._2 + -189 <= 0
[[34m  Info  [0m] checked VC inst... in 0.009s
[[34m  Info  [0m] - Found inductive invariant: rotateDrop-time --> time + BigInt(-189) <= BigInt(0)
[[34m  Info  [0m] - Verifying Invariants... 
[[34m  Info  [0m] - Invariant verified
[[34m  Info  [0m] - considering function get-mem-time...
[[34m  Info  [0m] - considering function force-time...
[[34m  Info  [0m] Candidate invariants
[[34m  Info  [0m] force-time-->res119._2 <= 0
[[34m  Info  [0m] checked VC inst... in 0.01s
[[34m  Info  [0m] Function: force-time--Found candidate invariant is not a real invariant! 
[[34m  Info  [0m] # of atomic predicates: 6 + 1
[[34m  Info  [0m] solving...
[[34m  Info  [0m] solved... in 0.008s
[[34m  Info  [0m] Candidate invariants
[[34m  Info  [0m] force-time-->res119._2 + -9 <= 0
[[34m  Info  [0m] checked VC inst... in 0.008s
[[34m  Info  [0m] Function: force-time--Found candidate invariant is not a real invariant! 
[[34m  Info  [0m] # of atomic predicates: 6 + 7
[[34m  Info  [0m] solving...
[[34m  Info  [0m] solved... in 0.008s
[[34m  Info  [0m] Candidate invariants
[[34m  Info  [0m] force-time-->res119._2 + -12 <= 0
[[34m  Info  [0m] checked VC inst... in 0.007s
[[34m  Info  [0m] Function: force-time--Found candidate invariant is not a real invariant! 
[[34m  Info  [0m] # of atomic predicates: 6 + 13
[[34m  Info  [0m] solving...
[[34m  Info  [0m] solved... in 0.007s
[[34m  Info  [0m] - More unrollings for invariant inference
[[34m  Info  [0m] Candidate invariants
[[34m  Info  [0m] force-time-->res119._2 <= 0
[[34m  Info  [0m] checked VC inst... in 0.015s
[[34m  Info  [0m] Function: force-time--Found candidate invariant is not a real invariant! 
[[34m  Info  [0m] # of atomic predicates: 6 + 1
[[34m  Info  [0m] solving...
[[34m  Info  [0m] solved... in 0.007s
[[34m  Info  [0m] Candidate invariants
[[34m  Info  [0m] force-time-->res119._2 + -9 <= 0
[[34m  Info  [0m] checked VC inst... in 0.011s
[[34m  Info  [0m] Function: force-time--Found candidate invariant is not a real invariant! 
[[34m  Info  [0m] # of atomic predicates: 6 + 7
[[34m  Info  [0m] solving...
[[34m  Info  [0m] solved... in 0.007s
[[34m  Info  [0m] Candidate invariants
[[34m  Info  [0m] force-time-->res119._2 + -12 <= 0
[[34m  Info  [0m] checked VC inst... in 0.01s
[[34m  Info  [0m] Function: force-time--Found candidate invariant is not a real invariant! 
[[34m  Info  [0m] # of atomic predicates: 6 + 13
[[34m  Info  [0m] solving...
[[34m  Info  [0m] solved... in 0.008s
[[34m  Info  [0m] - More unrollings for invariant inference
[[34m  Info  [0m] Candidate invariants
[[34m  Info  [0m] force-time-->res119._2 <= 0
[[34m  Info  [0m] checked VC inst... in 0.035s
[[34m  Info  [0m] Function: force-time--Found candidate invariant is not a real invariant! 
[[34m  Info  [0m] # of atomic predicates: 6 + 1
[[34m  Info  [0m] solving...
[[34m  Info  [0m] solved... in 0.007s
[[34m  Info  [0m] Candidate invariants
[[34m  Info  [0m] force-time-->res119._2 + -9 <= 0
[[34m  Info  [0m] checked VC inst... in 0.022s
[[34m  Info  [0m] Function: force-time--Found candidate invariant is not a real invariant! 
[[34m  Info  [0m] # of atomic predicates: 10 + 7
[[34m  Info  [0m] solving...
[[34m  Info  [0m] solved... in 0.009s
[[34m  Info  [0m] Candidate invariants
[[34m  Info  [0m] force-time-->res119._2 + -12 <= 0
[[34m  Info  [0m] checked VC inst... in 0.025s
[[34m  Info  [0m] Function: force-time--Found candidate invariant is not a real invariant! 
[[34m  Info  [0m] # of atomic predicates: 9 + 17
[[34m  Info  [0m] solving...
[[34m  Info  [0m] solved... in 0.009s
[[34m  Info  [0m] Candidate invariants
[[34m  Info  [0m] force-time-->res119._2 + -36 <= 0
[[34m  Info  [0m] checked VC inst... in 0.03s
[[34m  Info  [0m] Function: force-time--Found candidate invariant is not a real invariant! 
[[34m  Info  [0m] # of atomic predicates: 14 + 26
[[34m  Info  [0m] solving...
[[34m  Info  [0m] solved... in 0.01s
[[34m  Info  [0m] Candidate invariants
[[34m  Info  [0m] force-time-->res119._2 + -206 <= 0
[[34m  Info  [0m] checked VC inst... in 0.009s
[[34m  Info  [0m] minimizing...
[[34m  Info  [0m] Candidate invariants
[[34m  Info  [0m] force-time-->res119._2 + -205 <= 0
[[34m  Info  [0m] checked VC inst... in 0.008s
[[34m  Info  [0m] - Found inductive invariant: force-time --> time + BigInt(-205) <= BigInt(0)
[[34m  Info  [0m] - Verifying Invariants... 
[[34m  Info  [0m] - Invariant verified
[[34m  Info  [0m] - considering function forceTwice-time...
[[34m  Info  [0m] Candidate invariants
[[34m  Info  [0m] forceTwice-time-->x$219._2 <= 0
[[34m  Info  [0m] checked VC inst... in 0.014s
[[34m  Info  [0m] Function: forceTwice-time--Found candidate invariant is not a real invariant! 
[[34m  Info  [0m] # of atomic predicates: 13 + 1
[[34m  Info  [0m] solving...
[[34m  Info  [0m] solved... in 0.008s
[[34m  Info  [0m] Candidate invariants
[[34m  Info  [0m] forceTwice-time-->x$219._2 + -843 <= 0
[[34m  Info  [0m] checked VC inst... in 0.002s
[[34m  Info  [0m] minimizing...
[[34m  Info  [0m] Candidate invariants
[[34m  Info  [0m] forceTwice-time-->x$219._2 + -841 <= 0
[[34m  Info  [0m] checked VC inst... in 0.001s
[[34m  Info  [0m] - Found inductive invariant: forceTwice-time --> time + BigInt(-841) <= BigInt(0)
[[34m  Info  [0m] - Verifying Invariants... 
[[34m  Info  [0m] - Invariant verified
[[34m  Info  [0m] - considering function createQueue-time...
[[34m  Info  [0m] Candidate invariants
[[34m  Info  [0m] createQueue-time-->res125._2 <= 0
[[34m  Info  [0m] checked VC inst... in 0.056s
[[34m  Info  [0m] Function: createQueue-time--Found candidate invariant is not a real invariant! 
[[34m  Info  [0m] # of atomic predicates: 28 + 1
[[34m  Info  [0m] solving...
[[34m  Info  [0m] solved... in 0.011s
[[34m  Info  [0m] Candidate invariants
[[34m  Info  [0m] createQueue-time-->res125._2 + -225 <= 0
[[34m  Info  [0m] checked VC inst... in 0.039s
[[34m  Info  [0m] Function: createQueue-time--Found candidate invariant is not a real invariant! 
[[34m  Info  [0m] # of atomic predicates: 27 + 29
[[34m  Info  [0m] solving...
[[34m  Info  [0m] solved... in 0.01s
[[34m  Info  [0m] Candidate invariants
[[34m  Info  [0m] createQueue-time-->res125._2 + -228 <= 0
[[34m  Info  [0m] checked VC inst... in 0.005s
[[34m  Info  [0m] minimizing...
[[34m  Info  [0m] Candidate invariants
[[34m  Info  [0m] createQueue-time-->res125._2 + -227 <= 0
[[34m  Info  [0m] checked VC inst... in 0.004s
[[34m  Info  [0m] - Found inductive invariant: createQueue-time --> time + BigInt(-227) <= BigInt(0)
[[34m  Info  [0m] - Verifying Invariants... 
[[34m  Info  [0m] - Invariant verified
[[34m  Info  [0m] - considering function cons-time...
[[34m  Info  [0m] Candidate invariants
[[34m  Info  [0m] cons-time-->res120._2 <= 0
[[34m  Info  [0m] checked VC inst... in 0.014s
[[34m  Info  [0m] Function: cons-time--Found candidate invariant is not a real invariant! 
[[34m  Info  [0m] # of atomic predicates: 17 + 1
[[34m  Info  [0m] solving...
[[34m  Info  [0m] solved... in 0.008s
[[34m  Info  [0m] Candidate invariants
[[34m  Info  [0m] cons-time-->res120._2 + -658 <= 0
[[34m  Info  [0m] checked VC inst... in 0.001s
[[34m  Info  [0m] minimizing...
[[34m  Info  [0m] Candidate invariants
[[34m  Info  [0m] cons-time-->res120._2 + -656 <= 0
[[34m  Info  [0m] checked VC inst... in 0.001s
[[34m  Info  [0m] - Found inductive invariant: cons-time --> time + BigInt(-656) <= BigInt(0)
[[34m  Info  [0m] - Verifying Invariants... 
[[34m  Info  [0m] - Invariant verified
[[34m  Info  [0m] - considering function reverse-time...
[[34m  Info  [0m] Candidate invariants
[[34m  Info  [0m] reverse-time-->x$46._2 <= 0
[[34m  Info  [0m] checked VC inst... in 0.002s
[[34m  Info  [0m] Function: reverse-time--Found candidate invariant is not a real invariant! 
[[34m  Info  [0m] # of atomic predicates: 6 + 1
[[34m  Info  [0m] solving...
[[34m  Info  [0m] solved... in 0.008s
[[34m  Info  [0m] Candidate invariants
[[34m  Info  [0m] reverse-time-->x$46._2 + -9 <= 0
[[34m  Info  [0m] checked VC inst... in 0.001s
[[34m  Info  [0m] minimizing...
[[34m  Info  [0m] Candidate invariants
[[34m  Info  [0m] reverse-time-->x$46._2 + -7 <= 0
[[34m  Info  [0m] checked VC inst... in 0.001s
[[34m  Info  [0m] - Found inductive invariant: reverse-time --> time + BigInt(-7) <= BigInt(0)
[[34m  Info  [0m] - Verifying Invariants... 
[[34m  Info  [0m] - Invariant verified
[[34m  Info  [0m] - Nothing to solve for empty-time
[[34m  Info  [0m] - considering function tailSub-time...
[[34m  Info  [0m] Candidate invariants
[[34m  Info  [0m] tailSub-time-->res128._2 <= 0
[[34m  Info  [0m] checked VC inst... in 0.019s
[[34m  Info  [0m] Function: tailSub-time--Found candidate invariant is not a real invariant! 
[[34m  Info  [0m] # of atomic predicates: 6 + 1
[[34m  Info  [0m] solving...
[[34m  Info  [0m] solved... in 0.007s
[[34m  Info  [0m] - More unrollings for invariant inference
[[34m  Info  [0m] Candidate invariants
[[34m  Info  [0m] tailSub-time-->res128._2 <= 0
[[34m  Info  [0m] checked VC inst... in 0.088s
[[34m  Info  [0m] Function: tailSub-time--Found candidate invariant is not a real invariant! 
[[34m  Info  [0m] # of atomic predicates: 17 + 1
[[34m  Info  [0m] solving...
[[34m  Info  [0m] solved... in 0.007s
[[34m  Info  [0m] Candidate invariants
[[34m  Info  [0m] tailSub-time-->res128._2 + -10 <= 0
[[34m  Info  [0m] checked VC inst... in 1.161s
[[34m  Info  [0m] Function: tailSub-time--Found candidate invariant is not a real invariant! 
[[34m  Info  [0m] # of atomic predicates: 34 + 18
[[34m  Info  [0m] solving...
[[34m  Info  [0m] solved... in 0.008s
[[34m  Info  [0m] Candidate invariants
[[34m  Info  [0m] tailSub-time-->res128._2 + -1094 <= 0
[[34m  Info  [0m] checked VC inst... in 1.287s
[[34m  Info  [0m] Function: tailSub-time--Found candidate invariant is not a real invariant! 
[[34m  Info  [0m] # of atomic predicates: 34 + 52
[[34m  Info  [0m] solving...
[[34m  Info  [0m] solved... in 0.009s
[[34m  Info  [0m] Candidate invariants
[[34m  Info  [0m] tailSub-time-->res128._2 + -1098 <= 0
[[34m  Info  [0m] checked VC inst... in 0.029s
[[34m  Info  [0m] minimizing...
[[34m  Info  [0m] Candidate invariants
[[34m  Info  [0m] tailSub-time-->res128._2 + -1097 <= 0
[[34m  Info  [0m] checked VC inst... in 0.01s
[[34m  Info  [0m] - Found inductive invariant: tailSub-time --> time + BigInt(-1097) <= BigInt(0)
[[34m  Info  [0m] - Verifying Invariants... 
[[34m  Info  [0m] - Invariant verified
[[34m  Info  [0m] - considering function tail-time...
[[34m  Info  [0m] Candidate invariants
[[34m  Info  [0m] tail-time-->res121._2 <= 0
[[34m  Info  [0m] checked VC inst... in 0.007s
[[34m  Info  [0m] Function: tail-time--Found candidate invariant is not a real invariant! 
[[34m  Info  [0m] # of atomic predicates: 9 + 1
[[34m  Info  [0m] solving...
[[34m  Info  [0m] solved... in 0.007s
[[34m  Info  [0m] Candidate invariants
[[34m  Info  [0m] tail-time-->res121._2 + -1312 <= 0
[[34m  Info  [0m] checked VC inst... in 0.001s
[[34m  Info  [0m] minimizing...
[[34m  Info  [0m] Candidate invariants
[[34m  Info  [0m] tail-time-->res121._2 + -1310 <= 0
[[34m  Info  [0m] checked VC inst... in 0.001s
[[34m  Info  [0m] - Found inductive invariant: tail-time --> time + BigInt(-1310) <= BigInt(0)
[[34m  Info  [0m] - Verifying Invariants... 
[[34m  Info  [0m] - Invariant verified
Resource Verification Results: 
. ┌─────────━
╔═╡ Summary ═══════════════════════════════════════════════╗
║ └─────────┘                                              ║
║ cons-           time <= 656                 2.556        ║
║ createQueue-    time <= 227                 2.309        ║
║ drop-           time <= 18 * n + 2          0.854        ║
║ force-          time <= 205                 0.989        ║
║ forceTwice-     time <= 841                 3.286        ║
║ revAppend-      time <= 17 * l1.size + 2    2.297        ║
║ reverse-        time <= 7                   0.125        ║
║ rotateDrop-     time <= 189                 3.971        ║
║ rotateRev-      time <= 142                 6.193        ║
║ tail-           time <= 1310                2.101        ║
║ tailSub-        time <= 1097                5.539        ║
║ take-           time <= 21 * n + 3          0.972        ║
║ takeLazy-       time <= 19                  1.501        ║
╟┄┄┄┄┄┄┄┄┄┄┄┄┄┄┄┄┄┄┄┄┄┄┄┄┄┄┄┄┄┄┄┄┄┄┄┄┄┄┄┄┄┄┄┄┄┄┄┄┄┄┄┄┄┄┄┄┄┄╢
║ total: 13    inferred: 13    unknown: 0     time: 32.693 ║
╚═══════════════════════════════════════════════════════════
[[34m  Info  [0m] Stats dumped to file: Deque-stats.txt
