[[33mWarning [0m] warning: there were two feature warnings; re-run with -feature for details
[[34m  Info  [0m] Output written on leon.out
[[34m  Info  [0m] Output written on leon.out
[[34m  Info  [0m] Output written on leon.out
[[34m  Info  [0m] Output written on leon.out
[[34m  Info  [0m] Output written on leon.out
instfuncs: pMul-mem,invokeMul,parse,lookup,pPrim-mem,invoke,pAdd-mem,invokePrim instFuncTypes: 
[[34m  Info  [0m] Output written on leon.out
[[34m  Info  [0m] Output written on leon.out
[[34m  Info  [0m] Output written on leon.out
[[34m  Info  [0m]  - Now considering 'postcondition' VC for pAdd-mem3 @?:?...
[[34m  Info  [0m]  => VALID
[[34m  Info  [0m]  - Now considering 'precond. (call pMul-mem3(i, st@))' VC for pAdd-mem3 @?:?...
[[34m  Info  [0m]  => VALID
[[34m  Info  [0m]  - Now considering 'precond. (call pMul-mem3(i, st@))' VC for pAdd-mem3 @?:?...
[[34m  Info  [0m]  => VALID
[[34m  Info  [0m]  - Now considering 'precond. (call pAdd-mem3(j - BigInt(1), mulRes1._2))' VC for pAdd-mem3 @?:?...
[[34m  Info  [0m]  => VALID
[[34m  Info  [0m]  - Now considering 'match exhaustiveness' VC for pAdd-mem3 @?:?...
[[34m  Info  [0m]  => VALID
[[34m  Info  [0m]  - Now considering 'match exhaustiveness' VC for pAdd-mem3 @?:?...
[[34m  Info  [0m]  => VALID
[[34m  Info  [0m]  - Now considering 'match exhaustiveness' VC for pAdd-mem3 @?:?...
[[34m  Info  [0m]  => VALID
[[34m  Info  [0m]  - Now considering 'postcondition' VC for pMul-mem3 @?:?...
[[34m  Info  [0m]  => VALID
[[34m  Info  [0m]  - Now considering 'precond. (call pPrim-mem3(i, st@))' VC for pMul-mem3 @?:?...
[[34m  Info  [0m]  => VALID
[[34m  Info  [0m]  - Now considering 'precond. (call pPrim-mem3(i, st@))' VC for pMul-mem3 @?:?...
[[34m  Info  [0m]  => VALID
[[34m  Info  [0m]  - Now considering 'precond. (call pMul-mem3(j - BigInt(1), primRes1._2))' VC for pMul-mem3 @?:?...
[[34m  Info  [0m]  => VALID
[[34m  Info  [0m]  - Now considering 'match exhaustiveness' VC for pMul-mem3 @?:?...
[[34m  Info  [0m]  => VALID
[[34m  Info  [0m]  - Now considering 'match exhaustiveness' VC for pMul-mem3 @?:?...
[[34m  Info  [0m]  => VALID
[[34m  Info  [0m]  - Now considering 'match exhaustiveness' VC for pMul-mem3 @?:?...
[[34m  Info  [0m]  => VALID
[[34m  Info  [0m]  - Now considering 'postcondition' VC for pPrim-mem3 @?:?...
[[34m  Info  [0m]  => VALID
[[34m  Info  [0m]  - Now considering 'precond. (call pAdd-mem3(i - BigInt(1), st@))' VC for pPrim-mem3 @?:?...
[[34m  Info  [0m]  => VALID
[[34m  Info  [0m]  - Now considering 'match exhaustiveness' VC for pPrim-mem3 @?:?...
[[34m  Info  [0m]  => VALID
[[34m  Info  [0m]  - Now considering 'match exhaustiveness' VC for pPrim-mem3 @?:?...
[[34m  Info  [0m]  => VALID
[[34m  Info  [0m]  - Now considering 'postcondition' VC for depsEval4 @?:?...
[[34m  Info  [0m]  => VALID
[[34m  Info  [0m]  - Now considering 'precond. (call allEval4(i - BigInt(1), st@))' VC for depsEval4 @?:?...
[[34m  Info  [0m]  => VALID
[[34m  Info  [0m]  - Now considering 'postcondition' VC for allEval4 @?:?...
[[34m  Info  [0m]  => VALID
[[34m  Info  [0m]  - Now considering 'precond. (call allEval4(i - BigInt(1), st@))' VC for allEval4 @?:?...
[[34m  Info  [0m]  => VALID
[[34m  Info  [0m]  - Now considering 'tact (postcondition)' VC for evalMono4 @?:?...
[[34m  Info  [0m]  => VALID
[[34m  Info  [0m]  - Now considering 'tact (precond. (call evalMono-VCTact(i - BigInt(1), st1, st2)))' VC for evalMono4 @?:?...
[[34m  Info  [0m]  => VALID
[[34m  Info  [0m]  - Now considering 'tact (precond. (call allEval4(i, st1)))' VC for evalMono4 @?:?...
[[34m  Info  [0m]  => VALID
[[34m  Info  [0m]  - Now considering 'tact (precond. (call allEval4(i, st2)))' VC for evalMono4 @?:?...
[[34m  Info  [0m]  => VALID
[[34m  Info  [0m]  - Now considering 'precond. (call allEval4(i, st1))' VC for evalMono4 @?:?...
[[34m  Info  [0m]  => VALID
[[34m  Info  [0m]  - Now considering 'precond. (call allEval4(i, st2))' VC for evalMono4 @?:?...
[[34m  Info  [0m]  => VALID
[[34m  Info  [0m]  - Now considering 'tact (postcondition)' VC for depsLem4 @?:?...
[[34m  Info  [0m]  => VALID
[[34m  Info  [0m]  - Now considering 'tact (precond. (call depsLem-VCTact(x, y - BigInt(1), st@)))' VC for depsLem4 @?:?...
[[34m  Info  [0m]  => VALID
[[34m  Info  [0m]  - Now considering 'tact (precond. (call allEval4(y, st@)))' VC for depsLem4 @?:?...
[[34m  Info  [0m]  => VALID
[[34m  Info  [0m]  - Now considering 'tact (precond. (call allEval4(x, st@)))' VC for depsLem4 @?:?...
[[34m  Info  [0m]  => VALID
[[34m  Info  [0m]  - Now considering 'precond. (call allEval4(y, st@))' VC for depsLem4 @?:?...
[[34m  Info  [0m]  => VALID
[[34m  Info  [0m]  - Now considering 'precond. (call allEval4(x, st@))' VC for depsLem4 @?:?...
[[34m  Info  [0m]  => VALID
[[34m  Info  [0m]  - Now considering 'postcondition' VC for resEval4 @?:?...
[[34m  Info  [0m]  => VALID
[[34m  Info  [0m]  - Now considering 'precond. (call depsLem4(j, i - BigInt(1), st@))' VC for resEval4 @?:?...
[[34m  Info  [0m]  => VALID
[[34m  Info  [0m]  - Now considering 'match exhaustiveness' VC for resEval4 @?:?...
[[34m  Info  [0m]  => VALID
[[34m  Info  [0m]  - Now considering 'postcondition' VC for invokePrim4 @?:?...
[[34m  Info  [0m]  => VALID
[[34m  Info  [0m]  - Now considering 'precond. (call pPrim-mem3(i, st@))' VC for invokePrim4 @?:?...
[[34m  Info  [0m]  => VALID
[[34m  Info  [0m]  - Now considering 'precond. (call evalMono4(i - BigInt(1), st@, res._2))' VC for invokePrim4 @?:?...
[[34m  Info  [0m]  => VALID
[[34m  Info  [0m]  - Now considering 'postcondition' VC for invokeMul4 @?:?...
[[34m  Info  [0m]  => VALID
[[34m  Info  [0m]  - Now considering 'precond. (call invokePrim4(i, st@))' VC for invokeMul4 @?:?...
[[34m  Info  [0m]  => VALID
[[34m  Info  [0m]  - Now considering 'precond. (call pMul-mem3(i, scr._2))' VC for invokeMul4 @?:?...
[[34m  Info  [0m]  => VALID
[[34m  Info  [0m]  - Now considering 'precond. (call evalMono4(i - BigInt(1), st@, res._2))' VC for invokeMul4 @?:?...
[[34m  Info  [0m]  => VALID
[[34m  Info  [0m]  - Now considering 'match exhaustiveness' VC for invokeMul4 @?:?...
[[34m  Info  [0m]  => VALID
[[34m  Info  [0m]  - Now considering 'postcondition' VC for invoke4 @?:?...
[[34m  Info  [0m]  => VALID
[[34m  Info  [0m]  - Now considering 'precond. (call invokeMul4(i, st@))' VC for invoke4 @?:?...
[[34m  Info  [0m]  => VALID
[[34m  Info  [0m]  - Now considering 'precond. (call pAdd-mem3(i, scr._2))' VC for invoke4 @?:?...
[[34m  Info  [0m]  => VALID
[[34m  Info  [0m]  - Now considering 'precond. (call evalMono4(i - BigInt(1), st@, res._2))' VC for invoke4 @?:?...
[[34m  Info  [0m]  => VALID
[[34m  Info  [0m]  - Now considering 'precond. (call allEval4(i, res._2))' VC for invoke4 @?:?...
[[34m  Info  [0m]  => VALID
[[34m  Info  [0m]  - Now considering 'match exhaustiveness' VC for invoke4 @?:?...
[[34m  Info  [0m]  => VALID
[[34m  Info  [0m]  - Now considering 'postcondition' VC for parse4 @?:?...
[[34m  Info  [0m]  => VALID
[[34m  Info  [0m]  - Now considering 'precond. (call invoke4(n, st@))' VC for parse4 @?:?...
[[34m  Info  [0m]  => VALID
[[34m  Info  [0m]  - Now considering 'precond. (call parse4(n - BigInt(1), st@))' VC for parse4 @?:?...
[[34m  Info  [0m]  => VALID
[[34m  Info  [0m]  - Now considering 'precond. (call invoke4(n, scr._2))' VC for parse4 @?:?...
[[34m  Info  [0m]  => VALID
[[34m  Info  [0m]  - Now considering 'precond. (call allEval4(n, x$2._2))' VC for parse4 @?:?...
[[34m  Info  [0m]  => VALID
[[34m  Info  [0m]  - Now considering 'match exhaustiveness' VC for parse4 @?:?...
[[34m  Info  [0m]  => VALID
  ┌──────────────────────━
╔═╡ Verification Summary ══════════════════════════════════════════════════════════════════════════════════════════════════════╗
║ └──────────────────────┘                                                                                                     ║
║ PackratParsing.allEval4     postcondition                                                    ?:?  valid  U:smt-z3      0.013 ║
║ PackratParsing.allEval4     precond. (call allEval4(i - BigInt(1), st@))                     ?:?  valid  U:smt-z3      0.011 ║
║ PackratParsing.depsEval4    postcondition                                                    ?:?  valid  U:smt-z3      0.012 ║
║ PackratParsing.depsEval4    precond. (call allEval4(i - BigInt(1), st@))                     ?:?  valid  U:smt-z3      0.009 ║
║ PackratParsing.depsLem4     precond. (call allEval4(x, st@))                                 ?:?  valid  U:smt-z3      0.012 ║
║ PackratParsing.depsLem4     precond. (call allEval4(y, st@))                                 ?:?  valid  U:smt-z3      0.008 ║
║ PackratParsing.depsLem4     tact (postcondition)                                             ?:?  valid  U:smt-z3      0.036 ║
║ PackratParsing.depsLem4     tact (precond. (call allEval4(x, st@)))                          ?:?  valid  U:smt-z3      0.012 ║
║ PackratParsing.depsLem4     tact (precond. (call allEval4(y, st@)))                          ?:?  valid  U:smt-cvc4    0.011 ║
║ PackratParsing.depsLem4     tact (precond. (call depsLem-VCTact(x, y - BigInt(1), st@)))     ?:?  valid  U:smt-z3      0.008 ║
║ PackratParsing.evalMono4    precond. (call allEval4(i, st1))                                 ?:?  valid  U:smt-cvc4    0.011 ║
║ PackratParsing.evalMono4    precond. (call allEval4(i, st2))                                 ?:?  valid  U:smt-cvc4    0.013 ║
║ PackratParsing.evalMono4    tact (postcondition)                                             ?:?  valid  U:smt-z3      0.047 ║
║ PackratParsing.evalMono4    tact (precond. (call allEval4(i, st1)))                          ?:?  valid  U:smt-z3      0.012 ║
║ PackratParsing.evalMono4    tact (precond. (call allEval4(i, st2)))                          ?:?  valid  U:smt-z3      0.015 ║
║ PackratParsing.evalMono4    tact (precond. (call evalMono-VCTact(i - BigInt(1), st1, st2)))  ?:?  valid  U:smt-z3      0.009 ║
║ PackratParsing.invoke4      match exhaustiveness                                             ?:?  valid  U:smt-z3      0.008 ║
║ PackratParsing.invoke4      postcondition                                                    ?:?  valid  U:smt-z3      0.182 ║
║ PackratParsing.invoke4      precond. (call allEval4(i, res._2))                              ?:?  valid  U:smt-z3      0.191 ║
║ PackratParsing.invoke4      precond. (call evalMono4(i - BigInt(1), st@, res._2))            ?:?  valid  U:smt-z3      0.011 ║
║ PackratParsing.invoke4      precond. (call invokeMul4(i, st@))                               ?:?  valid  U:smt-z3      0.009 ║
║ PackratParsing.invoke4      precond. (call pAdd-mem3(i, scr._2))                             ?:?  valid  U:smt-z3      0.156 ║
║ PackratParsing.invokeMul4   match exhaustiveness                                             ?:?  valid  U:smt-z3      0.007 ║
║ PackratParsing.invokeMul4   postcondition                                                    ?:?  valid  U:smt-z3      0.133 ║
║ PackratParsing.invokeMul4   precond. (call evalMono4(i - BigInt(1), st@, res._2))            ?:?  valid  U:smt-cvc4    0.014 ║
║ PackratParsing.invokeMul4   precond. (call invokePrim4(i, st@))                              ?:?  valid  U:smt-z3      0.010 ║
║ PackratParsing.invokeMul4   precond. (call pMul-mem3(i, scr._2))                             ?:?  valid  U:smt-z3      0.124 ║
║ PackratParsing.invokePrim4  postcondition                                                    ?:?  valid  U:smt-z3      0.085 ║
║ PackratParsing.invokePrim4  precond. (call evalMono4(i - BigInt(1), st@, res._2))            ?:?  valid  U:smt-cvc4    0.013 ║
║ PackratParsing.invokePrim4  precond. (call pPrim-mem3(i, st@))                               ?:?  valid  U:smt-z3      0.010 ║
║ PackratParsing.pAdd-mem3    match exhaustiveness                                             ?:?  valid  U:smt-z3      0.020 ║
║ PackratParsing.pAdd-mem3    match exhaustiveness                                             ?:?  valid  U:smt-z3      0.022 ║
║ PackratParsing.pAdd-mem3    match exhaustiveness                                             ?:?  valid  U:smt-z3      0.027 ║
║ PackratParsing.pAdd-mem3    postcondition                                                    ?:?  valid  U:smt-z3      2.496 ║
║ PackratParsing.pAdd-mem3    precond. (call pAdd-mem3(j - BigInt(1), mulRes1._2))             ?:?  valid  U:smt-cvc4    0.681 ║
║ PackratParsing.pAdd-mem3    precond. (call pMul-mem3(i, st@))                                ?:?  valid  U:smt-z3      0.206 ║
║ PackratParsing.pAdd-mem3    precond. (call pMul-mem3(i, st@))                                ?:?  valid  U:smt-z3      0.147 ║
║ PackratParsing.pMul-mem3    match exhaustiveness                                             ?:?  valid  U:smt-z3      0.024 ║
║ PackratParsing.pMul-mem3    match exhaustiveness                                             ?:?  valid  U:smt-z3      0.017 ║
║ PackratParsing.pMul-mem3    match exhaustiveness                                             ?:?  valid  U:smt-z3      0.014 ║
║ PackratParsing.pMul-mem3    postcondition                                                    ?:?  valid  U:smt-z3      1.319 ║
║ PackratParsing.pMul-mem3    precond. (call pMul-mem3(j - BigInt(1), primRes1._2))            ?:?  valid  U:smt-cvc4    0.618 ║
║ PackratParsing.pMul-mem3    precond. (call pPrim-mem3(i, st@))                               ?:?  valid  U:smt-z3      0.011 ║
║ PackratParsing.pMul-mem3    precond. (call pPrim-mem3(i, st@))                               ?:?  valid  U:smt-z3      0.014 ║
║ PackratParsing.pPrim-mem3   match exhaustiveness                                             ?:?  valid  U:smt-z3      0.012 ║
║ PackratParsing.pPrim-mem3   match exhaustiveness                                             ?:?  valid  U:smt-z3      0.020 ║
║ PackratParsing.pPrim-mem3   postcondition                                                    ?:?  valid  U:smt-z3      0.172 ║
║ PackratParsing.pPrim-mem3   precond. (call pAdd-mem3(i - BigInt(1), st@))                    ?:?  valid  U:smt-z3      0.134 ║
║ PackratParsing.parse4       match exhaustiveness                                             ?:?  valid  U:smt-z3      0.007 ║
║ PackratParsing.parse4       postcondition                                                    ?:?  valid  U:smt-z3      0.287 ║
║ PackratParsing.parse4       precond. (call allEval4(n, x$2._2))                              ?:?  valid  U:smt-cvc4    0.013 ║
║ PackratParsing.parse4       precond. (call invoke4(n, scr._2))                               ?:?  valid  U:smt-z3      0.149 ║
║ PackratParsing.parse4       precond. (call invoke4(n, st@))                                  ?:?  valid  U:smt-z3      0.120 ║
║ PackratParsing.parse4       precond. (call parse4(n - BigInt(1), st@))                       ?:?  valid  U:smt-z3      0.028 ║
║ PackratParsing.resEval4     match exhaustiveness                                             ?:?  valid  U:smt-z3      0.009 ║
║ PackratParsing.resEval4     postcondition                                                    ?:?  valid  U:smt-cvc4    0.013 ║
║ PackratParsing.resEval4     precond. (call depsLem4(j, i - BigInt(1), st@))                  ?:?  valid  U:smt-cvc4    0.010 ║
╟┄┄┄┄┄┄┄┄┄┄┄┄┄┄┄┄┄┄┄┄┄┄┄┄┄┄┄┄┄┄┄┄┄┄┄┄┄┄┄┄┄┄┄┄┄┄┄┄┄┄┄┄┄┄┄┄┄┄┄┄┄┄┄┄┄┄┄┄┄┄┄┄┄┄┄┄┄┄┄┄┄┄┄┄┄┄┄┄┄┄┄┄┄┄┄┄┄┄┄┄┄┄┄┄┄┄┄┄┄┄┄┄┄┄┄┄┄┄┄┄┄┄┄┄┄┄╢
║ total: 57     valid: 57     invalid: 0      unknown 0                                                                  7.782 ║
╚═══════════════════════════════════════════════════════════════════════════════════════════════════════════════════════════════
instfuncs:  instFuncTypes: 
[[34m  Info  [0m] - considering function pAdd-mem-time...
[[34m  Info  [0m] Candidate invariants
[[34m  Info  [0m] pAdd-mem-time-->res86._2 <= 0
[[34m  Info  [0m] checked VC inst... in 0.065s
[[34m  Info  [0m] Function: pAdd-mem-time--Found candidate invariant is not a real invariant! 
[[34m  Info  [0m] # of atomic predicates: 6 + 1
[[34m  Info  [0m] solving...
[[34m  Info  [0m] solved... in 0.034s
[[34m  Info  [0m] Candidate invariants
[[34m  Info  [0m] pAdd-mem-time-->res86._2 + -7 <= 0
[[34m  Info  [0m] checked VC inst... in 0.034s
[[34m  Info  [0m] Function: pAdd-mem-time--Found candidate invariant is not a real invariant! 
[[34m  Info  [0m] # of atomic predicates: 9 + 7
[[34m  Info  [0m] solving...
[[34m  Info  [0m] solved... in 0.011s
[[34m  Info  [0m] Candidate invariants
[[34m  Info  [0m] pAdd-mem-time-->res86._2 + -13 <= 0
[[34m  Info  [0m] checked VC inst... in 0.042s
[[34m  Info  [0m] Function: pAdd-mem-time--Found candidate invariant is not a real invariant! 
[[34m  Info  [0m] # of atomic predicates: 9 + 16
[[34m  Info  [0m] solving...
[[34m  Info  [0m] solved... in 0.009s
[[34m  Info  [0m] Candidate invariants
[[34m  Info  [0m] pAdd-mem-time-->res86._2 + -19 <= 0
[[34m  Info  [0m] checked VC inst... in 0.26s
[[34m  Info  [0m] Function: pAdd-mem-time--Found candidate invariant is not a real invariant! 
[[34m  Info  [0m] # of atomic predicates: 10 + 25
[[34m  Info  [0m] solving...
[[34m  Info  [0m] solved... in 0.021s
[[34m  Info  [0m] - More unrollings for invariant inference
[[34m  Info  [0m] Creating VC for pMul-mem-time
[[34m  Info  [0m] Candidate invariants
[[34m  Info  [0m] pAdd-mem-time-->res86._2 <= 0
[[34m  Info  [0m] pMul-mem-time-->res82._2 <= 0
[[34m  Info  [0m] checked VC inst... in 0.06s
[[34m  Info  [0m] Function: pAdd-mem-time--Found candidate invariant is not a real invariant! 
[[34m  Info  [0m] checked VC inst... in 0.019s
[[34m  Info  [0m] Function: pMul-mem-time--Found candidate invariant is not a real invariant! 
[[34m  Info  [0m] # of atomic predicates: 16 + 1
[[34m  Info  [0m] solving...
[[34m  Info  [0m] solved... in 0.008s
[[34m  Info  [0m] Candidate invariants
[[34m  Info  [0m] pAdd-mem-time-->res86._2 + -7 <= 0
[[34m  Info  [0m] pMul-mem-time-->res82._2 + -7 <= 0
[[34m  Info  [0m] checked VC inst... in 0.043s
[[34m  Info  [0m] Function: pAdd-mem-time--Found candidate invariant is not a real invariant! 
[[34m  Info  [0m] checked VC inst... in 0.012s
[[34m  Info  [0m] Function: pMul-mem-time--Found candidate invariant is not a real invariant! 
[[34m  Info  [0m] # of atomic predicates: 23 + 17
[[34m  Info  [0m] solving...
[[34m  Info  [0m] solved... in 0.012s
[[34m  Info  [0m] Candidate invariants
[[34m  Info  [0m] pAdd-mem-time-->res86._2 + -13 <= 0
[[34m  Info  [0m] pMul-mem-time-->res82._2 + -13 <= 0
[[34m  Info  [0m] checked VC inst... in 0.054s
[[34m  Info  [0m] Function: pAdd-mem-time--Found candidate invariant is not a real invariant! 
[[34m  Info  [0m] checked VC inst... in 0.018s
[[34m  Info  [0m] Function: pMul-mem-time--Found candidate invariant is not a real invariant! 
[[34m  Info  [0m] # of atomic predicates: 26 + 40
[[34m  Info  [0m] solving...
[[34m  Info  [0m] solved... in 0.011s
[[34m  Info  [0m] Candidate invariants
[[34m  Info  [0m] pAdd-mem-time-->res86._2 + -19 <= 0
[[34m  Info  [0m] pMul-mem-time-->res82._2 + -19 <= 0
[[34m  Info  [0m] checked VC inst... in 0.324s
[[34m  Info  [0m] Function: pAdd-mem-time--Found candidate invariant is not a real invariant! 
[[34m  Info  [0m] checked VC inst... in 0.041s
[[34m  Info  [0m] Function: pMul-mem-time--Found candidate invariant is not a real invariant! 
[[34m  Info  [0m] # of atomic predicates: 27 + 66
[[34m  Info  [0m] solving...
[[34m  Info  [0m] solved... in 0.01s
[[34m  Info  [0m] - More unrollings for invariant inference
[[34m  Info  [0m] Creating VC for pPrim-mem-time
[[34m  Info  [0m] Candidate invariants
[[34m  Info  [0m] pAdd-mem-time-->res86._2 <= 0
[[34m  Info  [0m] pMul-mem-time-->res82._2 <= 0
[[34m  Info  [0m] pPrim-mem-time-->res84._2 <= 0
[[34m  Info  [0m] checked VC inst... in 0.116s
[[34m  Info  [0m] Function: pAdd-mem-time--Found candidate invariant is not a real invariant! 
[[34m  Info  [0m] checked VC inst... in 0.036s
[[34m  Info  [0m] Function: pMul-mem-time--Found candidate invariant is not a real invariant! 
[[34m  Info  [0m] checked VC inst... in 0.014s
[[34m  Info  [0m] Function: pPrim-mem-time--Found candidate invariant is not a real invariant! 
[[34m  Info  [0m] # of atomic predicates: 33 + 1
[[34m  Info  [0m] solving...
[[34m  Info  [0m] solved... in 0.009s
[[34m  Info  [0m] Candidate invariants
[[34m  Info  [0m] pAdd-mem-time-->res86._2 + -7 <= 0
[[34m  Info  [0m] pMul-mem-time-->res82._2 + -6 <= 0
[[34m  Info  [0m] pPrim-mem-time-->res84._2 + -10 <= 0
[[34m  Info  [0m] checked VC inst... in 0.079s
[[34m  Info  [0m] Function: pAdd-mem-time--Found candidate invariant is not a real invariant! 
[[34m  Info  [0m] checked VC inst... in 0.023s
[[34m  Info  [0m] Function: pMul-mem-time--Found candidate invariant is not a real invariant! 
[[34m  Info  [0m] checked VC inst... in 0.014s
[[34m  Info  [0m] Function: pPrim-mem-time--Found candidate invariant is not a real invariant! 
[[34m  Info  [0m] # of atomic predicates: 39 + 34
[[34m  Info  [0m] solving...
[[34m  Info  [0m] solved... in 0.02s
[[34m  Info  [0m] Candidate invariants
[[34m  Info  [0m] pAdd-mem-time-->res86._2 + -13 <= 0
[[34m  Info  [0m] pMul-mem-time-->res82._2 + -13 <= 0
[[34m  Info  [0m] pPrim-mem-time-->res84._2 + -12 <= 0
[[34m  Info  [0m] checked VC inst... in 0.149s
[[34m  Info  [0m] Function: pAdd-mem-time--Found candidate invariant is not a real invariant! 
[[34m  Info  [0m] checked VC inst... in 0.016s
[[34m  Info  [0m] Function: pMul-mem-time--Found candidate invariant is not a real invariant! 
[[34m  Info  [0m] checked VC inst... in 0.013s
[[34m  Info  [0m] Function: pPrim-mem-time--Found candidate invariant is not a real invariant! 
[[34m  Info  [0m] # of atomic predicates: 49 + 73
[[34m  Info  [0m] solving...
[[34m  Info  [0m] solved... in 0.017s
[[34m  Info  [0m] Candidate invariants
[[34m  Info  [0m] pAdd-mem-time-->res86._2 + -19 <= 0
[[34m  Info  [0m] pMul-mem-time-->res82._2 + -19 <= 0
[[34m  Info  [0m] pPrim-mem-time-->res84._2 + -18 <= 0
[[34m  Info  [0m] checked VC inst... in 0.13s
[[34m  Info  [0m] Function: pAdd-mem-time--Found candidate invariant is not a real invariant! 
[[34m  Info  [0m] checked VC inst... in 0.026s
[[34m  Info  [0m] Function: pMul-mem-time--Found candidate invariant is not a real invariant! 
[[34m  Info  [0m] checked VC inst... in 0.017s
[[34m  Info  [0m] Function: pPrim-mem-time--Found candidate invariant is not a real invariant! 
[[34m  Info  [0m] # of atomic predicates: 50 + 122
[[34m  Info  [0m] solving...
[[34m  Info  [0m] solved... in 0.012s
[[34m  Info  [0m] - More unrollings for invariant inference
[[34m  Info  [0m] Candidate invariants
[[34m  Info  [0m] pAdd-mem-time-->res86._2 <= 0
[[34m  Info  [0m] pMul-mem-time-->res82._2 <= 0
[[34m  Info  [0m] pPrim-mem-time-->res84._2 <= 0
[[34m  Info  [0m] checked VC inst... in 0.144s
[[34m  Info  [0m] Function: pAdd-mem-time--Found candidate invariant is not a real invariant! 
[[34m  Info  [0m] checked VC inst... in 0.037s
[[34m  Info  [0m] Function: pMul-mem-time--Found candidate invariant is not a real invariant! 
[[34m  Info  [0m] checked VC inst... in 0.027s
[[34m  Info  [0m] Function: pPrim-mem-time--Found candidate invariant is not a real invariant! 
[[34m  Info  [0m] # of atomic predicates: 35 + 1
[[34m  Info  [0m] solving...
[[34m  Info  [0m] solved... in 0.012s
[[34m  Info  [0m] Candidate invariants
[[34m  Info  [0m] pAdd-mem-time-->res86._2 + -7 <= 0
[[34m  Info  [0m] pMul-mem-time-->res82._2 + -6 <= 0
[[34m  Info  [0m] pPrim-mem-time-->res84._2 + -9 <= 0
[[34m  Info  [0m] checked VC inst... in 0.144s
[[34m  Info  [0m] Function: pAdd-mem-time--Found candidate invariant is not a real invariant! 
[[34m  Info  [0m] checked VC inst... in 0.024s
[[34m  Info  [0m] Function: pMul-mem-time--Found candidate invariant is not a real invariant! 
[[34m  Info  [0m] checked VC inst... in 0.019s
[[34m  Info  [0m] Function: pPrim-mem-time--Found candidate invariant is not a real invariant! 
[[34m  Info  [0m] # of atomic predicates: 43 + 36
[[34m  Info  [0m] solving...
[[34m  Info  [0m] solved... in 0.012s
[[34m  Info  [0m] Candidate invariants
[[34m  Info  [0m] pAdd-mem-time-->res86._2 + -13 <= 0
[[34m  Info  [0m] pMul-mem-time-->res82._2 + -13 <= 0
[[34m  Info  [0m] pPrim-mem-time-->res84._2 + -12 <= 0
[[34m  Info  [0m] checked VC inst... in 0.27s
[[34m  Info  [0m] Function: pAdd-mem-time--Found candidate invariant is not a real invariant! 
[[34m  Info  [0m] checked VC inst... in 0.058s
[[34m  Info  [0m] Function: pMul-mem-time--Found candidate invariant is not a real invariant! 
[[34m  Info  [0m] checked VC inst... in 0.018s
[[34m  Info  [0m] Function: pPrim-mem-time--Found candidate invariant is not a real invariant! 
[[34m  Info  [0m] # of atomic predicates: 55 + 79
[[34m  Info  [0m] solving...
[[34m  Info  [0m] solved... in 0.015s
[[34m  Info  [0m] Candidate invariants
[[34m  Info  [0m] pAdd-mem-time-->res86._2 + -19 <= 0
[[34m  Info  [0m] pMul-mem-time-->res82._2 + -19 <= 0
[[34m  Info  [0m] pPrim-mem-time-->res84._2 + -18 <= 0
[[34m  Info  [0m] checked VC inst... in 0.313s
[[34m  Info  [0m] Function: pAdd-mem-time--Found candidate invariant is not a real invariant! 
[[34m  Info  [0m] checked VC inst... in 0.066s
[[34m  Info  [0m] Function: pMul-mem-time--Found candidate invariant is not a real invariant! 
[[34m  Info  [0m] checked VC inst... in 0.026s
[[34m  Info  [0m] Function: pPrim-mem-time--Found candidate invariant is not a real invariant! 
[[34m  Info  [0m] # of atomic predicates: 55 + 134
[[34m  Info  [0m] solving...
[[34m  Info  [0m] solved... in 0.016s
[[34m  Info  [0m] - More unrollings for invariant inference
[[34m  Info  [0m] Candidate invariants
[[34m  Info  [0m] pAdd-mem-time-->res86._2 <= 0
[[34m  Info  [0m] pMul-mem-time-->res82._2 <= 0
[[34m  Info  [0m] pPrim-mem-time-->res84._2 <= 0
[[34m  Info  [0m] checked VC inst... in 0.198s
[[34m  Info  [0m] Function: pAdd-mem-time--Found candidate invariant is not a real invariant! 
[[34m  Info  [0m] checked VC inst... in 0.043s
[[34m  Info  [0m] Function: pMul-mem-time--Found candidate invariant is not a real invariant! 
[[34m  Info  [0m] checked VC inst... in 0.036s
[[34m  Info  [0m] Function: pPrim-mem-time--Found candidate invariant is not a real invariant! 
[[34m  Info  [0m] # of atomic predicates: 35 + 1
[[34m  Info  [0m] solving...
[[34m  Info  [0m] solved... in 0.01s
[[34m  Info  [0m] Candidate invariants
[[34m  Info  [0m] pAdd-mem-time-->res86._2 + -7 <= 0
[[34m  Info  [0m] pMul-mem-time-->res82._2 + -6 <= 0
[[34m  Info  [0m] pPrim-mem-time-->res84._2 + -9 <= 0
[[34m  Info  [0m] checked VC inst... in 0.151s
[[34m  Info  [0m] Function: pAdd-mem-time--Found candidate invariant is not a real invariant! 
[[34m  Info  [0m] checked VC inst... in 0.028s
[[34m  Info  [0m] Function: pMul-mem-time--Found candidate invariant is not a real invariant! 
[[34m  Info  [0m] checked VC inst... in 0.026s
[[34m  Info  [0m] Function: pPrim-mem-time--Found candidate invariant is not a real invariant! 
[[34m  Info  [0m] # of atomic predicates: 43 + 36
[[34m  Info  [0m] solving...
[[34m  Info  [0m] solved... in 0.013s
[[34m  Info  [0m] Candidate invariants
[[34m  Info  [0m] pAdd-mem-time-->res86._2 + -13 <= 0
[[34m  Info  [0m] pMul-mem-time-->res82._2 + -13 <= 0
[[34m  Info  [0m] pPrim-mem-time-->res84._2 + -12 <= 0
[[34m  Info  [0m] checked VC inst... in 0.434s
[[34m  Info  [0m] Function: pAdd-mem-time--Found candidate invariant is not a real invariant! 
[[34m  Info  [0m] checked VC inst... in 0.088s
[[34m  Info  [0m] Function: pMul-mem-time--Found candidate invariant is not a real invariant! 
[[34m  Info  [0m] checked VC inst... in 0.02s
[[34m  Info  [0m] Function: pPrim-mem-time--Found candidate invariant is not a real invariant! 
[[34m  Info  [0m] # of atomic predicates: 59 + 79
[[34m  Info  [0m] solving...
[[34m  Info  [0m] solved... in 0.015s
[[34m  Info  [0m] Candidate invariants
[[34m  Info  [0m] pAdd-mem-time-->res86._2 + -19 <= 0
[[34m  Info  [0m] pMul-mem-time-->res82._2 + -19 <= 0
[[34m  Info  [0m] pPrim-mem-time-->res84._2 + -18 <= 0
[[34m  Info  [0m] checked VC inst... in 0.556s
[[34m  Info  [0m] Function: pAdd-mem-time--Found candidate invariant is not a real invariant! 
[[34m  Info  [0m] checked VC inst... in 0.116s
[[34m  Info  [0m] Function: pMul-mem-time--Found candidate invariant is not a real invariant! 
[[34m  Info  [0m] checked VC inst... in 0.029s
[[34m  Info  [0m] Function: pPrim-mem-time--Found candidate invariant is not a real invariant! 
[[34m  Info  [0m] # of atomic predicates: 64 + 138
[[34m  Info  [0m] solving...
[[34m  Info  [0m] solved... in 0.017s
[[34m  Info  [0m] - More unrollings for invariant inference
[[34m  Info  [0m] Candidate invariants
[[34m  Info  [0m] pAdd-mem-time-->res86._2 <= 0
[[34m  Info  [0m] pMul-mem-time-->res82._2 <= 0
[[34m  Info  [0m] pPrim-mem-time-->res84._2 <= 0
[[34m  Info  [0m] checked VC inst... in 0.235s
[[34m  Info  [0m] Function: pAdd-mem-time--Found candidate invariant is not a real invariant! 
[[34m  Info  [0m] checked VC inst... in 0.051s
[[34m  Info  [0m] Function: pMul-mem-time--Found candidate invariant is not a real invariant! 
[[34m  Info  [0m] checked VC inst... in 0.053s
[[34m  Info  [0m] Function: pPrim-mem-time--Found candidate invariant is not a real invariant! 
[[34m  Info  [0m] # of atomic predicates: 35 + 1
[[34m  Info  [0m] solving...
[[34m  Info  [0m] solved... in 0.009s
[[34m  Info  [0m] Candidate invariants
[[34m  Info  [0m] pAdd-mem-time-->res86._2 + -7 <= 0
[[34m  Info  [0m] pMul-mem-time-->res82._2 + -6 <= 0
[[34m  Info  [0m] pPrim-mem-time-->res84._2 + -9 <= 0
[[34m  Info  [0m] checked VC inst... in 0.178s
[[34m  Info  [0m] Function: pAdd-mem-time--Found candidate invariant is not a real invariant! 
[[34m  Info  [0m] checked VC inst... in 0.032s
[[34m  Info  [0m] Function: pMul-mem-time--Found candidate invariant is not a real invariant! 
[[34m  Info  [0m] checked VC inst... in 0.046s
[[34m  Info  [0m] Function: pPrim-mem-time--Found candidate invariant is not a real invariant! 
[[34m  Info  [0m] # of atomic predicates: 43 + 36
[[34m  Info  [0m] solving...
[[34m  Info  [0m] solved... in 0.018s
[[34m  Info  [0m] Candidate invariants
[[34m  Info  [0m] pAdd-mem-time-->res86._2 + -13 <= 0
[[34m  Info  [0m] pMul-mem-time-->res82._2 + -13 <= 0
[[34m  Info  [0m] pPrim-mem-time-->res84._2 + -12 <= 0
[[34m  Info  [0m] checked VC inst... in 0.617s
[[34m  Info  [0m] Function: pAdd-mem-time--Found candidate invariant is not a real invariant! 
[[34m  Info  [0m] checked VC inst... in 0.093s
[[34m  Info  [0m] Function: pMul-mem-time--Found candidate invariant is not a real invariant! 
[[34m  Info  [0m] checked VC inst... in 0.025s
[[34m  Info  [0m] Function: pPrim-mem-time--Found candidate invariant is not a real invariant! 
[[34m  Info  [0m] # of atomic predicates: 65 + 79
[[34m  Info  [0m] solving...
[[34m  Info  [0m] solved... in 0.017s
[[34m  Info  [0m] Candidate invariants
[[34m  Info  [0m] pAdd-mem-time-->res86._2 + -19 <= 0
[[34m  Info  [0m] pMul-mem-time-->res82._2 + -19 <= 0
[[34m  Info  [0m] pPrim-mem-time-->res84._2 + -18 <= 0
[[34m  Info  [0m] checked VC inst... in 0.599s
[[34m  Info  [0m] Function: pAdd-mem-time--Found candidate invariant is not a real invariant! 
[[34m  Info  [0m] checked VC inst... in 0.111s
[[34m  Info  [0m] Function: pMul-mem-time--Found candidate invariant is not a real invariant! 
[[34m  Info  [0m] checked VC inst... in 0.025s
[[34m  Info  [0m] Function: pPrim-mem-time--Found candidate invariant is not a real invariant! 
[[34m  Info  [0m] # of atomic predicates: 70 + 144
[[34m  Info  [0m] solving...
[[34m  Info  [0m] solved... in 0.017s
[[34m  Info  [0m] - More unrollings for invariant inference
[[34m  Info  [0m] Candidate invariants
[[34m  Info  [0m] pAdd-mem-time-->res86._2 <= 0
[[34m  Info  [0m] pMul-mem-time-->res82._2 <= 0
[[34m  Info  [0m] pPrim-mem-time-->res84._2 <= 0
[[34m  Info  [0m] checked VC inst... in 0.19s
[[34m  Info  [0m] Function: pAdd-mem-time--Found candidate invariant is not a real invariant! 
[[34m  Info  [0m] checked VC inst... in 0.073s
[[34m  Info  [0m] Function: pMul-mem-time--Found candidate invariant is not a real invariant! 
[[34m  Info  [0m] checked VC inst... in 0.064s
[[34m  Info  [0m] Function: pPrim-mem-time--Found candidate invariant is not a real invariant! 
[[34m  Info  [0m] # of atomic predicates: 35 + 1
[[34m  Info  [0m] solving...
[[34m  Info  [0m] solved... in 0.009s
[[34m  Info  [0m] Candidate invariants
[[34m  Info  [0m] pAdd-mem-time-->res86._2 + -7 <= 0
[[34m  Info  [0m] pMul-mem-time-->res82._2 + -6 <= 0
[[34m  Info  [0m] pPrim-mem-time-->res84._2 + -9 <= 0
[[34m  Info  [0m] checked VC inst... in 0.19s
[[34m  Info  [0m] Function: pAdd-mem-time--Found candidate invariant is not a real invariant! 
[[34m  Info  [0m] checked VC inst... in 0.044s
[[34m  Info  [0m] Function: pMul-mem-time--Found candidate invariant is not a real invariant! 
[[34m  Info  [0m] checked VC inst... in 0.049s
[[34m  Info  [0m] Function: pPrim-mem-time--Found candidate invariant is not a real invariant! 
[[34m  Info  [0m] # of atomic predicates: 43 + 36
[[34m  Info  [0m] solving...
[[34m  Info  [0m] solved... in 0.014s
[[34m  Info  [0m] Candidate invariants
[[34m  Info  [0m] pAdd-mem-time-->res86._2 + -13 <= 0
[[34m  Info  [0m] pMul-mem-time-->res82._2 + -13 <= 0
[[34m  Info  [0m] pPrim-mem-time-->res84._2 + -12 <= 0
[[34m  Info  [0m] checked VC inst... in 0.57s
[[34m  Info  [0m] Function: pAdd-mem-time--Found candidate invariant is not a real invariant! 
[[34m  Info  [0m] checked VC inst... in 0.153s
[[34m  Info  [0m] Function: pMul-mem-time--Found candidate invariant is not a real invariant! 
[[34m  Info  [0m] checked VC inst... in 0.026s
[[34m  Info  [0m] Function: pPrim-mem-time--Found candidate invariant is not a real invariant! 
[[34m  Info  [0m] # of atomic predicates: 69 + 79
[[34m  Info  [0m] solving...
[[34m  Info  [0m] solved... in 0.016s
[[34m  Info  [0m] Candidate invariants
[[34m  Info  [0m] pAdd-mem-time-->res86._2 + -19 <= 0
[[34m  Info  [0m] pMul-mem-time-->res82._2 + -19 <= 0
[[34m  Info  [0m] pPrim-mem-time-->res84._2 + -18 <= 0
[[34m  Info  [0m] checked VC inst... in 0.633s
[[34m  Info  [0m] Function: pAdd-mem-time--Found candidate invariant is not a real invariant! 
[[34m  Info  [0m] checked VC inst... in 0.164s
[[34m  Info  [0m] Function: pMul-mem-time--Found candidate invariant is not a real invariant! 
[[34m  Info  [0m] checked VC inst... in 0.037s
[[34m  Info  [0m] Function: pPrim-mem-time--Found candidate invariant is not a real invariant! 
[[34m  Info  [0m] # of atomic predicates: 77 + 148
[[34m  Info  [0m] solving...
[[34m  Info  [0m] solved... in 0.022s
[[34m  Info  [0m] - More unrollings for invariant inference
[[34m  Info  [0m] Candidate invariants
[[34m  Info  [0m] pAdd-mem-time-->res86._2 <= 0
[[34m  Info  [0m] pMul-mem-time-->res82._2 <= 0
[[34m  Info  [0m] pPrim-mem-time-->res84._2 <= 0
[[34m  Info  [0m] checked VC inst... in 0.301s
[[34m  Info  [0m] Function: pAdd-mem-time--Found candidate invariant is not a real invariant! 
[[34m  Info  [0m] checked VC inst... in 0.075s
[[34m  Info  [0m] Function: pMul-mem-time--Found candidate invariant is not a real invariant! 
[[34m  Info  [0m] checked VC inst... in 0.057s
[[34m  Info  [0m] Function: pPrim-mem-time--Found candidate invariant is not a real invariant! 
[[34m  Info  [0m] # of atomic predicates: 35 + 1
[[34m  Info  [0m] solving...
[[34m  Info  [0m] solved... in 0.01s
[[34m  Info  [0m] Candidate invariants
[[34m  Info  [0m] pAdd-mem-time-->res86._2 + -7 <= 0
[[34m  Info  [0m] pMul-mem-time-->res82._2 + -6 <= 0
[[34m  Info  [0m] pPrim-mem-time-->res84._2 + -9 <= 0
[[34m  Info  [0m] checked VC inst... in 0.233s
[[34m  Info  [0m] Function: pAdd-mem-time--Found candidate invariant is not a real invariant! 
[[34m  Info  [0m] checked VC inst... in 0.036s
[[34m  Info  [0m] Function: pMul-mem-time--Found candidate invariant is not a real invariant! 
[[34m  Info  [0m] checked VC inst... in 0.045s
[[34m  Info  [0m] Function: pPrim-mem-time--Found candidate invariant is not a real invariant! 
[[34m  Info  [0m] # of atomic predicates: 43 + 36
[[34m  Info  [0m] solving...
[[34m  Info  [0m] solved... in 0.013s
[[34m  Info  [0m] Candidate invariants
[[34m  Info  [0m] pAdd-mem-time-->res86._2 + -13 <= 0
[[34m  Info  [0m] pMul-mem-time-->res82._2 + -13 <= 0
[[34m  Info  [0m] pPrim-mem-time-->res84._2 + -12 <= 0
[[34m  Info  [0m] checked VC inst... in 1.431s
[[34m  Info  [0m] Function: pAdd-mem-time--Found candidate invariant is not a real invariant! 
[[34m  Info  [0m] checked VC inst... in 0.163s
[[34m  Info  [0m] Function: pMul-mem-time--Found candidate invariant is not a real invariant! 
[[34m  Info  [0m] checked VC inst... in 0.026s
[[34m  Info  [0m] Function: pPrim-mem-time--Found candidate invariant is not a real invariant! 
[[34m  Info  [0m] # of atomic predicates: 71 + 79
[[34m  Info  [0m] solving...
[[34m  Info  [0m] solved... in 0.017s
[[34m  Info  [0m] Candidate invariants
[[34m  Info  [0m] pAdd-mem-time-->res86._2 + -19 <= 0
[[34m  Info  [0m] pMul-mem-time-->res82._2 + -19 <= 0
[[34m  Info  [0m] pPrim-mem-time-->res84._2 + -18 <= 0
[[34m  Info  [0m] checked VC inst... in 1.399s
[[34m  Info  [0m] Function: pAdd-mem-time--Found candidate invariant is not a real invariant! 
[[34m  Info  [0m] checked VC inst... in 0.152s
[[34m  Info  [0m] Function: pMul-mem-time--Found candidate invariant is not a real invariant! 
[[34m  Info  [0m] checked VC inst... in 0.028s
[[34m  Info  [0m] Function: pPrim-mem-time--Found candidate invariant is not a real invariant! 
[[34m  Info  [0m] # of atomic predicates: 82 + 150
[[34m  Info  [0m] solving...
[[34m  Info  [0m] solved... in 0.019s
[[34m  Info  [0m] Candidate invariants
[[34m  Info  [0m] pAdd-mem-time-->res86._2 + -21 <= 0
[[34m  Info  [0m] pMul-mem-time-->res82._2 + -21 <= 0
[[34m  Info  [0m] pPrim-mem-time-->res84._2 + -25 <= 0
[[34m  Info  [0m] checked VC inst... in 2.046s
[[34m  Info  [0m] checked VC inst... in 0.26s
[[34m  Info  [0m] checked VC inst... in 0.022s
[[34m  Info  [0m] minimizing...
[[34m  Info  [0m] Candidate invariants
[[34m  Info  [0m] pAdd-mem-time-->res86._2 + -20 <= 0
[[34m  Info  [0m] pMul-mem-time-->res82._2 + -21 <= 0
[[34m  Info  [0m] pPrim-mem-time-->res84._2 + -25 <= 0
[[34m  Info  [0m] checked VC inst... in 2.592s
[[34m  Info  [0m] checked VC inst... in 0.307s
[[34m  Info  [0m] checked VC inst... in 0.028s
[[34m  Info  [0m] - Found inductive invariant: pAdd-mem-time --> time + BigInt(-20) <= BigInt(0)
[[34m  Info  [0m] - Found inductive invariant: pMul-mem-time --> time + BigInt(-21) <= BigInt(0)
[[34m  Info  [0m] - Found inductive invariant: pPrim-mem-time --> time + BigInt(-25) <= BigInt(0)
[[34m  Info  [0m] - Verifying Invariants... 
[[34m  Info  [0m] - Invariant verified
[[34m  Info  [0m] - considering function pMul-mem-time...
[[34m  Info  [0m] - considering function pPrim-mem-time...
[[34m  Info  [0m] - considering function invokePrim-time...
[[34m  Info  [0m] - considering function invokeMul-time...
[[34m  Info  [0m] - considering function invoke-time...
[[34m  Info  [0m] Candidate invariants
[[34m  Info  [0m] invoke-time-->res85._2 <= 0
[[34m  Info  [0m] checked VC inst... in 0.008s
[[34m  Info  [0m] Function: invoke-time--Found candidate invariant is not a real invariant! 
[[34m  Info  [0m] # of atomic predicates: 8 + 1
[[34m  Info  [0m] solving...
[[34m  Info  [0m] solved... in 0.007s
[[34m  Info  [0m] - More unrollings for invariant inference
[[34m  Info  [0m] Candidate invariants
[[34m  Info  [0m] invoke-time-->res85._2 <= 0
[[34m  Info  [0m] checked VC inst... in 0.026s
[[34m  Info  [0m] Function: invoke-time--Found candidate invariant is not a real invariant! 
[[34m  Info  [0m] # of atomic predicates: 9 + 1
[[34m  Info  [0m] solving...
[[34m  Info  [0m] solved... in 0.007s
[[34m  Info  [0m] - More unrollings for invariant inference
[[34m  Info  [0m] Candidate invariants
[[34m  Info  [0m] invoke-time-->res85._2 <= 0
[[34m  Info  [0m] checked VC inst... in 0.026s
[[34m  Info  [0m] Function: invoke-time--Found candidate invariant is not a real invariant! 
[[34m  Info  [0m] # of atomic predicates: 10 + 1
[[34m  Info  [0m] solving...
[[34m  Info  [0m] solved... in 0.008s
[[34m  Info  [0m] Candidate invariants
[[34m  Info  [0m] invoke-time-->res85._2 + -14 <= 0
[[34m  Info  [0m] checked VC inst... in 0.074s
[[34m  Info  [0m] Function: invoke-time--Found candidate invariant is not a real invariant! 
[[34m  Info  [0m] # of atomic predicates: 11 + 11
[[34m  Info  [0m] solving...
[[34m  Info  [0m] solved... in 0.008s
[[34m  Info  [0m] Candidate invariants
[[34m  Info  [0m] invoke-time-->res85._2 + -39 <= 0
[[34m  Info  [0m] checked VC inst... in 0.157s
[[34m  Info  [0m] Function: invoke-time--Found candidate invariant is not a real invariant! 
[[34m  Info  [0m] # of atomic predicates: 15 + 22
[[34m  Info  [0m] solving...
[[34m  Info  [0m] solved... in 0.01s
[[34m  Info  [0m] Candidate invariants
[[34m  Info  [0m] invoke-time-->res85._2 + -61 <= 0
[[34m  Info  [0m] checked VC inst... in 0.172s
[[34m  Info  [0m] Function: invoke-time--Found candidate invariant is not a real invariant! 
[[34m  Info  [0m] # of atomic predicates: 16 + 37
[[34m  Info  [0m] solving...
[[34m  Info  [0m] solved... in 0.011s
[[34m  Info  [0m] Candidate invariants
[[34m  Info  [0m] invoke-time-->res85._2 + -82 <= 0
[[34m  Info  [0m] checked VC inst... in 0.008s
[[34m  Info  [0m] minimizing...
[[34m  Info  [0m] Candidate invariants
[[34m  Info  [0m] invoke-time-->res85._2 + -81 <= 0
[[34m  Info  [0m] checked VC inst... in 0.006s
[[34m  Info  [0m] - Found inductive invariant: invoke-time --> time + BigInt(-81) <= BigInt(0)
[[34m  Info  [0m] - Verifying Invariants... 
[[34m  Info  [0m] - Invariant verified
[[34m  Info  [0m] - considering function parse-time...
[[34m  Info  [0m] Candidate invariants
[[34m  Info  [0m] parse-time-->0 * n + x$218._2 <= 0
[[34m  Info  [0m] checked VC inst... in 0.009s
[[34m  Info  [0m] Function: parse-time--Found candidate invariant is not a real invariant! 
[[34m  Info  [0m] # of atomic predicates: 11 + 1
[[34m  Info  [0m] solving...
[[34m  Info  [0m] solved... in 0.008s
[[34m  Info  [0m] - More unrollings for invariant inference
[[34m  Info  [0m] Candidate invariants
[[34m  Info  [0m] parse-time-->0 * n + x$218._2 <= 0
[[34m  Info  [0m] checked VC inst... in 0.013s
[[34m  Info  [0m] Function: parse-time--Found candidate invariant is not a real invariant! 
[[34m  Info  [0m] # of atomic predicates: 10 + 1
[[34m  Info  [0m] solving...
[[34m  Info  [0m] solved... in 0.007s
[[34m  Info  [0m] Candidate invariants
[[34m  Info  [0m] parse-time-->(0 * n + x$218._2) + -86 <= 0
[[34m  Info  [0m] checked VC inst... in 0.014s
[[34m  Info  [0m] Function: parse-time--Found candidate invariant is not a real invariant! 
[[34m  Info  [0m] # of atomic predicates: 15 + 11
[[34m  Info  [0m] solving...
[[34m  Info  [0m] solved... in 0.009s
[[34m  Info  [0m] Candidate invariants
[[34m  Info  [0m] parse-time-->(-91 * n + x$218._2) + -86 <= 0
[[34m  Info  [0m] checked VC inst... in 0.004s
[[34m  Info  [0m] minimizing...
[[34m  Info  [0m] Candidate invariants
[[34m  Info  [0m] parse-time-->(-88 * n + x$218._2) + -84 <= 0
[[34m  Info  [0m] checked VC inst... in 0.003s
[[34m  Info  [0m] - Found inductive invariant: parse-time --> (BigInt(-88) * n + time) + BigInt(-84) <= BigInt(0)
[[34m  Info  [0m] - Verifying Invariants... 
[[34m  Info  [0m] - Invariant verified
Resource Verification Results: 
. ┌─────────━
╔═╡ Summary ═══════════════════════════════════════════════╗
║ └─────────┘                                              ║
║ invoke-         time <= 81             1.270             ║
║ pAdd-mem        time <= 20             25.925            ║
║ pMul-mem        time <= 21             0.000             ║
║ pPrim-mem       time <= 25             0.000             ║
║ parse-          time <= 88 * n + 84    0.856             ║
╟┄┄┄┄┄┄┄┄┄┄┄┄┄┄┄┄┄┄┄┄┄┄┄┄┄┄┄┄┄┄┄┄┄┄┄┄┄┄┄┄┄┄┄┄┄┄┄┄┄┄┄┄┄┄┄┄┄┄╢
║ total: 5     inferred: 5     unknown: 0     time: 28.051 ║
╚═══════════════════════════════════════════════════════════
[[34m  Info  [0m] Stats dumped to file: PackratParsing-stats.txt
